Transaction ID,Client ID,Transaction Date,Amount,Reason
3be908d5-f21b-4b57-831a-406d82200d64,bb5eb58c-fd18-4d33-b46f-97343d800a38,2023-05-17 20:30:34,261.2000011767544,Open vote tonight history to important standard start.
b2854b99-0de6-4412-aa30-0d7defecb116,73b1e494-b525-464f-b54f-088b0b160a2f,2023-07-30 14:39:13,473.7697827937105,Carry become must make.
b96f9fd6-4439-4d3e-acaf-43813389124a,69421de4-3aa7-4aa2-ae35-6c9da4a7f8e0,2023-05-03 10:31:03,454.69904996525156,Term fund beat drug style peace.
511f9a79-fe9d-441e-9e68-2c70ee62ac50,8a5f113d-bdda-4cb6-a956-f30b2c984e52,2023-08-10 03:47:26,208.5230715275099,Make about money.
3fe79a08-0487-42c2-97ce-b2eaf2cdd144,3e738a55-bf27-4150-96f9-fd1c23dc6354,2023-07-07 15:42:18,77.06276395758974,Simple ask similar today.
96326c67-a6dc-4015-b760-b633429b8f0c,b152ada8-de37-4fa6-87d5-7f5bf34b04b1,2023-07-04 17:30:53,242.25136889875955,Sit as either under knowledge risk.
83204518-eab9-4a3e-9a0b-437634f0806c,383649d5-bdf3-492d-8462-97baaf7dbfd0,2023-02-01 08:25:17,78.93493381069283,Themselves development available.
e2b9d0c2-adbd-4da7-8fa8-5dfb6a91f501,2d5fada9-69c7-42eb-9d1c-475b8ed7c833,2023-04-27 05:41:45,285.8893907342486,Attack media century hour standard speak company.
9bc383ab-e1dc-4857-a6a4-9d5177ded31f,23823285-4fbd-4676-a50e-8c0e117e7933,2023-04-06 12:00:11,435.05307765350847,Specific school explain increase know know.
de40d9f8-de87-4c2c-a3dd-82b331d92463,4de341e5-c963-40cb-952c-78dddc25790e,2023-03-12 05:03:34,453.7000374948373,Music reflect what five.
27e1da12-13e4-45cc-98aa-681d1c692df8,9e273a84-f97c-4591-8463-3d2f6261e9a6,2023-03-11 08:47:51,310.14009406087405,Thus start provide different now end.
7a9c33b9-2e0b-4278-9983-60cb48902918,93baf97e-0b3a-4f1c-8683-020cb87ea95c,2023-08-10 05:56:32,173.7760129512871,Thousand official recent image four.
e7466cd2-18f6-480c-bdb7-ffd2486e952d,ef0e1677-bc95-417b-b17c-dbea56ce86db,2023-06-12 08:17:04,383.63802046507607,Enough cause nothing kitchen send develop knowledge.
6c6964d1-bbae-4ee4-aaa3-b8a16478df83,9941b7b5-7feb-4843-bf51-c6001c70dcc3,2023-06-01 07:37:33,278.5025645728208,Organization lawyer home.
ea1143c4-c9b2-45f5-8fe7-8839edee3578,2ce4198a-d84d-4c4f-9a29-2f0800069d82,2023-05-31 18:00:32,143.75772363864968,Positive report physical national.
4f005fd4-3019-43df-a19a-c2eaa827f2dd,01712064-3ce3-4171-9ba6-a1093da7032b,2023-05-24 02:15:39,471.13397061205376,Agency go Democrat should short behind woman.
76792fa6-8967-41f9-bf96-3a1b084cf0b9,3a0ddb6e-ef78-4dd7-9651-d1c6338c6ef3,2023-04-04 17:20:06,361.334371416774,Government continue individual agreement other thus.
d6f40c1a-98ab-454d-b59d-61ecec59bd0f,066d463a-c4c6-4905-9313-8b11f3aaaacc,2023-04-07 19:40:28,105.6295863901562,Middle rich truth range standard.
84686c23-924e-44c0-9cb9-120c706bd038,7147665e-0dac-492a-84f9-3861b6511aa6,2023-01-11 16:15:53,120.20067913689257,Affect form town decision.
347a0178-476f-4865-80bc-b5a7636e05a9,3fd62c48-adb7-4a45-bf21-19637f2af6a4,2023-06-18 14:25:09,243.04590133768352,Your relate someone.
b55bc9dc-943b-4d15-a112-a1ca04d37c4f,02731734-720f-4d36-9ac9-883b52e795f4,2023-03-24 17:56:19,48.351532119699634,Trial mean use arrive claim themselves media while.
45454644-7600-4c4b-acc4-a0cbd9654b21,8f9265d3-4265-48af-9faa-5e76f87d2ef6,2023-04-29 00:32:30,234.70062621051667,Through whatever down safe yes without range.
753e5636-3d7a-493a-ad8f-3fda01050bae,e1d19182-5da2-4eb9-8328-6086fe776a6a,2023-07-18 14:26:16,70.85561662902101,To significant run help imagine pressure.
5d1a0a59-3577-41fa-bbf1-c82dbd5b365f,2e815092-243b-4424-8a1c-dcb0eb950b4f,2023-03-08 06:20:45,74.88497361608535,Himself who nothing blue theory head just.
9b4afe07-3d45-43f6-ac2f-6a20119b98cb,bddc37e6-ad7b-4d94-95ce-34bd81104a3b,2023-07-25 12:53:06,340.0640428294129,Its special test who life share.
8fc3fec3-ce04-4196-9bd2-4c79115e4afa,1784412d-43ab-4868-9919-18d7111b9b94,2023-07-04 07:05:19,13.6162972011107,Leg character identify energy well mind.
e69390cd-d9ab-4519-87f6-eb65240588cf,005e4c11-17ec-46d9-bca1-351a27d8790a,2023-05-22 20:43:59,419.6440756580666,Against growth ahead.
0b1d6c3e-ce6a-46e7-a87f-fb7343762bfc,029a467a-0a33-4b0e-9d61-ef68f9a54609,2023-01-16 18:54:12,117.43207327169927,Cell big offer.
14efee80-3e3d-4ab8-a5d1-251e6497822d,e0b7b8d7-8838-4b72-be10-192361c788e3,2023-01-21 22:00:53,300.15871223064266,Argue design author raise.
ac314b09-693a-4cc6-8f8f-10a893aa1113,290b8ee4-b40f-408c-9576-6ab02b06d585,2023-04-30 02:39:48,304.714054421419,Goal both size American drug.
dd512788-5ea4-4147-95af-be3631211a22,17410fa5-b8c4-4cfb-89e2-f053dd32e0e9,2023-06-16 14:35:49,18.532367009373225,Base political fear term.
44f1a238-5732-4872-8233-bd4c88dcdc87,04718cb5-bc28-413c-a3e9-240d2191dd53,2023-04-03 20:17:22,283.70988161696124,Program over identify later big major resource.
373ae081-344d-446e-83c9-9e3b4080beda,2b4087f4-2307-43ca-92ed-ab5f880f6960,2023-02-05 07:56:44,71.35829544783402,Civil position certainly main without into you.
adfd7b90-d2be-49f8-9e03-d21bc5bff6db,e22f1331-06af-429a-bde1-80f93b569918,2023-01-01 03:22:13,367.9926370958227,News me learn thought after specific.
e71bd979-c70a-4749-b155-9ff6030dcbf9,488e5715-83d5-4d04-9bf1-b26720ccbe80,2023-04-24 09:44:31,165.4825727964826,Against protect official interview number order girl.
c6271889-16f8-46f9-925c-8c71743197fc,a7fba3bd-ea3a-455f-a38b-e2a1e09b49bf,2023-04-27 12:21:18,71.55220697439925,Together economic family.
d4b9363b-d293-49a9-aa1d-c18ebac43995,72af93bf-804a-4513-88a0-66d2570f3d01,2023-05-18 02:10:57,281.2958233677536,Population where trip remain century reality PM.
a68a5ce9-099f-43cd-8d32-cd26c058f794,acd5aa19-00ce-40cc-a433-29b3898a5e01,2023-02-25 07:36:38,385.80278902479967,Property reflect yourself.
edd9c503-1728-4c7b-b861-c5c0ca01d68f,0f181db6-7c17-4841-827d-55ef191ef7fe,2023-07-18 23:50:51,187.58119710362058,Successful structure represent for society responsibility room want.
128f0610-6a19-41fc-a58a-dbd01d74b275,d406261d-6ef2-4081-8fe4-162fdef0fbdc,2023-07-05 19:18:48,200.41788857044943,Plant bank knowledge different.
f1806709-61f4-4713-ad5f-636ab975ce70,82bf6766-6d42-4af8-a7c9-37804741acaa,2023-02-27 14:18:26,98.29238456794886,Low enough company bill pick.
058991fc-6cfc-4b90-903f-973158b60981,fa8358a2-d070-4214-8e1e-70c29b39c4c7,2023-01-12 02:26:00,16.970956357159274,Couple always address ready however onto.
4c7c5ca2-f309-4d65-a92d-d02a6cbb9f68,32529f2f-fbab-42f5-b433-494fe276cbf2,2023-06-25 23:19:46,281.83299003764637,Place back without small onto.
7a53a129-a3a6-459a-b92c-1538e28f2cc7,dd6ec998-ee9d-423e-bf1c-5aee368b4615,2023-05-28 21:51:59,169.60594376935853,Yes edge shake lot perform tough.
cdf05695-4526-41e8-be0e-d02b209cfc9d,936b1a45-bd37-4f47-811f-3bb10b37ca7d,2023-02-17 15:28:21,81.14728522785198,Citizen write director member town our base.
18508805-7dbd-4053-bb4d-a9c4eb370694,68e85d7e-f494-4649-ad77-a72634eb84d3,2023-06-11 23:20:24,463.9355349327379,Quite bank above big change today exactly.
f948d755-08fc-4b2b-af7e-074584a15911,c29dd973-13b0-4f46-a2c8-b399201cc678,2023-05-24 22:44:25,270.3709717541114,Figure sell face understand.
a2490953-83e4-41c3-93e4-d43c9bb56278,56d20ab0-e092-43ba-a5d3-d82166c0e554,2023-06-06 02:34:45,487.1152023949867,Season address decision wife glass message kid.
561ac50a-bb6b-4df8-8229-233e85c1d295,e6c72e70-c0e8-4f69-932f-b2c0d560f89b,2023-01-21 02:30:42,279.4645902911044,Yard worker almost after particular none third example.
ddc8eff3-ce67-4894-87ad-12cbc1c75df7,43028485-b020-4ecb-bd25-cf164a8719c5,2023-04-17 18:25:44,153.98823608986146,Old out miss everybody.
818c3afd-22eb-47b0-be84-38f5daabf0c0,3f357b6d-a021-403e-a16f-bd18fb446801,2023-01-26 06:16:39,102.85951616613646,Least best general whatever fast.
f7862e1e-46bb-4ce4-a968-2b4b1c55b2d5,ae4a188a-2ee8-4ad7-b820-c4929be6af86,2023-02-06 13:25:12,359.1826307286317,Guy service crime stock it population know.
2f869205-4b85-4e62-ad87-7f7b7b9ef1dd,4d64fe83-32a7-452c-ad22-b1e140a195ec,2023-05-27 22:19:47,268.76419813951213,Although might worry organization science billion newspaper.
73bb3229-7db3-4799-9cca-304e95640dcc,ea78bc81-33fd-429f-8005-2dd41e3eb790,2023-03-21 16:15:35,495.361650103813,Cause pass break.
67c48b18-885e-45c0-a8e0-88a47ac69536,3e2742a4-ecbe-40cd-904b-af4ac2478a8c,2023-07-10 03:21:00,166.46914608612528,Weight drop particular part hair kid budget.
d93347a9-9cbc-4240-b362-974349d0c908,9b62af25-b994-465e-b75c-83fd510cacce,2023-02-16 17:11:29,256.7928798932862,The their their long.
aec0c28b-449e-4dab-99e5-9c0ecb7a9215,9efdd667-1de0-4e35-8b0f-24b81cb32e54,2023-05-02 15:21:49,280.9635915974548,Including only concern deal.
b6864a30-b5ae-4f6e-b9bb-99614d6bea0f,c996ab2d-1809-457f-b095-662285e9f38d,2023-02-19 18:12:51,189.07909607826548,Consumer result lose first travel defense level.
3bbedad4-338f-4fbc-a130-977bc9d5ec01,e6a4f81f-7318-4e4c-b580-ce1a0bf0b6fa,2023-05-21 13:27:12,40.036536244675695,Bank thus finally draw.
f00f00d7-f8bd-4c1d-96db-54759c2baf02,87c019b7-cf16-4c3b-a562-34a53f1c6854,2023-05-19 17:54:25,80.26962970360664,Find six never sit knowledge.
36ffbbf9-960c-47ad-bd43-1ead75c72227,9194cab4-d459-4891-9d82-09b26841de5b,2023-01-24 12:24:24,212.73546725842377,Reason family hour series single career but.
3bea6cdc-2c88-44dc-8bc3-4ba906e0e60a,e1909e0a-87fd-42fd-b917-41d4d3e5505c,2023-03-20 10:11:08,492.16629501758393,Night policy imagine factor fire.
9166918a-1689-4e31-8043-24114789ebc2,9a0b37d1-a279-415f-a158-50e34b6e2ace,2023-05-10 01:23:30,320.12112343180524,Safe great rock far compare close.
51bc2175-6782-48af-9051-7d9178bb62ef,0693af37-9081-481e-b9d3-7daf262630a3,2023-05-04 05:31:59,477.7797688262359,Responsibility field practice of school.
cf0a0f14-0bb6-41ab-8743-36ac2c4601c4,2788b02c-ef48-4eea-887f-44b4aaf05b26,2023-02-11 23:23:28,481.26844249034207,Nice teacher remain business deal beat avoid.
2a7d6b63-9120-4b28-9cfd-78fddd0c607c,df33cb0a-76bb-4a47-922a-05c827bdcf46,2023-04-27 18:12:04,324.7052871679504,Case company future ten.
cbc872dd-4505-41e3-970f-4400df1eec4d,bd2381ca-a5da-4e5f-86b3-fe0e18a72f3b,2023-05-05 02:38:44,322.5664606778455,Difference treat book story money evening.
1deb7969-b526-4cc0-a975-3d988d162f8e,89e5167c-0fd4-4b43-966b-80509bb99adf,2023-03-11 04:55:38,228.10397566180976,Us actually smile American no.
e3c6ec89-07b0-4ca4-ba54-641c43e10cd3,c6a345f8-25d5-4fa6-b21a-3d7a7a375dac,2023-08-11 19:09:38,469.5304137246079,Seek year item already prepare.
a8e1e678-7da4-476a-816c-bd055c762ba9,0c4b714e-b8d5-47fc-ac59-80e7e24e1152,2023-01-24 21:02:10,229.43532507326623,Camera usually whether several.
92716f23-b58b-474a-9de1-ae534a541eeb,534d9f09-cdbf-4fab-beb9-2f22e5898fae,2023-02-24 02:51:17,325.66675941477047,Inside defense again agent conference.
3f48c7bf-073a-4a5c-b4c1-da0e6f1bd77e,72fa9109-9fc1-4f5f-8c30-be6b2db2d6c2,2023-05-30 00:48:42,456.7814606573273,Inside after yet begin.
8984e8b7-2c34-4cf1-b58c-ed9218dadb65,236ecefc-8d91-4600-af3d-282f56e118fa,2023-07-16 23:04:51,423.0148852838243,Perhaps return let plant summer.
3b8b0ee4-afbb-4578-90a9-3ffdaeadc859,94d71944-1a8c-4241-b1b1-f3e358786864,2023-03-24 22:27:15,303.52481540199454,Similar establish with training.
b74ab095-ed07-4100-842d-e01dd426b922,9290c0cb-e488-49f6-8f29-618dbdf95ce1,2023-07-31 03:43:47,99.47833749284976,For father budget next example president.
6ff8bd56-4cc0-4d6f-a4a4-6279bbb79ff2,725f7c33-44a7-4565-9e1d-caa0e76d70db,2023-01-29 04:41:53,412.56877244704225,Television same teacher.
05aa2218-3737-47a4-9680-bd146ee0cb87,74741e5c-249d-49d7-a64d-6a28cf9d7d4b,2023-06-12 03:30:59,403.3341696444294,Travel table popular I someone allow should fight.
6aa2ad36-7ab5-4152-9867-c9f67b8d4ace,514180e1-c7f9-4447-868f-d3596230e9ea,2023-07-10 09:04:49,469.17442609345323,Garden environment position station.
9201d138-b4c1-4c57-b2e5-764c3f58c379,decaaa6b-819a-4e39-be72-9e3a7e67b744,2023-04-29 01:05:11,293.06627722123136,International measure control coach challenge work majority.
926034e4-a752-45d4-88b3-620111d0dbaa,e5792316-aadd-4b9d-9123-b6fe2ebdb6ed,2023-01-22 02:23:20,14.371742085424966,Culture two unit catch leg person.
2b6b4940-3887-43cf-a039-39a0c85f8902,d819efc4-4834-4da1-afa6-95b6d4d44ee8,2023-05-10 14:19:11,76.515155639929,Likely hand first movie one.
f6a8b120-dbcf-4f51-837a-91ead343c0ed,c79dd5b6-4a53-497f-ba86-2f40d6509e4a,2023-04-06 02:14:10,402.18941747183266,Mr kind available shake some.
123062e3-4081-4fdc-a215-878eec739bd0,6998cfc5-573d-4efb-997d-b7446a2c3312,2023-06-28 02:54:06,280.14572242793474,View air or until establish defense so.
2cee42c3-be15-475e-93e4-c01e0ea4055b,686c48a3-7500-46e4-9a37-e1fe9db00b95,2023-02-12 00:33:56,178.45804266136238,Power wall act.
a0c8dda2-06f9-40f0-a244-4652aba169ff,df3cc892-675e-43c5-8a90-658963433aa5,2023-07-03 13:38:18,174.47520993536708,Rest leg along explain nearly.
e827c85e-e828-454e-a464-b816adc37e7f,d3d0f2d1-b373-4271-b2b9-9f5b5783ae52,2023-06-29 14:37:21,427.3371655811291,Science body most argue strategy strategy.
2188ce07-2ee6-419b-901e-518bb80631ac,d23f0bf9-3242-490d-a731-5ed7c32a83f1,2023-03-04 16:48:39,95.21296056257759,Network natural focus someone candidate mention owner.
fa2b70b8-17a0-4366-94b4-bdb270162f96,400a9ce7-1b10-4b5b-954c-94cb164cfa96,2023-04-27 02:44:04,117.50382939945017,Return music new future deal.
4cfa9455-812c-4f9a-914e-eaa8ca7f8575,655d3ea1-482a-4bfb-bcc1-fe2d5efdd5cd,2023-03-08 16:36:03,122.95765786279837,Who occur sing card.
2d286acb-b16e-485e-b85a-cf2e60f1aa87,1e4b93e2-a713-475f-8351-1abe87b8f9bb,2023-05-28 18:26:15,94.09586660170358,Ready run hope shake paper attention.
e0a17d1f-2880-4ac1-a61f-6907c9f48795,d008ce37-0323-40a3-9e6e-4ea0f898fe1d,2023-04-19 20:49:08,278.49959684870936,Possible meet foot election most century.
ee74e29a-0a69-4981-99fb-038730e91ac3,32a2fd99-aef0-493d-8ba6-63e8a07932a3,2023-08-06 18:29:51,123.53733038917994,Identify school firm simply rule kind.
4758cdf2-5ef0-4f4d-8a0e-929bee384095,9f2a07f7-3cfa-4d9e-a9d0-9bcba4e4d4f1,2023-08-12 21:04:11,358.3933756057391,Employee political treatment throw price.
5ec44976-85e3-4cef-918b-c98c04ce4cbd,f1084c16-ef69-4e06-815e-50c40d005e12,2023-06-23 17:01:35,119.65331042850137,Likely yeah within.
ffcc6b86-9bca-4bce-b0ac-27f087c7ec3e,5ed85970-4138-4f79-a633-330c93e39b0e,2023-02-11 15:05:02,247.21374860550986,Present war trip rise.
feb32f04-7505-4dbb-a96e-37b7b45938a0,ba09ec76-c417-4c0b-ba2c-a6901d9de702,2023-01-16 15:55:42,204.3560711786736,Onto everything station of simply exist.
dfbffe02-600a-40f8-9385-752e4b57e777,d4714a06-5d77-4d44-b329-5ae11a625b06,2023-03-15 18:52:34,231.86449186220437,Employee him while fine stop.
1a3397fb-57d9-43a9-9acd-25f02cdb9c83,30f59893-3246-4ec5-9ff8-c89cd3aa28d7,2023-02-16 09:17:47,198.60823898743317,Just station share seek need.
82acb4bb-24a6-4152-a501-b52378a6b7be,e144aceb-2966-4d34-a8ba-a5feb1bfba7f,2023-01-05 18:30:33,106.20024231102722,Court south run.
45f86183-4934-49db-a86b-57197789e6b7,319fa03e-f56b-4b7d-a7ca-d6dc879ef3c2,2023-03-25 23:43:42,373.0605562741959,System likely example receive.
f7dd5b6e-de2b-4d93-b98e-2a45c3d0826e,bceabdf6-0e97-4332-ae8a-bb04baf89dcb,2023-02-09 14:49:05,392.64275388189236,Last third there language music long spend.
833ff43f-e8cc-4dc1-911f-740be2fbecd9,17d7fee4-b79d-4505-bb2e-02ecdb5c0ec2,2023-02-16 06:21:58,223.05987329301993,Show great authority really as ago matter.
5c7a2adb-bd96-41b0-9a56-503b4a5d818e,e0ba6558-be46-4aed-8d5a-4bed8bc37dd7,2023-03-15 10:18:58,228.98710544293434,Base century general.
f470493b-e762-414f-841d-f033256abc18,abe0fa81-9074-474c-a0fd-85c04b77c729,2023-04-12 21:25:15,150.0235507921132,Environment power body response man.
d8f2be55-4fda-4f84-b750-8237d534e243,2d8b3ac8-a3c1-4684-bc23-88756dba78de,2023-04-30 23:53:58,204.29357440705695,Walk bit body government sort term.
c194ed32-214a-4b3e-93e6-8410b743393f,cbed697b-aa21-4fa5-bd8d-3d92c6b2bf31,2023-04-02 12:24:10,42.340529773619075,Speak professional make view among rule modern.
5a57b1e1-777c-4d14-b4ae-4298196eac74,5209a5fd-f3ad-4616-b223-0951b4571a15,2023-02-27 22:21:23,485.4486864203958,Tax since lay station keep believe.
793e4dcb-b2b7-4f6c-b9fc-af3eaa9f4bea,eab367be-804e-4588-84eb-fcff93666bb7,2023-05-08 09:22:09,135.06914468277577,Sign door four among course remember yet.
67915cb9-61fe-4655-982c-455343d32c33,50e2c8a4-265b-4dc8-b72b-cccc39737403,2023-06-13 06:06:13,278.6977733249454,Half everything hundred property very keep administration.
a1eb9ffb-5947-481d-a8a0-5476325db983,6569467d-3f2a-47b6-aea8-49ac883f899c,2023-07-16 23:35:01,498.1193104391812,Space design item.
c6f0d4e0-9c20-44f1-a9ea-7f4c295bde26,759c3290-eadd-4016-82e1-1d3b0b555aad,2023-03-10 00:52:05,168.3677311053906,Focus better thousand middle social you ground truth.
544eedc8-ce8d-48fe-a0e0-ec5d9cb1ca93,afbc138e-6868-4c5c-b269-28f4a70fae19,2023-05-28 05:14:23,388.04907420014035,Size vote value stand range still range.
75dc8b1c-2fcf-46ab-99c5-ae9d38ea5dd4,d737ed32-1f1c-4136-b213-a38485dd39dd,2023-06-29 03:41:02,103.19110580555447,Medical life hospital friend.
27fe2643-4f6c-48e7-9814-cee54c8c3402,39da1399-5ed9-48d9-88a5-4f294eaa3f4d,2023-07-31 23:15:53,361.01639369283873,Specific consider south boy former.
e5385ec3-f18d-4446-99f5-b5634d691514,ad8ffa84-e3ed-4adb-b903-2ec8fc9529ae,2023-03-27 15:47:08,17.491564943077222,Page street sell.
498a3c77-5a8c-48d0-b593-e9d98359870a,340cc25b-fa59-42c4-b777-11eae1560797,2023-04-15 06:14:34,432.51085374597386,Measure consumer seat detail.
425de983-cd7b-4ada-9d72-b92441ce3f8b,544e8612-4c2c-4d10-8d76-6152a3f61382,2023-03-14 20:58:39,24.40738756478299,Painting truth work face recent ever.
b7ff425a-70b9-486b-836b-58579e0e97fc,0e210d10-ded8-4b86-8c01-17193991a949,2023-01-10 11:32:46,232.31669042613063,Consumer late everyone who official.
3182ed9e-858b-4bb7-8f7d-44b5123aec4e,6c71a77f-3867-4786-b171-6f7e15a2ae45,2023-08-16 15:35:46,345.58568556685196,Court picture computer night yourself weight reflect.
08a0496b-3cc5-40e9-86b7-e40df154df7a,a0c24aad-a363-4498-8fae-1ca07a3f35d9,2023-07-02 12:10:52,310.44778659773874,Save happy analysis job street against analysis official.
4c319e50-404b-4d05-ade7-272e3cc682ae,a46ffde4-d370-487c-9b1d-c34a23cae292,2023-06-09 19:41:29,443.83974805635677,Large prepare itself follow subject.
8d08e15f-e82e-4dc0-bde2-f95e34a32e47,03d269e1-b4f5-4d8c-b281-fa2ff98a7190,2023-02-08 11:47:40,86.36310452231297,Space apply these five.
89078394-5ead-43fe-a722-eeca47b694e5,cb9e9b98-1313-4da9-a03c-4b629bc63f9c,2023-01-29 06:28:52,275.0469294375074,Student bring effect collection baby option.
c661876f-3407-4400-bb44-61822b89c6b1,be730703-2d52-4ab2-807e-4a871a8144d6,2023-05-26 10:32:12,267.4000997418018,These very often issue film first.
0a0f27e5-4fdb-4615-a10e-893c6d5bbb9a,40bc3736-13ca-4ea9-9b57-a3fb7e0fb64b,2023-08-11 18:11:22,359.0437937582596,Easy trip race goal recent.
cae4c7d2-2322-454d-b816-8a1bc516ef04,26d0011b-012a-4bbb-a79d-d9ae0e79a24b,2023-03-13 21:23:53,193.80093711738724,Six inside us quickly detail.
91b37e7a-2225-47c5-a80e-32751e340513,213aa627-d05f-43aa-8a72-b152b4f50a8e,2023-02-16 21:20:08,111.13884878286662,There above fast during politics show risk guy.
06398fec-d888-4510-8284-5c5562a67772,e3808c2f-fc3f-47b3-84c9-27d43b796b7a,2023-07-15 17:38:02,223.07696433719423,Back modern another listen wonder while.
1b18ed86-6114-4ac2-9554-0ab5a7f8b449,19857bd4-41ca-49b4-b7c5-0d728b21e4fd,2023-05-01 04:19:17,189.16466116438679,Key material treatment even structure into even.
3e39abd4-eb69-4b47-8b1c-77473dc0357b,d71673eb-e46f-4194-a3df-46d9cad68fed,2023-05-06 13:56:32,223.23792109829114,Congress interview send to friend.
be3ef8b6-a755-493f-967e-fa24c78d7b72,047125fd-97ba-472f-ae12-8d92ad4e0c6a,2023-05-22 05:06:51,17.0725389803696,Food remember who send senior mind.
3fb8dbdb-37c0-4931-82e2-0a587114f2df,dac15e07-e1c6-4ad7-a880-0d85074ffa89,2023-01-03 07:34:38,238.29805413124436,Character behind gun son key news.
25816864-dd7a-4ca2-9c47-d39ca3e633d2,e4c08ee7-9da1-421e-9699-74f9530334f4,2023-04-25 21:08:08,180.58845519455937,Industry response prove down finish above consumer your.
b824a284-9400-4593-900d-86b1e33b52b5,ca93076e-58b6-4f06-a71c-0b88aea98bc5,2023-05-21 12:58:08,108.45815971864013,Rise factor be add increase artist understand discuss.
4179aaa6-5f5a-44b3-b562-8b8c7dacbebc,f734f9e1-3d32-44dc-b9a3-264b2d628865,2023-08-08 10:30:08,91.0456948414282,Major against same exactly account film.
c8cac364-8f3c-4bbb-9fdd-2669d6f1e88f,abae0526-10ae-4c26-92a1-8517c4767330,2023-02-20 18:14:21,115.04503660157503,Simply glass smile game tonight may.
26d666c0-8b68-4d5d-8c5d-e8d42b9210ce,a699d133-a44a-42ac-9c0a-22eb45a076d7,2023-01-21 22:46:14,28.938725652908907,Great election suddenly behind.
b2f473f0-0bea-48df-9c2a-300d89a3f4fe,29141274-4576-44d6-95a7-ea643c82b23e,2023-06-03 09:47:00,471.11689306966605,Seven agency bad keep always raise buy.
18214095-999b-4175-8124-c3f741623cd3,a5240480-68e0-4239-8718-e4b399205896,2023-05-03 11:19:51,143.48046916644168,Case grow place recognize.
4c2fc602-4e68-41b4-aa0c-327697313477,c3954d6b-8942-44d5-bd8f-d387324b26ea,2023-07-13 01:36:32,197.2778914619977,Reality save especially sound pressure once study.
3b2bc07d-56fb-4078-ad9f-ec55fee3c703,718df3f1-b305-4461-819f-6797d12a2e94,2023-01-12 03:00:23,79.63024956610509,Tree level glass.
c7511d99-0020-4a41-ac73-1561de3c0302,8852fbce-1dbf-45de-8303-e080cf38f7fa,2023-07-04 00:58:24,269.0166703306444,Case friend travel town save.
46ea0a42-b982-45d5-81ba-ef197c9bd723,ce681591-07fa-43eb-a10e-5aa7f7ed6630,2023-01-28 23:22:00,172.4402996199893,Consider fish hope experience performance.
b27544f3-37f2-4c96-a7d6-139c056e8525,54cdacd0-5a59-489c-a2df-f140c37e96a4,2023-07-26 21:18:27,129.2278608144334,Century author claim bank on method.
fc51ac27-4a98-4f1f-822e-b9c10ce8b9e5,0fd03ce1-d793-40eb-9cf8-fe12df191806,2023-08-06 03:26:25,14.626106986271614,Describe which young right room learn much.
fd43727d-1831-48e6-ad96-b3c891824de7,2498fd60-6a44-4e0a-ab37-450290c98b5e,2023-08-04 07:01:33,343.3882837970694,Month list left challenge where.
e78838aa-d011-46f1-9e8e-87547a24d56b,41f0bb4b-ed58-4ca4-9c57-18b368bdffd5,2023-01-16 18:37:42,101.71345856760823,Official know minute skin event task.
61d7ded4-8423-4013-8bd2-5953d9b90182,eebab08a-96e0-456c-94e5-753cf196afd7,2023-03-25 06:50:12,81.51691051299078,Political whether trial too.
097bb4e6-fb52-4379-83e2-d49cd572dc2b,15c8023d-6b26-4e7d-afbb-ea46f710f542,2023-02-23 00:21:04,234.09385779650162,Debate rest wide example.
5d618c37-ff49-4a66-9092-be95728c6bb8,f5e1cb73-55da-4699-9481-bc190d06c569,2023-06-09 21:26:53,370.4515348781029,Difficult campaign around well.
c8d0c9ca-21e4-4b1a-aa8a-1c2f5317803d,d5ccb26e-a67f-4517-b00c-5bbb6584d3f2,2023-04-30 21:24:14,175.62211313749967,Spring finally world.
99336752-e432-4147-9cf9-db3243d6e6ae,3505ae1f-ac6e-4f70-bd22-b1194854da16,2023-07-06 14:50:39,468.1191528176487,Speech but focus writer during society.
f2100498-6aa6-40ff-98df-fe6ac8d9a8e0,7d837552-4fb6-4034-b899-78d6bc7db897,2023-03-16 04:05:36,146.64429186945304,Those face pretty market thousand sell bring leader.
bba64c21-330e-42f0-945c-eac1b7dd73d5,08366a5f-788c-48a0-b2bd-cd5f18a23298,2023-04-12 11:34:34,82.05975228663081,Theory actually increase system.
8de34d46-147b-408e-b7a9-f05acc2ed115,9fbd6036-2bab-4180-9358-1bc54a6c6b3d,2023-01-27 08:12:24,314.2209966097672,Month they people person.
eeaaf396-ffc0-4f8e-a8c6-670ecb0a2064,1c2d1e6b-67fe-4266-ba55-95fd9e73fbfd,2023-03-16 00:27:39,34.61664077885032,Challenge today step nor.
81bfe9e6-a8bc-486d-afc2-7c0ba3242a82,eaeb10a7-af65-4df7-a961-918f914b8b32,2023-05-11 08:56:33,113.93195840028295,Occur become peace next tax.
e83722b1-c4b0-490a-bda0-b2cc71a201ca,d585f89c-0692-430f-a9e8-f00cae7c10a0,2023-08-14 07:06:34,462.3997367934687,Situation mind interest shake.
173a9fe1-0861-4f55-8582-f5e51d1e7132,19c79d64-53d3-4908-bd80-493f67f2f070,2023-02-21 06:04:00,378.3151652277907,Cup star key.
6a76f46a-d88e-4472-9ea9-ec12cad1e399,4ec7bf8d-5e89-48f2-9eaa-fb1da8665840,2023-02-12 19:01:21,489.7818258491609,Increase after culture practice take style.
f5e52cb0-9bec-471a-ad31-c09023cd7eb8,5c3a465e-7e86-4a8c-8f66-9ab67b67b8a4,2023-07-23 23:46:07,479.5219757987351,Manager return exist beyond administration guy store.
7cc56fa0-1b1c-4979-bb8e-cc4b8952d204,42ade54e-88eb-484b-867d-174e859b7b72,2023-07-11 16:03:17,230.11811015639663,Skill reality fund involve remember.
3ac194e6-9aa1-4c68-bc9d-3a623c06f118,690b4a55-14ce-4d49-9c0b-1687006f4b65,2023-01-09 15:35:44,220.53078416853822,Training history board development name.
01c50ac6-e9b2-452d-8937-150868a69906,2a265681-56f5-4c44-9397-e1739eb47864,2023-03-13 01:14:22,229.1923895323897,Day rest meeting economic pick evening.
5f377a33-3f2a-4f9b-b24d-e7a582cd9816,34f4aa21-a8ee-4901-9927-3efc38b34953,2023-04-21 06:52:27,483.0954566742004,Find indicate garden serious themselves through.
b5719e91-574c-4b39-b670-6f0ada79c268,befb6552-d850-4263-af27-11221797b40e,2023-04-09 08:41:14,395.59784479738755,Kind able hot be choose.
a072970b-90c9-4832-aa0f-283763b18468,923c2209-3702-4c85-9017-99bc0e060c20,2023-05-03 07:15:23,178.9104544984945,Local listen trouble break learn year there.
f4806bb6-a805-4abd-bf8c-30128f2728ea,684a5650-dc5c-41d4-a396-b6064dcb3196,2023-04-23 18:11:15,107.30450971458832,Sense rest tough establish.
277000f6-7fab-4fca-8546-8857a9e6835b,a73a4bab-86e9-4d45-9702-0ddc52116eb6,2023-04-11 06:55:57,461.3450492911587,Article relate movement together environment.
8bb32ee0-77cc-425f-a368-693a94a5aae6,5b525ee1-618d-4803-bfb8-5bf8cd6ec1a8,2023-06-23 06:41:30,357.2313157734796,Everyone happy natural less western.
cedc3254-869c-42fe-af80-531d81390db4,1af5d8b7-ca67-4a6a-aee5-4cbf5f010ab3,2023-03-22 12:06:30,227.56626297806432,Glass modern difference black name sister cause.
41c195db-10b9-4016-bec8-3384927d3805,7e410e17-948c-48b3-b8af-ff04f692212a,2023-04-26 21:22:11,283.919222506468,Collection east one forward.
