Transaction ID,Client ID,Transaction Date,Amount,Reason
e7663e14-6290-4622-a731-1086030cf91c,1ccf38e0-c15f-4f62-931e-d8836e84cce8,2023-05-19 18:54:07,492.80572526439875,Generation officer sing blood if.
cfa68f5e-bcb1-4dca-9793-380577cdbc65,84564f99-6615-44b8-93ea-7eea05ed697f,2023-07-05 12:09:35,356.9261773457378,Away trial whose defense something floor stock.
0a7a9cfa-1325-42b6-a37d-64e7a4478070,a5e16351-8bed-4bae-b8df-e86121e2edda,2023-08-07 02:03:29,449.70216193581405,Behavior game off accept physical.
8e34c736-6682-468f-a618-aa94292ccca4,84ad47ac-c66f-40cc-b5a7-f62f46c1a397,2023-01-06 03:08:29,467.91062918062045,American argue one tell whether care development later.
2f4cad0c-98d3-4b2e-9445-b8a3941a33f3,ed57c175-f2a8-430f-8ae5-90752d9ec653,2023-03-13 16:26:04,363.3535313420026,Project raise range.
5fdbd347-313d-4320-9a1b-aafc1a1af053,0da34eca-cb7d-4264-86e1-be57526aa208,2023-06-20 09:13:49,435.90768689557063,Agent window policy rule stand.
604fd365-d861-4506-8e71-c910d316a3f8,03f797c1-6d7e-4841-8487-b272c420742a,2023-03-15 09:23:55,365.71362806388123,Cost catch money against beautiful.
7ad9da2b-4ced-4dcf-b7e2-675603839f82,737e2725-85ec-42ad-bd7e-9394d604b605,2023-02-25 13:10:38,424.61230900298176,Language apply movement head water establish.
b8a02a86-b2a0-4cc9-b38e-dcaf98979e54,e577bbc0-987e-4bbe-8e10-2a73982f96cc,2023-07-08 21:27:44,196.4280714254544,Building personal hit listen executive.
ba11dc2c-6644-44fd-9fcd-06037f1705e1,dec8c5cb-2911-4489-bdda-aa881c2c7453,2023-04-21 14:51:12,32.60650959996897,Practice book growth before until be write.
68bf6876-9714-49fa-b50c-5f13e4ff7a45,2575e892-cbe0-4e30-9ba0-6b542e534f81,2023-02-11 00:30:12,162.2623122519126,Occur street east for.
1fde1b2d-7cf2-486d-a46c-051f7925b32f,6733c677-ea7c-40d9-b34f-91053db7f1fc,2023-07-17 22:04:48,473.36232193733514,Back song both throw out ability organization.
be39366c-bf1e-406b-befe-efe6652635a3,4cb691d5-3d4d-4f30-b746-0a3427e3f9b6,2023-05-02 09:35:06,157.5098622749607,Black traditional just knowledge career miss.
bc45777e-8022-46ff-b683-7a47a6b31d9b,635653f0-22a6-4b7b-a602-cfa7ce7c2711,2023-04-01 22:47:02,42.66994186468466,Change buy face pretty image.
cf83df25-57d7-49ae-b1bc-ab31767aa256,cc7c4565-3f2c-461d-b3fb-48bb372b078e,2023-07-23 02:27:07,31.115679908909613,Them cold return cultural if his middle know.
9e91b2d8-1e5f-4242-8d67-2dfdc354f81f,e1c01ad1-f3b8-4153-bd6d-c770e3940c7a,2023-04-23 05:19:21,321.30779099690807,Left majority show audience.
1197f702-b9cd-4962-8a96-8d85681aaa4b,c0f7b626-3a1f-4453-beff-dbe01d894ab6,2023-02-09 19:32:08,458.9883155179966,Also front yeah follow Mr including.
fa4d15d5-bd79-4c91-95ea-0aeb3fb88bfd,1c6b6fbb-3663-471a-9dfa-e3025b9b237c,2023-05-18 19:17:36,310.113561958969,Method world any store including real.
34970668-a487-47c3-946c-50f30b8a7409,955a58a8-a349-4167-adda-d55cc563ecb0,2023-05-25 07:51:20,285.47849202034314,Turn wear language play area.
7218afc1-6280-4140-919f-090fdaa05c5a,b3eff25c-761f-412b-822f-51ea3b83eb25,2023-03-24 02:30:30,219.67515562863304,However number camera guess development rather.
c8449431-6a57-45de-a669-3c03ef40d892,2a5084df-122d-463d-bdea-65bc81ff10a8,2023-05-03 23:53:11,260.784003411188,Big assume magazine.
bc98d21f-1a67-498c-9eb5-0bc65f7d0d7e,d8c391cc-ff2e-4e3f-acda-54ce8e6100d7,2023-06-21 16:21:24,373.88075544576554,Up couple use season.
7f9e2b9a-cd9c-4709-a748-52751229be80,902d6c29-cfbf-4977-bae3-b5e311aeac64,2023-07-07 08:14:15,386.3499892105012,Face garden be this major receive.
78f9008c-71c2-4a72-ba69-fb73f3389594,52665f57-1ac5-4247-ad29-270b6d379224,2023-06-30 16:42:27,41.58250142747015,News ok box inside language lot cell treat.
002ac460-43dc-4b0f-b91a-3ea798f4c587,9e7a9139-f03d-4f1f-9dfe-6b6dea5d6202,2023-03-26 14:47:04,23.72375170457777,Civil person tend rather.
f5b67b90-fcfc-4228-82d5-5968ccf780c1,96500140-db8b-4d5a-a800-51a7e7acf3bd,2023-04-21 00:34:54,415.69354198044846,Give none commercial carry foot.
134c0eec-528b-4d2b-956a-2f3acf371380,6e50c5ef-d985-4616-acc7-2f2186e60603,2023-05-17 00:44:14,483.8633743215958,Risk base agent reality civil nothing side carry.
68ab6aa1-3588-46ad-b8d2-bd5d9c4fc6b7,b8ea6499-f31c-436a-b56d-3f9fec028c6c,2023-06-03 14:41:55,407.66974719653064,Provide often media add behind.
6c17d87d-380f-4f87-8f9c-510a6397c5ea,1ebe8160-c2c9-4a3b-a7af-97bd217af27d,2023-02-26 21:48:56,435.29456066038705,Identify safe by either right she.
3203a6a8-867a-432e-8c2f-db03e50ad4a5,2c8b5a04-6ad7-4744-844c-c90dc1627484,2023-08-09 23:59:39,159.0034985200735,Area visit player ball.
ae7ca325-9cbc-44fc-af0a-27f84cb42600,d038719f-5497-4c51-8303-a7b8c259a94d,2023-02-08 10:07:53,165.5198339443501,Or team win management gun way care.
2670f751-e246-40b7-ad51-4ced8e7e892f,d5b9945c-eedc-455c-9238-448a52fab804,2023-08-07 21:26:02,55.87828856632648,Matter these still skill place.
538f25af-99d6-4827-b8f8-9bee24edbc7f,c4f43bba-6c6e-46af-ae18-369bbbe9f97c,2023-01-08 15:24:58,133.38992099304573,Inside speak prevent make.
ccde6570-3c32-456a-81a5-167b8fe2923d,59512911-a27e-483b-acce-674820918a1d,2023-02-01 14:14:58,371.78766976980353,Commercial tonight seem follow believe story range.
da56b8ff-f30c-49b6-868d-8aea939d081c,f33e4b17-54b9-4a65-86cd-2b20bc042ace,2023-05-22 21:14:26,83.68470725196381,Audience report training right director condition time.
81bce174-0396-4597-9798-085fac03bd71,43faf429-ba97-4d43-b0d4-5225801cc6e1,2023-07-02 04:06:12,133.55018836611288,Allow kid look board at address.
ca519de4-6d58-44bf-98fc-1adea454a69f,b5157049-0c64-48df-97bd-7c3ebf15a423,2023-06-27 13:45:14,87.64153212833718,Only box around house with.
8b529116-451a-4bd3-9861-cf883b10f262,8a498f2b-5883-4c1d-b574-12e7649bbbad,2023-02-25 02:18:42,321.52418923216163,Like town himself approach seat own education feeling.
293f25c5-5fbf-4974-b8d9-60dd18014814,306e93ee-4c33-4a63-b80d-e2c7b3f28eaf,2023-07-17 06:47:51,352.0305500220168,Under pretty government three popular.
0078a3c3-6327-4e1e-89de-e54ae066c3bb,b3534eaf-e255-4469-b2b3-79bc26107f2c,2023-03-04 08:00:29,46.08289979753787,Claim painting agreement four middle easy.
1986d300-1845-439a-8562-f20c14108967,4f6b295c-08de-4675-a839-6b7a72415fbf,2023-03-24 10:34:09,76.85149056387047,Push culture bank night way small nature hotel.
8d1d1971-956e-4636-83a2-1d8189cc8b79,92434037-b43d-4655-92dc-85eed1262fb0,2023-01-18 00:33:16,220.61252189229103,Financial situation himself leave drive in behavior.
d14b1410-c3c3-4470-9a68-fe25c27b3fa9,fb80d2b2-4155-4e71-b625-e7fcd4d95b4a,2023-01-04 02:00:34,62.83541364444378,Name to final nor yes.
a81b69db-530a-4806-89c8-51b38b0df346,2da4ed29-9c12-4f4f-983c-d352d54e5f39,2023-07-25 13:37:51,274.6863093925928,A her sometimes court ground region.
ac1126fc-8e15-4dc7-9ec2-a0ff75224364,aa587968-c7b8-40e9-bb1f-6da034f8f93a,2023-06-08 19:24:47,91.81492812214273,Hope sort great such occur eye if.
9186b6ea-c7ef-4327-941c-0aca2231161a,6e56d798-b8d5-491f-a8bc-366b92dd900d,2023-07-18 04:49:03,398.14953235185186,Personal reach democratic himself value.
99e0ffdf-f5a7-4b35-8391-683da7410bdc,9226327a-0066-45fd-af6f-ef3d78150c12,2023-08-14 01:35:04,269.4573099539821,Page do best various.
df5f00e5-8e66-46f4-af3e-2834094bce38,a8e1a5e3-1d67-4f3c-bbf3-4f96ebd8da9f,2023-07-03 10:44:13,488.80598693115275,Letter sea determine business fact.
2b4ac614-d19c-442a-8bf7-a9d7663f3ff4,ec5bb6d0-715d-40bf-838a-b434572ad9fc,2023-07-24 11:59:35,339.9960189811467,Until form sister page minute entire name.
c2625ab1-7ba2-492f-a105-b9eac4fc541f,a3c0bde2-a8b2-4aff-b735-8bc0ebff7b05,2023-04-02 03:40:12,269.1076139552313,Forget ask thousand professor various.
d8cb5bee-7a51-43ae-ba8a-b425d38c41a4,bd48be37-641d-40f4-9f45-6f7a027fe3f3,2023-07-25 01:08:08,486.73834291379876,Reach three hospital pull.
0293bde3-d84d-471b-82fe-051782f21e80,0bd7ced9-313f-4ce1-9045-d8d6bd882d23,2023-07-23 04:58:26,315.7239575424897,Rich product television.
f7ca0b96-31cd-4c4e-a539-5763b380c3c7,57f49a08-baac-4231-aff8-1b63a72c2acd,2023-02-21 05:24:46,196.97180651546094,Until kitchen wear quickly chair.
9323dfb1-548d-49ef-b292-6723abe7ffa5,075f4cd5-baf6-419f-b4c8-0daa182dd576,2023-04-17 17:29:17,296.0316447212781,May million couple brother prepare.
e8b34717-73a7-4b35-9763-d9e12e9b7db5,eefd26c8-d273-4224-a010-4cfb1610736d,2023-03-17 21:57:41,155.77676617138454,Number increase grow shake personal little.
2bac2e64-36bb-4764-a3ed-35e1a1a2dae3,dda10fdf-ec47-4689-92f7-5707881edda0,2023-03-21 12:21:25,266.3540818716969,Successful able more.
6962a491-d5bc-40f4-96e3-d6a736964c8f,5f690b88-1642-4c78-bc2d-f356df2d2cff,2023-08-04 16:00:27,364.9915666327487,Tree scene evening anything country close.
cc6eed58-989c-49e0-bd2c-00db7005cb9e,aef0473a-1aa7-4028-aa31-7d581e634655,2023-06-01 19:11:04,465.471115884478,Indeed fast large hour.
b31938d5-a89b-45c2-9186-a2ab27ebe3f0,70b3ea45-22e8-4eac-9813-4f96c3dba8b4,2023-02-05 07:49:00,56.00885088855435,Two whole bed fast discuss heavy.
e6a98e4e-d48b-4354-b6fb-21416d4da6ed,a2eb8b8c-f8f8-417e-8715-6c87faf6a4df,2023-03-06 06:12:54,301.2494603463021,Strong back cut.
19acf86d-7c38-401c-98e0-e93b9688695e,cb5e4cf9-fbbc-4d18-bef0-dcdf305d603f,2023-07-28 11:45:26,361.102703047423,Arrive worker marriage shoulder.
895bb146-006a-4f71-946b-f31792e6831d,27fba018-6f83-4dfe-9d4e-f47f378617cc,2023-07-19 20:12:59,197.80067972316496,Deep someone truth particularly office audience commercial particular.
6d5f9832-1cf1-41c1-ad53-057f6e077e5f,6df7c466-d3d1-48bb-bf6c-8d18b5e0804b,2023-04-04 02:55:37,355.18683240090047,Role ask name foot into job research spend.
797dd5e8-5ae7-409f-8166-eb43b21d86b2,73ef503d-b5ca-4def-ac2e-4099c1164a03,2023-03-13 08:45:56,17.712927679965752,Dark be plant my state.
aee57c9e-a160-4525-92e8-1e14c801988b,81fba2a9-64d0-40ca-a99f-9c336c4d6a44,2023-04-16 21:16:26,38.264202307120144,I away bit two worry scene.
5183b305-c003-487e-bc36-15680b5e0de1,6b2fa5ca-e39e-488c-840f-56fb3360a4ac,2023-04-24 04:17:16,466.31429347792704,Trade commercial drug rise.
a81e4b68-c970-468a-894f-75ba797e7409,4feec442-123d-4386-8c24-c3aa4aff2807,2023-08-14 18:43:11,373.74327445267903,Outside respond here reason recently.
51f803a8-db1f-43d2-a872-4daea0da0acc,a280641a-7741-4457-9c95-c5eba4ebbfb1,2023-02-04 00:43:01,348.197916460898,Career rather boy politics draw bit.
2365eb4f-851c-4235-9ef9-47bbd47cc624,6f484990-d406-4398-ad39-25b6cafe3379,2023-03-29 13:08:28,401.9317096811558,Three bank economy end year project sell.
75473e79-efc3-48eb-8ebb-3e828d61b762,a08b4b3b-860c-4d3f-b1b7-a9dd48f12325,2023-08-01 21:34:37,332.4042456073768,Member above to accept worry reduce try.
0a33d442-b3ca-4359-b1ff-811b70ce9195,a41bf7e4-7685-49f3-886b-e72ff033ecf1,2023-03-22 19:46:07,221.97376366731672,Small must fall upon start provide develop.
84f8c6d4-aa63-4a10-9c1a-bb72e186486b,0522f967-59da-4ff8-a627-8b9fcd4a9fdf,2023-06-04 14:08:06,175.4116590836204,Young blood decade not.
f2cc0447-470c-4480-9422-39c1a64fe2ce,aafa3bc5-eed5-41d2-907f-501857c6b5b9,2023-07-11 18:44:03,491.77707583694405,On hospital per information indeed their option argue.
c15a9373-b8fe-4d6a-97ac-773fcda7da93,528e4e8a-90f4-4343-892a-fa3f046bf517,2023-04-29 23:48:22,14.488401860795257,Admit health prove beat manager structure finally.
06c1d735-6282-4233-ae7c-d0b9e245afb1,019ce123-5180-4840-b1aa-7fc31f47096f,2023-05-15 09:22:14,235.18663647150842,Room pay provide remain.
b28edda8-4bd6-4971-b520-41891450d1ac,bf8f8c84-2cbf-4de2-94f5-77f21623d39e,2023-05-29 08:40:20,203.01165894915425,Pretty because picture assume.
1d9ce26e-06f6-4cda-a579-f4ae530ce737,bd0a91f1-9be0-4903-9e36-6b4df8bd5528,2023-04-16 07:29:32,452.61248090175087,Wide matter myself without marriage.
2a2c69fb-b37e-4aab-bcbd-eada100d9695,df8bcf0f-cb04-4012-ba56-da4a0b64025e,2023-07-11 23:54:28,421.4537733017862,Control within might.
27bc839f-4eea-404d-b772-4543babfc364,e98a64fc-0127-4e35-b912-563b863e085c,2023-06-16 09:58:37,118.96243003742669,In paper traditional type direction six feel weight.
bfd68606-25c9-404c-a87c-80fde9f49a23,69e0a72e-87ae-4848-85fc-3ae9df4483b4,2023-06-12 16:18:06,316.3637928619443,Money forget development action.
43fa2b1d-09fa-4991-97dd-82c52058b372,1a57491a-b0ee-491b-8486-5945ec5f6d51,2023-04-07 14:42:02,205.51381618371246,Bar several admit truth.
a33a3d68-cddd-45f9-9008-977b7690e475,e181de39-382c-466d-bde1-645af09b216d,2023-04-21 09:03:15,30.107044896994477,Culture time simply energy your.
f33a6786-1abb-4d40-850f-e6ec9d4260c7,a860f8d0-7b8e-49f7-9a2a-0982df15edfc,2023-03-03 17:53:08,450.8628035509861,Office under box executive technology.
cc8f73a4-6237-49a4-907d-989d52e1cac2,0bdd163f-bc5c-47c6-ae3e-89e82f99db9f,2023-05-04 16:55:58,263.62943719304445,Phone school wall eye set.
287395c2-16ea-4234-9266-16c1b3c00504,77f7b851-c535-47fb-8b5b-7d4465e48538,2023-05-11 13:54:40,371.3498149197178,Create especially provide yard prevent glass bar.
b38e57ca-fff7-4eeb-9171-621717e5907b,4ddd193d-f2ff-438e-a4c3-2aae73be38a8,2023-06-28 03:37:25,276.5162870597963,Voice hotel myself student so floor southern.
f7850fe1-d0fb-4887-8169-02b34b704e58,7d267a3d-59db-40bb-a088-73d091e9a873,2023-06-28 19:06:45,69.3009107006491,Like level likely often despite pressure.
373add9d-fe97-4a0f-91ba-816da5400383,7b34c350-da18-4e59-9b9e-320484c57c16,2023-02-03 07:07:13,172.24499009381032,Middle available local field necessary.
9ee3381b-b861-443b-be66-b3884b8a9b2a,68000353-d5fa-4af3-9a31-30c1d4c91222,2023-02-04 06:03:42,240.9111927310316,Require body make tend detail argue.
69680874-1a6e-4e6d-ae0c-706c977fc6d3,97885aa7-2886-4c32-8d55-cd87e6b56ad8,2023-05-26 14:05:49,387.87629228544444,Class attack woman performance red discuss believe.
32965b46-ee91-4017-bf55-c0ba05206543,bb79a603-d004-4e32-a71f-0f1d3f2d21c7,2023-08-08 11:06:58,22.42093732695133,North establish answer character.
5072f7a9-9a2b-4fda-a507-34933468a7af,8eb1d3fd-3bd7-4ede-aedf-0fa3b1e7b532,2023-04-05 23:55:27,176.8697344977155,Study month former future professional so.
d197c8a8-92b8-4eb8-acae-cb82b0910042,9d5e0263-c69c-40ab-8a60-216f18473aac,2023-01-30 17:32:17,495.9658226033692,Myself official suddenly benefit concern within his little.
08914cc5-da7f-451c-a98d-892d0ecdc038,6b7840fb-7273-4b4e-9f93-d00896ee4df0,2023-01-20 08:07:13,423.94507711350536,Send performance career able nature everybody top through.
126ae6a6-84e3-43dc-a8ae-1c30fc38ca14,28b53a7b-6310-4d5b-bb4e-139cd01cb8a5,2023-04-24 15:52:59,485.4543259595911,Peace if total.
4e947edf-b724-4937-8376-46421308876a,938d49bd-993b-463b-b63d-0fc77eb1e445,2023-01-12 16:31:49,406.8689192033016,Reduce star artist treat interest stop foreign.
3eed811e-4758-4107-bdad-99eac0450bf8,d5028b64-2076-4312-bbcf-8e08faaba849,2023-05-30 09:57:59,131.19625747841178,Let begin same other body.
8fd32c02-e0cf-4a64-ae01-3bb6c765f6c5,7d9c2e62-ab06-4e97-8ca7-8e8d022cb8a4,2023-08-08 22:27:06,382.41785329549356,Nor central letter three magazine member.
c6e45cc9-2bcf-4887-8918-66edcbe90efa,7acebcb9-4d05-477e-b5eb-fd33bbc992d0,2023-01-21 04:25:21,327.52490427146336,College drug simply no policy government land summer.
bd494000-2005-4383-b3e3-d40cc9dd01a5,6642003b-7b37-4a3f-8e5e-dca1396c2c3f,2023-02-07 04:24:13,283.8155231720399,Administration science administration young anything.
4fe8bfac-5723-40c8-84a1-972804b9c6f1,d8cadb7b-9c33-494d-a304-527c6c77e08b,2023-03-07 01:33:46,50.424067656528834,Third lawyer success example wrong central beautiful nature.
4a0d874b-58a6-4be1-9878-859c654d6fe9,0a530700-7ce8-4dfb-a9f5-efbc49eadfee,2023-05-05 09:13:20,238.1522842594387,Mr himself official.
832377b5-a9a8-4faf-80c2-6cd4d31ef8dd,45e143d6-36cb-497a-bce0-15a30eec88be,2023-08-05 08:59:33,191.09385483973182,Spring light animal often charge fund.
dbc66412-c315-4a31-8e4f-2e4794e74038,0971a44c-4902-46c8-9573-6abfc8a33a87,2023-05-09 06:06:00,493.4099145715424,Skin area own score ready read.
84d04859-8003-4a74-95c7-22aa17c68e97,958684cd-8876-4755-b055-cb9dc1f21380,2023-07-23 10:14:46,138.30763117363955,Together until medical.
52c47957-c0ea-4836-96c2-da92b5c4382b,756c34c1-c9ed-4cb0-aebe-aa2bbe213391,2023-07-19 17:46:21,115.12812929169125,He while spend pay.
0f8f1900-35d2-4786-8a1a-f8cba60d8d9f,0e4f4421-e01e-4724-b8ee-160097c42d56,2023-01-11 17:43:02,219.0246612314063,Will line its ago two attack.
4a64134c-5c94-4d56-8b0f-70622c3aab5a,873e751d-7ecd-444a-98f7-162c9195b855,2023-04-16 14:34:37,463.89269846540924,Last major class analysis lose pay guy at.
272a57f4-ba68-4614-a5a5-464712db839d,e4fcf35f-8cf4-4714-9dda-87cfee55ed54,2023-07-17 02:14:59,152.5051169071221,Summer also significant would successful no.
9c2a7d39-22b8-4d02-8163-d59e3253dc57,4c2b49fd-6dd0-405a-8276-23fb059ca3fc,2023-07-26 22:08:58,340.38271746374704,Team image ball according manage point.
3b035fca-4ca1-49c3-8361-1a9e171f4979,e5272253-00fd-48f7-9c63-93acd6aba6ce,2023-07-31 14:20:49,59.83384352699181,Seek good safe hear kitchen.
bb11312f-98e0-49ad-9cfe-612c73f6c42b,3a89dd10-301f-42c0-a81b-6f7b4e7c86c7,2023-08-01 18:42:01,274.31780570361167,Truth fish talk against store you look.
550c098d-b2af-4cb9-b41c-5675ac16e146,e2a8c945-f360-4338-a5df-df83a9149409,2023-04-22 11:09:56,163.40492182039918,Kind citizen arrive adult cultural wall bank.
805b55f9-a845-4e00-af1f-a5e0dc01bab4,99423fa4-2bed-4168-b6aa-05a7ce1fd630,2023-05-05 18:23:33,69.9384938606243,Ever carry until reflect interesting politics.
be9ce919-33a2-49cc-9ac6-f26259405be0,09db1b10-efc5-4cb8-b310-f2725f589a56,2023-01-07 18:59:22,360.40639218474996,Center result develop as push.
408da78a-f942-4209-af59-49038be10b1c,968daedf-a107-4e18-94d8-ca5491352ec5,2023-01-19 15:24:50,233.21981121940414,Data sister throughout travel fact.
0e429663-ab16-4045-8e29-d1ad35474c8d,7d781a89-f6bf-47c6-acd9-bc265a9b4450,2023-03-17 02:07:10,270.52034110729255,Out town other he back me its.
8fcd66aa-f81d-47a2-a54a-d67296080522,1514b033-63b8-4e2d-bdbb-24db733ed7f1,2023-06-10 00:22:58,217.20772568754742,Race Republican high commercial mission make.
d1311d29-6652-40a4-985b-7bf52365adac,1e880ffd-c84b-4606-b291-c4c778737484,2023-05-31 20:13:14,223.6544435895691,Focus floor week technology.
0c479d45-6eb4-4f3b-9b30-0f650c99bb23,7ab5bd33-1ebf-46e7-a0f9-95a5dfad7b96,2023-04-15 10:57:57,149.77264660571424,Letter hospital bar area stay avoid.
c055dfd2-c0aa-466f-9d2c-dcce962e0488,5bd07831-6bdb-4ed6-8cba-3c433bad040a,2023-03-10 05:32:54,172.87350845870037,Student top third firm change character.
7129a333-15fb-4743-a751-8401223b11e7,70d0d564-e400-4473-8135-4dcd59c4ca37,2023-07-28 11:32:48,306.341320658255,Ever item sport experience whatever war material.
3883995c-012d-4a64-8bff-f0e09793515a,eb7de0f9-5d83-42f9-83ed-db1851e83aa0,2023-03-20 23:52:34,434.4295501169991,Opportunity support body student fly put.
828e8938-6112-4aff-922a-683c61261a95,8968114b-bfb0-4543-add6-5f7164ec2dc6,2023-01-18 05:47:49,443.8504096790707,Challenge anyone and them quite police black.
cef99956-57c5-4efb-b19f-fa3667bdffc9,4b428e14-5379-46c4-bb6c-0e5381e7256c,2023-04-28 01:15:08,189.11180785895777,Store best hundred decade officer.
204df1e2-0c18-44a1-af20-9bd889fe6203,0c400c41-45af-46ad-bee4-7278664dbfb1,2023-02-03 21:09:44,445.330802757612,Positive group table service agent election research.
e25f6dd1-5396-4206-a4c6-616ddca7aeb7,5835804c-4a0e-4972-99b3-07663165d5d8,2023-01-21 05:02:17,293.8047609383431,Building right finish push administration relate writer.
1bd73634-b53c-4355-a9e2-97b68de0063b,5fe46118-c85c-4334-8228-438bab0dd297,2023-06-21 11:01:24,300.50089853154486,So serve day movement.
a0effea3-1298-43ae-af9f-097c9568eb91,ead8b45c-0093-43ec-a1af-758e572a2eb8,2023-04-05 16:48:49,364.9916620458952,Local four believe follow your seek no.
b23cb6a9-6cdd-4e07-b27e-5057357c3c18,d752400d-290e-47f6-9c87-193c27563a06,2023-03-10 17:20:02,371.4335035869214,Film sell test charge.
8d47c1dd-47d4-4c9d-873d-ea9f17f453ed,ba2aff31-0d0c-4118-bcde-5c1fa02bc671,2023-02-06 04:11:51,264.6323273302294,National itself step account.
b59d5e3b-0029-48c5-92b9-538a9fd09354,4bb4e461-8824-4b5e-abe9-87e77f61acc2,2023-01-10 12:01:55,237.9484382609001,Mrs lay style type operation.
310b9a07-f750-4d03-af71-007c6e6273c0,3dbfe8c3-d25f-4996-8018-f7f56c45b02f,2023-06-09 12:19:15,103.61870407935353,Road stand shoulder state soldier increase pattern.
10610d8a-ca21-4b43-a519-4b543cd7c408,d50f85b0-6955-4b06-ad5d-17d21d541101,2023-01-15 10:27:30,412.77449102766695,Window father business when.
ace0c5f6-b530-4b57-b4b8-b853c926ed3d,4be45326-6567-44e2-999f-b87d041bfe12,2023-03-28 00:10:43,139.38152814066953,Rock race surface reach.
e86472b8-4150-487c-bb92-62ef54b2324a,64c0ebb9-c15b-4688-a423-b59ca0636a37,2023-05-13 19:04:26,318.1062460921019,Campaign assume rest along agree.
d77e3a6e-432d-4f14-a035-28204ee13ce4,7aa6ee8e-12eb-4e2e-8d3a-698a6018e270,2023-04-10 13:52:05,169.43180142100755,With lose since make discuss.
0c63aa07-f15d-4abe-b3b1-7b4488ed39f5,2503cf18-7ab7-4093-a33d-04796e6ae679,2023-05-26 11:52:58,412.8616671333141,Simply stop current fire rise road report.
07e306a9-fd5b-46d4-8217-325b88e1509a,8e8d0d16-ebf2-45d5-b05b-ead47e6a2673,2023-08-04 20:56:54,221.36517162422209,Performance see beat.
22319786-20d8-4b37-87fa-f5fe12191f6c,381f71cf-ac42-46d0-9b19-9376aac11ee5,2023-01-07 08:46:53,398.34586770854617,Degree federal cost discover.
73e4aa9f-4a94-4be3-98bb-f46cabaf411d,6fb1a69f-ddff-4c50-b6e1-8d71d3370bdc,2023-05-13 07:48:01,399.74781782193423,Nor how Democrat bill impact election factor.
a44fd7d1-275d-4503-91f8-4d2dbe889b99,aae23fdf-59cb-4e57-8d3b-d76d935a1caa,2023-07-22 23:17:36,309.2138296818214,Maintain floor specific we decide attack job.
2e03f369-8ab6-4fb7-be3a-8022e6458ded,4c833142-4411-4776-ab53-f8d21f9fd141,2023-06-17 01:05:28,362.0945663615241,Anyone their argue win.
7dcd481b-a1ce-4e35-a3b3-8fb0d0ddf372,38ca79c9-66b7-4e01-847c-0277191d3161,2023-02-23 11:38:07,155.95396317396617,Onto bad job hour perform forget already floor.
210f5440-5ae0-41a8-be77-d1cbce1ede7b,2ac98856-2913-49a9-ad18-691a405c9b1e,2023-01-11 01:32:28,94.73845065589937,Prove hour back care own.
ff0616b5-e42a-489c-af2e-34b78012a342,e44cd25d-87cb-4890-983a-9e2cf6b27a22,2023-01-08 20:17:11,390.4819205455948,Bad sister door.
0a3d37b6-741d-405c-854b-510d1424317f,dbafa5fa-9d42-4e5a-a4bc-25979b0df68e,2023-06-07 15:35:27,53.63679529242755,Character too discussion just run support turn.
ef8b7d81-4ece-4b33-a1a7-c86332c086aa,9c71b7f2-e6a9-4c6c-8ee7-c1e4ab5cc0e0,2023-07-22 23:34:53,148.71817748658194,Good well perform someone tree various professional provide.
7492739b-cdd7-4564-b06e-e852ee084aa8,419d423c-18b1-459b-bc14-ec4ead29e673,2023-07-15 03:52:00,98.52948877680609,Far short reflect something analysis attack.
50733b61-ec86-4fcb-b883-186c5d10c201,5b975cfb-52e8-479b-a797-f77a44665e45,2023-07-23 09:40:09,240.27010386315337,Our agent pass attack practice nature entire.
98bcb19e-4b41-4b87-9257-4529cba5de4b,3b79d4e7-fc0c-41d7-8d6f-294f8fefa22f,2023-02-08 10:45:09,193.7546770483052,Mouth it security opportunity.
21564007-83b6-4029-9a58-00face6ece8e,77230b9a-7ccb-41e0-a458-8e290b3efe1b,2023-06-21 19:48:58,396.5842557931903,Activity want whom write great.
32d07487-86e6-403b-94aa-7aae359d7c6c,fc42c7f6-3745-444a-9a61-ba925a832519,2023-05-20 18:29:37,15.848357622285096,Itself position yourself contain bill local.
94664cb6-bacc-4f1c-a392-8cc4f92d6de2,1edf7c5a-db6e-468a-8cb3-acae9a39cadd,2023-07-21 13:46:37,79.29509055570247,Bar player baby main then series party since.
a85a22b5-c309-435a-ab0b-023c9f416049,e2fa2f1e-35d4-4209-8165-73ba6ec4e35d,2023-08-06 02:08:20,181.47172296517974,Buy away game page.
f57324c4-b602-4cf1-b6fc-e2de85b5cffa,3c6789a8-058a-44ea-9978-af68656d0fff,2023-05-08 18:51:53,411.9610065328616,Front value move institution agree.
14fb825a-3b6f-41ab-97a0-b3f13e2242f5,eb3f6b5b-6e22-4d2e-8a31-9632b1461793,2023-01-14 08:58:18,106.88709253872065,Action similar report down mission party.
404dccee-5101-4308-9d01-af8aba7310f3,2eee7a9d-d6cc-48d6-9916-29aa29a2d604,2023-05-01 00:36:59,433.2882423774784,Draw according get message economy wonder.
e3494097-3976-422e-a230-9cb0a7b6b69e,f2d499e8-0100-46fb-a1ad-a5ea5cb89b4d,2023-07-27 18:47:15,252.81014387321787,Congress actually while last give stock name.
ddb9c378-cfa8-439b-98d7-aafed1a23408,d757354b-a0d8-4e22-8052-d1a49ebfa2a5,2023-01-06 05:19:55,116.3407546054997,Knowledge event minute we purpose.
ea33becd-a68e-49b1-852c-f2b1c077c237,33df0068-cd47-4118-95ca-ab52bec52591,2023-07-04 21:46:59,364.1081626246366,News everyone into answer choice like.
1f9e9ad0-025f-4d38-aeb3-88e9b9935ae5,f08ff75a-c0c3-41a9-88ce-68733ca7012d,2023-07-02 21:54:41,300.6077641934228,South yeah deal Democrat painting.
7227572a-bef7-457a-8600-71151b8bc989,8c966e06-d0cb-4084-92c0-44ee084d5c03,2023-02-28 22:38:29,97.82463492708874,Here open vote wait.
9163f04c-c730-4418-a78f-f7a8702ff7a8,1fcad660-0b5a-438e-95e1-dc3d7159b1d6,2023-01-02 04:36:00,280.06377349275135,Value understand pull second somebody lay upon.
68dfdf3a-698a-4b35-9b55-6e0cb0acd78b,cc2c3b11-f154-42b7-99ec-3a078addbf36,2023-08-12 07:11:55,22.737822100444546,Direction small leave of newspaper base born term.
dc73a2ab-566d-4f4d-bc7e-7211f575e49c,6df40c58-f92b-43e1-8dce-084130e93d10,2023-03-16 07:21:56,54.78727094032305,Boy quality fish.
eb6c0736-f341-4741-867c-8193473b298a,30e9ff58-bfe5-40e7-9cdc-a1770ae3e752,2023-01-22 03:56:14,64.5539411120835,Couple not individual wall participant black.
dc297a5c-3796-43f8-966c-c5bd17a4e57b,694f4716-89d5-4c73-a741-98c491d6c44a,2023-04-17 04:59:17,39.26849960875621,Type response eight onto wait never claim.
8eb92d03-3b59-42b7-b31c-aec98cb87160,165f07f4-562c-441f-81c4-33e12d382f24,2023-04-08 09:33:04,135.5944886318959,Total through which fast but.
3855817f-25f6-4274-92b0-a8acdc56f132,1988354c-9ab7-49aa-8a61-b122cc7d5138,2023-01-19 01:42:59,364.28304925649616,Toward radio around if.
65538a8d-ccaa-4e70-8541-3d2bc8f1a4bf,c5a2118c-03af-4f09-8bec-d075436d8c03,2023-03-23 17:05:50,84.10156521590619,Type use edge value treatment from.
ef07edca-20e7-4d70-a786-affe37269198,212a8cfb-4dbf-474c-9e90-e29321cceff5,2023-07-14 12:09:22,83.21830143821511,Popular arrive machine so try.
