Transaction ID,Client ID,Transaction Date,Amount,Reason
b6dee110-23d5-42d7-8810-e559226ff914,5fa8d285-06bb-417a-b1f3-45a019a29a81,2023-04-05 07:27:59,468.7200756475197,Them hand set later audience money focus operation.
dcf35a0c-37e6-426d-ae9f-af2d5dac43d1,4e2c03b3-ddf9-474e-94d9-c766743571f6,2023-01-05 14:04:34,52.44858085108301,Already today onto phone foot language like.
d01b6632-aa14-45ce-9b12-f3f889cd17d5,195e8946-08fa-4959-9115-6cd4af88aac3,2023-02-10 00:39:48,205.65388412028008,Every own parent store.
19f23286-cc94-4504-9360-f3ef604fbf26,3e7eaa29-d8c0-4aea-919d-c04ae9f75edc,2023-04-11 06:29:10,354.06882707969396,Age bag senior.
15b06361-fe7c-4a7d-96f5-8f24ab3e5016,a0ffc171-3c9e-4df5-9afb-7e58b9e7f92c,2023-03-14 23:16:14,273.23044651273347,What find maybe few on bill.
c70b9383-40a9-4810-9c20-38dac7511bd6,234e9654-41fb-4a58-994b-edb9019bba05,2023-05-26 02:04:32,458.63536745095377,Believe alone response remain more.
f8fdbf5c-466f-42fe-875e-831e10295ca4,e02c75ad-d3fd-47ad-a373-2af590771edd,2023-05-25 02:02:55,104.05975900892167,Bill better attack meeting usually.
4dabd4b4-2840-4e58-85a1-fafd1344abf8,a69e0a3e-f17b-4306-81e7-813a44e2ad73,2023-06-20 23:31:23,74.22206237900035,Support second scientist writer character among police.
6e96ccc8-35af-44a7-b694-92fd65afe09a,ba3927c7-eb20-42a0-9178-7318659db15e,2023-02-09 17:46:41,176.33623515831107,Professor visit enter about certain top.
2e7527e4-c7cc-4d45-960d-ea9c0d47878d,af7ed98e-5924-41ab-8ce6-c9213253f72e,2023-03-30 02:14:40,474.68953674109946,Language improve station weight thank call adult effort.
f15e752f-f9f8-40ca-b501-fd6515381659,2d0056ce-3800-43cc-bb11-114b057c0db3,2023-08-05 02:56:15,59.32164535051509,Huge ok then themselves recognize.
fe079c9d-d868-48ac-be22-8077bebb104e,432ad3a9-c673-496e-a38d-aed21fe8cafb,2023-02-11 15:58:39,418.35036659538275,Have rate chance.
42356802-c620-4375-b2d1-b96065989961,ad31c459-36bb-4b63-a02a-689efa743e03,2023-06-29 08:41:14,21.06795626783339,Behind magazine say art lawyer close.
2c3e71a8-073d-4238-8c02-7a6822c8e467,051a64c8-8ae9-48d3-ad38-eecf6ad3acc6,2023-02-15 05:03:03,65.37025647408811,Amount travel save final admit action forward.
38dcd830-03d3-47aa-b4eb-655316010807,a7caf2e3-ab33-4e3c-a2bd-124799e8f97d,2023-02-02 02:03:48,44.165987167701886,Agree group she resource TV industry relate.
c23012f6-f68b-4f13-9577-f7c3ea8b1195,64c2a319-7bb1-4744-95c0-788ff01bd7d3,2023-06-08 18:22:43,39.63778395518062,Determine level person positive up bad when.
8c1b14a4-12f8-4693-9dd0-e6c3ba6d591e,b39f844b-a528-4df9-b7d0-7a72060d4e9e,2023-07-23 17:17:03,129.35451677496144,Information four seven.
41738290-2fd2-4007-bdbd-ddfba3e573b6,a2a43f40-d9d0-4a22-8f1a-928544af906d,2023-06-23 00:39:10,437.98094684692217,Education side general decade future.
ba1468ee-bd36-45d2-a91e-ab55ed17d6f7,c93d96c3-4b76-4a28-a34f-af88781bf9d2,2023-06-02 03:08:33,411.54601278902385,Possible too unit month.
e75aa168-70e9-471f-9390-307faf82ffb2,567e52fc-dce8-4496-b1cd-9e75729562cb,2023-03-26 07:11:07,310.60229706036,Along hair note understand discuss.
7db4319b-bd56-4553-9778-234f402f74b9,e7d0d6bf-c896-44f9-85b2-53e9e89b1b19,2023-08-06 16:23:12,289.14750069796713,Discover sit ahead technology student entire.
1511f527-a61a-4aaf-ab4b-248152f3beff,1d575d9d-a8cf-489d-816f-73f6ebd8186d,2023-04-20 05:16:07,350.7452173120843,Month throughout practice become whether student where per.
e3f30e04-07b8-4e16-96bd-5ef24d998c68,20017872-59c1-480c-bb6e-eae3f5238774,2023-04-29 07:25:00,247.95438126325294,Fund position foot myself upon direction.
4a17b206-4eab-4fbe-bb3e-1efdc474009d,90822e72-3541-4f54-b13f-f6cb1584ccb0,2023-07-21 20:04:59,39.58267240866412,Able response thus authority.
11d69c7b-ff47-4138-a787-2ed14be98abf,ed14ac30-e084-48fe-a7c5-d85b3e94b7ac,2023-04-09 01:05:56,55.45311771573456,Provide watch TV subject run cost.
02cc5813-4823-4fc4-ae0d-7a84958593b0,b0317e1c-e789-43f1-bee9-1b6ca284d341,2023-04-05 19:43:36,393.49299805876944,Mouth young baby.
ee54f70f-0c78-46b7-bcac-e733b0d1b7f3,c0332026-c1a1-4a6a-9d07-8de70f67f211,2023-03-13 22:03:21,440.9051378074011,Radio mother couple church.
cc9e9818-0fcb-43a4-b91a-6d29c1c2b605,bbb0917f-3fd5-45fb-b36e-46361844a60a,2023-02-23 19:33:00,236.25724887641096,Leg about owner yet nature available.
ac46cc36-2a45-4c5d-b13b-5c13f030a608,c7977dd5-0b6f-4e71-9304-519edfcff555,2023-04-20 06:37:43,131.1444346394535,Board air herself property fund wish.
8f297345-3a22-405e-8489-46032d14659a,1c0d6330-c6d0-4da6-9495-b06a2f99b68f,2023-01-11 02:23:51,189.08509683540183,Close site power boy perform strong.
718edce7-1ca7-448b-a0be-49828d95d3c4,f98c455a-568d-4c18-bddb-5990120b618e,2023-01-16 22:29:48,85.88865366034787,Method pull scientist none add organization.
addc5680-37d7-4a48-87da-50b00ba28d5c,5e82b593-2513-4dea-b53a-d6bff83d0d0f,2023-03-26 01:34:16,128.56075830846834,Toward student pressure concern character office.
8a8810d1-da26-4cbb-bb3c-0a4122db9082,bf0b95fb-bb1e-4a8a-b734-933adb400a41,2023-03-27 12:10:09,445.6160461333858,Receive individual road trip true chance court.
7d4c6025-106a-4095-905a-605145a1600c,21cd15d6-2ae3-49c1-a007-baaa14e0afbf,2023-05-23 19:37:34,229.563332395593,Say customer production reach.
14d157a8-c3e9-4a17-8b18-665b199bd735,0bc7f6a5-cd02-4042-88ea-955e532ced7c,2023-03-29 18:56:01,160.88451427681906,Woman respond staff across.
33d5bbf3-5895-449a-adb5-b79078c13c0e,55a79a02-5271-4711-8cc7-4590ba92d4f8,2023-05-14 20:46:52,313.775131193452,Tough work view billion.
6029479e-0b86-4f9d-9479-6ef39fc4d961,77a193f6-cbb6-4bf7-aa2b-02067ae54e4e,2023-07-16 13:46:30,142.90092345402627,Each executive store technology address term couple.
cc882079-49db-4b20-966e-aa71bd8e4ec3,2b1b721b-0119-4d27-8bd2-f4871cd9d2d1,2023-07-01 21:36:01,19.096466788319983,Picture fall see require imagine believe look buy.
2c6a3920-f71d-43a2-8d74-7bfcf1748f49,d777847d-9498-414f-b21c-cc839e3deb8e,2023-04-13 07:09:14,174.30082775719416,Give crime boy.
53b5af4b-b427-49c5-9cf2-25deac7821ae,25d5314e-bd75-4037-a701-9b143bef82b8,2023-08-09 17:10:17,36.283748203885565,Enough especially him improve minute administration these.
fe40c305-0a72-4fb2-8483-ebee7bad04cd,5fa31d5e-1f65-4ccb-9f47-c6197cb9bffe,2023-04-21 15:06:26,306.02368215749044,Side drop plant person against product.
ad577321-cfa6-4bb1-adde-e55bbb479de8,cd02fb5c-c262-4b49-9226-e031142cf967,2023-05-18 08:14:55,340.33054136835466,Economy wall network society account seven color.
6b65f181-f925-48d6-b2ee-c6867b2cb9d3,1a0da977-c7f6-42e4-bf54-8d2ebe8e5c8b,2023-01-02 18:59:34,225.58875880996385,Window choose learn throw.
9a28cc6f-f589-410c-9452-5a865d0fb9cd,b4316ed7-fc5b-4f25-9691-3b5ddca0b892,2023-01-28 04:05:36,168.0411271822612,Again letter test end woman.
999f3635-814c-4719-8449-2bd043859309,e6f4032b-90ba-4c20-a4d1-15c56a8f7343,2023-04-23 03:15:36,72.64703779598881,Page agreement statement actually fall election she pull.
f3625b58-b393-4793-88c8-0527f7e4e586,d8a3e53c-eb05-4b89-9f7f-dd826898ede7,2023-01-23 08:32:39,84.05917398243426,Program drive camera mission artist present later.
c883fc1d-0056-4219-859e-4ee9da762b17,2ec28139-a64e-471b-8283-15b5cc82bbc3,2023-03-04 08:07:32,396.06065364775316,Be understand then street.
ee3d0a61-4c79-4aa6-91a1-51f8b125f19e,c264450b-9f09-419a-8a52-e5311c67fb56,2023-07-05 04:10:55,342.35323956274516,Memory grow front answer third idea spring.
f62d1ccd-b2df-4add-9b4e-7bd31d8ac5b7,0df2e6d6-fabf-488d-98c0-da09739ef91c,2023-04-10 22:02:48,192.86715963456257,Various girl director kind level.
2bad03cd-dd9f-43d8-84c6-8979c6b260f2,5539e4af-d9c1-45f3-90c6-29b7fabc69ef,2023-08-10 23:23:57,315.93328453181334,Together trial also pull.
36dd3492-43b1-47fd-b354-0d73e7d691f4,1fff9c82-efac-4538-88e5-eecf2588b443,2023-04-14 02:17:19,148.87705638320188,About act hear suggest floor they your quickly.
1ded3644-f054-42ed-b6be-c4a1a2c5edba,b53cfc80-f6eb-45aa-9829-ca5d1a3f3325,2023-03-30 02:38:32,100.68536830583284,Everybody social establish piece rule young improve.
b0e3bebb-5225-422e-aaa3-fa953bcb4995,2f83949a-1145-4a7d-86e6-ebccd3fbf599,2023-07-24 18:45:11,112.41264841549713,Suddenly president reflect star water.
b5f7175a-8767-4fba-836f-8a2e5cdb6540,e7f7a984-2ea2-4e07-ad98-e654cc337656,2023-07-09 05:51:57,190.76950853101968,Space bank much blue.
526ca434-d6da-44c5-8bd0-2e67135bd1a3,cf90ce62-5c84-4d4c-a571-0a33ab75eed1,2023-04-08 11:52:20,256.2907506061336,Forget traditional also professional dream buy save.
d9cf5ca0-1d30-4289-989f-c665cd4a13f9,6527c8bc-ca50-4946-9459-734cf9341993,2023-06-16 08:19:43,435.73028313954904,Or add each necessary even.
ec3ba2d4-d740-471a-b5aa-64225989f6f6,2ddce984-4459-41ab-b5fe-2b51dbec57c6,2023-06-09 20:41:33,324.5366684028365,Song break under plan.
8668fd2b-7c60-4f8e-9789-1d34a1b2042c,12ad929c-3ff0-44cc-b063-4e1b38a3f6b3,2023-03-03 16:07:07,83.9852747480527,Any kid serious real direction year.
168aa14a-fb30-4c35-a0d6-6ecbfefc4206,c25a8733-ea28-4ebb-b850-bb5cdb39a55d,2023-05-18 02:05:15,36.93667956114042,Authority radio chair garden.
e7c7e82d-4073-4cc7-95e7-8d4f65437fca,67bcb4e9-8559-4929-baef-1eedd7be8d05,2023-03-09 15:01:57,130.11552077901632,Affect could woman should political.
75642489-7c5d-4f4f-9729-8b03a4ae1b3f,86d9477c-12ae-4627-be12-3850c777e0d5,2023-06-25 01:33:00,167.81316736097384,Room behind smile bring peace talk next decade.
9f2535aa-8cca-4d7f-9295-d96218e6ed03,8d31bcb8-0ee2-443a-85cd-e4b173e61442,2023-02-11 12:47:47,117.15505872025165,Above there his hundred.
5e24ff86-114d-4e3e-b00e-5854f5632e21,74b0f5f1-ce72-4137-828e-b8639b87b55a,2023-03-01 04:19:27,373.0274449994393,Read PM defense.
a20370c4-f9cc-42e4-b174-37ec9092e813,29a052b0-ee03-4ace-84ae-c81a46e8e6e9,2023-07-07 01:51:31,216.12126560420842,Great student most exactly.
ec9dceff-f8d2-4a05-b13c-21096c995ea6,77d95a3a-5ec0-47f9-ac2f-f4cd40d88290,2023-04-18 09:04:43,114.43273846852492,They grow far room option.
4acaac52-e877-4a69-a26f-5da14bb12976,80a1167a-4da7-406b-b455-5e2539169c7e,2023-02-18 04:23:40,133.24944540409084,Around society human age dark project.
f268c0d9-99b3-4537-b439-4d75c1d010e9,ffc7c967-e2b6-452a-9455-76a6f54342b7,2023-07-23 14:21:45,83.91526209128835,Stuff ability sure worker attention.
e9b01188-0467-4372-bc79-90d181a56225,236db2be-33c1-4eab-8454-64dee171eeba,2023-01-06 19:23:10,274.26220639588627,Join card security indicate charge upon something.
7f5e9897-f2f3-49a3-90f8-41fef2084404,334b3a85-ab9b-48c7-991d-2dfaebc7de50,2023-07-16 15:23:18,49.40503238896768,Trade plant generation why raise newspaper word really.
afb57265-8a91-4b39-a607-89def9910c46,94ab7ab0-cb03-45aa-850c-b0b22613e5ca,2023-04-17 06:21:07,389.9540995755613,Official think city form minute necessary.
2eb95519-238c-4d29-8b2d-9ff310d0d10b,6f1fcfc2-3e39-48e8-9e92-b1cdedb4a265,2023-05-25 09:25:24,433.61350067006885,Religious under grow dream perhaps glass.
5b41a762-912b-4e3b-b44e-31a7222fa50a,629acde5-dea7-4153-9986-6d5b19ec76af,2023-04-23 11:48:27,463.4224170007787,Book score group college mouth bank always.
8d93038c-a84f-4cd1-95f5-9898b011f3c1,487ed50f-9994-44d4-93ef-28fea6b746a2,2023-07-23 00:27:50,21.919500963114224,Listen man face product require though production.
edda71c4-94d6-4d88-8f5e-fee8eb730342,12228443-c5d1-44f6-890c-538063c1a583,2023-04-26 18:25:15,259.99960784899423,Bring right sport city international life threat.
27daab7e-96c1-4764-a3a0-6e035c610137,6673e275-8db6-4c46-bf43-54b6a6ca9148,2023-08-03 16:39:29,368.89777711459345,Six big fund.
d56b5ea7-f7ba-4ccf-8729-9e7ccfc94857,48dd379f-0f58-4d93-9650-1808ee89a078,2023-02-27 06:46:37,459.46883750626944,Place Mr staff example town.
d946d2c3-9df6-4fe1-b8d8-8d3a86895b81,2b7d94a6-2b02-4038-a9b3-b57f6a40a0da,2023-06-15 00:25:37,268.0000427322485,Population number media political occur.
1d1cdcd7-1ac5-4338-a553-c46eb910af97,49343061-5814-461e-aeba-413a737d8894,2023-07-10 09:42:12,186.7319053731921,Mouth card before candidate.
c7abcdb3-8db2-406e-bad9-5dcbec23f697,544087c1-747e-4843-a15e-4e2f9e5f6afa,2023-06-07 07:47:35,10.019793081623552,At lawyer drug fall different.
9fa7aea3-2607-4e92-8f1d-692dbe3e3df8,32eb2a52-ca10-4da2-bee1-7c003b85c51e,2023-04-26 12:18:29,165.68538942287785,Security before bed different.
4c68d3c8-f2e9-4885-aa42-5b21625cb2b8,52d1b8bd-cdcf-4784-8290-0c4d52eeb590,2023-07-13 19:03:56,261.50240898450886,Large myself protect degree.
a04699cf-556d-4b28-8d5f-0ce611483b47,23c9f23d-b3e6-416e-a7e0-1cd18e0b1ae5,2023-05-18 16:29:52,175.0588518731705,Bit career student be test amount.
f56b4384-9451-4351-9a17-1135c5ad2074,b56643f2-65e7-41bd-9239-22b43ca8b575,2023-08-02 08:45:52,72.28783147762118,Some author him dark.
7c9fa661-5834-45de-bfb9-bbe5ca92c803,26dd8052-52e9-4b75-931a-21b05387ff2e,2023-06-25 22:13:58,393.0766814124847,Idea why let especially process type.
206ae7e4-866b-495e-a169-35f341ffccbc,a938875b-cc64-49a4-8f3b-32208ee3b055,2023-02-13 16:21:28,321.31748114167704,Mrs your stage ever.
5a3dbf66-aa11-4163-aba2-23a14b4905dd,b44cb6d4-67d9-45ea-b4a0-cd3b3b655af4,2023-06-23 17:31:31,115.89653970107318,And than without federal politics green deep.
8e818410-8535-40f1-8109-dda6d106e5e0,5d19fa80-f6ad-4f69-95e2-9894dd3f7e63,2023-06-15 16:47:10,274.5056333614754,Offer music technology the anyone.
20e1acfd-c719-4c40-993b-02a25a611650,0dcd2415-d709-46ca-8c12-a224e3b9c3cd,2023-08-06 10:27:49,159.32474322197754,For area magazine.
877ab7ad-2e84-4898-a2ef-62c3a34f71ab,8c48241d-1047-4f8b-acdc-c12785055613,2023-06-30 10:56:29,414.9060003334743,Behind must modern tell.
12b3c728-e085-43f4-9b4a-5538c8adc521,e8df2e73-db49-47af-940b-0d3ce596deae,2023-04-07 21:47:33,334.2763843493975,List final remain office investment term.
70d1880d-473e-47c9-965b-5da5c7e8480a,d4afc5cb-a56f-482e-bc65-df875b51367d,2023-01-22 04:29:35,338.43127948506054,See hospital night matter total.
b7c54814-2cdb-463d-b934-25c624922fc7,7cb77924-d010-4ba9-bdb4-96a5d4017c8e,2023-06-21 09:40:31,468.9072838015364,True color back such.
56b3d61f-7719-4cfc-9a17-4c722213efba,40454014-8804-4c3a-b033-ebe3149b4520,2023-03-31 20:51:06,201.8087377940176,Write message share seek.
47c71cea-641d-496d-83f4-5ce9668dec9d,2b200eeb-6a70-4026-8c76-c4476d68cb31,2023-05-01 14:38:40,29.866568176841852,Anyone continue always produce issue one choose.
ff2843f3-1029-4259-9ea1-620eb70e9ac5,9dd3543d-79e5-431f-a06d-d184fd5e9ac4,2023-03-19 04:50:30,402.39546204016773,Practice maintain anything spring.
c3953274-13f3-4879-b4a8-ff01696a0a2f,1d469ee0-56d2-4dbf-8a82-5af29fd8d6f1,2023-07-05 21:58:47,132.67390809845264,Information dog too player material feel education.
5cacfa3c-12b1-40ff-93e4-4850496d918c,bf88836d-cc3e-49f2-bf0f-6199eb61694d,2023-08-08 22:39:48,369.91206193493883,Meet whole gas would just official.
1f9cf254-a687-4083-8186-7ed18f160210,bdf3faa9-5fc8-4619-b277-ed09a841f37e,2023-06-07 01:48:15,284.9784280514932,Above brother recognize fill.
e37c519f-1765-40f9-91d2-916eaac4c6f9,194f3c49-e5cd-4306-966c-7b9f688b5427,2023-02-17 20:48:09,442.8359064327841,Debate class us book partner read its.
777607c8-e19e-4ec0-8a86-a0479ccc651c,ea97f3c8-0fa6-4680-98ed-39dca9681b5e,2023-06-03 23:03:16,403.8785280663219,Week important along southern food bad life.
d2863e17-6b6e-4aee-bbea-67042ee46e2d,fffe8f72-da42-44f5-8ec6-1b59435890b2,2023-01-05 03:32:48,69.27905504343147,Its bag development father treat point toward listen.
9064a386-8402-41a6-aa9b-b5b77f912a6a,36d10be4-9828-473b-9c34-554bb2c9e3e1,2023-08-10 06:49:29,240.37340125651565,Night make long happen rate expect watch hit.
e62b9503-52df-4ce7-b3b8-fe9ca71d20ed,c1d91b63-dde6-483d-aa4a-bfb61424dab9,2023-05-31 15:02:13,126.8354923394539,All opportunity everybody medical case hear.
50d290a2-25c5-403e-89e4-6ef42c33374c,e9a31665-18a6-43f9-bff6-2df94ed6babe,2023-04-07 22:55:38,333.550686514061,Simple foreign score trial.
53ecd735-d060-48b0-9300-09352b775e08,46ade482-f3a4-4392-bc1d-e8d3e6e38ffb,2023-07-14 17:38:07,59.28388466844816,Animal nation friend must last.
9cb00790-6994-4e9c-8719-82cd89ae2ab8,48cca596-1d2b-483e-92dc-c88f208bbf9d,2023-03-13 17:10:37,223.97586294113432,Successful reveal now card attention meeting officer.
2df022be-2c05-4c33-a1f3-89ae227cd8fa,f759f53d-1826-4e77-884d-31cb0cff251a,2023-06-01 00:50:23,57.48345783155252,Southern miss right.
7367a9ef-f290-472b-948b-cdcda7429902,7781aee1-2168-48e9-b1b1-fe6817682dd8,2023-01-19 03:33:46,319.6266673173126,Low them be cell voice meet wide.
9846e74a-fed3-425e-9f98-065c1d89b31d,b588afaf-22a7-4448-94d7-c1a0cabf0c9c,2023-05-13 15:18:21,109.23693709866893,Individual national time until moment.
e9297ff1-30fd-4d63-a610-6a7db15b98ed,32eac750-1db9-4472-8bf7-3d13d7216dee,2023-07-20 12:54:52,203.3884306641259,Thousand else must animal imagine.
98ad30c7-404b-4a42-9edd-4a259ef77135,9e2912f8-7573-4fac-b3f0-dec580d19642,2023-05-30 14:28:21,183.3082471920085,Point young network let born.
f6c1b99a-abbe-4270-ad7c-08864da06a6b,66076fd2-a721-43e4-97d3-d826b9bf16ab,2023-05-26 16:00:04,208.82522501762637,Its just total director wear trip where nature.
f0d22b1a-25ed-4307-b149-7f5dcf8fdc9c,db73b863-65bd-418a-b7ca-46af301b860b,2023-01-19 19:42:47,94.4614974699162,Ago do PM year southern third culture.
2726f8d8-d3c2-4e63-9756-5c64d7427d13,846577fd-6ed8-4114-87d6-b76ceb87e7cd,2023-01-15 13:50:18,480.2282363213305,Beat respond event from either.
8b987b09-8258-42c7-8c02-8801551f98d3,7ba6ea62-ce7b-4cb3-951d-ae3a49c9f0b5,2023-07-19 10:17:43,225.9178655011285,Ever clear white live realize half.
44df8499-5e31-43b8-8a8d-90031894e5a5,9df03fe8-4677-4fe5-9427-76487e99ae3e,2023-05-10 07:11:26,148.91552765892934,Law share newspaper clear amount.
f09d65b6-78b5-408b-b9e0-bb4c7bbdc3f7,f1143af3-35dd-498a-b34d-ff981a6abf9a,2023-07-12 12:57:17,44.67387108061036,Analysis production return side national summer race.
bab3acbe-47a6-4794-9b4f-5bee773f8c88,7dfeaae9-88bd-481c-bd29-1ebff0d609b1,2023-05-21 20:09:07,135.5359483848074,Than environment loss north election same first study.
36263d81-3ef8-49f6-b001-37826dca2c19,3bab7076-c609-463d-964f-bb66a983393e,2023-07-06 14:27:54,171.52963405298198,Interest wind defense then relate wall activity.
f14ea327-f520-42ed-8430-3b98dc1f2152,a8675961-429d-4d88-8745-1d54ce3803fe,2023-07-29 10:29:53,38.3268867422762,Each sign why ever fire game many billion.
7263eac2-0042-407b-9a1a-a7f6dce550b1,b616f4af-1596-4541-8ecb-a2dd97c60d1d,2023-02-02 20:58:29,304.17861430533713,Main lose more page institution.
2e88f4eb-6029-4e56-bf2e-cc888c844c83,6627d6b7-aa30-429a-9dc4-99ce78e9e6cb,2023-07-22 01:16:31,148.7999867968224,Sort model group now.
419cf2d4-3d5f-4737-a598-c85afa47ee84,d0b70f36-13d0-408d-b890-caeccf51fb73,2023-08-11 19:13:14,251.72735730468753,Sound security break its.
32f27cc9-fd84-4585-ab0c-a028009e8b41,71209f9a-086b-4dd2-92f2-35b9c423d06d,2023-04-26 01:57:54,137.732040101125,Answer a work perform until reality.
0e2e8b49-f165-4e7d-8dcb-e6e128ddab5d,31ccdfe4-e1b5-4fe3-9f6c-a93107250be4,2023-08-16 13:19:51,72.81623415361541,Common social physical us job strong.
88112e27-ceba-43c1-a720-2ece9dc52aaa,beaf100d-b443-4240-9054-cd308281d8d3,2023-01-29 02:48:14,246.3459513279979,Vote question theory other.
30d9ac38-8fa4-48f3-80df-c11f81211280,cedd2c32-f579-424e-a3e9-6d755d492f72,2023-03-08 20:53:14,426.10920110743905,Glass same see challenge college effort soon.
73440224-8508-478a-aa2a-6de9dcf07bd1,758de1dc-0b9c-4ff2-9a9f-a5fc019ebc3f,2023-01-01 01:39:40,240.87067441782642,Certain choose give might mention.
bd07d733-e6ab-4660-a7f5-52c55143e004,fa070b91-9fcd-4390-ad46-de23eb8da698,2023-01-16 16:51:56,316.40554045906526,Among crime away news sort window.
667605cd-eed8-433b-a212-d0044b37d9ee,d605d487-5090-41d2-95b3-dd8f457ba593,2023-07-05 03:27:25,110.04013121100492,Claim appear mother break sea.
02ab8c05-c7a6-4352-adef-d5b5919145b5,878d3f72-d01c-4583-b68a-72047393e13b,2023-06-06 04:24:05,323.4533964971363,Letter star audience theory present west white plan.
a5aaadab-1508-457c-898e-25a9270306da,fe7949b9-697f-43c9-a4e6-c25e5db2c46f,2023-04-04 06:13:59,431.2070925153024,Speak than paper yet task plant local manager.
fa20c714-6b64-4eeb-a4a4-9aa74e2f0400,a67ae2e2-0622-4e89-9ff5-8f0b109b0546,2023-05-19 12:40:22,26.83057907916026,Painting run state necessary.
4d7e7e87-cbfa-44ef-a2e3-8629cccc2ccf,172c2eea-e4cd-45b3-bc31-fc7db3bae7f0,2023-04-09 13:59:54,479.0831213714325,Population card green trade describe kitchen physical.
6c2e6188-55c2-42a9-817c-51f9b9b21336,e67b4cc4-a032-483b-aec5-69cdbf458db1,2023-01-16 17:19:29,113.45978355942268,Day project floor population.
f525a393-6f55-429b-83cd-3fd9220159e6,ca253743-840e-4505-9799-1adafa4dde5a,2023-05-17 23:37:18,411.5621939544468,Service lot idea research member affect recent.
15af11d3-4f95-447b-bdf7-a1b37564beb4,707fb9cc-5130-4e50-bb00-4cf94510b988,2023-07-02 22:46:44,440.43695007880916,Along save indicate light whatever staff process.
141d3306-5e40-4555-86dd-b66de1db5b75,e3a5ab0f-17e2-449b-b933-77494ed4117e,2023-07-17 14:23:11,110.58656160051666,Seat dark than.
97f79022-3836-4935-a349-c240851bc4bd,89d56bf2-5f43-4673-8f17-15b040b185c0,2023-04-20 09:28:48,488.5524868096181,Despite action make could collection Democrat think.
8edc8067-12b2-4b41-b64c-21a883be21bf,215fb639-3aa2-4573-9287-530903b0667f,2023-05-12 14:11:44,46.94226704156013,Threat actually fire animal.
069c9f61-1967-418c-8165-1bc6b0ceaa36,53504f26-99ba-43d7-8bee-c13370f98937,2023-06-12 02:15:51,348.4478237569839,Magazine memory view commercial.
ab3260b6-2d7e-4a77-ae04-564202643c1d,4718afbd-c066-46e1-a02f-57681e78213a,2023-02-26 19:08:30,360.4914271390881,Difference discuss table spring quite happen within eight.
da0f5f74-2b45-4edd-b4db-36a3f4522e7a,f93ddfee-ab89-4b91-b40d-58da9589421e,2023-03-16 23:00:31,385.9394867010533,Support else consider building color deep.
4ddc7fed-72ac-4e7a-aeed-bf5dfae78936,07ac2f81-f29c-4140-a85c-3d9d2fea0caa,2023-07-21 14:22:01,407.61332136419304,Rock kind necessary increase.
2d1bb300-582a-4007-adfb-a1df6c917c5f,29b63fa4-c61a-4f50-bf15-2cfb3ccc305d,2023-01-16 17:53:39,296.7911572765484,Together energy serve dream.
df4affe3-575c-4ed5-9385-25eeb832952c,a5c11e08-16b7-4d6a-b273-3166c5329faf,2023-01-10 20:49:39,162.2913679426339,Civil wall goal senior person simple.
1f3a240e-91dc-433a-a0ae-03d6ae46eb4e,8d17ad16-d7ce-4be5-8095-257fc7cb2464,2023-05-17 17:55:24,298.94610935686524,Case party rich strong toward.
bed2594d-9ab3-4c66-9eba-c71e3d80fb7d,74d92db4-ee95-44ba-a5c4-2db5f54f13e4,2023-03-05 10:26:39,430.5299735241155,Professor natural cut fear clearly position generation.
3ffdb344-7e4d-4a98-bb48-20ae404b6fc6,3a55fc88-140a-4e99-ae74-43388a4164ea,2023-06-01 23:44:40,240.51793681782866,Bank thousand another if since program rather staff.
233089ab-f000-4893-9a76-4286c4f874ec,a0817d65-2649-4ead-be0e-f8b31f48aa0e,2023-08-03 08:34:53,469.5722307605777,Whom hope next box government these hit.
de3c3352-ce88-4b54-b923-4d1a3ff66ecd,0a5a66a5-e48b-4c7e-8e09-1f98d4664509,2023-03-02 17:36:01,328.5852514839497,Allow point in bit.
b018560c-7e8e-46ec-9a62-bc158aefa8e3,91b87dd0-4245-46ca-9739-8ca80013bd72,2023-06-29 09:38:37,136.43041189306746,Various home they front.
fcb7118b-f3c8-47a5-a517-d4c261119770,36a555ad-110f-40a3-b606-ff4f7c558d7f,2023-07-15 06:54:41,433.8394995314124,Help whole theory against education police sometimes beat.
c701da1e-2372-41b0-afc4-f103709b36cf,e185b6f1-6e7f-4519-b5c3-08b3602fa0b9,2023-03-15 15:38:03,378.7386802266574,Summer Mr statement oil.
d1559351-5d53-4c73-a7a8-c6bf3bc296ef,0cd94754-b696-424d-85e7-6f3abf50ab3b,2023-02-02 23:47:59,464.2256825778168,Occur catch himself financial especially year.
ac79e245-15bc-42df-83ec-4948551851cc,02a41393-f619-4d6f-9733-3190e2a0f71e,2023-07-04 19:17:41,340.82012461054586,Yard happen crime late.
405a75a2-b531-4d6c-b41e-e410ef0cc540,2ce886b2-4b5f-4706-a290-88ab0b0efe5b,2023-05-09 04:16:11,105.88048242822536,Parent front girl finish table world.
0081bc61-9b23-4cc6-ace8-bcc590471d47,daed5a59-d46d-422a-8585-e837f88a8592,2023-03-30 15:19:18,36.383987396111486,Adult early grow.
a535221e-ebb5-4fca-993b-ff832a2f28e2,c12c9d53-66fd-462b-85ea-3ac838a38209,2023-07-17 10:53:58,332.97727332186,Mouth direction professor.
b941fffc-594e-402b-a02d-4c42d7da9ee8,3b25f11f-6773-4e30-a59a-0c7dcbe2792c,2023-01-29 13:46:07,476.225638001047,Property hear soldier huge how total order.
725f0843-169c-4821-96d4-c679615be32d,b948a4bf-b5de-41f1-815c-398b3e8de029,2023-08-12 15:54:08,320.9302365218222,Example water nice foot rich husband media.
89c62dba-4c76-4da2-a014-8f94dde63a9d,6240151a-178c-45b9-94e7-9399e2796ad3,2023-03-18 05:31:00,265.52148960009504,Represent manager arm concern all.
7e5900d7-33e9-4452-8dcb-274e970dca7d,1207061a-30e7-416b-b381-6d7b562a60ac,2023-08-12 20:20:35,465.2291761536039,Sea travel practice behind.
f70dd628-513f-49ea-b159-974352f66cc7,79922745-4e90-473d-9323-daece4a11e67,2023-02-23 03:53:19,268.9115628854749,Hour almost wear.
f9fb4dd6-803e-40c3-bf65-b24b8230178f,ba15f6a5-e128-4f4b-bf55-874a80362995,2023-01-24 12:20:27,440.79197153531544,Result cost bank large open vote.
738906bd-dba2-4eb3-a4ba-0b7272d88833,09bd3459-7079-4865-a6b0-0f78669b8dfa,2023-06-10 21:34:12,342.6093626290245,Picture agree six big more official your dog.
47e1394a-63fe-4efd-96f3-078683fec882,4513cfa5-fb53-467c-8af0-5b06e45a8e12,2023-08-06 20:32:28,200.4327673334842,Bit those majority onto.
c95dc5f9-b03b-48af-811f-0a2b920f0c5c,c3c62942-3068-4661-a872-9bed664d5b41,2023-08-04 05:36:52,78.57601239091952,Student should be federal.
920df25a-90ac-45db-9bb8-43411d9911de,ad64ac98-cf44-4219-ab47-708da733e6f4,2023-01-07 07:45:32,11.256752161370741,Institution until develop interesting many.
c7deaaa6-9a5d-4e3c-bb35-29192439d4b4,a585ee7f-43f6-44b8-809d-01dafc23e52f,2023-04-25 08:35:15,123.31997840802745,Fund produce need show entire reflect painting.
8ae05eaf-8324-4082-9057-cef69cbb723a,b63b43a2-8040-4373-ae5c-739e09176cf6,2023-05-31 01:19:49,234.85654549504278,Study play create continue.
df561902-7013-4fc1-95aa-8b511da951cd,74cdecae-49c8-4424-8323-a27516e8c206,2023-02-18 11:40:12,28.328580870148112,Probably section physical owner.
