Transaction ID,Client ID,Transaction Date,Amount,Reason
9c1a070b-c41c-4d12-b191-f1d44659f63c,e54897a6-9773-4766-b1da-510608f9d62f,2023-04-28 15:11:38,322.162202952206,Bit green ground paper person.
3b684905-3076-4e35-bd58-7a687b1ec8b0,f0325b64-d56e-4582-aa32-2e1913340db2,2023-03-08 10:19:46,63.58930570859815,Believe east skill around them.
7460fd1d-05a3-420f-89cb-3e6bfa6bd425,b299dbcb-3d1a-4765-9799-4f9796fd4dfc,2023-06-01 12:57:06,147.7129662178197,Themselves maintain window create stand.
8499a4dc-fd7c-4522-b66f-01b7c4ad04b4,436c2154-d316-477a-bb8d-93eaa3e14d1f,2023-02-25 11:08:05,108.21537787541742,Although their none fear trouble continue already.
73af3e34-9505-471d-8668-6b20097f7ac6,167aad8a-b9b8-412a-a0be-28777499196e,2023-04-01 22:30:06,357.40600787536226,Sense room assume better court knowledge process.
ebe4a0fb-11ec-4be0-8e7c-d33d3abe4698,bdd99df9-7ea9-4630-94e6-232452053304,2023-01-30 08:43:49,112.0239105744956,Whatever home company.
00f0d776-17d3-49f9-b176-07a8a31d870a,e939e504-a9a0-4845-a487-552b92ea21f7,2023-06-29 01:01:18,371.9779796954573,Five together especially station itself old.
5b1e5910-cfe3-4683-8948-b996cdf66aaf,83bcf713-ea67-4a46-8775-a4cc42832951,2023-02-20 16:02:03,135.10707967756753,Crime return tree.
652a0cc1-5459-463f-84c6-900b4b8c4e34,b52d08b4-306b-48d0-9f77-8dc5880c1292,2023-06-27 17:50:58,293.6076266141131,Buy break hot throw region ask her.
3c312647-9ef9-4db6-aa5c-e78a4664684c,01c3b5a5-cccc-4de8-88a1-4cdb36ad7705,2023-08-09 04:49:48,156.27066503986123,Hundred when she its another.
62afe97a-7cb6-4fc2-8be9-302047391dc7,581f2d9e-3e10-46be-8c41-47cd00d55253,2023-03-09 06:49:54,114.44525722913903,Admit two a avoid so.
0a95be40-d29c-4dca-8cc9-fc0aedbcba5e,af4209b8-c971-4ea7-9a27-682be2539904,2023-07-01 11:03:32,213.8671744539212,Them choice former former decide seem production sure.
4b59cc1b-c324-48a2-a7c7-76c253b72141,4e824456-9cba-4eaa-bd25-dfd10a066ab5,2023-05-19 09:09:54,266.1812466164847,Peace white order affect program push.
52119cdc-a52e-404e-a0fa-4eec2acc09ba,991c96bb-7cb0-4cf2-8a82-e0b1284638f9,2023-02-28 13:15:28,106.07012065509856,Describe decision much general.
8b844b3c-1d0b-48b3-89d1-7e4b1a037d09,f68ec058-ff6a-49cb-84b5-4c7c4142347c,2023-06-04 19:41:25,58.09306886348576,To also development expect.
cb938c1c-80d9-44a8-adfa-2d2a4fcfe0cc,7e3feaf6-d465-4edd-9916-fc602bb4ae1b,2023-04-11 23:54:57,47.92464797234668,Much project modern.
1726ad24-9d87-492d-b56b-f8fd2539e27f,937761ea-4f81-4124-836f-c3b2cd743e7f,2023-07-01 11:45:18,464.9097172774083,Culture piece push step whom professional.
f11ffae2-ae1d-41c4-9b60-4c6ac04ed0e3,20653bde-cca0-46e7-9c25-a6a9d44f9950,2023-08-01 01:21:25,104.22208283696486,Speak challenge end subject notice either hit.
a2944330-dafa-4837-babf-096caaf33757,d609b8ed-87e2-4981-8486-f4adc70b0b9d,2023-05-29 02:43:40,240.6822120245636,Above police me wife.
2cdecc8c-9d1a-4e20-ad34-9ca0eaf63ef7,90b5ce4f-a21a-4623-b206-475a78286cac,2023-07-12 20:56:17,276.06611097034255,Able coach election training debate large start.
563359b6-76b4-430e-a5fc-dd4bf7921f47,1b5dd762-66a6-4e79-bfee-ba2d48f29540,2023-03-30 23:46:46,245.80062243635487,Floor such shake.
65ed4388-a010-4904-b197-9640329f2c64,5a52b438-a0c4-4d68-8741-dc6a9d274695,2023-08-07 07:30:28,393.5125554594268,Information success behind big whether recognize.
c0fd8432-1bf4-4da1-9c2e-8b4f55a5d2f4,fa408ad0-8104-4af9-9ad0-f29f927499d2,2023-01-26 00:46:40,102.43599433136477,Choose Mr itself work house accept much.
88f16c26-0651-43f2-87b9-7580e87e0746,0f19474c-2369-4c69-bfe3-7769efe223f6,2023-05-20 22:47:53,199.42422536009354,However report close fast character hotel.
ba484e13-74da-4c29-99f0-9f67043ff1c6,2a6ed616-2420-4174-a62c-e8f336d014a0,2023-05-04 23:50:26,225.4509657747172,Seven effect board last structure study.
b786f535-7ca6-4aba-8953-210f505b4115,adf3a38e-0f76-40f5-acfe-adad9c53723b,2023-04-21 03:05:46,188.7004071849529,Participant participant charge record matter seat.
15d77c08-9995-4dbc-81ff-187cd8ef235d,0ad56566-4202-4d78-b7a6-769ffcac05b2,2023-03-02 02:15:42,234.6140193687691,Book exist store skill.
746196c9-c46f-4b5b-af80-2bedced6f666,69e14a96-c405-414b-a0b5-15a67f7bd6b8,2023-05-23 14:45:52,328.6937421876039,Explain charge social food although recent.
73dc6b9e-0300-4cd3-9f8b-8d6e79bf9078,278d2adf-47cc-43d0-9e0a-28646c40b45f,2023-05-24 04:27:12,237.89915823407364,Difficult positive statement often scene person.
1c7eddfe-c931-4b60-bec0-87de59d32089,bc50fa47-a94d-4a54-a0b9-4a61a44c3217,2023-02-23 08:07:17,186.37713121350674,Situation but fact speech.
43d34925-c083-4178-a727-e25ea857325b,82a60a3d-c35e-41f8-a823-fb2aa8f6758f,2023-06-21 03:34:25,213.95612644688285,Learn push huge picture.
502a31be-f87f-4c31-b41e-c888f8c0516a,31c90ecc-8880-4e48-9025-3f5fda410aa6,2023-02-22 13:23:58,355.0753654377696,Book moment shake personal and.
5a1a89b0-0397-4bb8-bbf6-4b6ce5643d6e,59bd33ff-2e91-4e9c-9ef1-c459e4913b6d,2023-01-14 08:12:34,414.63813865367786,Unit voice others animal local.
1fe9cbf1-8c2d-49b5-8cdb-a97fb48e7ff5,aa4c1446-b679-435a-8ce3-8faca15061f1,2023-03-09 07:17:07,37.50389466678384,Teacher quality health idea gas.
5c44ff53-c3a5-42db-a58c-f2eef3024002,be253a2b-1bcf-424f-9c16-9d0793c39837,2023-01-08 20:49:27,426.6202934689069,Keep where popular explain nearly look four.
5b60254d-f2a8-48cd-bae0-ec6b17e6cbed,8940ddd6-b1c7-4988-9cf6-2598d1e7e310,2023-05-04 17:39:30,415.9678867929332,State determine wrong born put billion.
39025e74-6208-453a-9f64-37f6a74a4b28,c691244d-ebf5-435c-87a7-2ecae833e1c9,2023-01-03 23:15:04,239.4939912034242,Born successful campaign these evening.
05a7f09b-f072-483d-8cf8-b70f42477bbc,45b5d915-c04f-4dfa-bafc-46d09b15a3fb,2023-05-14 16:21:21,38.1809671843819,Card traditional wind worker security.
7f1f34f6-aedd-40be-a2c2-981fafc417ff,eb6046fe-2841-4013-8419-ba07c48398f4,2023-07-09 17:35:53,166.742570735932,Measure discuss among step hard security.
beac7703-f450-44f3-b789-54fdad6a83b6,4e4ac9a7-f56f-47f1-b889-8415bc148d0d,2023-04-17 09:46:11,301.9197134131654,Station human reflect see truth throw talk company.
1d774f86-686e-4e12-ac3d-f9fe9e9d4bf8,19c46f16-792e-4c09-a029-a30b589320fe,2023-01-29 03:05:22,318.1981824428961,Live raise second.
e05cbafc-8e18-4ae4-8e99-8eeb5cdba493,c8364fb2-dc77-48b1-83b4-227ae693ff94,2023-05-02 16:09:10,245.69101842029679,Total increase plant common health table.
e3a1f46c-1721-4655-9df5-36eb8906c475,6ec42275-e838-4246-8fe0-6cebe8ce2c97,2023-05-26 07:57:35,49.44140477739831,Face hand like best investment any may.
8f8b00d9-b7df-4d90-b9e3-7bf350e113f2,a02e421d-b5a6-49ec-b2fc-da7fbc8134ab,2023-03-05 16:09:56,385.15626680560075,Social join nearly beautiful many.
db04c595-bf70-4541-8b4e-7b8612ca4fbc,3ec6f41e-9fd4-4f39-aac7-63dd01481c96,2023-03-02 15:58:09,288.6718124741461,Understand learn right record tree involve particular.
66be14b4-ac9a-43f4-94ae-c5abd0ae3403,ea4fdb1b-160d-475f-8532-167a3ebb37ea,2023-05-04 01:19:26,211.1971847237677,Service exist management glass community market increase.
adab35e5-761d-4ed3-a8f5-5f9a6b90a5fb,0d6ad854-c920-4c64-a2d3-ab5cb5c4d016,2023-04-19 04:33:25,65.02664496021744,Move chance office defense fall.
768e11b9-09cc-4cbd-ba62-b2f6645a3200,f63bc454-9bb2-45da-9442-85a17c631549,2023-07-24 14:25:14,173.09615028218056,Hospital great yeah memory arm foreign.
17163772-5817-44b8-a7c2-9fc35e398d3b,5bd5d9fb-9b68-48d1-abd8-80727699ae22,2023-08-08 00:32:18,48.7428837648323,Project deal consider white special.
8077f468-3225-4a1f-a6d9-efae156f48ee,5fac9366-8a5f-4e8f-a93b-13a2127ea740,2023-05-08 14:00:38,62.98163794760558,Age discussion thought.
94297a9a-8984-4b00-b292-c8ae3c261517,a38da8f6-236f-45ab-accf-1c2772d843aa,2023-06-11 10:45:19,314.91671362302986,North family road into.
4e9cd75f-cf4f-4070-8c74-6fa7e4087666,9108b3be-27c1-488d-9c09-5e899591deb4,2023-05-29 06:36:25,190.36169752482525,Work deal arrive head.
c5a955be-ecae-4ad8-9794-ea684e9b313d,4f6b0ef9-d87f-4650-92cf-f9cbc1f9039d,2023-04-09 17:42:44,473.7785855403749,Police show reason positive produce.
00333f77-3aab-4bdf-8d60-c7d8da542ab3,861e4588-1ae1-47eb-ac2a-653d102e1c97,2023-01-05 14:28:58,473.09997260170013,Dream entire week memory almost officer style.
ad795a08-5391-4412-8263-b487f6c1b26d,0875275c-8da3-473f-93c7-e3bf950ed612,2023-08-16 06:09:47,238.00398264146148,Water evening happy affect.
bc68ade4-d2e6-49df-8149-d1f1c43b21ad,c00aeb33-6cc3-4c73-8cdc-41bd9ba0f67d,2023-07-14 16:51:46,412.2730735067903,Letter several event more nature close.
69fc9ace-0555-4969-b75c-a39c2ecda6ba,697e9250-9e2b-4819-8b74-c863247254b0,2023-07-27 01:56:52,463.8210043943449,Bank election image name mission machine south argue.
d79eb824-c6b1-49f6-8ff1-9f9093228efb,4f2da30e-88aa-4f7f-9902-9d69adabbce1,2023-02-11 22:20:52,186.80285593508518,Capital somebody one million.
41854df9-aeaf-46d8-bcdc-730dafc2789c,c8a0fb30-091a-41db-a910-918b11e9ebd9,2023-06-22 22:47:34,91.55144286414121,Him security how prepare clear.
58369141-d98d-45a0-8bc1-ae95e8a53f50,01210a0f-8831-4cbd-ac0e-4fd942b54085,2023-07-22 18:56:52,333.1910395623649,Good force city with.
b5f5c174-4d90-47b2-9328-331a2443c0c4,9ea54a3d-ed99-4012-8f6c-31950b83aaa8,2023-02-24 12:37:27,65.28503889444073,According key how company enough small move never.
cc2ad3a2-aae7-4b9b-8798-3c02e1a74294,8d6e1f76-69ac-49eb-b31c-8233923896a8,2023-04-08 13:49:20,265.5371469956482,Front method today big child necessary.
3dc64231-d536-459f-822c-d63990f8a354,a3a29b4d-ac38-4bba-aa6a-4f7555acd9f2,2023-07-14 06:03:41,346.72184026550843,Learn eight never spend general hundred increase.
a1668b57-3a30-4555-a3e7-8e7ea8956f9f,f74e3e3e-327f-4f2f-8339-0febf85e25c4,2023-02-05 18:29:11,471.29138270385573,Ground small feeling open.
d592d54f-dec6-45cf-9b42-f8c82bea3703,53860e49-e1db-41ee-9bc2-5c6c7c2da4a2,2023-05-01 02:23:49,389.32964458061826,On actually quickly.
5f5e85c9-d530-4cad-902d-b719400864f7,b6088feb-2f45-4e50-9ad0-32e9b2f438e4,2023-03-17 07:54:29,23.57728132929529,Movie value number contain.
67e01eed-697e-4e64-8a2b-7df1bcd25a45,798b3b10-b484-4d17-a5fc-5e146f75bacc,2023-07-21 16:17:34,96.5711928452394,Forward she whole support.
75677a67-9c46-4ec8-85da-066bf615658f,95d0db37-46aa-4ce5-8b25-6482c2499fa0,2023-06-29 15:51:31,38.42463256472104,Watch power herself increase believe.
0278c19f-cd0b-4314-8b5d-579fc7ef6303,8fab7fe4-98e2-48c5-94b9-10be9174c9b4,2023-06-04 21:11:08,216.18494270128159,Market politics protect possible hour wide.
71360ac6-15a2-455a-aa5e-395043a3672b,28aa7af6-5ee9-4e09-b974-882e1f00c411,2023-07-11 05:19:36,405.6853267566559,Matter reason skin.
cb789fee-212e-44b0-ab78-d53bdf168382,c2f2c381-1003-4fb2-907b-bde40327d702,2023-05-11 04:49:18,193.86166765663975,Upon decision value kid option.
48b19011-b274-4e0b-8b3a-7dee2e3dae95,3fd0e906-a40a-47d4-9b46-d78627e92472,2023-02-16 18:41:50,263.3551313428799,Clearly include describe election director history exactly.
637cd0d0-6118-4089-a6ce-02632e3fad69,6492b5f2-5081-44dd-9e8f-4bc073631e2f,2023-03-24 17:51:17,456.373483484769,Song admit market green organization as begin.
2fdde39e-bc3e-483b-9a38-6a03eeba9d82,c31a86de-6c6c-4369-9a64-c096413e2c12,2023-03-09 23:42:14,420.49642108730256,Key cold team upon anyone.
92c23d2d-0469-4d9e-a5ba-4e6fcb5bbe25,0dab476c-9912-4c75-8be8-b7e9165f4d77,2023-06-17 16:15:08,157.09215843153726,But involve rule state player soon.
6f0e9ca0-04e7-4bd0-8696-1a6f13a3a0d3,f34e5d03-f522-4781-993e-4c57c1244190,2023-06-15 08:07:48,210.8015898569121,Base perform manage why.
fee1b9e3-ac0c-41ca-acaf-d27312b65d8a,7a39aa11-3931-45b3-8c87-7e955f214d9a,2023-04-01 10:45:30,55.729564304084874,Perform art commercial into born policy through.
f823416b-922d-4829-83c8-6c3c13e97f23,246cb91c-4283-43f1-9c36-d9ea3e570ad9,2023-05-18 01:19:02,138.3500875919196,Start project shake this with.
3b23b2ac-a932-4dbe-857e-300f7912016e,adc02fd1-c999-4efa-99c2-c4eb07e346fe,2023-02-18 10:00:54,102.5416094876951,Animal seat some interview.
46daf4cd-7656-466a-b15c-c2d82edb0f23,80ade0b3-f818-4d89-8723-14716d49a295,2023-07-22 04:41:58,94.19429795624445,Play maintain team executive admit.
ea52183d-46c4-4a51-a266-2782726560cf,d931b905-c4a0-4cd4-adc8-4551132ad09b,2023-03-06 10:34:09,310.025527874204,Number class truth movement.
14e07dfe-da80-4379-a362-c373dfd5c026,2cde0389-a7fd-403e-89a1-8066f4ab2cde,2023-08-07 03:00:56,75.9269183739205,Almost art program.
3a49fa0d-2a8c-4b56-a229-2a75f2b6e6c1,c39e7f76-a065-450e-a17e-6106b78a28c6,2023-02-17 18:20:15,379.1249292948003,Rule almost child last be.
d60daf5e-6c66-44c7-a3ad-cf185205cf48,5c34c243-05e8-4e44-b7d9-160d152cb340,2023-06-30 22:55:56,106.18482556944181,Fast particularly soon enter.
44cec19c-5ce4-4666-88a4-c2bc4370df1a,f3844bf4-7e4f-41c4-abb7-80fe5a03e866,2023-03-08 23:51:14,257.0881567421257,Shake program culture a.
88efd971-b9d1-415e-a829-cc810409af7f,c0874c37-313d-484a-969c-e2d5a6d097c5,2023-06-28 11:58:49,411.3393660791317,Kid bring long leader that quite report.
8566e0e2-fcce-4795-8f1a-55615788f159,a5fd2e39-bf04-484e-94ba-063b211925c3,2023-01-21 16:12:04,358.6487011557694,Several international ground girl.
0f366baf-5a3e-4a94-976e-5afb3f555c0d,cba793a4-bb82-41d6-b70d-81b76950a359,2023-03-06 10:53:54,166.16246539084662,Deal general business bill not.
e28b0450-b5ab-489e-a135-0561c1ac9847,853df525-c8fe-4923-821a-7053530b51e2,2023-06-01 11:32:58,150.21367819432928,High up attention executive.
1f39e805-ef14-4c62-b690-64b1cc7eef43,0493b1ec-ebf3-48ce-93cb-d7dc454ef91d,2023-06-05 11:10:19,489.84918204470506,Cultural material early customer manager note student cut.
987a8900-003b-4977-8445-79e97bc27c9c,38bbeca0-ae35-4c2c-9db4-27d84d1355f2,2023-01-01 06:40:04,153.24181665371302,Do money seek second they energy true particular.
9d75578b-9d50-4157-8e98-5ac6ef8a3380,fc3a4941-ebce-4fdd-9e6e-df35ce3c236c,2023-07-23 16:29:01,217.9959306516377,Type family case line amount cell people.
a41052c6-3288-4c90-982b-d19498a34dca,11fbb5c8-2a77-4715-8ced-343a5f4351f2,2023-01-10 03:03:03,336.758026434136,Side decision office.
176a2f10-95ba-45ad-8128-0fa5295dbcce,c21ec276-c536-4f4d-8990-e5cf01a82148,2023-03-31 01:35:49,66.50880204190261,Star for pull my.
4acc66cb-3d00-4992-97b4-0c49b924b501,52456209-f37c-4f40-b563-55eea777ab56,2023-01-22 04:53:24,190.03961698371668,Thus already sea summer phone.
4ba9e37f-17df-45d1-ae0d-0dc5c402ad43,6c293eab-0b5b-4634-a639-605f996e0436,2023-08-07 03:57:12,286.3838005487454,Church reveal guess federal pull build management simple.
cdd5b313-6886-4d41-ac08-1d1abd88dd05,d849186b-d868-4dca-91b5-2b284095175b,2023-05-09 17:56:09,143.57066158333717,Realize difference same cover dream.
d13bcf37-320c-40bd-b27f-377ea08c95e6,ce46e652-20e2-4f41-b630-27aa31f63982,2023-08-03 07:52:57,34.01579303611304,Whatever left federal score successful hospital.
0d8e4b9a-3743-4501-b524-ba97dd5a56a2,c14b9bb2-23ef-498e-8a47-fce1e229b6a3,2023-01-07 16:28:44,107.702061510625,Source others action or degree.
349c3d48-7900-4e29-ae41-12b7f86b3676,6846abef-c108-4841-9ec2-0d99e3d74698,2023-04-26 16:24:16,172.8695409549063,Human now ahead.
24a66381-3e9b-49c1-a800-54a2474f3d9f,804b2d19-57a3-4aa8-8116-076fe882c726,2023-02-03 22:56:57,32.53916707402277,Responsibility during blood read.
fbffbda9-ac06-4c56-bb4d-335cbbe360cb,c65aae34-2621-4dc1-8a1d-e7118797607b,2023-02-01 07:07:23,120.75035707824505,Vote run great wind.
144093e7-8b9c-4c8d-abc9-078b62c5c54b,926d1a8f-67da-4a9d-94c3-644024404f57,2023-08-07 20:55:23,439.1548164738526,Land bed behavior fear professional admit family.
df07fba1-4a04-4340-863b-960628667183,88547f7b-18ab-4190-9661-98c3455f4ffb,2023-07-03 18:11:42,183.48145538826287,World manager later.
ed006968-d7c0-4e44-8f95-9f87d0dedbcd,ec3b4232-df4b-4e4b-a16f-ec4b44edc4a9,2023-04-30 21:46:50,430.2996019537659,Environmental rather during middle along effect.
3a87cbe7-ed0a-4cd3-a14f-3ae69bb9d623,81434fba-c69d-4a02-b31a-e7fad1e6db9f,2023-06-08 15:07:49,135.14249834578308,Attack move size third rather minute left.
88ccbbfc-3453-4f3f-ae50-be6eb9e0dd32,311110bf-a26a-4fe5-9814-ddf5c98afd81,2023-01-02 22:01:47,144.40792130563534,Else hot blood.
e7bc692c-d253-479a-92e5-e819200356eb,30ef0c85-c606-46d9-8002-ced54f0a4cca,2023-06-04 00:29:55,374.4256128669943,Meet consider hear employee player garden yourself knowledge.
5638703f-cde7-4ec7-969b-f071f8d55fd7,f2f0848a-30de-48f3-9bb3-5797e46c55c8,2023-08-01 13:43:51,377.5136358753256,Apply catch write customer size sister.
f00df05c-fedd-4f98-94d1-2f5cbe374cfd,1b277cd2-995e-407d-bc91-35929a485d56,2023-08-15 18:24:02,447.3710491080449,Discuss have interest.
245bcdf9-01bd-4a59-975e-caa18f751fc9,e65a4d6d-a92b-4ce0-afec-8722ccf82c15,2023-01-10 14:26:32,100.36221452368495,Near need table end prevent.
edd60ce6-f401-443b-a2ad-82a9b6849344,74a4416e-0770-401e-9ce5-c5474d223e6b,2023-03-30 08:14:53,20.463802387146153,Candidate peace actually very city.
714a8946-1d13-4976-8ab5-3d8b9a5feafd,f16a6597-f0f5-40a0-b134-a2a7d5e88615,2023-08-04 02:13:50,387.43521966622893,Offer painting institution conference per Congress artist social.
033022d8-1817-422e-aba8-41748270c262,dd6579fb-c23c-4a5e-80f5-89f5f50d7a2b,2023-04-30 11:50:51,484.3974735585462,Million audience very himself scientist south economic future.
bd4c2f24-4006-43f6-b2c7-a2d7f19ef4ad,6ceb9947-07d6-4822-960c-30440a118421,2023-04-24 08:12:33,484.3513203511674,Drop challenge human enjoy.
b2872897-35e5-4a06-88de-45db374138f6,c3c9af32-0388-46b4-811e-7cd0164dac50,2023-05-13 04:47:21,236.0381533671958,Official meet likely southern during until training.
1d854c47-3ffe-49de-a035-abb618261610,ad54c1b4-75c6-432d-ac32-919472d1c0bb,2023-04-18 15:11:22,253.31068139413367,Everyone today it bring of stage ball.
61643440-4b3d-47b5-a6fc-21e205eda9ff,5f9037e0-5fe3-4d19-add4-5bc227df6e93,2023-03-04 21:03:26,499.08722325569784,Character page thus include city loss.
35ccf501-d565-407b-aa04-f0bf7cb6f148,14ceda44-8082-471e-a7ab-6931b4d9db06,2023-04-12 17:23:09,488.3478517846622,Behind child interview allow.
c19f2ab0-a653-4fb6-8fc8-ae4623e62c2e,64a4b785-46a5-4369-bddf-d7fa411b011a,2023-01-13 14:11:54,20.43067942012548,Break western positive believe let cultural end.
c5f84611-6dcd-47e2-a9cf-55719396d0af,932a5ebd-1f07-4a87-bd7a-dab0adde14cb,2023-01-31 13:40:49,326.22260660465344,Recognize make listen back picture similar.
0f10c6bf-1d0c-448a-aca3-8b6650136dd9,accd2bfe-bb7e-42c2-9f6b-c7088f49438f,2023-07-10 22:19:37,303.63910140381637,Vote describe figure on.
473aba49-9309-429e-a560-0c581f21ba8e,3e69bd9f-4baf-4b67-9646-e0b2df91a841,2023-08-15 10:16:18,43.954177431698355,No future possible money deep.
8dd56ad9-7be4-4356-a4c1-1ceebad5b239,6ffac483-b22f-49fc-9da4-797ca36e6f02,2023-05-20 06:59:03,470.6181501912428,Former lose cell their car outside agree.
51a16097-0e04-4361-95a1-fec43086f2e7,1b07ea30-3e7b-4a82-ab8b-b9f8e372e0e8,2023-03-13 15:35:05,286.25144630406476,Rate know tell region begin movie stand.
d46b4577-3fdc-470c-82ee-c4758b92c0a8,1ce8d56c-4dc7-42c9-b711-043efaa241f7,2023-06-24 17:46:05,429.4841315772604,Prove major court.
14ae3b06-3cac-47cd-9ab3-65b8dd8af505,14c36fef-fabf-4ba7-80e6-681c73b32207,2023-01-15 03:42:04,328.2557255692042,Republican room art music born care.
9ba8fa6d-2c63-4ed6-aba7-4416234aa204,eacfd93c-595b-4206-aa02-35e6941938d1,2023-02-03 00:17:09,81.97703358618665,Hour any cold together decade help consumer.
79ecf77c-8ef3-4b07-ba85-5750cd5959ab,844ce4e4-6069-4d25-aae2-09e700af6fb3,2023-01-08 14:02:54,284.5549527538482,Hot do she.
04bc0de4-ba08-4641-9738-bdf36c7f68d4,568759be-d855-41f8-8b7b-99b53b0a1f64,2023-03-11 03:03:15,58.847208485842394,Spring your five serve call.
40480ca3-0dc1-42d3-ad4c-9f2417b7c166,0ad4b204-a5f8-4133-bcd9-764afc0def34,2023-03-24 17:25:26,484.90290723699934,Time travel whether common.
a322f4ab-cada-4570-a61b-218dfad9cd48,80c5c7ee-77ef-4ef6-b0df-817c534e9454,2023-04-26 23:26:57,300.76787242338503,Ever happen write reality rest memory thing.
3ab61ed1-9da2-4e2c-92de-97fa3519b2d2,c649bf82-ef4e-42cb-b9d7-8581d736c22b,2023-01-13 19:11:09,109.89670641329239,Bad father simple one.
a06a340c-62a9-4a3a-8ac7-f71cd836152c,ed8059df-02ac-41d0-a83e-b307f4b47c8a,2023-03-22 23:02:28,193.61418033587688,Worry political court couple drop record.
a74b00c4-1ce1-4c76-a34f-edecef23cc7e,defaf67f-f4f6-4178-9f64-474cb52a029c,2023-08-07 00:33:15,408.9150606101781,Thousand anyone suggest down they.
fd5f5e70-617f-4032-92b8-7b682cb8d7fc,aad5b4b5-7d50-4319-a73f-54455849eb5e,2023-06-15 22:58:53,299.1059663608272,Eat officer tree box.
3125dc78-9f1a-4650-be0e-39ec814f316b,7d6dc446-4fd3-43a3-b045-fa2dfdb32163,2023-07-10 22:15:05,94.90998564833532,Able box moment TV.
d390b978-1b8a-4aff-b38d-7689c1ce14e4,3d7fecf9-e2fe-4706-b50d-e059be1fde91,2023-02-05 18:38:37,345.6224217711608,Usually decide tell individual instead.
e635dcd1-4b36-4bb7-b5f4-711bb852df15,e2e95a00-b2f0-42b3-bcdf-90f4ce2d76c6,2023-05-31 16:51:17,171.7968756554561,World either according relate degree.
f2b7d205-967a-4180-ae9c-2f8373795797,e468d730-6646-4eac-99aa-76ea4bbffeb2,2023-03-16 05:06:38,356.86328026235617,Various check yeah budget member participant.
c6f0add2-44ec-4171-81f9-74c8c81b7eca,8666f9e8-9bba-4078-b99b-74042c772574,2023-08-14 01:59:45,434.0851249133181,Official big husband doctor hard remember soldier.
a3519415-6913-4b68-8114-1669b678837c,b1f5a21f-04b4-4ba8-940c-ac72dd7e09b7,2023-04-27 05:34:44,462.0216109320602,Window tend example society no level what section.
672344d0-9143-43f7-958a-fd86c423495e,68ecc906-5a0a-44a4-bc96-b23f232563c7,2023-02-07 12:41:58,250.19425862000875,Skill will son actually early job send.
6daf0d61-f697-4693-905a-22f31e18afac,45b11581-b86c-4039-9675-f60516bf0d14,2023-06-18 22:14:06,177.08046620181835,Free sister between phone.
50e34eb0-830e-4690-ad09-4bbf7edd2568,1ef84010-4801-4d7d-a3bf-f3c7c216a301,2023-03-15 02:13:03,318.77170618732,Data debate idea federal Mr nor.
c5089e18-f7e3-4786-8181-fc8cc9594fc9,25dc5f9b-bc45-4a84-8713-4fcf2e3e47bb,2023-02-09 20:24:12,69.97047893192422,Challenge whom within thing number risk west.
5fc86215-7a38-4080-9721-1dc8be08b035,c888386e-3334-4d8a-ab97-73f314850ee3,2023-08-11 06:19:11,313.61016136399695,Consumer main human city maintain call way assume.
6f92330e-f9e4-4763-a8f5-71282506f8f5,b0e84652-47af-49ca-9f6e-575f1b46a276,2023-04-30 12:46:33,108.99813679717208,Listen least such.
140c2569-47f3-4c9c-9f55-a525804c764a,e57c5f53-40c7-4c75-aaf1-55a78f3fd755,2023-04-27 13:39:25,490.5529915955418,Stay national rule notice particular national everything.
84897548-bac7-4150-a111-71680d35ab76,4dba2360-978b-4a8b-aced-0768c1f819e9,2023-06-26 14:44:02,352.56620754382914,Man trade staff talk field.
0bf41836-877b-4fd9-b5c7-0ce02504345a,4a0948eb-f62c-4d58-9893-8c01356986f7,2023-05-23 21:37:24,261.3941591234095,Population always far American inside.
c236617b-942c-44ba-a5b3-b345a91c1171,46e0fee6-69f6-4f6f-a739-d8471f555ce4,2023-04-11 17:05:29,110.0337959134873,Mrs few kid perform.
e3db6210-a335-46b3-bbce-80f375c6748c,8cbe823e-f314-4e07-a323-4f4b10131733,2023-07-13 02:01:14,118.60025901240148,Attack early necessary plant.
3b922616-511c-422e-90f2-38828acdd874,a2f11dda-786d-481b-baef-52c10832bf00,2023-08-10 00:37:14,221.02324681889124,Hundred moment start address officer above something.
5c84d0a5-7ca9-4157-8949-b804bb6a5c5b,81e5eaa7-c38d-4e85-80b9-3f30d4a8e3ad,2023-08-09 17:55:11,356.96287041745626,Question rise poor hair.
f810b085-ee46-4250-9279-b55779a27d92,fae1494f-8df2-4799-b791-e68d21018707,2023-02-08 21:50:03,397.6395285374256,Agent discussion happen painting reason hit should area.
89195753-ba5b-4ed8-bb02-0416cebb5c0b,6d258a74-5edb-4bb0-ba69-028ebb5b2090,2023-02-28 14:27:04,49.0847801024361,College should federal help subject mind animal.
10f0a04c-0cef-470a-b2f4-3d6c310162a8,dda6317b-0026-4fe7-b101-f52a723c4246,2023-08-13 10:12:34,311.97954048220714,Season fire couple effort.
b6b7f794-6048-4b87-8f0a-18de3ce41c31,26e6a3d0-09fa-4c4a-8d47-d0f093ca97a5,2023-01-24 10:43:35,130.74669168959514,Technology think manager fish.
191d86a8-70d0-4518-8ac5-02f086470f17,62521857-3841-4936-af1c-5cc4f5eef490,2023-06-21 18:03:38,323.9132824460504,Just star play fast party over hand.
e13cf7b7-2239-4042-bb39-996a45b6c40e,8c949bc1-bcd0-44f1-86c1-3f2ae99c155f,2023-01-16 10:01:12,495.43447288278026,Around spring tell effect song his.
7a9bcb50-af8b-4846-890a-f5a86bdc6921,39c3bde5-983e-40de-ba2b-2298344d64fc,2023-05-26 13:01:52,236.46349791942484,Return success such collection strong turn knowledge like.
5f241a71-60a3-491c-b747-1153358123ac,2490d5fa-4e10-4791-b849-4da79ae7a415,2023-03-22 19:44:19,77.69845191689367,Face bar book environment middle see.
a1a5cbc2-d2aa-4b5d-a241-89a8b434ce27,f6d96fab-ba91-434b-acf0-0f69440ad918,2023-07-10 11:51:02,457.4117938064301,Very everything already mention safe court without.
217f3ad2-4a71-4d97-922c-d11705d62ef5,a0655f26-cd5f-4e7d-b69b-be85a2406fe8,2023-05-15 04:49:52,247.06626565188128,Seek agent five thank thought standard know.
7fa46691-b8de-40b4-b84a-0ef082206087,df52275d-844d-4c7f-8b6a-2c72637a5c8f,2023-01-29 10:48:39,478.08117798580355,Phone tonight race think kid political other.
a6e7ed62-95a5-4e74-8609-4b5de2ff86ae,cfad4cb3-02c8-4062-ab00-fa0b22992288,2023-01-30 11:21:32,403.6135942598037,What responsibility office stuff state wind.
904fd562-aa18-46c9-acf4-1027831d9260,164eed51-5249-4fa8-ade8-c9a8dd89889a,2023-02-16 20:07:07,182.710659048348,Follow either responsibility head exactly real.
a78ccab7-4afa-44d0-9be2-67cc7cc65718,b9fbec0c-caf0-4e61-b26d-7f67d0ce5434,2023-07-18 18:30:51,355.9378363375513,Foot never place.
e15069ac-8185-4e9c-aabe-c3f4abc3b4e7,3b724133-34e6-4351-858a-5ae190a80caf,2023-03-11 15:05:19,462.20210639416644,Cell question management minute natural health education.
4a693123-2d2d-4e23-94b4-dadb5a33bc1d,3fb5f03f-532f-4cc0-bed7-2cef1514c160,2023-02-24 17:30:24,190.50620281608218,Write business baby senior company.
cb759937-2857-489e-b3a0-e5bf7c9f2cde,c25a5eb5-3278-416b-ac28-e2aefcb2e13c,2023-03-05 13:51:09,139.82956419012834,Some rise whose seem.
