Transaction ID,Client ID,Transaction Date,Amount,Reason
214a36bd-e6ba-4e99-a8c9-2cd95445ab9d,413e89de-6c46-486b-8421-e57739f24fbd,2023-01-26 14:17:52,112.88947167110975,Along most large bar amount bit.
2b64abb2-dd7c-408d-8b97-70bcaefa79c7,7883717b-fcf7-42bd-9a5e-57ac5ca583f6,2023-02-14 20:28:04,283.57043297430465,Experience radio community accept.
0bf79694-6894-4ba0-912e-4a0c5e6794c3,a1ffcc4b-3d57-42cd-9f45-fba7fb26e57c,2023-02-25 21:36:19,451.3831327831977,Range seat performance around writer kitchen.
6b439b24-2ac4-4680-8f4a-abba827d1c4a,702aae00-ca25-4b12-b296-bafb18d8d86b,2023-01-26 21:45:45,71.6326229635194,Themselves store its media.
4a8420d7-3d08-4027-962d-51d313e33c4f,e90a030b-9a5c-48ff-b9b3-359704b45015,2023-01-28 06:30:39,171.14248423811995,Then address we simple.
2fd0d82e-4230-49f7-bfce-e5a0170e8634,908f8f40-f989-4aeb-9965-ee3ffab4d22c,2023-01-11 23:56:34,397.81442145810104,Car style market anyone.
48de8f86-6f36-4d5d-84ba-409ec2445318,72a2e0d8-4785-42e2-8cd0-3aa34f094a55,2023-05-25 13:32:10,96.02631890763917,Increase charge provide data mean.
b1385b39-da44-4ef6-a427-b65cf6feaafe,c6a7cc64-fb00-44ad-bb60-7a7272f15bbb,2023-04-18 08:44:37,472.1240896435156,As support ever.
5eb1550e-b34a-4e4e-967d-bafad30ecaae,b2b562c5-5c20-4cb7-a3a3-d3a2f7028199,2023-06-25 02:34:54,270.51624434560375,Fight major pass city change.
9ad3f2cb-2328-4175-9092-b38a1315fff5,01ed5fde-74e9-410b-b457-2f498baf6c10,2023-07-10 03:17:50,12.146803764691562,Word early cell science bit five adult third.
51d60066-0585-4eca-904b-afe949c59f67,af3528e3-fef5-43eb-ae57-5bff87de0412,2023-05-09 11:27:58,385.9088089610752,Treatment hard system relationship.
61d0abf0-87e0-47d6-8d46-6cf5a64948b2,4b5c99f4-7fdf-44b1-af5a-3f1caec4154b,2023-02-19 19:46:51,93.39306419534601,Fear might responsibility rich.
3558cb45-5e52-46cb-aa36-7c2448c7ecab,e6b99480-b3e0-400c-8a67-92b9000c86be,2023-01-16 19:05:10,83.06122566356854,Food although need official open.
635cc53b-0024-4945-830d-cde1eab98958,4a0e7a62-5dff-47b5-b784-6da14c6260a5,2023-01-31 06:51:54,345.4406412320146,Explain realize south reflect run environmental.
2843e0cf-2c41-443a-a02c-1379faeaf122,f5237eb8-47a2-4168-870a-8c9347e41889,2023-01-03 16:33:39,323.92339412644174,Month teacher become smile population day leg.
7fdfae58-1f0c-4755-86e6-5bf97337e216,365f1171-674d-41b4-bc8e-088163c77b65,2023-05-14 10:01:30,370.9186701489014,Suggest over without executive avoid.
952c1523-6a82-49b3-9e18-f573b49fd41e,89a11c71-529c-4495-8195-ec5a968d9153,2023-04-18 20:49:35,315.7032485578026,Provide or add game really dark rather.
3a5c3233-42db-4a07-bd0b-3e01b3a8ab36,b7ba4f59-7824-4686-987e-8211aa24ff75,2023-03-02 17:03:02,223.95936396894027,Yard food very mission growth.
a1940c1a-960c-41e8-9ac7-84f9f38cfc40,c73145f8-fb81-4e9f-ae0a-9dd906004221,2023-08-11 13:45:03,128.99962936477763,Himself mind like wear early.
8c4763d1-cc2f-45de-91c2-39b1e550d79d,ab0ccb4e-2d7a-48ff-bdc3-b4b831eaa1fc,2023-03-07 16:00:12,99.94397559958391,Yourself reveal law nor more can worry.
192dfc22-bbeb-47e6-b4b2-e56b3ecc0408,8bf2068c-f15f-475b-b174-5a825cce9c81,2023-07-10 21:02:58,242.1714855918639,Base claim expert artist institution.
d68d8a89-9f31-408f-99ee-5b8cd3b01e63,83f29b4d-8c19-46f5-925b-22556ef8cbbc,2023-01-05 08:20:17,465.9686939254572,Class establish generation.
f8320975-8b26-4aaf-815c-a73b1e8da764,4e39e158-38b1-459c-8ab5-9fcafa75f502,2023-07-10 21:12:47,85.34098616862883,At about the probably oil.
1218a4ce-4c05-4dec-a128-9ff8050453a1,0f30e830-61cd-4683-ade2-54f20b5c51c4,2023-05-22 19:27:16,355.936215260577,People maintain yourself.
5d7317f4-6faf-474d-a2a1-36f68ac5c183,e6ba1d6e-8441-4ac2-bfa7-daa620c0b497,2023-08-02 15:55:57,60.76767281282486,Part sister Mrs leader.
4a12152d-3336-43cf-a88e-c92a8490e3bb,683ce0d5-1ad5-4a6a-873d-7e1ffc1b31fd,2023-01-22 15:31:34,198.44953598158253,Least job science lay.
ab9b75c4-22d6-48b6-9954-a51dacdf70ac,e55e65fa-1127-414c-a878-3f1a9b7aa2ae,2023-05-31 00:50:33,364.62027894084923,Understand cost item age understand sister.
e1728f46-5fcd-419c-865b-99f5c3704a6d,f8439437-41f6-4288-a48e-5607b355b27d,2023-08-05 23:09:47,258.8729992215816,Note American consumer nearly.
79525d15-c179-42fb-baa0-1ec7c4126573,81716326-d080-4c2a-a22c-a512a0e99ca4,2023-03-31 17:11:42,373.5205026599168,Fall serve or fear general six avoid.
fbbe1467-4ef5-4e97-8518-cf2931d1b946,bca0ec82-18ce-412a-8940-9a0dc7b79a82,2023-04-08 19:27:45,95.93926589947786,Deal lead yourself low memory.
6f387f0f-7871-4659-9b1d-58e821cd9c2b,82c99e90-dc83-4cb1-a2a8-029e3b5e37b3,2023-01-23 03:18:35,218.96881052591533,Culture have prepare movie.
50f3d182-debb-4fe7-bf8f-69aea7b57d09,dffd0de4-5761-4f92-bebb-635cd964a456,2023-08-12 16:16:26,412.12584491218803,Offer anyone finish morning indeed result large.
c9056dac-bd95-4684-8688-1ace3fc5b67e,e1cc8a87-f917-4568-94a9-4bf4daaa5852,2023-07-27 01:32:08,462.2770628137644,Music science start entire.
57d82082-0e12-4b23-8e24-737419a09fd7,2658f054-4c7a-4a5f-b27e-12bf7cc69602,2023-01-05 11:16:28,103.20802994611303,Get rest effect peace special war case.
26725955-5f4f-48c1-96c0-efa55c1c667e,f510c8ca-b75e-4a14-ba6f-d73be866a8ae,2023-08-12 10:14:02,188.04615557641188,Physical keep again herself large word.
316e53ee-5300-411a-8a54-692a400b7c59,f06c1a6b-5608-4d25-b429-6c8f18c44c40,2023-03-07 00:47:40,408.3471563541444,Customer seat drive college case it.
132397a2-50b2-41b8-aadb-cf79be984d0c,613743b6-6eba-4703-ab60-606fedbffbad,2023-06-23 16:02:06,479.329948407218,Space day push society student one entire morning.
6ebc7a76-905a-4979-bb8e-28f0ecd79bf2,9c037cc1-3e34-4dc2-8eee-c89c5a606716,2023-05-03 21:42:05,191.34522934118112,This worry ago my always arrive any country.
1491a4a4-2bee-4dda-ad09-93be7e00f038,f790e354-54d1-4ee3-bb43-c5fd74742736,2023-01-03 15:43:30,382.2298808616475,Because speech everything area.
714bbb15-09b3-4c9e-af93-b6894b7e7e39,adfa655b-6f03-413e-83fd-4963d851f619,2023-02-10 18:45:17,448.5458000138766,Admit success power yes kid card cause.
83575ee4-77c1-4f79-ac59-28b981f419d5,d144b77e-f738-433b-8c98-38fb4de2aafa,2023-02-08 08:38:34,380.67831928228014,Friend heavy have which.
d0e587b4-8be2-4baa-a3f3-2f214f5d2a96,7bd82c09-dd61-4019-a674-f1d145ea6386,2023-06-04 17:35:23,367.327764953388,Stage hard design cup whether.
33ab45d2-4a98-4885-b06e-bc7cff9fb7b7,ae6636d9-46c8-43d0-86d2-1e7abf092f77,2023-05-07 00:50:05,39.30098143399334,Seek professor resource traditional into suffer.
7203b3db-24fb-4254-8328-99335b45e735,119de142-a9fc-42ba-b8cc-b9a6ea5af130,2023-05-03 13:07:43,449.5099828831399,Study set the.
daf85d10-e58b-44aa-bfe1-ebdba974e67c,d0f004e0-6db0-40a8-918d-10a0bfbd8fb0,2023-04-30 09:28:29,442.14501132173916,Summer exist list quickly.
e0bbbed2-3903-4696-8c6d-f7e87b7328f2,8e01e013-3615-4729-86f2-021f5162bab9,2023-06-09 07:34:00,493.8061481017751,Real social radio rest.
fec1a53d-3d8b-4a85-9aab-4a045e8c92c2,a4a20a5a-96d1-409b-b20d-b1c910651c84,2023-01-28 03:26:20,166.6569106097203,My technology dog season land front.
6fa17c71-0e8d-4d44-b4f5-ed6040344074,360707dc-e664-4a72-9c53-892961d194b3,2023-03-30 05:31:00,163.45910878634024,Probably individual example lawyer.
c27f274a-498e-4fd4-9793-01353d75d63d,6b0377d2-d551-46f3-ac29-5e4bed8e87e0,2023-03-24 22:45:41,372.16308590486113,Dream manager despite movement military.
cae2c972-b1f3-486d-b6ed-e16be338f785,40c49bcf-4317-4487-9bf2-d229e9d78466,2023-05-31 04:05:16,226.31463952079747,Form attack property.
3aaf1872-6fdd-4dc1-b86c-2e902cabe963,99448b6f-c0b4-466e-b701-87332540403c,2023-01-22 20:28:15,304.73545603482785,Occur my show food more ability.
e82fc5f6-f333-42fa-a9f6-b8a6d7efcf03,af92d5c5-9878-4776-aca5-7288a474882e,2023-07-13 01:27:31,372.6218474106141,Operation per agency successful size.
e5241b5d-4b15-491a-bcf1-c2031fa31d3a,e1ee934d-06f4-4204-a56a-1261ef5ee218,2023-08-04 23:27:44,208.47030713267682,Quite to both always poor.
739ccb4a-7e41-4ed8-bd9e-75224e9a992b,1c6cec71-4241-41fb-bf7e-b74809bdeb79,2023-01-02 15:38:59,348.4565340943338,Month sign majority firm.
f0fdb15f-9afa-4379-9f8b-85a3d30eb253,ac61fd95-c3a3-4d01-885e-8290ac34733e,2023-03-25 21:16:52,382.6860571332697,Low card whole sister.
309e6a1e-77e3-4310-b1fe-1eb5b63aa945,9cd61621-0d88-4174-8f92-f85ae5d59c6a,2023-07-19 09:44:08,25.08379601321044,Social focus capital data.
177d7183-a8fd-4491-a389-8f1d4e9c9eac,a1b2943e-cf7b-4317-b4a0-4e27e88ba1a6,2023-02-04 08:42:16,51.354185560696735,Focus wait occur nearly.
458be44e-4ef2-4a0c-bc25-7b7f2e7131e6,b17fe385-3bf5-4c6b-a18a-05724b57eaff,2023-08-12 16:54:13,141.6594754855157,Always include fact economic politics price black.
b799883b-6f59-417d-bd45-2b2c77a61345,a8b878d5-3672-4c0d-b8c4-dc3fe4ea1e6a,2023-04-09 14:36:36,398.2353674915912,Along week believe.
70a43d53-8cac-4d15-b338-fef0476bd9d1,f4d5e782-fdf0-4151-9faf-17f549872163,2023-02-06 16:08:44,272.1421205713481,Door girl none operation section.
9c3c9e53-cdae-472d-aebf-1c8defd9d7ff,64fb6706-a49c-4bb0-a5d6-0c6b3a714cde,2023-01-17 06:37:20,384.21643465232563,Human identify son place feeling.
38251bca-394b-4be6-99f4-fea30a74f72f,475a1d77-929b-495c-bac9-4d00613fb461,2023-08-05 05:57:54,35.239300108558126,Professional unit parent.
61cd0318-9a50-427d-9813-7951748a11f9,ca1d5120-6631-44b6-bd0b-4f14e329666b,2023-03-13 16:07:06,290.84776879223045,Approach study art.
642b2655-4e32-462d-b409-f2c9e28b8cf4,74b2d0c1-240a-4eba-a498-2f012c71f513,2023-04-08 11:10:41,39.57579144225586,Red move across story society.
d4cff0ea-ee2c-4937-8ada-b979a83a76d7,368091cf-8d4f-424e-8a44-9bbcbf630f40,2023-05-26 12:16:06,60.183489353462214,Imagine another to.
5ea7f404-4641-40e8-ab9e-f6a2ef0942b0,19bc5ce0-1cda-4197-92c8-74614750ad23,2023-04-04 06:13:45,459.6012465842841,City source different stage.
50d417c6-dc3d-4af7-8255-62ddc3a4cd3f,638b75a5-82ab-4ceb-9463-9efe7dd33f6e,2023-04-18 02:33:31,276.74457061561276,Design front perhaps maybe.
b6f2659b-e943-4b1e-a1c1-42348435528f,b1708786-84ff-4b10-9405-4706612f9568,2023-01-04 21:18:10,112.58791883770317,Sure central indeed culture believe can reason once.
51c70956-6397-49be-9514-14cc48ed3941,61bf03a0-ce73-40c5-b62e-173fc15be523,2023-02-28 15:12:12,174.7507228689671,Three table five purpose.
ac319636-b468-478b-a791-5a4cdf57ebc9,75ce1c23-1dee-41f5-b2fd-c47c0d6e6b5f,2023-04-12 23:12:17,37.625431897947436,What Republican hold visit at mind industry.
7cd2d253-abcd-4b2a-b4d3-dfcc76a89464,c9e4c7ac-4cf4-4bf0-9089-4971a8e0b1e6,2023-05-01 14:14:28,451.68847844289724,Hope sure fill trip phone nor.
3fb05855-dccd-4dc4-9e9a-443f39ae708f,12c6ef72-7860-49b2-b96f-6c21d5c38b28,2023-06-01 10:14:39,392.63919923509485,He letter evening turn box popular hit.
aeecdcab-573c-4cc5-882b-1e8d4adab3e7,2ad1bc52-51f0-4bd1-9bc3-8550576abb08,2023-01-15 08:48:01,363.3846819447227,Suddenly appear last water respond wide likely.
a29f1910-751c-401d-8951-0b30c37cf9ac,935c2989-455e-4891-8892-abcf65d4b8f1,2023-06-25 06:11:13,151.35899666278817,Now set one contain.
1f5ec27c-8de7-40e3-9575-d96cd2dc6c90,c915c340-4e7a-4fb8-8999-dfe73caf0f08,2023-05-28 07:04:22,193.5732852116518,Look case space activity.
a0419372-187a-4b9f-be1a-752349695426,b8148de5-739d-436b-8939-6351623454c8,2023-02-17 10:39:02,222.21646657137464,Else north edge effect land.
da7b45d4-81dd-4b7c-adda-b00a8b68a700,4356de0b-d013-4f89-ab10-ccaaf1e41a6a,2023-01-08 18:00:06,348.1549560020919,List rock clear president news both.
2d022cb4-b488-4b02-b476-86457d5f139b,2836227b-d2dc-422f-8320-7314fe7c9cf9,2023-05-20 09:41:43,153.29247565738447,Thought speak walk national.
fc5eaf94-0ebd-42a4-90ff-90e39cd8e64b,d1f39b41-8225-42c1-9335-754b51710093,2023-01-01 03:08:06,350.2945655954655,Pick especially pick see.
e071623c-6199-44e3-bd9a-6db2ccd1c1aa,65e11976-a27a-4203-9bc7-361eeb644f5c,2023-02-15 15:08:55,229.38102183652381,Section usually suddenly method discussion.
19f478f7-4905-4200-b0e2-e1fa9b5e993c,da394402-8dbc-48e9-92f8-4a799c3c519a,2023-07-18 14:07:10,465.5808419354589,Official cause by hold across kind.
880d5dfe-cb7a-4d38-a629-4df152768907,e241ebe2-0323-413b-81be-37e9dfd882f9,2023-05-24 05:24:22,64.749656860561,Couple charge option customer him.
3aef705f-1549-471c-bbf4-058b558fc12a,5c3b54f1-1783-48ed-af15-d18fe0604b67,2023-07-23 23:46:00,461.3640309867678,Possible skin foreign arrive.
0f220097-8fdb-41cd-bfab-5b79579451c4,353e732f-c8e9-4112-859d-20314b9af4fb,2023-01-30 06:32:14,486.5082510430612,Smile design return another season message.
59c9a50f-7bfb-43c4-9594-7c844d2a61fd,10eb3c71-7a52-4004-acb6-f9f3c1b6e868,2023-06-20 15:45:21,290.57573698132114,Travel affect term job garden foreign.
6e26b2a3-87cc-4d08-91b3-40862e76b1c9,2b76baea-0eeb-40f3-926c-32be6c781ea1,2023-07-14 11:43:10,18.403192356353006,However off smile during Mrs activity arrive.
46d7c199-944c-457e-a0d2-2fd11c0d4907,dfb88a00-0c81-41e2-b60f-e698142f897c,2023-03-10 10:06:30,163.2339397386797,Effort response car truth through size leader provide.
763a74f4-c090-4bfb-bfc2-f9ab74127790,4689c781-6048-4e8e-99d1-73d01ac0ffee,2023-01-29 07:06:09,262.6684920408629,Maybe discussion impact strategy claim close bag.
b5ed4586-c56d-4853-ac2d-615a63be25b9,bbaceccc-7946-418e-ac16-6882b7e19689,2023-07-16 23:53:03,338.35979989788785,A agent than reason various hundred data.
4e983ebd-30dd-4384-87c4-975bd9bc2ea6,827d7a4e-b8a4-4d37-827b-1cb8fe99538d,2023-02-28 00:45:42,202.78774351544885,Next discussion world amount.
98dc698f-3de5-46cf-bbd7-99ef47477a58,9124027d-cac3-4adb-b073-7d9b3b16df2c,2023-03-16 10:16:43,138.7977713563899,State decision section.
417a8cb8-0d51-47e1-b3a8-18517a9fb012,35a3d232-35fd-4523-9978-dfe93687fe51,2023-08-01 13:45:08,109.84675841286416,Color area decide most forget common debate.
e3b6c0e4-6e0f-45ec-9d94-fc55bc41e716,ffd6d8cd-068e-414a-a08b-630806340625,2023-08-17 20:19:37,154.1804017034645,Someone current answer forget audience fear for build.
59a5906a-944b-4e3b-82c5-01fc15d28bb1,c3ffc765-16e5-4448-b77a-edb980f261b7,2023-06-02 14:11:39,55.26048070412257,Vote story available beyond imagine particular bed.
60efb028-af0d-4599-bdd7-638952609c70,90616ba5-ae0b-450b-aad9-c54173bbb5bb,2023-04-30 14:18:45,194.87288814973314,Language recognize measure attorney choose season just.
68590454-9057-4248-9fee-a452570f583a,0c52f3d8-3b15-4cf3-9f37-0f55d0b2663c,2023-08-14 10:21:06,106.17609667287596,Heart possible east wrong onto project rate.
c1a362f5-6846-4c70-8a55-e4ec216b92c2,57f548f9-f4fd-47d3-be7c-2f23f704f336,2023-03-25 11:27:28,406.55129073389327,Task music return five item.
9dfd9451-f264-4abf-b991-826843162e0e,9ab3c9f2-3b64-40fe-adde-5585b024c603,2023-06-08 09:18:17,454.92225587120276,Student threat believe certainly always stage hold collection.
342c5094-3a03-4b5e-b323-46389df7b034,06ee01fd-8445-455d-ba13-757c1a75d962,2023-04-21 19:24:38,24.817222371130697,Especially quite likely policy.
be4ba0e7-0732-4eb2-b6d4-cead413a7d06,140a7308-9a66-43c6-9cff-cb4ad80c51bf,2023-02-02 20:24:46,104.58983360932521,Pm own under force partner board.
529f262b-c5fd-4cd6-b06d-edeec272dcb7,83a82a5b-0165-43fb-89cb-7ddcea6a4750,2023-05-26 12:05:13,291.11951451330134,Enter many other discuss guy thousand.
f9d399bc-561a-4c7f-ad72-63df92eaa2b4,f97402ba-dd37-4cf2-9953-0dd69e6763bc,2023-08-03 21:06:16,12.321023937477733,Nature between turn stop.
7e118ee3-cb62-4d5c-9eaf-5d8ee7e48737,65ca8d4b-ed8c-4ce8-a4d5-b076828042c5,2023-05-22 06:41:53,385.8714781802082,Hold power young generation during.
e245024b-809d-470f-9db4-37bed246b216,2d33ac4d-06d6-455b-bcb8-84e822c7570f,2023-07-03 22:18:20,249.66312784031078,Impact increase writer event with run approach.
a3152cd3-989b-4939-9b83-bf7ae134fb33,dddb76d6-9e95-42e1-a1ec-0c2a2a80abd6,2023-01-05 21:21:24,262.2103214971431,Daughter decision trade each.
cab5bb80-3276-44f5-bddb-d2d6b0616e41,a554eb0d-0226-4d77-b3b4-f0759e22f1b1,2023-07-16 15:11:04,442.00103886909625,Red sell government star east population.
aa6cb855-9bfd-418d-b34e-6a84239ca84f,7fb38465-9d23-4ea8-81b0-408a335b62ad,2023-06-12 06:04:58,253.7516940236285,By country indeed ever education particular explain.
b7894262-b902-458d-901b-fc9be079ef47,4d48f09b-c7fc-43ec-8110-111b7cd7b667,2023-08-11 01:49:56,456.30926802432055,Out box network treatment why.
207dd72b-e789-40c9-98d0-4c500e63651c,f49ed3a2-e528-4ca1-8b8b-f856d5b10c35,2023-05-06 02:37:18,215.07602647348233,Discussion accept reveal front.
cc77a9f4-58b1-44d4-90ec-db692a518356,354835a6-3ccd-4cff-9dbd-17241020653a,2023-03-06 10:33:19,220.80922566092676,Grow never think theory price base all whether.
c86e0642-68d6-41dd-ba84-2c4ac75c4365,18bbb479-c443-430c-ba8d-05b75f27d000,2023-01-10 05:06:45,138.03721548184677,Show rock second discover meeting operation.
6aa550fd-a5a7-4030-b293-a63557bfc201,5d705b14-7575-43ad-a9ee-418fb0211101,2023-01-01 04:39:20,449.8241612712198,Property until analysis first.
093eaeeb-d386-47e5-a28e-e7e7ec9c9d79,688bf65b-ab8e-4c05-911e-69267c205dc1,2023-01-03 18:45:53,418.83290580306857,Professional us investment activity expect.
ce3a59d5-94e4-49db-9e51-f88fa7612a94,e4d12748-c1f6-475b-a80a-e75a2534ab57,2023-02-20 07:02:54,188.4363760855168,Value into during language down clear.
8c8bc3c8-7bde-414b-9577-0287b1f4a379,93ab241e-661c-4109-a258-c2f7fff68da8,2023-04-10 08:24:07,412.4013016784973,Shake within citizen theory language someone.
11d20885-8ade-42d4-ab6f-b896b32b0907,8c32b09d-10fa-4326-881b-182e21a509cf,2023-05-23 11:57:48,188.17342649307852,Commercial pressure at seem call idea may.
9fa3c3f2-438c-4e44-9ce6-0700817731d7,475e865c-ac91-4a95-b062-ad0259a61ce6,2023-02-13 04:58:14,495.950407689619,Than guy tell head operation human.
49ce3b27-4ba8-408b-97b4-6af904dfd32e,2eb6171c-df30-4ce6-8d08-280a92ff1131,2023-01-30 10:57:06,186.31766837525478,Cost analysis open three audience wife project.
a43b5b7f-1044-488e-bc30-8fe13d091616,923f43cd-e45b-4e49-a74d-082df8834aae,2023-06-03 09:33:52,335.4739015590028,Player I next sure majority itself.
964c45fc-f1c8-4201-84f3-97a200548470,42d46c20-689e-4c14-bbf7-52c1cf1d8609,2023-06-08 21:20:51,48.03630377257091,Military human option lead because picture opportunity.
d73d573d-3b02-4ead-aa64-ad8d28336da1,2e582235-fe9f-475b-a4cb-fd66d64fbc5e,2023-06-21 10:20:06,467.4003743575478,Red red try common.
8b879900-646c-4def-8153-a4d031e8e6fb,8cabd10c-aab5-4acd-80b6-371fd0fd8388,2023-01-24 00:51:21,473.5111897970787,Condition song husband claim cold important.
6d02cc84-5864-4f35-92d0-04831b598ede,b0ba6be8-be35-49b9-85e8-646c4ebd02d0,2023-03-20 06:20:40,37.259329841071796,Interesting yeah network college simple return here.
64928eb5-7d9f-4f5e-aec7-14a3cd098638,294d1072-692b-458b-9cbf-04686805e667,2023-02-19 07:42:23,418.6050982546303,Determine to staff month learn result.
677fc958-c254-4748-832b-3944dd5160ae,3ce867c9-c9bd-45f6-9524-fea2300f2b46,2023-03-12 20:01:07,40.76222366647005,Ago network full agreement.
7deadefb-4088-4204-b89b-c3dd7926045a,f625af6c-1ef8-41b4-b9e5-ba1b9fe5fad7,2023-01-05 20:10:29,269.673303383024,Understand increase appear fish so may line.
7cd32ad8-c055-43e0-8b73-aa6a6a7dd707,ca07ed0f-2ac3-4dab-bd07-ebf992a42d7a,2023-05-13 16:53:36,237.4259077745983,Practice event face medical less black.
58e74e76-62e6-493a-8441-fdc540b7de72,4e1bafcf-509b-499c-979d-28fcaa3e5bc6,2023-01-26 19:06:37,116.31078116246184,Common join stage.
45d3a34c-689f-48f7-98ad-aa09a91f1476,da54c6ee-26b2-40c4-a95d-8758118bbb06,2023-05-10 03:17:32,455.8193255406818,Affect ready husband born.
bde485ec-b510-47f5-ad5b-758d447aa77c,6bbbd1d0-51ac-4b77-a657-42b23835de2d,2023-08-05 13:27:02,376.7206585389262,Value save friend common right fact.
e61d965a-8b07-481d-bfe6-2fef0a2ed982,6620dbe4-b1b8-4314-ba5c-fa63f088225d,2023-06-15 19:11:28,338.42541337887,Road key region tell close individual various race.
80be0fb2-ed2f-43cb-a419-0b7c0ab45b47,98f7f479-5afd-4864-87cb-e92af3a7ccd1,2023-01-24 11:53:41,228.556691704113,American myself hundred memory participant goal.
49bd5b3a-963b-4950-aef9-865423b8c6c4,22b53ae6-e3ed-4554-8ce4-7dbeabcacded,2023-02-04 01:08:34,399.8826882111354,Hope specific situation someone take part prove.
14b07773-7ffb-4be7-a251-1f7bcfce3f30,464c1be5-6874-48f0-babd-08ab1360de8a,2023-08-06 09:06:02,370.8677806805705,Economic really night summer.
d57d15cf-bb22-46c0-98e8-d20ffa84dc14,1da2f6e2-9717-4fa5-a299-58b53f08ddaf,2023-04-04 20:42:00,153.68882541107993,Five police hotel team protect make skin blood.
99b6126f-5544-439e-b0ff-c6497b3010c2,cd623443-6b89-49be-b552-55e5971de3da,2023-06-15 01:49:50,247.53754716625812,Hold to team claim condition.
95071176-64c7-4984-b0e8-a3d0b4bc79d4,3295b572-3ec8-4aa9-aacb-f9de6b79e67b,2023-03-27 08:09:28,282.52588189484624,Understand suggest law give culture help.
61e26ff9-63c6-45ab-b813-fec47788300e,b8b3b623-9b67-4d69-88b8-552ea2479900,2023-01-27 02:03:14,62.50254391445536,Window short myself become property.
107416bb-cb40-49b3-a3b5-6aca0b7e4530,fff6c117-feaa-41fa-b687-f86b62a4bf4a,2023-01-24 06:16:03,316.5397087505083,Interview technology film six.
e48ba6d6-b826-4979-8dcc-542494737b76,348789a0-25d8-4d9d-ae3a-25815507ed9b,2023-05-12 06:19:32,431.49267752133517,Answer behavior story ground offer region.
064ffc40-3aa5-421c-adbc-01d894dea467,fe5238cb-2429-40ff-96ed-3fbc4e046e6c,2023-07-25 08:28:57,167.47286758091997,Meet without hotel movie maybe stop expert.
1afb8a2d-9f72-443f-9e50-dae05454e620,a24fdcb3-a273-4529-bf69-7ecef2b7282c,2023-02-01 12:04:33,86.1236599260632,Director kitchen ten positive.
d9924edb-ec5c-42f9-a11b-9e883110ae0c,46499a29-3539-48b6-ade0-74893967d4a3,2023-01-21 02:31:24,436.75182071260224,Its worker phone yeah trial.
b73aa296-9fa3-45cb-97d3-8e1a66ac33a4,b87402da-f56b-44ba-ae55-363f3c5967e4,2023-01-02 18:39:19,452.2208240968879,Pay section through final single.
768990bf-a6ac-4a55-ab86-4fdc18df3d70,cfe3525f-dfa9-48d1-88a8-15109fdabc38,2023-01-17 22:58:33,85.74434040605746,Drop nearly current growth region.
8a07ed09-9973-4e2a-a099-f3eed83cfb44,ac98e45d-a730-4d4e-92ec-80388870e1de,2023-04-20 14:22:42,217.76718274992402,Long face manager prove floor.
832956ff-16ae-4aa5-9778-3988ce7b3857,e4160f23-1018-4dd9-b7ec-89742e9bf995,2023-02-06 23:11:41,473.0066437500857,Method only herself including.
f50c720d-a71b-4a13-b579-6ac1e89163a4,4b805bd5-6fd0-4458-8c6e-8fd97f88e8bf,2023-04-21 15:29:30,283.7436323177519,Coach none during him newspaper brother.
a5a6d783-a27c-4925-84ef-f865a6dbf8a4,4d12f20c-c157-4b22-a7c0-e7bda0ad1c76,2023-06-28 05:42:53,73.47773835869839,Science stuff over pick fish.
381088b5-3e8b-4ec8-bda3-f6f3c867b21b,f8f33482-bc39-4544-83a2-5522c773c2ba,2023-06-01 14:42:06,235.93939855497015,Goal travel too nation care of here.
9821c876-5256-478b-aa9a-538db6c28f9f,4c5a7586-ad0e-4e07-bd8f-e9940f5806fb,2023-06-14 12:42:18,133.7641860061403,Quality sense treat eat.
016faebf-eeb3-4c4e-9537-448cfcf28134,beeecdbb-2f4c-4b1d-961d-a61730055202,2023-03-07 08:37:07,299.3014701576197,Congress dinner ability if.
18ac5ece-d3be-4c08-8340-9eb79df081b6,0a8cedb8-9c8e-4728-981c-6c7a1ade5712,2023-07-03 09:57:10,478.2806817595517,Forget check final Mrs.
bd4760b0-7103-4dbc-b09f-5ba5e607442b,04ca0454-6d24-4ad6-8a9b-4d6b2e2c6629,2023-04-13 19:20:01,34.41661071168845,Often too wish wrong person deep.
b7c4fe15-5af5-464b-bfec-1e632eb9d58d,6abcafbb-9d52-40a7-801d-286e4874ecc4,2023-06-14 20:12:02,78.89921775403998,Make citizen effect energy sport.
12c6312d-7c6a-424b-a893-e02994ad3e23,e46324e4-1f6b-4207-a3aa-3d1b5aef2214,2023-07-08 23:03:48,394.3377937137249,Rise financial finally yeah.
0f8be7f1-a02f-4d70-b44b-1fd0d2d905a6,a7ec5119-8145-49ad-b7d2-193deb33b1af,2023-07-20 18:43:59,393.5316030284683,Child official foreign state there.
4ed35a1d-dbb5-4108-9e07-c17af84882ff,4e2713b3-4ef8-4b72-847c-c77e67eba390,2023-06-29 06:57:02,396.65695659927474,Table when actually international newspaper.
6e2e2e22-42bf-4b9d-a938-c9ac960a9359,22eaf724-cb5a-44e2-8972-54655d927708,2023-05-21 22:58:05,345.05353696777905,Movement head prevent power.
349f5eff-e1a3-4b56-ba9d-d146241e7742,c2d4f349-e3d8-4bd3-8e0a-4dcb668f257b,2023-01-18 19:49:18,469.38863963280266,Notice establish have conference reflect yet quality past.
cc7b66f2-699d-4783-887d-d7e9664b9d8d,3f9d7204-e6e1-426e-9aa7-d1c5bab86904,2023-02-22 20:59:27,51.509981754933804,Without say eat laugh within can wrong.
114b878a-9c2c-437c-bc86-f7631a55cae6,5a656c3e-4a20-41cb-a004-e8d1912b0c28,2023-08-04 21:38:40,103.69436526079718,Town hair here himself item employee rather eat.
d17a3a97-fb05-4da6-abff-1fc391fb4af4,51c4f3b4-300a-4429-8c0f-11e873fbbba6,2023-04-21 13:22:55,16.103594815422188,Remember well guy challenge use on.
9f9155b1-94aa-4d8b-a5d9-07f6e8f742ef,55ac6377-de09-4d55-b207-28064170fccf,2023-04-03 02:16:42,89.32017616187746,Film put know now word force.
96e38c97-5053-4002-859a-b5b2884ff0a4,ae6ba5c2-c527-4c2a-b4f2-2f2df3867640,2023-01-09 07:54:16,228.9012111587694,System with white here join last.
84191d0d-7095-4df6-b6b9-d267dec59428,22e1f209-8eff-4faf-8e21-e5325805e65a,2023-03-23 11:30:42,27.033019255209673,Economy base charge east blue easy organization.
192e7aa6-38ec-465f-8851-18e61f0d0ec0,4d0010bd-9224-4659-97e0-86a76c709de4,2023-04-25 17:21:56,467.3954920168061,Letter school within college plan citizen.
aa5ec050-cae3-43cc-9657-2f23fd9438d3,e0b4e674-1a4d-4981-a497-d128e75ea9d8,2023-06-18 04:09:35,336.69941501016405,Personal bank commercial international help.
0d376436-d5d8-432d-9399-b843aedd3dc1,0255a411-64f8-41a4-a90c-d74dc06ef283,2023-02-10 02:39:04,32.58590498378763,Still much address nice think.
4baeb6c8-12e2-44e4-8fd4-d86fb90d65aa,d1556831-0edd-4619-96db-b7c2db38b69c,2023-02-18 06:42:08,317.81403238974,Stock idea no sometimes similar language.
c6263c18-ceed-49ed-a886-4e0c700fdcdf,fc19011c-efe0-4524-9ac7-aec3fef939ac,2023-07-06 07:26:28,89.39079908067289,Animal apply certain.
bcae9235-f552-47a3-896c-cdf4b42d873f,1720ab41-7535-4768-a65b-8112ad64ef86,2023-07-27 01:10:27,12.796432535765941,Agreement action health.
0863a9d5-1b95-478b-abdc-7450ff700c0b,4db0cff9-4ec7-49d2-bfb1-bbd986dd4e1c,2023-06-25 11:37:01,205.23187197842722,Beautiful care help every risk marriage of land.
