Transaction ID,Client ID,Transaction Date,Amount,Reason
9cc019c5-fafb-4cb1-b1c4-a3ff113b2e59,5b3df3f0-45f4-4175-b570-04a963d2cbd4,2023-04-17 12:07:13,158.75711801765314,Word image gun.
f2c365c2-6faf-4395-9e1d-d4683398453e,9b98d167-ba05-472c-915b-062f6b70632b,2023-03-25 04:38:28,380.971547653049,Industry every fall buy everyone.
4331a870-ede9-4c68-a811-394b157e87a9,7595aed7-f331-4bf1-bcef-96852edc6542,2023-03-25 18:59:02,243.80137886831608,Open look practice able where dinner campaign.
9c528b15-19fb-4bc2-94d3-0c08ab7b36f4,3a16c51c-bcf2-4f86-baee-b32af9cb73e0,2023-06-26 15:01:53,16.29434398204487,Will approach himself protect discover.
bdf97dd3-208e-4517-b3ff-c0ab0a582902,a8b28f82-aca5-47fc-b330-10ad78d7198e,2023-01-16 07:05:31,207.83060305169795,Owner affect true someone establish cell program.
8f646709-4b1d-4d4c-8d4f-53395bf65504,32f206a3-3b01-42a3-897d-41b74b08be5b,2023-07-15 00:40:57,171.41898477728355,Accept national meeting them.
99b36c51-df54-4908-8a3a-51e6d9535e68,ce91642f-7c82-4e1a-9fb4-1fa9a54bc29b,2023-01-19 06:35:33,268.8995202127972,Already market allow next property near senior.
bb63b136-93ea-40e2-82f9-76ba97b39e59,a58e83ca-bf87-44f3-8fd0-afae64a028ac,2023-02-24 18:11:09,435.4709855328071,Around anyone what network high just everyone.
7bc6ab1f-0ae3-40b4-a70d-74e7d5c345e8,4a22575a-37cb-4ac3-a652-a331f747ac03,2023-04-10 11:05:34,50.14914508307467,Rule have role base opportunity out stay.
66192180-dff9-4a79-a7e1-36d75dd3ba99,76495fad-8a41-49a0-b44f-9bbe89d60738,2023-03-01 08:30:24,297.67410641633666,Local child relationship key son factor market act.
d4669fdb-9693-4160-a87c-53838898712a,65188d9a-d74b-45a8-9dba-f4e81ee8e80b,2023-06-16 10:39:46,187.51752949661636,Mission source clear government.
2afa2e68-65f4-451e-812e-fa3bf4131348,25dfd3e8-0aef-4085-b9a6-bcbf69459e25,2023-04-22 07:41:33,11.974336233491087,Up author inside thing institution.
b8895a91-846a-4c42-955b-2f6a5e679e5d,fdfa5706-caec-46df-bb70-d65be23aecfe,2023-03-07 07:15:34,232.08404441375666,Attorney debate contain half population.
ffa0dcdd-e682-4c14-a288-c50a859a491e,937eff02-995a-4f51-b3c7-1f92c5869da4,2023-02-08 00:41:55,41.538129170761685,Then he mention church agree quality doctor.
c5339489-a4cd-4533-816c-942ab41463cf,e8b7a5bd-f3c9-455d-9428-0d749aabe9e4,2023-05-31 04:00:01,362.7817474708905,Compare rule good evening ground.
e477c52f-c342-4566-a24a-50ea5524727a,09acac43-4c15-41de-ab04-00f36ea208c1,2023-08-08 10:46:25,44.12409341417672,News rock nearly suffer rock edge cause good.
9940bdd7-89dc-48a4-a128-1e5e5baf69d2,159dc486-7190-4807-8c26-dfe9b8f32745,2023-05-08 13:52:27,11.21496053205975,Watch present teach pattern.
270adc78-9d37-461a-81ae-09a918cd4c9b,05a4a109-85a4-4c84-99e6-221acaaebe3b,2023-02-18 14:32:46,257.14347583804926,Rate issue suffer arrive boy wide organization.
6349942b-f3a2-43a0-8bba-ec69b309d8b8,f56de623-110f-4c3a-a0e7-121618e54a57,2023-04-17 03:15:19,126.42109046039538,Civil bed likely bad talk behind choose.
4ed6e9a1-2c61-44ac-8992-2c6251f71b2d,4faaf34a-d170-4854-8312-816d05c5e062,2023-02-13 12:51:41,435.16410101339625,Ever million collection laugh share million.
e247afad-6a26-4319-a722-728c0b359c0d,5d373759-394a-413f-9ee6-e4b4a8adc7e6,2023-04-14 03:48:03,38.56451093975344,Man owner but sit six simply knowledge.
b5bb4821-0748-452f-b377-4e32d390bf45,7e7e1da3-d8fb-4592-8d18-97108d22e8a5,2023-04-04 23:43:18,191.5656372520936,Whether available people leg nature.
9f265690-fdaf-4c61-b250-cec670da81a4,412b6afe-68ec-47f4-a349-7ef08d07a5f7,2023-07-18 17:46:34,223.12530961524132,Nothing glass almost great billion first.
f4b75758-9c0f-4f67-b23d-6a3238bd4272,548bbc68-bfc9-4dff-819f-12ee8a8179bd,2023-03-29 02:07:32,52.400513941833196,Next none Mr over sell dinner building voice.
4431cdaa-4e80-4931-9e1a-9c7d726318ed,36b88e22-7de6-4506-9c13-38e8eccf1850,2023-07-06 17:44:34,413.52704770223875,Still hair against if.
5068fec7-497f-40f9-9a70-eb8a668e7b4e,328b8f84-c44b-4f9d-bbe6-5a797a42ca69,2023-01-26 13:45:46,488.9213153399721,Especially stop power I before arrive.
ef69f268-4a60-4e1c-9c43-4bf6b37d71fb,ddefc5ce-49ad-480a-8f00-7482820aac6d,2023-02-13 19:31:21,368.739480718921,Yes happen should develop different.
a6a934ed-fbf5-4142-8d59-a6a70d0157e7,187deffb-a824-401f-8711-885857479a3e,2023-02-12 09:17:38,361.28137565860095,Assume beautiful some approach music.
e77dbe28-eb00-4ef6-903f-f68589e79ec5,2a4dc1f2-d886-4a2e-a4c0-8283dd6ee91e,2023-04-24 22:16:27,226.1605610613542,Draw different much stage behavior statement.
42da1224-b196-4478-bba9-19251d47b62c,d27a1bc8-086b-4447-87a6-a15bccd9525f,2023-06-16 21:36:58,445.37123780335264,Among risk care think since prove.
e592e5f4-6cdc-4cdb-a0f4-db2656f8e3d7,cd07efca-afd3-45d8-acb2-6e5a70f80356,2023-07-14 12:36:21,268.10958195249475,Blue policy guess blue wide man.
1dfa8e08-1ab9-4474-9df1-5266dfbdca21,e35b5222-6c0d-4328-9830-60b5a7975653,2023-03-14 04:20:53,331.70597642509887,Modern generation employee new particular.
fc8116e5-d5c8-454f-aa30-cac7c18db49b,8f791227-1fc3-43c0-b131-a66fd51d5564,2023-03-26 21:52:15,181.61464034737676,I form though week act week.
66ad9d9d-6148-454f-acbf-462675e4cf60,7c4ec6af-9576-4502-8d08-74c488f93e9f,2023-03-03 04:28:18,337.0912330846594,Ten loss clear.
e5f86e48-f244-423c-87a2-7c27fadd044c,9aa8c2b3-dba6-4423-bb8c-9367df7868e3,2023-02-08 03:09:43,417.69407497879143,Dog perhaps message large different ago side.
336982c6-4438-470f-a534-d669f7f9b5a9,6c24e2c7-efdc-41ff-8029-ca4be6bcd383,2023-08-20 10:18:42,460.95532300297566,Expect drug performance decade and.
d51cbab5-7d86-4836-97ac-da76f17d5b6e,89a28a5f-9f0a-4022-9d87-8aa80cdd90bb,2023-06-19 14:18:52,390.9588910665582,Because need better.
94148b05-9b1f-43dc-aac7-997cd4a1d64f,a4cd8d66-c8a6-41fc-a00d-313d3cc5d6b7,2023-07-08 01:01:19,478.45997233017533,Line government forward raise avoid.
825dbe10-b529-49c8-ae2a-103f6e05eae0,8e06058f-2604-4d6d-af0a-86a1a7fc0eff,2023-03-28 03:00:41,341.8166555539364,Make bag against suffer first when carry.
929d649d-ef40-4f33-8d8a-cb33ea28a03e,17038b1c-427b-452c-868a-fee76b42dfc4,2023-02-25 07:18:13,465.0448945759068,Management pretty foot figure entire economy.
7243eea5-6f8b-4a22-b084-21772253ded4,70f901d4-2d7c-4bdd-b5ea-2b12931fe499,2023-06-18 14:56:44,39.78735107271157,Us tonight Mrs financial large each.
9bc4bba7-c6e6-44e9-b88f-b86337a293b9,7e60dd0d-5d3e-4935-ab73-01483640211f,2023-06-04 06:34:33,175.5970037315871,Lot campaign ground toward trial.
c39a8488-9fc2-4cc0-9771-1568a50d283d,9ac65410-336d-40ec-bb73-5dd0546ade15,2023-08-08 00:16:54,445.73094945062434,Light personal drive great my.
7b78d6d5-67e8-4882-9e05-14c7efa4cbf0,c660cbb4-f177-4017-921e-ec4f38a51d3f,2023-07-03 22:49:07,442.0817732755993,Let safe director strong sport condition film.
5e33055c-98b8-4660-bcd1-7321e4406617,88f6607d-b7a1-4817-9ab5-507e63d81b95,2023-06-08 21:54:13,358.64083306740054,Bar candidate second character.
9ba0647e-e806-4a3c-820d-59e3f6519d7d,00da8490-2edc-45f3-800a-f4a37bcd7eb3,2023-06-11 11:08:30,462.8367759374719,Watch lawyer sport last evening.
b4af4885-8ab1-4ac1-958e-41c9bc34e769,399ad091-6d9d-4a61-b703-abf0ab619f60,2023-04-10 20:10:45,471.7229739775447,He number road be.
8d9963b8-7775-432f-854d-b93bacfaeee1,66f7a08f-3dd3-4870-a2a7-31334c3b4393,2023-06-29 03:07:19,23.746001801889093,Whom quality trip hand have.
d30e8ccb-0561-44e8-9eed-6fbbd77b2b6f,ea1b7131-cffd-4636-9a94-98be18c56c04,2023-01-20 06:12:06,386.607424720542,Might charge plan hotel example.
099ddf17-776e-4d6e-9a8a-b7c51148f538,5d794b4e-3088-4f0b-9745-200879fb08e9,2023-01-26 04:40:07,461.2715756321413,Party security among.
ce672423-185f-4804-aac4-030e37f033a7,9b58e4bb-1a7a-4b5c-aaa1-63cd6887c653,2023-07-05 19:48:41,17.053426368975114,Theory instead camera.
07fcb636-d752-4edc-874e-5d0b08d700a9,57dd53a3-fcb5-4027-ba56-79e1afb3c852,2023-05-16 21:47:46,136.59769958312137,Add response perform information many.
a3949db0-a2c8-4ce2-b395-0c5b71c1100d,7e6f1a43-1981-41b9-b155-af1dc955668e,2023-04-25 09:48:22,481.45986998886343,Choice budget throw surface month want child.
e967551e-d96c-43f6-800d-c5a30d1927f1,d47ea364-d35b-43d6-a1f2-a7e76b1427bb,2023-06-22 05:26:23,11.185531925699156,While cause soldier travel evidence although.
1b9950b7-4bbe-4219-971f-d6286691a30c,92ee8cda-0490-41fc-a89f-ff6c182046c2,2023-04-28 07:28:37,290.0662101162452,Serious three six against single difference.
4e401223-cb53-4175-a1af-5bd1355f8f4e,9abe143f-15b1-4272-b8e5-e1167e52dfb1,2023-04-28 01:04:16,234.27667130271672,Policy about series someone song trip few.
3e8da821-f843-4019-b7d1-124cadeb9e99,cf679bf4-ef10-4411-802e-2bca45daad40,2023-04-19 01:28:23,47.600566729637,Leader role value measure light lot believe line.
c721ca99-29b5-4b42-a912-ec110a7725b6,f9d112a9-9d3d-4a18-a824-3e8370449af4,2023-03-12 08:58:11,337.2725008838396,Work act deal adult table maybe head.
5b0b88eb-2550-420c-9c51-598c9609ab79,f5899c20-a715-4105-819b-840fd2e560dd,2023-07-11 18:14:57,316.96939034267785,Congress finally out rock.
3dc7da61-cd1e-4fdb-95de-b3dcaf636308,89b2e3f3-ade9-4b02-b79f-3b16f5c82efa,2023-04-27 02:34:34,495.97304860294554,Certainly might business situation red computer.
43c86bab-e0fe-4d74-af57-beb56297ce19,fc487a74-23bd-4876-a425-53cfb6bc764c,2023-07-23 11:44:15,228.83401111499273,Coach store rather now.
52b5d344-5cb9-43e8-ae35-a07e10a09965,f6c1790c-dffa-4fc4-8aeb-5030d76550b6,2023-06-15 05:48:21,456.57038207877497,Opportunity perhaps yeah.
b9eb4f21-9ec3-424d-8419-0dea890c7b25,7da308aa-0dce-483c-ba51-63680fbffe00,2023-03-20 12:08:54,387.6461835286721,Attack process good.
16309837-3559-4099-8f4a-7645447e57d3,c4852384-b7c3-4719-973c-169e38a2d6c4,2023-08-03 07:58:29,473.9533659451923,They himself claim each focus.
7a1d054b-4c1c-49f4-9c7d-f6bc40b82388,7c048527-4777-4deb-9ea9-e34a3e6b98f3,2023-08-16 19:27:18,15.011333228472717,Down staff above space peace.
0b9575ac-4494-4086-9bbf-c7da43461aa2,74224120-f97c-47b2-a2e6-9d8605531daa,2023-05-08 17:32:06,206.1584566477284,Generation involve seat politics live near.
077de7c6-4b8c-42ed-9611-0cfd24945e3b,14933d0a-19d9-4c25-98ed-9e172ac2cfa0,2023-04-19 07:22:24,141.78372340474888,Involve bill series.
5e31905f-e8b5-47a6-b348-a1b4e8b0126e,d2d47829-86e6-4666-bf9f-855b033147ae,2023-07-24 02:09:34,158.3602239923884,Respond receive still environmental purpose kid.
283a95ce-f4e0-4e98-9294-43e23ac4677c,0703242c-46c7-46d3-be6c-4c1334a791be,2023-04-06 23:52:18,320.6167623938288,Share performance talk state.
a1051dcd-6c48-4907-af6d-782a083b0591,a7061cac-2dd6-4250-ab7d-f0fc945ea334,2023-02-25 03:50:47,101.02487044490198,Air debate message whom no.
63188ef0-6f19-4b34-a378-64a7d1a919fe,484ac79e-cbdf-4914-9f20-56330635b90b,2023-02-09 17:53:11,426.8342111182601,Truth six work size son range peace sister.
3f8884ac-8d50-4a38-9ca5-e849cc24419e,00b2aeac-0b68-4419-a099-73ca72d55f20,2023-02-26 05:44:02,97.29333789259435,Avoid structure reason begin summer realize.
ddb75149-7e05-45b3-8ea7-5d228580cde1,01b05d41-e61a-4736-8568-617d12d05500,2023-07-18 02:06:25,144.55171961687216,These behind relationship claim camera hour significant.
91dc5278-c6ba-46c9-8d72-659b58d28e82,0abaa056-3613-4c01-882e-a1b85c86d9cc,2023-06-26 13:38:09,425.20275453368055,Present against ago five item worker data.
033ce1b6-1f8a-49ee-80c5-cb38d6d48e82,1d70647e-e683-452f-8914-ffc5bd52b0a0,2023-02-13 12:52:57,13.363599745104665,Understand report my.
5d0ddc55-f940-43ee-8bce-9efeeb2c53ae,b777e4a4-f396-4c60-9c8d-2ac5585eaef9,2023-01-24 05:22:25,206.33174147898137,Enjoy anyone challenge professor practice.
46cda4ea-549b-46b7-b8ff-8cd54a767c4d,c8fd8cce-19fc-4bd4-9bbe-c38b981b2cb8,2023-06-19 06:38:59,473.06379986847645,Dark little base fish.
79574481-3843-44a0-928a-a24ac6a6aae6,bde31207-f097-4ede-8a36-9ee04ec16b1a,2023-06-04 11:34:05,441.57810350970516,Different let right soon bar subject explain.
e8ecbc38-f9d7-4819-9cf7-01e8b6ccb880,57aa4387-0e6a-40f5-9923-38c06f36a87d,2023-02-27 17:19:30,479.6792816915703,Large product something writer.
5c6aac26-e7e5-4fa0-a378-d57e65799e26,cebc24cd-7a2f-427e-aec7-3e5cff478247,2023-03-26 02:09:36,495.2061374962218,Yeah drop compare tell large.
948d5579-2d7b-46f8-973c-06aacb07d0dd,638a524d-3679-48e3-aa1a-7341b8b0a819,2023-08-08 12:48:04,463.2393494614318,Hard tree personal former should certain.
19927bcb-2702-4e1e-b0d0-0fad2dbdeadf,2c9c62bf-0f31-4051-a3de-c262a9f80a85,2023-02-17 11:44:32,412.6267244247539,Be stuff nothing able four message put cost.
641581c5-9ee5-49a4-80c5-5f4ca1443beb,e5fa8a27-8510-4556-88cf-8bb98e456d7e,2023-07-02 03:31:43,358.051775957096,Away film pay bag.
6ff87a37-57c8-481f-bcd3-71b216401040,4c412936-52d0-4121-a651-327aa5cf6863,2023-07-15 04:26:04,116.10004918980522,Fly PM she law.
1ab152ca-ff31-4d8b-a9ee-a45311faddf1,fb402be5-618d-4954-8044-c095c0d77393,2023-05-06 16:33:12,386.4737354304969,Evidence analysis party story line.
ee91da99-d8cf-4206-b608-38fbe1c09fd9,7191dd61-f778-476c-8dcc-04848c609ee0,2023-04-02 00:48:45,353.94069023871134,Debate field run which quickly.
913d5484-546b-4b78-8255-7ca8b5d698f8,d3e34180-4bb1-46f7-9605-64c25eb932ab,2023-01-27 13:44:00,56.962094346442214,Message son across across late sign.
f30f48ef-d0fa-4e69-93e7-f8a6e0159b1c,f14cf3f5-7425-4657-a0bc-800c67dae643,2023-01-06 17:20:57,411.29607823330844,Even song write mouth.
2e93a0df-0c8f-49f4-abda-8c7661c8c016,14ce3031-dccc-4266-8734-a0696eaf5347,2023-06-15 18:36:55,151.13871230187863,Environmental organization around become.
cb18bc07-2904-498c-95c4-9925944ffa99,23a1a178-7035-4281-9d24-9750540b54f9,2023-02-24 16:38:09,351.674463542439,Agency top forward.
be204a82-3492-49c4-b7d0-c6901146a90b,591a5f84-e4e0-4062-b699-547df10e2b3e,2023-07-05 10:08:08,496.94243123481954,Especially model entire career pay view huge.
959070c4-7458-4316-8987-b908e79eb927,a2582d06-d965-474d-987e-80abd23f7b44,2023-05-24 12:17:56,414.5663975719332,Mention none two whom.
6f04d22b-72a5-4a58-a562-77c3a8b9b90d,469ad1ec-ac99-4877-a608-ede5346abbfa,2023-06-15 02:16:38,449.32176644972566,Music sing early very billion street.
c336ea4d-b02c-4555-be31-fdb9b067cdf6,f2c0d688-91a9-45dc-8e50-698433bb671b,2023-08-19 21:55:32,136.3166545418798,Research year pay clear finish small collection.
60b9592d-0ed8-4b77-a33d-aeb994dd89e3,fd34ae88-795a-47dd-b90a-bf1a6479057c,2023-01-06 00:43:53,83.23078989268231,Shake accept high edge.
5f6d86ab-c764-4870-879b-8bfb121bf7c8,d98b015a-bf44-4c1c-b393-e724aed73626,2023-06-09 06:40:18,339.58340631074776,Baby assume allow meet pressure we low.
40df9e05-df69-49c0-ba60-1c9c04ab4534,cddbec6b-1c0e-4238-a9ea-39a7b07705a7,2023-02-18 09:14:28,85.41782572151126,Let ever simply under firm majority myself.
06b0cc50-3762-4aeb-904c-cb658439d07b,459f49f0-53b1-4dfc-8d0a-58517e7c8fdb,2023-05-03 01:25:55,174.4899254064033,Forget election role among instead industry chance.
d6bf8ac0-1c17-47d6-a744-d247d1b46670,3eea3294-15ac-47f9-b6ec-2ee33053540f,2023-05-21 02:26:50,450.92997341084964,Step understand issue level economy certain.
09890328-ba21-4fee-8bf0-e4b99ba4073f,369cb335-0ed2-4ea5-a4e9-e8852104ee00,2023-01-27 16:35:21,296.8133041420538,Rest your head enough particular card thing.
4d55fa83-076b-40e5-9f2d-5da011ba55b2,6d32843d-fb00-431f-a2f5-ee9a7564e997,2023-03-03 18:49:39,214.33003434007696,Respond say despite action here hold hit.
2d833c9e-9569-49a5-892e-64caf5befc54,b970bc70-6f2a-4018-a613-0316ba5f99bd,2023-05-20 06:07:36,370.0755866190062,Hair under four first live future old.
feca57ad-df73-4df6-a135-9c9438d29254,4857aacc-4e4b-49ca-b405-f254e2d844e7,2023-06-20 06:39:51,310.6985927831136,Church movie quite.
e5c62fd4-9022-4d87-8932-de3f056602e1,ee5c93d1-b704-4261-9b27-864e281ad589,2023-05-24 04:07:29,82.94361167901839,Kid simply center big lead surface.
c902a03c-f362-4281-8949-7826d172177b,a34989f2-ce9e-44dc-bb77-fec4cc2500d5,2023-06-21 10:35:09,186.75899005584716,The of would science.
b2ed1b38-203b-4422-82ba-2812ce92b662,ea9b20e5-5bc2-45f2-a72f-5b30bb3badc8,2023-02-09 00:39:13,461.8406231409891,Than series whose budget challenge.
32f6eda4-b722-4c50-a776-73bd4008c1ae,ad36a352-1c4d-4586-bd65-6d41816b8824,2023-02-28 15:45:28,483.2203825649668,Say piece rate try use.
9499225e-6557-4e75-9977-19228b0bce46,f697c286-50b8-4b57-9976-3c78870e9f34,2023-03-12 12:23:44,465.3477462103558,Soon action compare century politics stop.
e961d02b-b8c7-4459-8e85-470459e1f7c0,04fe491b-adb3-4f26-b351-714ce7a6391f,2023-06-06 02:59:46,62.30368132067406,Treat what officer.
8cda8a29-4ca6-4d2b-99bf-dc47abeeabbf,69f48c00-5a1b-43d2-bf35-75f3c90b6c4b,2023-08-01 20:01:55,49.54975836427404,Over including community continue contain set.
bb27789f-cc3f-43e4-9c50-18ac6a52478c,86da8ff0-5f37-42e6-92da-9be15362f21c,2023-04-03 12:38:05,173.00211553287315,Since bad all threat front rule since.
d90c0c4d-8e9b-4014-9dc2-a88ec374ff41,1f882374-105d-446e-a3d7-298dc16b0d0d,2023-05-25 05:13:58,327.2422804887944,Girl artist operation against.
81ed16aa-4cc7-4d97-b36e-e49c7565abfe,dd26778e-90ea-4d04-8c06-f954c93f4f28,2023-03-22 04:55:47,200.4486680204702,Same civil teach director without image west poor.
f434cfbd-d3a7-464c-8541-cceff5217e6e,95f62e90-09ae-4520-b4b7-fdbd2c1f29b5,2023-05-10 03:22:14,18.845471105851274,Learn current outside public grow this visit.
62e6dfea-2fad-43f6-9848-d91336a54ea9,09062977-badb-4857-bca5-efcd6f589a55,2023-07-12 02:02:26,204.10974276709808,Involve loss amount break international vote.
d512a87a-4b8e-4986-84b8-0e2367f327d6,61423c41-b6db-4184-a23f-6ce77fde739a,2023-08-02 07:00:24,163.3422246025344,Despite head upon improve material.
987fa957-fbcc-4b31-9f9b-bdec1b94af93,20480a12-e605-4483-a5cc-038a7f4eb9de,2023-02-05 21:41:07,105.84617469520718,Country network leader.
01290634-b6ee-4a79-ade0-16addb9ff941,379a4f49-6ef7-4884-8f57-512aff825957,2023-01-22 17:10:08,270.78906394527064,House power relationship beat many fact sing.
9f8d9628-2c53-4016-ad76-1b65ef6c1e4f,a6bf7366-0c61-4596-89db-25c681b2b365,2023-03-05 07:43:08,390.3079919678809,Yourself effect data bit minute receive popular.
b9136f1f-c8ab-44a5-8f7e-0ed5f8917c2c,60779c4d-16fe-4d1c-8e07-588df02f88c1,2023-02-13 22:08:01,54.77418383385824,Perhaps night dream baby do unit hand Democrat.
95c65164-10b9-4ad3-9033-6d320ce7d89e,50658f71-cc38-4c7f-8cee-55186901a8f8,2023-05-29 01:57:00,284.64153064246375,Note child color.
e772e8da-c0d0-4355-9c38-b154879f6011,2c34b4c6-4e1a-4e13-8922-a29e18e293d0,2023-03-21 06:48:30,324.84329767096705,Always lead team film break follow send site.
8485f206-8e48-4a68-88fe-a7b375a3f12a,ac390d63-938d-4943-9c56-0480551aeb15,2023-04-23 14:50:26,495.2899789193229,Relate purpose line cost test close popular.
85825d12-b290-4ad3-a0d1-25166427a8d5,1fefc850-7ee2-4683-a254-ec65313cad09,2023-03-27 12:45:17,182.25640942097823,Here take office list five eat.
b183b62b-a13a-4aeb-a05e-3006770ab3e6,e9d9c86f-df43-4354-891e-8b0f2087ef15,2023-05-31 12:12:03,271.2085573860102,Per rate cover some.
74cc541e-c0e5-42a6-ba2e-e51e2afd4c07,3cd1254f-9f50-4473-a8ca-f179a28de32e,2023-05-15 13:50:43,59.65634327802453,What receive can human mean.
e7aefff4-63e9-4f91-b73d-73fa92d18ec2,0e6f04d6-a435-475b-9901-74d1866d6225,2023-06-09 11:27:48,467.8845545717555,Wear for letter but.
d486507d-d2bf-4c62-8a6c-f96d2fe6c59a,fa022456-4b27-4775-bf81-16330f00306e,2023-07-08 02:22:12,96.95192061479526,Hear add idea occur teacher.
302fb1ed-500c-4f61-95e7-0e2fa859670d,42c4167f-4411-4c2c-9791-b9f35e882195,2023-07-25 00:49:09,181.27693013881753,Soon word product north card standard before.
94ba59d4-2ca1-4284-8ca8-dd31f4893578,b4a1c063-0a07-42bd-af1e-988205934c8c,2023-06-16 12:50:17,28.54721882689228,Citizen there benefit.
dc09a341-f550-4ff3-ac94-2927f4f573da,b13f1261-36d6-4502-8a97-dd0dd27a0915,2023-03-22 20:25:20,331.7312810823792,Decision difficult hair party.
77637096-9e53-4de3-b780-777d8dc759dd,1b618282-b04d-4755-875b-1677b4f91a38,2023-08-03 14:13:55,479.50745112942246,Kind question kitchen then local speak speech.
ea49bf00-2e8e-4d6b-bad2-77c892ef4c05,0cbf3524-b3a6-42cb-8355-82af69af57e3,2023-07-01 23:11:31,141.584838278651,Mention alone season else whose.
6a2781e6-fd5b-4101-a1d0-dbd02f661d59,e60cbc51-cc7e-44a2-b309-90a8b7ec8884,2023-08-19 07:49:40,237.89791939181475,Center approach describe mouth.
31037a53-706a-4b28-85c7-a21a02b231d9,69420dc2-4480-4751-b61d-cd6be48de273,2023-05-22 21:32:08,224.80805071648217,Able research budget have describe.
c2c38a1b-b556-4dd3-bfad-7c49040bd202,044163b7-194b-4675-8180-f6b0afeca959,2023-01-01 05:01:53,427.6631136515127,Left doctor perhaps life well.
581bfb0c-c227-4f37-bbf0-b4a65bd97e6f,36313fb6-a74e-4ac8-bf55-708a67f57513,2023-05-27 02:08:02,381.7474217995538,Contain ask evening easy seem.
965e6eeb-d260-46ca-b602-ce2e8b1f4de3,07ed6a3f-7ec5-4a2d-9871-ca86dcc212bc,2023-06-20 16:33:26,49.02376684698994,West however put he near standard.
5cfe4d55-9415-4210-94e3-c6484ea0b1b3,9c6d47af-3c2e-4e3c-aa3e-919ab54049a0,2023-02-08 20:09:30,249.11349630857111,Visit together truth guy glass about guy figure.
9840b38f-7818-4eea-ad30-aecc5e8f05ee,df191548-42ea-4f38-9323-972ada991042,2023-04-21 06:32:13,357.39827638266837,Popular school opportunity sometimes left.
19dfa5cb-05de-4f26-971d-f55eb032ba1f,b8d4c422-1ffe-4dae-9684-3a76054bf914,2023-02-07 05:24:11,217.20010139065147,Mean avoid at room energy.
58a2379a-fa66-4545-8475-a5fac43dba7d,1de4d1a0-0f84-4a2e-a54d-30a16ca31068,2023-06-08 22:07:38,422.23001224586943,Meeting store personal south close billion authority.
a485d627-abe9-4d0d-a5b1-3d8141b4b3aa,5ed77103-1d74-4319-b9a8-fe7e4bbefbc7,2023-05-13 11:44:39,36.468303672410094,Up room follow show response suggest.
f1c91b65-0c99-4a1a-ac8f-38fb13efd654,1aa8e2e5-57b1-47d1-b105-80a841bdc4b7,2023-04-17 11:05:19,22.844531939730707,Father some society find mouth since.
493e1e7c-f9c8-4832-b52c-0ad6c816547c,404ac2b6-c726-4bb7-9376-ba35a3129d7e,2023-04-05 08:54:55,88.37678709615832,Task itself general education including.
1a649cd7-1b4f-4922-8af5-cbf19116c707,050d6a8d-ed01-4c44-801d-73d35b7bdacc,2023-05-03 01:37:30,392.5817901991104,Without this available service result story mission range.
4451e2c9-19bd-4f82-9a56-890e3c61f958,48f2c5c6-5af5-4ab4-b241-7c179c10d29f,2023-06-25 03:49:50,440.1236882217098,Life oil young daughter leader.
9102927a-bc11-4950-9f15-607b3352be57,d5315ff9-6e58-46c7-94ca-ec72d971d171,2023-05-03 18:58:02,322.09676347233847,Attack pattern six red member.
ee6b06a9-75c6-4a8c-898e-80c2132000cd,79b31ee0-ec65-4468-8919-8e64516b4322,2023-08-07 00:49:44,480.1399629616966,Build reveal detail western.
b0edbf78-d611-49f4-97ea-0847fc2dca86,35a9b2ba-9db9-4181-920f-47d87728b2f9,2023-02-10 14:53:26,163.27237010001448,Eight will wind tell though on.
a2b52fe8-5e58-4e27-a51a-59d8206bb758,29dda9af-001e-486b-90d5-60b6ea23274e,2023-07-31 01:12:56,135.9994583126766,Lead heavy night argue television local.
eb84c39e-fd20-420e-a008-900eebe210aa,0a95e596-4503-41e1-98cd-ae30683cea4a,2023-04-04 21:51:31,205.49296647195263,Hear over one send wall save bring.
b804c15d-7626-4d71-94dc-f6f258fd5726,f20843e2-3d72-4f4f-9f0c-a5700ec0a786,2023-04-21 07:50:34,260.12885289053406,Investment civil policy attention speak strong recently.
84609f07-b0e2-4904-85d7-c51d2791757e,787bc9cc-f9f2-490c-916d-75aed7343cc2,2023-05-13 18:39:49,392.19350754085616,Old business mother front resource.
2f0b491c-3419-44c8-9285-a14169236561,66b7889f-2eaa-4a9d-bb43-6f6ae84c2817,2023-02-16 06:35:26,479.3749774200392,Name on control.
6d23addf-b67d-4b5b-91f1-b4e5f3ea198c,5029b5b5-d3a0-4132-9b2d-b3a0caff54be,2023-06-21 06:29:44,366.06995616484426,Social manager drive three well with goal.
d417677d-0a7f-4dc7-a5a8-cfed2cd31a8a,c476f59c-4bee-4adf-944b-1b8315a13ad4,2023-03-29 13:14:41,90.73239565928064,Push way tough fact.
37374e44-a348-4eb7-a482-8566a7832bc4,379ffb05-5b81-4348-b61d-fdf6cffb6088,2023-07-19 19:40:18,15.97943605290494,Court art full forget still need.
b88ee99e-4696-4a3b-af9c-35f3a8a6cba9,9f1df780-95db-4a43-bedd-51ee4887b4da,2023-06-14 06:18:53,478.7241470248828,Heavy gas technology area.
6ee1c7a8-827e-43b1-981e-f5840d227d80,c12dfc5d-8544-4637-9c49-7592cf5a2dab,2023-03-05 02:01:09,53.849386609883666,New blue just other team soon enter.
ae5dc7a9-39d3-48ee-872d-224ff89cb2dc,d6567fcb-a10c-4d8d-adbd-dcab216fa325,2023-01-05 12:12:43,494.50786908303235,Family author door my amount inside picture value.
31ddaadc-cced-4fd4-b6c8-a38dd9dc83f4,446844f9-b836-47f2-92ff-a181dc8a272e,2023-03-26 08:39:50,234.0546076444945,Together player have decade.
2f3ed91b-bd38-4d5d-be50-a904d36f54a1,a27055ae-50ae-433c-a33a-c5ca123c3123,2023-07-06 00:46:49,409.40561459881934,Born five close increase.
dd228a38-3153-4cd9-920e-a55c24f68d04,73e013c8-516c-4b99-bcdb-3aef746675a4,2023-04-03 20:45:40,363.49612881445995,Who certainly dinner.
5cb7c393-3440-48af-ab44-5eeba3cef98f,4226ceb1-116c-42c2-bcf2-1efdd7cc8e94,2023-07-21 10:12:33,420.19239017741484,Reason team town start they financial like can.
c8f2ca37-374f-4e47-b379-18ace71a0f9d,867ad677-b6e8-4dc7-9b35-b31c73fc6806,2023-01-09 07:37:17,457.4828532519616,Nation Republican majority life whole.
8d081ce6-fbf4-4ce3-a20b-493722dcc86d,831bdcdf-6a57-4771-af16-0eea7cb90267,2023-02-23 14:55:17,271.11416925949385,White pay sing recognize moment science.
1bc561cd-244f-4ed8-9448-ac4dd7d00bde,cd1dc37c-4b37-456b-8961-09c15c643889,2023-03-08 15:43:08,399.19279262912744,Budget member thing.
7d112880-7fd7-4db3-b937-5944a37e4e6e,2315f1c8-903f-41fe-bb32-5a4a3d17f660,2023-08-17 19:06:28,32.19468618499762,Least song card avoid manager people trouble.
ac841567-7432-4074-b951-2f665fa05719,3dd838ab-b013-4c03-99a8-6e409851c4a1,2023-03-31 11:01:01,252.98730574430374,East certainly very.
39fae123-cd3e-4cb2-8839-d8d57d320ead,d760f092-2c1e-46c6-9009-1b02cef0e5ba,2023-02-11 11:53:54,75.41000585253322,There show data seat.
77493480-d8d4-49e0-a3c2-da482d2a2acd,07679b3e-37ea-498b-a2ce-6f1a4d9bb3f0,2023-05-20 23:33:18,468.74466184612953,Sing debate price partner.
283260fc-9dcb-40e9-8c56-d55371bb9d84,967ae767-5c35-41f3-a986-6ddfe33c6708,2023-08-09 23:26:21,356.32996208892916,Own black ahead structure.
