Transaction ID,Client ID,Transaction Date,Amount,Reason
d8d29367-5b18-43a5-b256-950102a1f371,9c9eb02f-e648-4ae2-a85d-4bdc57b9d791,2023-02-10 11:18:47,462.6951598186941,Idea none model turn assume.
6802b555-c94c-4d35-8ed5-f357a8256573,833e08c0-e3ad-4697-aa8c-2e47835e788e,2023-07-29 01:25:47,337.76525229292145,Than happy describe fire.
71d3969c-f19e-451d-bf87-e076ba36bc49,698842ef-1978-4e6a-ab40-dc4a55091bab,2023-05-13 07:50:57,201.5148706532867,Guy high at energy lead.
016c727b-c064-4f1b-a9a7-52189f0b8174,801109a7-a3f0-4cfd-b93a-5b78926cf53d,2023-05-20 08:38:56,151.66519731038355,Kid bank skin.
ee114b5f-a50a-43cd-8a4f-93d904be8982,03ba4b6b-a977-40c4-b7ed-921e5296ee57,2023-05-21 22:42:50,343.7896367613888,Party practice notice decade throughout.
2d012e62-5f99-4277-8767-a5406ddebb09,7f898a08-75d9-4a09-88f0-6adb8dd44cfb,2023-07-11 02:04:52,108.64815136386281,Son four behind actually property front.
8bca7cca-8526-4f88-8615-6821f8d38b3e,887cfe64-2d5e-43a8-bb57-c8ab577feeb8,2023-07-07 05:21:21,309.57716507309186,Ready from able Mr method happy PM produce.
f657058d-f14e-475b-8d5e-652d3f8e0009,7ffd95a3-47fc-435f-9c7b-a6483581ffd8,2023-01-25 09:03:29,426.5026994245153,Office me weight room go election me.
df509307-654a-4d42-95a4-221260a9c0a0,937ca6d7-25e9-48c5-aeb2-6247e952a516,2023-04-03 00:29:38,481.0820933132048,Race lose chance.
1b791d12-fa34-40c3-bf97-78246552a1fb,f6ec7ae7-26d0-4d65-9f3e-00d1cf5d68e1,2023-02-19 00:37:11,85.60418422929098,Defense can unit happen instead moment doctor.
da5a6d60-6eec-4150-93e0-6861e920e125,2afbda72-ab04-4d49-8db8-f6e8d3399c4f,2023-03-29 21:57:43,447.72724991261913,Test direction low state become consumer.
15991834-937d-463b-a55a-754f5097ca31,ef6750d0-48ab-4f1c-830d-f46f702ffe5c,2023-02-08 12:42:05,441.3555291469657,Pay hope live local be.
50eec40d-7b3b-4e2c-b56f-3f59acc798b3,f9d80c64-6bd8-4f6a-803e-5772d36c950d,2023-01-16 02:21:31,160.29012934259043,Section he water.
9c58089b-c73a-4119-881f-72efe2709103,dcfe4648-989c-47df-899c-53fe071d01b0,2023-03-02 20:39:23,317.03499738699475,Not production yes put all.
c3454a57-dbbd-43ee-9604-b9ab2c895bf3,430337b7-017a-47c0-a93f-3d50429b5dea,2023-01-06 20:12:20,393.4509424653499,Should they difference.
3d3396be-418e-49e9-bb38-825aa5cb5778,9387a78c-14c4-4d69-89a4-f81f1ef6853e,2023-05-21 10:57:01,130.54537041783095,From general ready force maybe apply piece.
46270459-cc51-447f-8467-3fe722165464,e1413e1a-4797-4e27-821e-9cc97040d7d8,2023-02-22 19:10:04,446.44867769801687,Forward us usually increase professional.
e657d428-0b25-49fc-9282-7c03bb94cc09,cef55bab-6138-4c28-9c33-3c28132faee9,2023-02-04 03:04:01,65.0696777379646,Over loss interest senior across second.
3ab844fa-a7d0-4481-b105-ec131fd61bd6,cb1a3e87-9954-43a6-8e6c-ae4ff903b08d,2023-02-07 19:41:36,410.3087363114166,Learn evidence address structure box stuff.
0ab8b231-dc62-4919-93b8-41952b74dcad,8c4e7cde-b215-4e50-88b2-ab6d1e85e89b,2023-01-02 23:32:04,209.99550885608232,His star morning subject game then.
e0d55dfd-3114-4989-b8f2-840a9f29f9d7,04797b36-cb19-496f-b953-c44002de3cdd,2023-07-17 00:11:36,450.67178240495224,Fast team on full seem condition.
caf6295f-7520-4f92-93bd-bbf0ef91b8dc,73a8b76a-938a-4b4f-b36d-e7be07be91e6,2023-06-15 03:37:53,413.5981743399746,Investment work study music again move responsibility.
98a27d69-9cfa-4a87-9729-0e7042c5622b,394a324f-04bd-4ec6-95e9-67480d3faf0e,2023-08-14 18:52:57,493.6357286338644,Official administration dinner plan building.
076eed2b-9be6-4293-86d3-e858f57ad9f4,fbb7fdaf-f1be-40b5-aa81-fb2edc707671,2023-01-26 10:20:00,16.515955443154176,Traditional most budget Republican low get bring make.
f8d42ed6-c396-49a2-a940-a5e9b35fb28f,24460ff1-ed43-4418-9085-efcff1029c6e,2023-03-27 12:13:39,222.57982289441998,Could region deal station her national.
33e6583a-9171-476e-a4fb-c130dc7001ce,a2d90e6e-a9e6-49af-83f0-78e7a7eae946,2023-08-01 17:36:04,257.5730785494452,Power concern miss end evidence movie.
d344617c-eb55-4b70-9a56-d0d9acc7d330,a7a372df-336a-4d9d-ae8e-b3814ac11b43,2023-02-01 13:59:50,293.7756477367463,Cultural Congress total feeling.
e87b3d77-0b0e-4537-8408-0637602f7818,fbce771c-b351-4d48-986b-b02e10cd458e,2023-05-10 22:42:07,451.74114872110454,Chair candidate energy situation player idea.
467e386b-a376-4e77-9fef-5e31ffb49d62,88621c2e-0b23-4c62-b355-70ba72fadad0,2023-05-17 23:03:30,20.327720317948458,Even where wind property maintain anyone current.
933ba4e5-15a0-44b4-a935-e272759c3409,70765df1-8b61-4637-a0ce-c59cab3fbbed,2023-07-26 15:46:17,440.9372914328067,Culture remain major group.
76691582-c4d7-4206-8e34-808b436fe35a,6a75f6b7-fba9-4981-8553-37c6d57bc017,2023-04-04 21:08:10,356.71121687629307,Third never need.
1558dce4-f463-492d-9c51-50356e524228,2928110f-8c51-4827-ba18-c52433bdab82,2023-01-19 05:24:41,171.73701660489988,Must chair value bag sell purpose future.
f22d275e-1a86-4014-8ea3-d550fdf460e1,ec3312a8-251a-416c-ab09-5a256a6b99c4,2023-06-12 06:01:45,32.91913840596681,Right song heavy.
d104c5d4-dfcb-42e3-adc1-d0625507c960,1593e14d-66ca-4a4d-aec0-ae4fe478152c,2023-07-26 18:13:29,436.91827724632975,Can myself ahead now firm in.
901418e0-176d-45fa-9fa4-a268b5cc8296,2cbfb69d-591f-4ba2-8a18-40972f68b8e6,2023-02-10 16:39:17,362.52799466425404,Impact new because care.
790af703-200b-45d2-bb6b-5b7fa81b6f76,ee2c16e5-2e89-4775-954a-e02fd88cf67a,2023-04-28 22:48:18,397.2774975535932,Reduce minute money billion trade.
c2695195-3cb0-4664-b7e0-89376c901645,bc040f1d-f537-4e0b-8053-b825f879d6ef,2023-02-18 12:03:59,193.06063047143866,Guess stay rock series second explain finally.
febe7f88-91c7-434d-aa17-87e264789359,e511247c-0a7b-4691-b938-9c8832181a1d,2023-01-22 08:06:00,322.1104556770929,Chair production room because.
c2c66b72-5e64-408d-9051-4790f880f83f,4dd2e3fd-37c1-409e-8c80-6165fc71483e,2023-02-19 22:32:56,236.49631418974886,Individual yard later put.
45983994-f1cd-4f6f-9e0a-e2ab93637d07,91958aae-e7bc-4564-a7ba-7127c55696c9,2023-04-27 15:09:00,377.56482550553807,Article indicate test address admit feel.
70f1ca87-b13d-42df-9a0d-69e5509eb56f,abff8af3-a6d1-4804-92e4-2224f03dcdcb,2023-06-29 18:50:54,428.5501315270491,Throughout arrive environment decision that establish.
74589198-3daa-4e65-acc5-60384b3d265b,c891a57e-69f5-4730-9d7e-fd6eb7142893,2023-06-02 21:27:03,140.028815499383,Go international recognize large toward.
b7351140-c128-43f4-b38d-28413c05109e,4da29446-7757-4a25-bef8-da5e033ae849,2023-05-10 04:00:20,21.750321349914834,Eye hundred everybody space.
44ed1243-6373-466c-a584-ecca751c39a6,43a17c39-c2a9-458f-8ad7-55cd07c25eb0,2023-08-06 09:24:29,192.16900038253843,Again road quickly.
92ce0531-c1dc-458f-8a4a-737458375345,5de058ed-589a-4bc4-ad5f-bd1dd5036781,2023-04-18 15:12:19,155.75853762851617,Learn health kitchen area.
a532395a-6da9-4f68-a346-7df9f455971d,abdf6971-d570-4b42-8da9-70bc2ec49461,2023-06-04 20:55:22,134.78333183935473,Same address recently industry artist discover.
6f1dc332-a845-4919-8831-62a427b1af84,7eb39953-178d-45fc-b9b0-512bdd05aef6,2023-08-12 21:53:45,142.44769091882478,Agreement tree window trip expert.
5214c1e3-fe9e-4085-b0e4-c5759f83b423,9368368c-c0ae-4a8f-8450-2a0491997c40,2023-02-22 09:03:41,278.25634617040856,Data member fine under career relate about.
d68ca8c3-3f3a-4823-b34c-37ade51a2e1d,1bf8c92c-2a87-4dd5-a668-d8dcd8b58f3d,2023-02-11 08:48:20,47.19457915418531,Institution crime company young.
95d85ecc-bfa8-4459-b385-ea7e5c7cbf91,33304cae-3c91-45e1-8829-ee2c6be62fdc,2023-08-19 13:33:48,43.99762753786097,Follow sound grow lay movie.
6be5c8bf-069a-4cd9-9914-630453fa4149,970eff03-2bd8-430f-be73-46cb117a2fda,2023-01-17 20:37:51,226.9726018423991,Change doctor campaign year daughter bar real.
288e0323-e88d-4d26-9763-d7b9521bdcb5,62ad1eb7-6efc-4a61-9de1-9d716f3219f8,2023-05-30 21:46:01,24.6864644777374,Large hit true series affect even.
e1dfed0c-22f4-4dd5-a0be-4e5bab897e8f,b901b5aa-29a3-4a08-9857-91719fbe5621,2023-05-21 22:59:47,340.43490112396677,Medical player take debate story thank.
20bcf983-36fe-4b8a-82a1-feab75786aec,46213b26-64de-416b-b8b5-6cdb89c2d865,2023-08-14 03:21:54,419.91793424531136,Force tax wide choose specific commercial.
c9500f12-41d2-4b0b-a1c2-800155099221,2baf2cb6-b231-40c0-be97-e2bce06b86d8,2023-02-10 09:11:55,323.30529834899824,Raise study do matter challenge difficult.
b0790b7b-49ac-4b46-800e-8b365e2d44f6,a1211d0c-3241-4ea9-82ff-3c2ff7ec5f20,2023-01-24 10:04:36,187.48670399119132,Kind of material doctor floor attack later.
6564e151-c69b-4e4d-94d4-12b07f941435,4717a43d-3083-4f70-88a7-396a00f20022,2023-04-06 01:14:04,275.9702739928565,Meeting modern even fine risk whole official.
081e2506-4c7c-4f8f-a0ac-691b85af578d,754ac17d-58d3-4f14-b4a5-2c5675a2c584,2023-06-10 12:39:41,278.2646619707811,Six event future stage will pattern.
0b01e1ae-08fe-4750-b5cf-ace9574d6281,10467579-c75b-4adf-a2af-f86c6e1a6b6e,2023-07-15 14:48:23,210.5046793693569,Strong bar against suggest similar short.
502104f7-0457-4ab4-84f7-4ac3e75880b4,1cf6fa50-ebbb-47fe-b422-c32dd279d5a9,2023-05-30 22:56:28,461.5048449517765,Within prevent several Mrs trouble section.
c83d4141-7a13-4843-80c8-3b6d874c2687,8f988063-8338-418d-83fb-acaaa0c8cce2,2023-03-10 22:25:59,328.38157169816753,Indeed head become court.
7c3933be-e882-4605-83b6-1a6985c8688d,1933b0ce-b24c-4000-862c-631894a25d0a,2023-06-16 17:46:37,311.7790478183545,Data first really second believe subject official capital.
37f52a36-a66b-44e8-9f0a-c565cfee195b,b27ac9aa-8810-4de1-b208-b1f37639ab67,2023-07-14 07:08:31,72.67494661871942,Some threat result single.
19233323-b1ed-4614-96d8-08cc4a43cb75,cfbb800f-5b6f-4bbd-bd9e-098d52fb5ed7,2023-02-23 01:59:44,321.1627216267728,Feeling bit government sound.
8d111e59-0b59-4330-9d02-4b1a38d3b4cf,637886f8-697e-4c30-8d35-4df8ca728706,2023-02-21 14:53:26,114.7199126913659,Strong successful hundred budget woman computer.
9a3d48db-a080-43d3-b049-cb1e8e6b9ea1,c76caa98-b0cc-4245-85cc-a7cce1b3ac26,2023-07-14 07:36:18,466.1034758926491,Stock art several whole true.
7bb0cc0d-a4e8-45fd-91ae-04609a4a80fe,f9285d40-5b00-42ab-8f13-5ecf72f4bc8d,2023-04-10 08:39:16,305.50352201412056,Indicate word across fast poor point production it.
39fe0fbd-3482-4c3c-8478-4ccfec120ca6,df701468-1281-4638-a635-b7c4deaa2369,2023-07-30 07:18:38,17.27078082021606,Professional less light card firm kind party training.
6b636598-ec40-46c3-b8f2-592b64eb5854,5926fa4b-be69-4e7f-b41f-6b8809e42f49,2023-08-14 19:15:13,58.939564745065425,Cup go admit American pull.
732dfe88-d10e-40f8-aed7-e4bfd93ccb05,275b2c88-8786-40f1-a94b-6834000abd09,2023-07-30 01:55:52,267.5158667497548,Energy bag site exist trade reflect listen.
76a35d43-5bfa-4af3-ae41-459760af2a0d,4915e3e3-0459-4d7a-b185-ca76f7173f18,2023-06-06 19:18:55,450.51749354849244,West approach suddenly yourself leader.
360f2150-c3aa-4ec0-864b-607578d90dc8,a921d6bf-30ca-4378-9156-1e49b4a9489a,2023-07-28 14:01:20,199.95681359024545,Choice culture part audience half.
0e4eea4d-5ba4-4e1f-a0e8-1992121a595b,c0c3701a-703c-462f-9ea8-e83019e241f8,2023-03-01 10:58:50,309.72233978350687,Speak ability available situation.
50bbad06-acef-4eb9-ba18-800bb6ca65f8,b1dbcfaf-a336-4959-92e2-928b212106ac,2023-01-20 02:01:12,252.35670626318262,Seat care hospital others throw.
aa3fde84-3373-4eed-a5a9-87bae08f6179,a3ea0299-ac1a-4e13-9f41-bfdb61695bcc,2023-02-26 01:59:41,479.2863027425403,Coach Mr choose reality government imagine me threat.
7d581b4e-37ae-44bd-9851-38658d9c3e3a,d682a70c-3aa3-4813-9dcb-c6a1fc559c26,2023-02-15 12:53:43,198.98265707791901,Amount one weight different doctor friend apply season.
c33e812a-359c-41a9-876e-23ecb3ce8d30,4393f712-2de1-4b6e-8794-4306bdea49d0,2023-05-12 05:49:07,312.64599497482817,Hour style say eye picture manager man.
9cb37089-d73a-4401-9ee0-884a40e0f302,ea4fb190-5b0e-4cb1-ad97-e03362d7656e,2023-07-13 15:59:16,250.8385903113343,Everything two else its later.
79c67cc2-2931-4794-98e5-b9641151102d,c8cf8630-5306-4595-9427-d8f6434d016b,2023-02-11 10:35:52,126.04882418004615,Support husband trip as new training.
e01d1286-c8fe-44a3-82c7-440b82fda082,3b8a6c07-9ddd-45de-845d-47e7510beeb1,2023-02-01 01:41:25,247.51502419986463,Attorney scene majority defense minute far.
d4f39967-5e3f-4701-84fa-f5313fe848ab,878708c5-6b99-40d8-b2f1-31ccd2e5737c,2023-07-23 01:49:23,200.09551730481596,Property professor memory brother parent.
cfe12118-69ea-4d3e-ab47-1169f1e0dc53,88e519ae-ce33-4803-8d96-7fb0daf31dc6,2023-02-22 05:30:23,180.69450903781367,Several before partner foot good strategy.
a813beae-10c7-4937-9c44-643d3b83ed81,f72eb6c3-2bbd-4e18-92f4-d9e7c3cfa65d,2023-05-25 16:01:16,324.1078083301561,Movie through firm race for just.
cd555ac7-21f9-405c-af0f-2e2691e3cf08,2812baa0-c89e-4c22-8f81-7c6fb06dfce7,2023-07-20 05:26:12,297.78482412476865,Ago however hair participant.
3554b3eb-53d5-4d05-b04e-4b6887fbb89c,06fa1319-9506-4b6a-a52d-d13e3a82927c,2023-07-09 05:09:54,435.846714690735,Buy laugh line very.
6ae089ca-db96-484d-8ac1-0e77bb3dbf4a,58eaf5e2-3ad7-4806-80b5-5e1a3e5cc00a,2023-06-27 20:49:18,417.3339501620204,Thus feel leg low effect budget.
66ef990c-4214-4f5b-921b-1c9b1d6b64ee,fde9af34-9acf-4efe-80aa-c140a3b57666,2023-02-27 09:25:46,296.10953362354843,Evidence leg career build.
7805e4ba-2ec1-4839-a01c-156568cc19d7,41951748-eaa4-49e1-98d5-bea26c7ca363,2023-04-05 09:06:43,159.39380610329428,Whose than body east entire land for.
2b235d41-03f5-475f-a51c-7ec89f2c42b6,065ed4da-6ab3-4f67-a6e6-5778ab936d2a,2023-06-20 11:10:08,454.77794269670517,Drop everybody bad of food produce.
a6f39cec-33f9-4378-b9f9-f118f5ba514d,6310686b-0e41-40e6-84be-73d082faf5f4,2023-01-21 15:29:13,147.74592457205136,Of car nation religious book.
715124ad-9eda-4d47-9c0a-2ad14e55681c,fcb46963-3d4d-4807-b960-b46c18504da7,2023-08-08 00:31:32,192.26642360200478,Just heavy somebody any oil carry.
84f23b80-5e01-4b1c-ab26-7002e140ad78,c2b17fe4-cedb-4a66-8774-ad4a83e4d647,2023-07-21 16:30:00,484.7486031207252,Policy better worry energy ability few.
277cbb6f-822e-4cb6-9202-f139f03174c4,3caa6a87-4e4e-4072-b425-c12c3b5616a3,2023-03-30 06:38:46,427.89367867966456,Hear magazine worry happen feeling difference.
7a605542-0281-43a7-a1f6-e40d053c54b1,9e7af084-7098-4072-9f2b-bbd655b63b4c,2023-06-28 18:20:15,27.5425515453589,Change street art meeting approach music ability manager.
8ec857ec-debc-431d-99ce-071fb2591bd6,8d30cfb1-93fb-43df-802c-fd02d46ab706,2023-07-29 02:35:25,290.5428552461705,Effort nearly these position water race development.
52d0c46f-46aa-4058-b8e2-2c755e0f5a71,bfb7a45f-7ca4-472c-afc5-780dd998c5e5,2023-05-20 04:19:14,33.369495193125964,Onto professional imagine light ball manage.
5af0d894-b9e9-4e13-ae69-a846e123be79,4e9c3e20-b56d-440c-962a-ed14cc0b58c1,2023-02-10 15:48:44,325.38914134740276,Although account ability turn out.
f7414326-4404-4f1a-8a3d-c6499cebfb82,fe97ecc7-97f0-4036-bc4d-427ce419ab25,2023-06-01 11:10:29,112.91648040481508,Mean like push whose.
9487f22f-c8de-4d6d-a73a-cf1c201bf600,936ae0de-e4d7-455c-bca1-8ad4e6c713e3,2023-01-03 02:19:09,39.084307092451546,Cold deal budget.
877fa45b-bdfd-44ce-ba8f-b8539b0af2e0,6b71b83d-556b-4417-b800-9448853c0b18,2023-04-14 03:04:30,352.8943051074345,Evidence everyone there I whatever.
8267c365-47dd-419e-9d42-14560c6ff7e2,2e19a91e-04b7-40b2-bf04-b13c2e253fdf,2023-05-06 16:32:41,86.44036864468623,Organization white way think ready.
583b28bb-a939-4123-b5a7-49179d4ee84a,7cd10080-96f0-4b5a-8d9c-07215e06a430,2023-07-31 11:23:10,293.4196987477327,Arrive region her society than.
cdd8235a-2afd-401b-baef-558a378bd9f6,7ac0cab6-b923-4bda-8e0c-1c48e341727a,2023-03-21 06:46:11,402.5616088557194,Across office grow enter may around.
08f52014-cfaa-416d-9323-e0ebf33dc3a0,e813639d-77ff-4169-a096-d80a9899d81b,2023-05-21 18:37:50,276.8136872425867,Industry per station ask lot lead area.
fad2b876-6d42-43b4-9e6f-1bdbdbdb6bdd,a1889c77-f0d6-4c43-988e-dbb23250871f,2023-07-29 21:48:27,294.41256192404995,Question gun tonight task.
e60682c9-d65d-4c58-8b91-d63dd9bb6e3d,c7f6f219-e739-4756-875e-ce809e8b1904,2023-06-12 22:11:39,70.94261875487253,Career three least.
54f684c8-f594-4d00-ba5d-4bc8e906c973,f2fa84a9-3ac5-48ab-8a48-8503d4d48bb1,2023-02-14 06:05:44,44.85751161648098,Market crime hard challenge compare available appear.
b63d939b-cd02-4d8f-b74a-22aa1ae08e36,ffe7c788-41e7-45bf-aa35-d96f0e6a4345,2023-07-16 07:01:59,394.19444709343713,Six cold when.
17a4535f-a362-41c1-a310-eaae332646db,f6fb749b-25b0-4835-99ef-9de897861810,2023-01-16 04:12:45,309.4029527993416,Training various doctor major design.
96a9cc43-8b51-43a7-95a2-f70702afff7c,3a7567d5-fb4b-4d67-be95-ac03389fcc97,2023-07-21 04:12:18,77.03174788288311,Identify few poor news.
47118236-137f-4ea4-a3ba-88d0f0dd67ab,9f1b6f73-46e3-469e-8d31-01f434c01ccd,2023-08-13 02:42:08,218.6070947558341,Room seek want.
614f13fc-2044-4ea6-bc9a-bb59d9cf5ba6,aca4ca4c-0651-4c36-979a-f7cd008bf687,2023-07-03 05:36:48,229.53408909617247,Eye occur form might growth paper.
fe283783-2983-4f14-8375-3ccd9f719aec,734500c7-9807-40d8-b938-a4949af81e10,2023-05-28 12:22:17,463.45399448824645,West foreign describe.
5197c5e9-f05e-4f96-a07a-9d82496bd920,ae1696f0-eefa-4834-8123-0ad97bba4db8,2023-01-08 02:48:43,429.59468238574766,Nearly agency keep school follow voice factor.
286e1616-3160-4585-94ef-4ac3f0c86417,44dfe3a5-e762-4cd7-abf7-02301de7f5db,2023-02-21 11:11:56,475.2884022661775,Authority bar single.
6f281ada-07bc-4d82-89d3-96374c9972ee,5e2f8a6e-ebc0-46d0-b766-c930ab9e2cb9,2023-01-16 04:49:28,284.279288402029,Instead score remember skin get decision produce which.
dc07a635-bb90-4131-be31-dc4460b4c54a,e5840755-09eb-4315-be6a-fe6c2ee06be7,2023-02-14 06:07:45,466.83662930736165,Group different happy special interest garden model article.
be04b4b4-199b-4206-bf33-cf73027ed891,8d8be005-fec3-4b9b-9f59-c6486f6a0cd3,2023-08-11 05:27:14,277.0486274618504,Road crime loss west keep ten person.
df3b2b69-4883-468a-b8a3-49bde37ba866,346c2e97-ed3e-4d45-8f38-0a1560cc859f,2023-07-26 17:58:02,432.660069389429,Send move social increase.
f681921b-2705-4ecf-8519-e7d06f2caaf3,33097ad2-88d7-45e6-bce2-73154a9dc320,2023-08-16 03:16:53,199.474991000019,Effect most concern study ability.
feeacf5e-67df-473d-b291-6d3a350ee50a,d08ce592-155c-47f0-b2b4-7dc161edc265,2023-07-19 20:34:08,467.30547502788113,Important agree pull painting expect.
ac36ec01-c9d5-4524-874a-d6b00b2bcbf6,5f827e1d-8bcc-4b42-a2ae-6eaadd29af50,2023-06-10 23:48:13,322.9672808768985,Next capital way.
966f39b2-f385-43d1-b509-537514895059,fd93f56b-dde2-458a-91e1-bea5a92dcd17,2023-05-16 07:31:52,225.32436680439585,Finish week thus blue tree yeah.
0e219c79-1076-497e-b659-b29b6e942e3f,a44ed229-03e9-4de4-be99-ea513ac83d9d,2023-06-12 11:03:17,79.90038711508097,Finish throughout give unit quickly.
bd78631d-4500-4bf0-b3c6-69dd952f5500,a32032c6-c483-468d-a3bf-44fca05d0526,2023-04-24 19:27:24,267.84790254635465,Green into after top beyond.
4d8f6310-75f0-43d4-add0-e1d4e0a575a5,e5c65213-2e44-481b-8127-0042322dba3d,2023-06-07 22:16:02,46.60610179319392,Ground rest address spring us ability.
5d7fe4eb-6601-4c0d-b5e5-3bf26f734c50,a23a1852-dd83-43f4-b79b-8fcf73655cfe,2023-05-03 20:09:12,130.20660543697915,Road only exist.
86bd7ed0-f656-417e-8995-a19e8ece6911,6a343aef-81c8-402e-a614-6d644c7d68d7,2023-03-26 22:35:09,101.96583189088638,Late chance politics act cut.
aa1c32f7-9809-4834-ac52-52ddd8dcb0ea,1446eaff-e3f6-4d17-afe7-fc8047c022fa,2023-04-28 12:15:36,282.03835843556215,Give no design call.
6823092b-a168-49a2-85fe-7bf7d796563a,360dce7a-fcae-40ea-91c3-fff648445b14,2023-01-10 21:59:33,282.1660836685389,Able five between stuff own personal charge.
8b56701c-d743-4969-a4bc-4f14ccc08a53,fb6f02d3-92de-4aae-9d13-83988ad4404a,2023-02-06 12:01:49,365.84983251556787,Fire have sound theory call field nearly Republican.
f8d0ceac-e976-4b25-97d4-d1035179ee54,292b258a-670a-4bfa-9c9f-06d3c2d46039,2023-06-10 19:42:54,330.3398295239687,Democratic mind gas black season.
ea242c21-0bb9-4b01-ba0f-b09557f828eb,ed30439e-3a90-4f38-865e-43806136a52b,2023-03-09 01:32:28,136.52818766021738,Either early money road certain group.
484e96d2-3585-49ef-87c8-7742f46eec9a,0ae2c3c4-ea09-415a-aa9c-6498ed2125a8,2023-04-21 06:27:09,217.3936496006069,Debate pass clearly industry total always end.
39de1617-58e3-4c4d-a5b2-f09ce2932915,da40f254-b555-408f-b18b-6d68fa12a34c,2023-04-23 06:31:05,467.17583423715854,Have work although north night.
4dcf951d-bba2-453b-92f4-3d6b59a7b15b,9d1445ab-5163-4936-8ee6-87217f2a8c0b,2023-04-04 00:14:12,110.03896305346119,Poor support herself consider either family.
d1b82788-8c95-4623-82b8-8a9b652429ae,db23b1f3-7103-4fa8-9c05-df4f8c3c8a63,2023-04-03 14:24:27,165.58925649523542,Couple us positive none will decide.
01049c96-5738-4a75-bf3a-70c79dee0042,bf52e508-ead6-45e0-810b-15e7e7e4e2e1,2023-03-13 20:58:36,445.55457643484874,Up drug too enter subject among.
5b65e5bb-f98e-4003-b143-ffea16881564,6edb0b90-80d4-4124-b1da-02152faec9a7,2023-01-14 22:01:42,370.65657669190887,Month capital church.
5cfa4909-f8a7-4840-ab11-01a8bd444060,1af23a8e-69b3-4ca3-8a00-f746edf4176b,2023-06-23 01:03:49,281.37961902136567,Learn quality there must dark.
4032b50b-6ca5-4e02-b61a-20199645b375,07302a25-5af5-4979-bac1-620941932f05,2023-08-08 07:23:24,323.95773504240924,Difficult film minute see town which middle.
b1aa7872-9077-41fc-8d89-76aff204fbe2,90984dcf-bd47-4ac9-a200-62a88bad3fd2,2023-01-21 18:19:04,402.8936457601737,Exactly will our gun son threat interest.
c62cafa5-49f1-4916-9d31-0ab70b9b5241,a969ccc5-c8df-4194-8223-41a288a7f2fb,2023-07-17 05:48:11,267.19428048224574,Similar will song compare population your record.
077757da-fcb4-44ba-8ad3-46ff695253a8,9e4e6fe9-b9c4-48ec-a548-eae539d6c556,2023-06-16 10:50:38,417.4971024257077,Player situation likely computer election behind day.
8aaf6729-98c5-461d-a426-39d4bebc7329,4de9bc89-13bc-4ebb-8792-7f4eaeee5535,2023-08-12 07:40:28,440.80942008678875,Gas team service cost.
c47cbf1d-19c6-4939-a8d7-e667930404a6,045df137-f687-4d31-920f-f6d2578a27ab,2023-04-07 02:19:49,261.30865770529033,These positive smile policy student spring around.
46ff5767-ea5f-479f-9217-9b35f8cbb242,812bd9f3-d959-4b3b-9f0b-f390070d4938,2023-03-02 08:58:17,391.9647880764775,Knowledge poor lot fire.
03f36f32-416e-48b5-95a3-e11c2c22b834,e37f2a1c-8546-4608-87fb-1095a049dfb0,2023-05-10 22:11:59,45.763867834393885,Often hand already.
ab91ffa6-f5d2-408b-a8ec-68dc47afeb04,b130aa01-5604-4b02-b5ac-c425918d7e8a,2023-01-02 23:21:47,356.8571884168685,Near thus floor us likely.
c8266b5c-4bc8-4bca-b91b-bcc12b576d85,16f2c4d7-57f3-4d22-b0de-21d8275b6bc2,2023-08-07 07:54:32,359.54350914255724,Course purpose bill still huge deal seem.
d8e3023a-e593-417a-bfa1-f215aceb2e9c,a988cc74-d2d8-4b68-a492-a2d0e1f26609,2023-01-05 02:17:20,195.37406281712174,Dinner suddenly these production seem.
ebbef04b-719e-49e8-a37c-f2753270f5a0,7a516a6d-fd1f-4fa5-b919-eee88bcc404d,2023-07-05 20:13:46,419.5027359891057,Effort painting rise describe side look.
06440341-ff52-49b8-9039-4106d2460b6b,dd7f42fb-7650-4f7c-b868-476e253021af,2023-01-08 14:53:36,238.48616410791018,Before matter public do pressure.
bfa0f5d0-98da-473d-86dc-1aa9933cc673,fa874263-541a-4e4f-9763-b4c29c62f935,2023-01-28 19:21:04,205.15565607278793,Join quality start college.
132a8a4d-0acb-439c-8992-83ba110d03c6,9ebfa6b7-c0c6-4e4e-ad75-faf59a94dd59,2023-07-30 22:06:02,258.10757130409445,Onto vote to chair contain as.
bad41e5c-d8d0-48d3-a807-7390ac2553af,d3e9fa04-d73c-4a59-bff3-f403640e2e54,2023-04-08 05:47:38,69.65943572644805,Participant stay finish.
e0e53829-38d7-4bd4-9b6f-62be8f12508b,25390069-1687-424e-84ba-1e964ee41b29,2023-07-18 03:17:37,10.465120341629087,Hospital purpose animal upon situation.
67dc5b55-7a26-4a74-800e-f8ba0816edc2,260713cd-243f-4b97-b5ee-34d4227cad5a,2023-03-24 04:00:44,69.13520471804009,Hard explain keep sell although approach.
75359a36-f503-45e4-a4b0-a6595ac74f61,3041085b-3697-4d9d-836c-35486481c46e,2023-02-11 18:18:12,232.36622412961756,Much project drive environment.
341b8057-3ea9-484b-ab4d-9ff1714cd0f5,3574703a-40c0-4bbd-b469-fa8e0feae408,2023-06-25 20:50:24,455.5656444250317,Performance rest child would maintain.
0360ea91-7fb4-440c-b1bf-14f15e8c68ee,f7072345-1b41-4635-92c6-e77ba654fdc7,2023-02-22 09:53:26,10.003322398665327,True outside him military.
6b1f7de5-1ad8-4d06-9fe6-ef1ab0697f92,9b4fde09-3d8b-4d82-b05a-c74bd9c2a352,2023-01-19 07:21:08,218.55860810912662,Center under fear understand situation include pressure during.
9e247948-bdcf-4e49-9e63-72668b03806c,7759d6f1-b5ff-4d38-b0be-978a592c83e9,2023-08-11 22:35:45,370.9082392254068,Many woman tree watch help bit whole simply.
576519d8-b1c0-4250-8220-7bdc596b46e3,e1c9070e-30b1-4917-a468-b4cd842603b1,2023-03-13 21:09:00,60.35313990847224,Reality business play.
30500089-64c6-4d59-8f05-d0b518ac4c1c,fd243058-a8cc-439e-83b7-124b53a18786,2023-07-16 04:59:20,66.96016851623415,Ok focus health score subject.
631718b4-b37a-46a5-bd5a-36f4f017d36c,01f977dc-fbfe-4f54-ab20-73e6103a6bbe,2023-06-10 21:29:08,400.52555828232505,Whether wall race.
36608853-0adb-44fd-ad58-536b11f9a161,a296a3d7-1eb8-408a-b89b-ba2c6b493c14,2023-03-18 09:38:46,18.012422878319548,Dark these interview whom technology forward.
221e7622-431f-49f5-aac0-19f96d3ca530,cb0da8d2-04cb-487f-b9f2-408e58922835,2023-04-26 10:59:20,64.66877521189681,Road nature allow safe.
d4f75947-e04a-4c0b-a82d-d4e720e0c4b6,10860df5-5f10-4bba-b819-f59112fee61e,2023-05-20 00:44:59,420.4487811266115,Mind forget agreement southern whom write house.
a63a95fd-dc25-4325-9655-60414b5b56e3,66d79471-01ea-44c3-a2ca-8d6ea116e6de,2023-01-09 03:12:28,479.48807395418146,Data finish head strong art.
a3501fa6-bd0c-4f26-a5bb-b7d6c807e077,c3774d30-ffa1-4659-833e-820a78906820,2023-06-24 00:39:46,145.0429421190127,Personal power during boy example worker.
f6fd35ec-1345-4a4d-ba92-af64d8b3d548,0d0c064e-8dcc-4b54-9ca8-a4337655fe41,2023-02-26 13:34:10,244.1264998327619,Or scientist of region late show hair eight.
