Transaction ID,Client ID,Transaction Date,Amount,Reason
6de780b3-ee14-4666-b07e-f7075f609b95,f816c98a-64e3-4614-aca2-d54a4e490cbd,2023-03-05 10:08:47,257.5870437233506,Either my such sea course successful marriage.
9823a473-ad81-44ac-ab1d-486b26b5d059,dca8f13e-982a-46cd-bc05-92d3394a48d4,2023-05-07 01:51:53,358.5474910648237,Place me heavy fear cup beautiful.
102fffb7-da8f-464d-9433-84e527421909,047fba1e-41c5-4eb3-9227-8da88e0eb569,2023-06-14 04:36:13,144.91169676122968,Capital beyond feel tree.
c85b7afa-c73d-431e-8551-0efc02ceb70c,1cee1fba-1980-472f-b4b3-f5e0cef8242a,2023-05-05 14:21:11,453.69576982273026,Interesting tax ago home purpose religious.
32381391-7356-4bee-bb0c-850dfcf85a20,499b761e-5924-4cc5-bc47-eabc55f71bd4,2023-03-26 18:12:51,344.18178310865557,Effect wish look nearly.
cd519f42-4eed-4193-876a-04740c2f156e,b8b1c6f1-d173-407a-88c3-6bbf04fdb1d7,2023-05-18 11:58:42,248.52614110207023,Character agency will very firm technology.
80f31800-7810-4320-82a3-5ddcc508d21d,6eca64c6-94df-407a-9000-36637bc21e0c,2023-02-07 07:06:50,230.3938250738153,Energy they minute sport everyone growth staff toward.
7c214e48-fb02-4041-8849-10042874d5c0,3e4481c3-5fe3-40e5-8ef6-4a84b35b330c,2023-03-13 03:18:35,309.7995014735969,Picture site under choose involve.
3a218538-8972-44d7-8524-fe5cb76d5c01,398dafed-d523-4a5e-87bb-5e0a2fe0d33e,2023-04-29 08:55:16,289.5615154891633,Into bill whole team institution success business.
17831f09-43e4-49ba-b629-899e81a5c5a5,178fe57c-968a-4988-ae2a-c4b2debccc3e,2023-01-18 00:51:28,139.81308852718527,Word wish cold our.
099c0ac0-3fac-4301-818f-c50970c8a979,9fe54f80-28f6-491c-8a8d-04c6a574c05b,2023-06-29 03:48:31,281.6320873019813,Service include success.
c34b44c8-a86f-4ef1-8acc-5ae389ea22b1,553d84fe-99c8-41b4-b4b9-ecd9c2753f62,2023-03-12 23:32:17,182.76043496440025,Interesting race sea floor.
77618518-714e-43ac-9fc1-36dd3d4c564c,47559929-8cf2-4317-a573-2e7cca69a174,2023-03-03 01:28:27,146.48716606415917,Box send hear.
9e660f9c-b9e5-40ea-90d5-fdea00a3f724,ca52576f-4625-4a80-94a3-95bf6a3056e4,2023-06-29 08:23:06,46.90639939268956,Laugh yourself speech cut.
f19dd8f9-fe22-4212-9120-e7c40ac11c24,486abe62-0ac8-4912-8374-2b66855274bb,2023-04-02 19:16:44,381.81101471964797,Me those value size site determine.
92ffb0af-f6db-4c6e-9b16-07d64f705215,30cdc189-0aa9-4ecb-bc53-4245812b33c9,2023-03-24 03:46:04,353.4343048028852,Education likely close happy pull.
e0a2dde3-01a9-4205-b556-6c70f289517a,92301a8b-fa51-43e6-8120-7525fee416fe,2023-08-17 16:21:37,301.46294834603947,Sometimes front risk.
db0d8813-4748-4bb9-bcee-2be4110ec06e,67d3569d-8bd2-4ec5-8358-1851eef21d05,2023-08-18 00:00:52,472.5601848755631,Budget open part agree attention.
d05f41bb-90a9-4036-8e4c-2919b31fbdaf,1984822b-5f5c-4fb6-b818-6e9778b31953,2023-05-29 15:23:28,458.76037954665463,Grow use Mr discuss style lot example.
2bc49e32-ed90-4e0f-be7d-2f39d2e43208,ec599f3f-6e3c-4ba1-ba2b-7f0d42ee644d,2023-05-13 14:19:07,282.9015921842029,West morning wide knowledge leave.
ec79bbbf-32f0-408a-8ecb-a1d86cbb8a27,ad17c88b-e89a-4a4a-9b49-d4fd672fb218,2023-07-22 13:54:57,100.41534016015218,Main book get start serious.
edd1cd4e-442b-4962-9256-340c781eba0f,cc44f4c1-0edd-4ba7-813f-d5d9e2f1972e,2023-07-15 23:56:07,342.60893359945203,Somebody tree major along compare big.
821eeade-3346-4115-987d-6a3dad6a1c7b,589c5615-0b2e-4063-9977-29c3a8d8c079,2023-03-13 12:12:34,48.61595463951489,Expert yes base than main.
587d1aea-f6e0-42ca-90ee-e7fbcc8d0ff6,f19406f3-7157-4350-bd5a-96644422690e,2023-07-16 13:36:42,441.4107293886006,Buy defense professional material risk it war.
5ad4e4bf-3e65-48bb-a358-341b6b2ece60,20441f72-b5ba-4954-8f72-0149fe03017c,2023-02-03 13:25:10,154.93682895071456,Him visit push figure.
209066f5-fb6a-4e28-9794-18e3a24d8b68,87bc7cd3-9927-4372-89f0-c06423da7b8f,2023-07-27 22:00:23,361.4917528167729,Social woman lawyer enter public sound.
fc8a4d3e-1b74-4c31-90fd-cef66d4b5b4a,1c95a526-425e-4358-91c6-4af37d6db465,2023-02-06 16:14:22,300.31888742073414,Difference happy hair environmental.
452308f4-de23-4281-9616-e77db95a1271,eaad03c2-a36e-496b-80fe-36047151abc9,2023-08-02 20:23:00,98.44500549096557,Quality Mr let to shake.
0904a615-5b0e-4b46-a1fb-c105b7f1ad90,f90d3f76-4d60-42fc-846d-fe56e8a70085,2023-08-07 23:10:01,378.8390940398723,Very community response product.
112c3d9d-c0e7-4e32-bdc7-58e7080a62f1,a0285864-7cbe-4f64-a0f3-3479eaecd086,2023-01-04 15:29:46,369.97127931180364,Hot crime involve house past social.
ec13b46f-3746-49e2-8bea-79caf47d57da,f28c9339-72f8-464c-8950-3cefda0735cb,2023-04-15 05:18:22,281.9431491466077,Price side best miss.
11facdaf-0677-4936-b403-096f3948c501,8e658746-fd5c-4ac3-aa0e-3a5ff5b3d360,2023-07-04 02:46:41,355.4812649487427,Owner condition experience development bill for.
f775513f-82ff-4158-96ee-94912a22e726,9f089322-fd4c-4ac3-8788-3ba835cb5e37,2023-04-02 21:36:58,22.777489315234142,What so pass.
29f8f509-6276-45fb-9a86-e376122bdb58,d38cc2dd-8757-4bec-9d63-d4973627fd01,2023-03-13 05:30:30,32.73061011733666,Hard smile me area.
d9d314df-ef7c-47b7-8aae-c8adda3f15f8,349b6848-8b30-4ef5-a1f8-40a3b16cdaa8,2023-01-23 11:33:58,312.991552115033,Father wish operation.
3fbc76a3-3a50-4ef0-b5d7-3131c5a28e58,fdc4a031-45f4-4c9a-8b03-bb4ca1ba8cfd,2023-02-22 06:29:18,310.33614585148734,For coach thing fill off.
64022e9b-51a0-4b3a-9546-19b472ba2a7b,350ecc8e-963d-438c-89d6-ac100ca50ede,2023-07-11 10:31:18,84.27552184532537,Item actually strategy according prove later site.
2d8c8433-a211-4fd2-87b6-b80e4160d5f3,338d2bba-13a7-4a75-a471-9d859a22c48a,2023-02-24 12:27:12,388.7682275895459,Religious research standard whether consider charge century.
a2d9199f-7d92-4873-9459-d189c5d2cd69,ce0fbc69-c4a9-4a0e-8397-426bf1abf65d,2023-08-18 07:53:52,423.17201090560826,Over black bag business imagine line road.
5aca42b6-2147-4b35-a1c6-20ac7f19622c,ce5d81c6-c611-45b8-90a4-74b5070fff5f,2023-07-04 18:52:51,376.45877510514487,Various traditional should seat.
f68d9f73-8ede-4f5e-a53d-6511b2cab848,de5bfe73-387f-4a8d-a4eb-d46b75c14c6d,2023-04-17 19:13:48,431.0373957480245,Grow film person else.
16f0a1c5-45bf-42c4-88cc-183c2f675bdd,8b23449b-55cd-465b-b715-db66f2db4701,2023-06-16 03:57:36,443.47326934404134,Religious science month who direction ask civil.
4d3f6056-49bb-4dd2-9841-b3b33b9dfafe,603043f5-187d-437d-b638-d51cbd4a0748,2023-08-01 04:00:41,477.88059295263423,Big senior year plan have matter.
e04d9bbf-a172-48b8-a407-74d6b3eb9570,9c290e93-2c9d-40a4-aa46-df57101fdd35,2023-04-24 21:20:59,188.3586500787931,Miss form why executive.
d95abafc-9d77-47da-bcfd-f96a38fc4932,b245de41-9cfc-44a6-bdca-2895a3049e2e,2023-07-09 09:06:44,156.41404621714943,Raise Congress after day mind suffer term.
72e08f79-d982-4d9e-a517-1cc3bcd34b25,71a31ad4-1286-4f6c-9104-216e9368208b,2023-07-21 03:08:19,263.0288903563383,Play pass score follow alone treatment.
9ee83251-bd90-448a-827c-fe748e5beb70,af7c7145-7d56-498e-a06d-6e667ae490ed,2023-08-06 20:55:31,111.5972539151063,Term material next guy rest.
978c2853-23eb-431c-88ae-bf1fec779cad,bafdf9f7-971c-484e-a7da-650d2edbaac6,2023-05-18 14:20:38,192.55144003902072,Sell suddenly cover model.
1b319598-149f-42fa-8c38-9f6f9ee84297,ca3cc796-c25c-49c8-ac23-79f71422c1a4,2023-05-31 21:21:20,409.29639210141147,Maintain feel north war process no short Mrs.
20dd7334-371d-4346-9f45-a7eefe92c79c,97c9c001-f2d4-45e8-8cac-43b1aacddb16,2023-06-13 14:52:25,309.5970735515964,Paper claim fall.
52478b8e-1073-4deb-8d2c-90aff671c9a7,0ae9267f-42b2-4a44-94e0-27c85ef42281,2023-07-15 04:19:39,476.1617215018536,Story foreign last collection sell.
6e856092-7163-4c27-86b5-e2380b4aa1d4,990f1233-a00a-4334-a039-6e65d261a006,2023-06-16 00:20:54,99.30564790150486,Expect result eye challenge international.
6116a567-3ef1-4d84-a065-c4de50abf15a,28956e1c-dea6-44cb-9a5d-55df0beee88b,2023-03-19 15:47:54,487.31815390791377,Cost coach available stay.
5c5ea29f-777b-4d9e-9842-aac4b7e7993f,432e7dcd-540a-4b7d-a754-35b32963f040,2023-05-17 21:20:40,389.47716470468856,Resource appear pick general song ten.
2a3902de-aa04-43ec-80bf-72e9560217e7,de327ea3-16a3-435a-916e-6537ba8deaa3,2023-05-01 00:10:04,330.0069575372133,Too pattern our east.
7b8aeaf8-4ac4-4bc7-8634-d982dd071169,ac2d457b-595c-4a40-9bde-29a515d03e72,2023-06-11 04:35:06,331.47894516980045,Tough never several.
9762b056-7a5c-4dd2-9d80-37dfb2ca992a,2e34c91a-775f-486a-89b6-cf6c428b7f9e,2023-06-08 06:45:09,380.803690175086,Trial never hand education produce perform long.
bb910ca7-2f3b-44e7-95fe-41871fad97b8,ca0d8aaf-25b5-47c5-8a49-e8f46be84952,2023-08-08 13:11:15,64.78837290106776,Opportunity remember like.
f07635ba-e0ff-4453-a0ea-d51759a37068,600d4628-4938-4f21-9d50-1e0040db5a92,2023-04-15 02:50:24,322.82287560522974,Figure first student environment develop.
b443ddd8-fefb-4ad1-beaa-e5338912f0a3,d6e2c32c-4196-4763-81d6-2819a0486afa,2023-08-11 16:33:48,185.0647355408161,Pick democratic career land lawyer information.
2c5bf787-ec77-4bb5-8526-8489f6e5a259,bd67bce2-5599-4256-8246-adae2fb5b9f1,2023-03-25 19:50:55,206.44717080366468,Suddenly way friend growth apply personal.
6a01aeee-5a41-471b-9512-73e5560821ea,232fdd3b-0695-4d34-8056-5b705c408ef5,2023-08-01 01:19:44,311.70490741274597,College per fear piece.
2fbfb49b-471b-4543-b852-94ceb3581ee3,d397054f-ac60-4e6a-b581-f2942358d959,2023-01-23 03:43:48,236.45357790815848,Consider American force message.
8310f31f-2d18-4c55-b46d-47279fc3ca21,478903e7-c0a5-454d-b946-ab8d146689cd,2023-07-19 10:55:56,385.11849410842194,Least culture several add man.
cdb24617-8bfc-4958-85e9-45d87143b427,ec110cdb-7ada-457b-be7a-0c03b870d41a,2023-03-26 02:52:35,349.48593394590705,Me interview but people.
953ce554-a792-45b4-a046-399814bb8ac3,2d54d676-0dfd-4d97-9866-a66b863d69d1,2023-01-05 09:17:16,253.9718861031333,Lawyer tonight full these least full just produce.
5c2c487c-eb33-4c18-8eea-f80c72c3af11,93b59d74-0165-46e7-a32b-b8db3211170c,2023-07-10 00:30:37,291.34691312337685,Individual visit occur.
edc0baac-c812-42e2-aa8e-bcfa9a5a0e33,e507667c-29dc-45ee-a351-adbae2e4a0c7,2023-04-17 06:54:39,56.995036675583734,Writer sense store push remember work necessary want.
421901ed-a611-4be7-9436-02b8449cfda8,ab56c3fe-5b4c-4922-a9f1-6a3604b4035b,2023-03-14 09:21:50,382.0035259006364,Game century hold word national pass morning.
a0b9c1d2-dd30-452b-a91f-674587418c43,30a4c59f-5e1d-4ba3-9f00-22df7b1b0f18,2023-03-11 08:16:31,49.90983799165896,Sure national his.
4fd668ad-681c-440f-88be-827490276576,a674278f-0424-4812-8a19-37edfa86c147,2023-05-27 17:32:50,376.2404871943605,Head little particularly section learn special.
85f314ef-e9d7-4f35-b16a-78f4ffb81d77,caa7b95f-7b2f-4ee0-9b38-6b6c02d7dbc7,2023-01-07 18:38:11,249.97107894366604,Mother act space blue deep I point.
109093c1-7736-461b-b995-cb119b7a6d6b,e3fdf253-53eb-4f70-b69b-60779c664490,2023-06-13 19:29:32,340.5064946387452,Coach Mrs suffer loss.
106c566c-7c4f-41ee-8f25-b3502fcadc51,b38e4ba5-41e2-4854-a96c-b2e7f3dd7777,2023-07-14 00:08:11,372.3735261468419,Day certainly everything professor performance prevent.
6bb981f7-aab8-4d50-acb1-6b6860ad697b,f8af08cf-487b-4f93-9d4c-f8b80116e611,2023-07-02 19:24:51,469.83186295026945,Green pick recent the business scientist enjoy side.
12d33614-2028-4030-9d31-8370f598477d,3db12a8e-e3c8-45d7-ac71-aac46a0d778d,2023-05-30 11:37:13,13.205776544803403,Never read training growth several collection make.
ff70d42c-dbc9-4b6b-a981-1a981f1e9bb1,fe0bbab1-a4dd-4efc-ba06-27fb58460c65,2023-01-22 11:12:01,95.49840969381687,Financial six religious treatment.
6c4b39a9-301f-4949-ac5b-a51d853396ff,299b25c9-8acc-4e83-8f5a-ed33da4e85b1,2023-01-11 18:46:03,254.862643058357,Four all voice.
8c0917eb-4da7-4982-8f55-41a2be1c1841,3e8daae3-b496-483b-95a6-32593e076186,2023-05-10 22:17:11,167.57837919175898,Soon feeling without join member.
1d0368ce-b982-4959-968c-83a0ae937a92,a7ae244c-a89e-4c22-a4e9-1f3634d73ba5,2023-01-10 21:10:43,177.84670234346535,Position language media attack stage.
c323da46-8e47-41f4-bb3c-493c8914a567,c35ba806-9cf1-418a-ac5d-b62fd04be4aa,2023-07-07 11:03:26,108.71059925732906,Top trade claim movement.
ac3d1c79-a57a-4ad9-964d-b8c1dec35020,065a8868-7676-4b0a-bca5-86e42c15dea4,2023-04-16 14:07:09,121.4551556546059,Example summer lay approach try.
57de9261-c800-4007-a7b4-4c2835112373,14ecc352-6d83-4be2-a0a7-f7b704881bd3,2023-01-11 15:07:10,492.47493282942395,Culture whatever everybody environmental certainly break during.
b1259769-60b1-4954-8ec8-4ad4352c1152,cfb30d9b-8963-4a01-b269-5855d2f6c018,2023-05-25 17:43:51,498.8975932947712,Opportunity perform soon perform century.
ddf8148a-2881-4a6b-87a1-9d59b803d28b,f6f556fc-ea62-4a2a-819d-434c685bbf5b,2023-08-19 18:55:03,179.44710489774405,Different together exactly among court nice pretty.
429e4a8a-0467-48d0-990d-f401ed482abc,e8aff9e7-b7dc-47a7-8b76-942493e581d6,2023-04-29 17:08:33,129.51208357406912,Beyond tree break more break note.
f97b1311-dc47-4146-ab71-e18a96703c99,0836af30-7d1d-4408-a3ca-2158f78190aa,2023-06-27 02:04:35,13.719500369117192,Arrive perhaps offer success hand man attorney.
8b13ec48-5bf7-481a-bb8b-549e28631dd2,9b0a7132-6679-42ff-aba0-7e868c51c5f1,2023-04-08 12:07:04,173.9287617977594,Teach nearly health place.
3c08d199-796f-441f-abc8-fd125343bec7,bc780676-9169-4762-9281-a1039a2e996f,2023-08-18 15:49:51,146.91082574464065,Star late say whole son development.
53874996-c18f-4742-9d69-efd57bf41f95,6aea1666-f2c0-413b-8f02-d9601a83baa2,2023-04-28 21:35:01,53.929035767395106,Structure responsibility ahead special toward find.
14f3208e-b676-41b2-8d2e-3e9f1fd2ca97,d75b9c54-c8b3-4b29-b0d0-f7ea518d6ffe,2023-07-09 05:58:22,447.15012057240625,Loss rather position whether involve few.
d3587b86-70ca-450e-98bd-d1a7c0ecc4f5,7ab0afd4-e40f-4345-b40f-3404cf651987,2023-03-06 23:52:03,69.33196016019933,Thing around change against system leave live.
65b2728b-5021-447e-b844-4ec8cac5df7c,42486546-5b36-4861-a3f5-42100ba3df19,2023-02-14 04:45:51,176.11751600362737,Information reality example light anyone among where long.
a2b40934-5dbf-40a2-9ea3-b9337ad5e9e9,f83e2ee4-811d-4f87-910f-a74961a10d6c,2023-07-07 11:34:09,178.6812667403369,Bit shoulder even reach writer process current quality.
7d247b44-4a1d-4bdc-ae6a-4d0a15b58ebd,76218f5d-4824-42c3-bfe6-ca8e4865e056,2023-03-14 09:12:09,95.81896066449784,Job kitchen quickly notice million stuff south hard.
8ba0faf5-84cc-46e3-b2cb-8b4ffeed90ce,54fe38d3-768b-4fb8-9db3-5d3621b89b3a,2023-01-05 20:39:40,196.7154658280124,Your indeed represent whatever market page yet.
4280f3b1-54ce-4840-b659-2953f1b97e2b,edf243af-47cc-4fb6-be18-bd7d343df80c,2023-02-23 11:57:36,128.690124753426,Wife join friend boy.
0702a680-e268-416e-9d72-4640a420844a,be4078fc-7628-4f03-9961-df40ea962ea8,2023-07-02 20:50:35,60.547576079806525,Set over toward.
2ffc25ee-6705-4aef-8d56-b16c3471f0d0,fc2bb1dc-07f2-47ae-8594-a5222671391a,2023-07-31 12:09:29,314.7039557768329,None different question season let.
743e78bf-a2f7-43c1-ab29-f693edea2686,33483047-fd07-4864-85da-2f29504ce435,2023-07-25 05:37:14,408.73078538459595,Technology TV mind Mrs Congress others control.
8a9e3e47-8ef6-451e-880a-93e4df68c952,5e6fc4f0-0d25-4e49-bc10-575c4170098b,2023-07-29 13:58:28,43.87013563204893,Total kind easy condition option ground form.
9d957fe9-579e-49de-a360-3abb375ed895,2ec6aca7-182c-4346-8e9c-144639dbd477,2023-01-06 09:47:09,14.57296217960808,Culture mouth early animal hair major particularly.
34b20c0f-b195-434f-8958-3e922d814f39,90fd4ed5-77c6-4eb8-899a-e57fa6b3131e,2023-08-02 05:12:12,402.6052759409878,Long cost suggest system room theory Democrat.
cd68569c-475c-4161-ae56-c785a49b8ec9,e90ef138-2d9b-42b4-b698-6cdd8e673958,2023-04-27 05:36:09,278.96852888167507,Nearly section operation.
689656b1-faef-4e6c-bfcd-86d5c02c9e7d,e3eb61a6-2bc5-480b-843e-db66c75fbce3,2023-06-08 13:28:58,123.46539922278572,Sure certainly organization note painting too ahead result.
a0f8d931-7dc0-4228-b8da-8895fa18e7e7,fd926a8f-7476-4277-9259-3c63476e89d0,2023-08-06 04:23:15,309.8809659901987,Market recognize eat read.
f621911c-20c2-444a-bd20-941433343e8e,aebd89fe-e84b-4f42-9629-0dbe966dfdc3,2023-01-08 06:20:24,100.9016811606179,Actually economic security PM.
82733b03-95d4-42a8-9baa-64c07e62cd08,166fb22b-c04a-40ea-8991-efe96ebc7f3d,2023-07-29 08:45:41,426.14037711828036,Fall reveal reality share result Congress oil.
6e79875d-adab-4a94-978f-45fbf530aa50,8b8f6cbf-a5ad-4128-92de-9a749bde59cf,2023-08-05 01:11:18,473.62520574877556,High represent cell prepare anyone.
a6dd14d1-b680-40de-bfd8-d60812235b8a,f19ce2c0-d825-4dae-9bf6-b809ad1a3673,2023-02-09 06:41:47,400.6974622271398,That through deal true foot store.
c2f3af6e-6472-4d3f-a536-43c59b5a1c15,e63dfc7e-b230-4cb3-8f4e-483e081246f5,2023-07-23 19:13:05,159.5368697946695,Those authority choose form leader could to.
3426f6f9-39d3-41cb-95c2-d795ae5b62cb,9e950a29-d574-4d62-a967-0129c3e85ebb,2023-06-04 06:59:42,97.6706093944773,Morning imagine hand ahead.
ab95ccb8-45fa-4a63-b53d-6f73cf74a119,b87336c4-8468-4ea7-8eb7-0d78d68ec764,2023-05-17 11:27:09,366.0828627306413,Everybody remain manager power budget.
e2db705f-b163-43bb-b47f-38fffcde9c14,411f16a6-eeda-4d42-9735-e157261f2fa8,2023-01-15 03:03:25,138.08500137924312,Front set discuss middle information.
974d11ec-20c2-4901-bd95-6a6103e5df72,e19d52a7-bd31-4fa2-996f-f81e0dbe75df,2023-04-18 16:24:29,307.58853427506466,Land wish court even.
b3572c15-c5ca-4385-bcaf-e94a64519961,e23eac69-b5da-415b-ac7d-b7c72ea84dec,2023-01-22 12:01:24,240.7104214162105,Author actually edge heart nice knowledge.
604e21e5-a49a-49d5-8b9e-1232b8f370b8,a4342df1-256c-4de8-89f5-ccd81d82de69,2023-02-28 09:47:21,291.3748566953388,Degree degree since body news.
932649af-b988-45c9-bd0b-08c44991e69d,45269aa6-e547-49a1-ac98-22c577cc022f,2023-05-09 12:39:31,364.3126632450458,Station born free past born.
8a66a835-31d6-4365-af28-f441746745e8,f87e0178-20e2-4a8f-9ee1-8736f86133fc,2023-03-08 16:04:50,111.85463411981691,Value recently event soon avoid money collection.
8786c236-172e-4668-a6b5-c168171bbb4c,d77dfea2-71b3-4ebf-8bbf-9b0e6c761df7,2023-03-24 11:00:33,412.2496877802595,Hot parent daughter use decade may eat.
98e3d2e5-1091-4e3e-a354-914291af6253,b7e70240-ece5-4109-855c-8cdc0ff08b75,2023-07-03 01:44:03,129.30994426713923,Cultural participant likely father somebody history.
2fc66e03-b6bb-4f3e-ab20-b9b7c3832367,70943a1e-bde9-478d-b327-78af1df6d1f9,2023-07-30 02:54:39,286.22772045743926,Letter allow including customer personal young best read.
955bff4a-a489-4af3-8250-0a5e268f57f0,c1548c2e-4936-4522-8aee-4567f4336793,2023-06-22 11:48:44,475.8910020676712,Upon even phone fish Republican.
872143fd-4f01-48a8-a5ee-aab26ade383a,8a073565-0f64-4604-b7e4-7960469b7e36,2023-03-22 01:49:30,393.87514246472216,Might what land.
1dc3825b-9ac6-40e4-b4b8-fb5a0839d648,3cca624b-8a1a-43ed-9aa0-98f8d252f54c,2023-01-12 10:01:47,21.446359309132106,Decision before together also.
c1726e6f-754c-4d49-9b26-229f2ae25d22,b2c9bebe-ad25-483b-b169-a281cc5c6352,2023-06-11 14:01:19,234.56649673783082,Suddenly heart war sport day.
e0baa290-f8cc-475e-b5ae-230d3fbfc33b,70108af6-3b8f-46fb-87a7-2939fd2a5fae,2023-08-05 12:43:13,449.37377406543493,Watch although before operation serve open marriage.
ba5d5f31-c7da-4e32-84de-279e85e3f5f3,7dd6e97a-6318-413d-b2a5-9ddc3fe80463,2023-03-07 13:39:32,311.3928375426568,Parent want again administration.
1a910645-9d4f-487a-b26f-7830269acb19,0f590698-c01b-4f9e-8778-a558ce04cab9,2023-08-17 02:39:29,445.5910398766334,Level peace reach pretty its professor.
1f756671-a016-4f70-8481-cacf8841f63c,275ba44b-3c86-4a42-8e80-ea0000e02dc2,2023-02-19 09:20:57,190.4250936633268,Hard court operation.
d2f00e56-3b23-4e05-887c-6426dfa5ba30,596a06c5-fe96-43ec-8066-eee69b8ebdaa,2023-05-29 00:37:06,116.20641699278181,Want home that yes.
922f4ade-73e4-4720-8104-a41fe2d9be72,8de95cfd-e001-4682-8002-d8fc8d2a01c0,2023-01-04 01:56:48,224.6157047146345,Board how building seven full leave throw.
21cc1a2f-69cc-4767-8e45-1ea92eb7f051,b5e6e78e-fa47-47bb-b82e-19ee18eaeee5,2023-08-04 23:25:11,484.2715536385672,Official road fill scene.
fcdafce4-f85f-4050-a69f-1196ed21d79a,8c847cf3-50ce-4731-bb11-8bac676a20db,2023-07-23 00:13:36,83.04025789081795,Two job quality not social.
6b78c8e7-f708-471d-b670-e75187d2b5ec,e5376ba1-7de1-4b21-92c0-16fecaea14b3,2023-03-28 18:19:39,349.31114884735865,Large today standard last everything anything somebody.
b7fa3b24-ebc1-4383-ab4b-b31cb62ccfcc,6464cbcf-baa6-49c0-bd13-94dd68d63b09,2023-01-15 04:53:37,299.4152562929788,Group very tax main green yet fire piece.
d958e8d3-59f4-48da-b588-4cd9ca30393f,bef4a8d3-a649-407a-8628-936bf8c015ba,2023-04-24 11:03:40,280.39287230924407,Building purpose phone skill hard growth race.
1b2b319d-8a6a-4dcc-a7ff-aa905037fee6,c3bc3999-573a-4b21-8c6c-41631d12efb3,2023-02-14 16:26:36,266.6532671141557,Value themselves crime protect treatment key boy.
45858aac-39ef-4e77-bce5-b61dfd20e0f9,ee8b5780-2fa2-44d2-b178-f4887aa8c77c,2023-07-21 17:59:53,413.39684658867117,Write prepare fly campaign according politics.
7cf560bb-52d1-44f4-8b32-1054dcefe1e4,978c3e17-25f0-483f-9125-3edaf6ef2ab7,2023-01-08 06:01:11,204.61557443406923,Billion wait like writer simply.
840cb9ec-395a-4ff3-a311-73c4c701e500,703b3a77-8773-4fac-994d-86a589f92f2a,2023-05-10 02:52:05,16.10875336380663,Several only field always southern marriage require.
2d193b5f-a580-468d-8f7c-8874001d9704,ab2b443c-1374-4666-8579-d50bbff0a5d7,2023-07-01 00:56:04,488.9843495462659,Evening ten democratic material between approach rather type.
fc1ccf16-4581-4a5e-86ee-a453afe4ea37,dc973e47-de6b-4d0e-8981-1b3b2f74234a,2023-01-25 11:47:08,159.8164833555526,Free fish pass create process set cold.
3f49bb8e-4d4c-4de7-8c34-44a1d1604963,5a7e4da0-0daf-4321-a5fe-df0d1fc3dba9,2023-07-03 03:11:46,91.83114901183612,Interesting get start down fall former.
dc783da5-74bb-42e7-871c-fec3bbbb9de2,44792429-5cdb-45a0-ad1c-ce736db78ed0,2023-02-12 17:56:02,395.0862360613975,Couple include mission great make edge.
77a07a89-e2f5-4cff-81b3-e68d718c2b1b,51250bce-be15-4497-8dc2-f9cba14d5251,2023-01-05 10:20:29,428.79471975633936,Way drug production open company report.
d8949319-4702-453b-a42f-b5055dcede1b,beb42a72-4753-423c-aae0-2e4cf5939bb1,2023-02-25 08:54:33,267.187178374541,Mean wear time decide politics.
92143861-d206-42be-99db-b0bd956a7c3e,b0d3b14c-0d84-4317-8ccc-bd0addce93df,2023-06-19 22:03:57,342.35007783245607,From majority paper above mission keep.
3a1e4d86-5b2f-4213-84c5-427c50285223,1aef82d6-47a9-47e2-b8b1-0b7ef6d3f045,2023-01-30 19:39:22,58.850559064934046,Pass power example.
6baf7449-7436-4434-9226-e0f1beb8139e,d43f8374-c2c2-41cd-b1ed-b41c150d0c59,2023-04-22 15:35:09,188.16677955414045,Often art to resource.
fd54a128-6280-40c4-b5bc-d838ae0cb158,dfbcadfc-e2c2-4688-9870-d3e0c49bba70,2023-05-24 19:59:23,43.16259910824834,Specific deal seem recent course huge.
4dc7340a-d9b5-4842-b036-c16bb5113d4d,14344956-eada-4387-b228-7fa58083b57b,2023-03-01 21:22:48,358.50457520202315,Per wait simply for.
79ba3c28-d9fd-4f74-839f-32e67a3d9f45,b24b9c69-4d34-4ecf-acbe-4f1add27997e,2023-07-01 17:22:47,429.07440812640107,Woman significant author imagine best need.
afda3523-7c43-499d-90f1-e25d36d0d8ff,384a0462-ad5a-44b5-8b1a-23670499b68a,2023-08-02 11:22:56,458.2169834669267,Affect water military.
a0bfd7b5-f592-4013-90cf-e11c1b1e97a1,17355510-219b-4f6e-a25e-857f8db5831c,2023-04-26 07:23:19,320.1408773122792,News could suddenly nor fund red.
1917f3ef-19da-4a23-8198-b222f05042bb,d72358fb-2836-4411-97b2-f1091b94f150,2023-07-06 18:44:51,381.94960847061697,Appear these police student.
2763ede7-7ff5-407a-99d9-15b3905017ff,5d696430-849d-4bec-94a2-ceaf22bc60ea,2023-06-13 04:01:04,34.489676000651556,Never enjoy over culture fall create.
92bc127e-6092-44e6-a651-22f9b756da8e,30820bf8-45f5-4b3c-b3df-28326aacccc5,2023-05-14 23:08:24,423.4770338118439,Tend bar ask.
dc736070-a5b5-4737-814d-06bdea1d8ffb,ae26ff65-334d-46c5-931a-6e564601396e,2023-07-07 16:00:51,216.0685862152432,Become chair six whole.
06a742f1-e54e-4137-bbbf-b83297f2cea9,57d4677b-0636-4d46-a931-076d9f8599cb,2023-03-06 16:33:30,498.83024892549076,Heavy him quality whole woman dark.
7c73ada1-c937-4e5a-90d5-1adc2b30fe75,6099d3d3-cf7f-4bf1-bf80-3c3c23727551,2023-07-18 09:38:31,95.59682006755139,Radio else receive thus hand.
a9535540-5772-4d18-9955-398dd3c56f01,ab781836-7d3f-4044-a54c-62262e08ecb2,2023-06-28 12:05:45,216.99129323201356,Hot better reality pass able manage how myself.
01ca62f6-8e99-4a8c-a6b2-ffd01669082b,740785ae-cdaa-4796-a32f-215ed548eec6,2023-06-08 10:50:33,377.5815560141469,National could church.
70008aa3-c8e9-4775-bd77-cc286742b357,eba58abb-b09d-4dd3-a686-7b7eaff2de27,2023-07-25 07:07:04,497.84380176916295,Themselves across marriage various religious attention.
5a5008c4-4b07-4bac-97c9-f6ba2d6bd792,b08beeab-22e0-422e-a528-0684b112b1d4,2023-07-01 10:17:22,187.33308369492315,Stuff tonight together store help last bring.
5fa517d7-05ac-4712-ad64-8890f05292f1,35afc87a-bdeb-4703-befa-f4fec59ded71,2023-04-14 05:00:25,254.59590086800006,Here picture continue father money speech all.
aa5ea254-4c36-406d-8c13-3beb42c2fb30,008c75dd-2cf1-46c4-b541-5eed94efd4cc,2023-02-08 21:09:20,408.09415519553664,Worry similar bar respond Mrs people.
1b9478ff-9a6f-4b43-bbcb-e4e186e3f66d,c00f350f-9f37-4664-ab99-8ad926ff9bf2,2023-01-03 09:15:10,332.37729964309494,Response popular father resource kitchen center.
74498981-ed42-4c5c-bf69-6f17179123f5,76f18db1-ad58-4631-9529-610ff2c7d413,2023-05-02 09:23:03,309.5137498164912,Prove know recognize participant.
bddc09c2-252c-4399-9872-5bb524e2c3ab,67f8a80b-fbf3-43b9-b737-218c277b5317,2023-06-09 01:04:00,185.94171266249802,Arrive space voice country along.
1a2944c3-1f5b-4667-93a8-8616146ce4a5,fbf45023-9501-43b3-aa22-4653ac96adea,2023-02-16 04:42:50,349.0209490103355,Side student author hit teacher statement half win.
d271f0df-f99f-4449-8708-1b539dca563d,89ee06fc-31e1-4583-b73a-bb686cb48130,2023-05-13 16:08:51,409.6246769688554,Stop allow possible station middle argue government.
