Alert ID,Transaction ID,Alert Date,Alert Type,Alert Description
5d26d64d-9b95-497b-9e38-4d8606f8e722,5ae053ae-4068-4bba-99e3-d1f95614146f,2023-02-25 21:01:29,Suspicious Activity,Minute according expect sell white hope follow full.
8702aabc-0de2-4261-a3af-c161ca0f7431,646b547f-feef-439d-93aa-cd54945821dc,2023-06-02 08:45:15,Chargeback,Rock national lay another audience day green.
39c39363-c756-4ea1-a224-60e37e510ab6,1e44c388-0062-426c-a221-0b5940378bf7,2023-07-10 13:54:41,Suspicious Activity,Subject market especially section.
ee682a24-a472-4d31-9dfa-3e676110ebf8,824ab812-274a-40e0-a9fb-b39c45e74af1,2023-06-29 17:12:51,Suspicious Activity,Fund begin central memory.
439dc852-4e58-45a5-b29a-b3660e9b670d,5f19c3ba-4549-4f8c-8222-b4015626efb5,2023-04-09 12:47:24,Chargeback,Why price cultural bar.
4163b93f-543b-4dc8-86a2-fb322d52ac19,7efa0791-05d8-4be1-aaa8-66926b5bb1c2,2023-02-08 04:55:41,Suspicious Activity,Road threat anyone.
684d3a53-5096-4a9a-97a5-363b3102596e,63577245-5a69-4156-b4f7-b602848f913b,2023-05-25 16:24:38,Chargeback,Even small employee democratic.
da25fbff-85e5-4eb9-a842-66cff59c0298,51ca0a7e-694d-46e7-90a9-d76fd4a20421,2023-03-13 23:12:50,Chargeback,Admit else ready paper quality soon eye.
0e01a20d-9457-4a55-8d58-685b1a645e05,c47fd7a2-5ee8-402d-b59e-39d94b50ed5d,2023-08-17 12:52:23,Suspicious Activity,Paper history high by.
e45c925f-6774-44ee-a6e7-9caf1f492ed5,dff0af95-8933-4623-a8ad-3bf694432ebb,2023-01-30 01:06:58,Chargeback,North draw page.
d27fa258-67fe-49d7-b5c1-adcdad71154a,1513c812-030d-4d77-8d75-7bd132b7f7e4,2023-05-31 02:50:45,Chargeback,Performance city place really act reveal.
36f9e2e4-62c7-4564-870c-fbd3abf0f73a,36894bc2-808f-4c09-851a-6a4cae4ae222,2023-02-20 19:59:19,Suspicious Activity,Boy offer form probably doctor know.
e18ec7fe-66dc-4280-8712-2a63d517f1c5,4ecaab9a-b969-4135-806a-4dd4788d9d9a,2023-01-18 06:21:38,Suspicious Activity,Whole area his vote course billion.
37294cb1-8a37-44cd-bacf-db14ec0ebc2e,5f081050-710c-4015-960f-616f18ce5a4b,2023-06-11 03:42:50,Chargeback,Myself have article model.
92f21293-790b-46d0-9151-3d6d5f444d93,b6d73620-f226-48cc-b665-2e6e5717f43c,2023-02-18 15:23:48,Suspicious Activity,Include view traditional way finally think box.
98f9c812-93aa-4278-a8ff-e3fab63deb4c,5393f54e-91aa-4e07-b4b6-c163644e47c7,2023-01-26 16:48:22,Chargeback,Education ago animal by analysis safe.
8e6a4e44-5d2e-49da-bade-0c09f5d06512,7abccc6a-a54f-4fd5-bf46-47ce8894a5d2,2023-02-22 00:33:56,Chargeback,Travel deal stop outside card imagine public.
441ea2c4-4a11-490b-a8bd-b7fb633e986d,eb81bfe5-79cc-469e-838b-3e7adbb2140f,2023-03-26 15:07:53,Chargeback,City must remain knowledge.
495047f9-d29c-4a62-9f75-3deda7e2de8d,8f6d80f6-5e2e-4abb-866a-15d1a9a5d9e7,2023-01-23 11:50:46,Suspicious Activity,Chance later really base myself.
dad58098-d9bd-44cd-a4e1-75073d513bab,e27f714b-c9ef-47d5-bb2d-bbe7be22a104,2023-01-25 21:26:52,Chargeback,Crime do despite for.
589ed14a-2276-43eb-9785-2fd4099cd624,96faf6b7-e8ab-4113-81a0-0df8746b8573,2023-07-19 17:31:42,Suspicious Activity,Difficult agree movie my easy technology.
04de53f5-1b6f-4b5a-ad12-d5dc46c39fa3,74d7ee6e-fa81-41e1-aad5-04bbcfd7d3d8,2023-07-31 12:45:10,Suspicious Activity,Realize together record music name.
1b749abf-b19e-40e6-8eae-72d34fefcc2e,e819d679-d38a-4d37-9206-f589f676feaf,2023-06-11 20:16:16,Chargeback,Fund contain life build blood training.
416fabdf-d540-41c6-947a-820af0156008,e1ccb598-f9f1-4089-8de8-353cc2a64e3e,2023-06-29 00:48:10,Suspicious Activity,Couple health fact that tell.
4fc8a068-e548-4a9f-8a3a-336e3a6799e0,e4d4bc4f-5199-4267-9f41-0b1a9ff1fe95,2023-07-12 05:57:21,Suspicious Activity,Bank fact general growth page very.
db280f67-31a3-48a7-b5eb-3c2e105d5ab5,c9562350-8e54-4f0a-af5e-4b78ba8116f3,2023-06-19 05:26:52,Chargeback,Mouth across program north.
a3a60c8b-933d-47fc-8222-7e0eff86467f,01df464b-1d7f-463e-89ac-139e138a7413,2023-03-08 21:06:14,Chargeback,Window realize relationship even support page.
84c757c1-44e4-4093-8664-4a95f070fabd,fdb8dc7f-78ae-411b-a0cb-819e8516fb9b,2023-03-11 16:20:54,Chargeback,A them learn party still.
81e0f3c7-b26a-4424-b1a8-fe11a7d38cff,755268f0-c102-49a4-9199-4e26dbe19eff,2023-06-24 15:13:44,Suspicious Activity,Seat current official.
d6544612-dbf7-4921-a255-81e1ba7718b9,850bb74a-69d1-4d79-8e92-93ad1ae98c55,2023-03-31 15:39:30,Chargeback,Different decide poor.
6bae7e99-9198-40c5-8f5c-3ffc64433f79,66fa5039-0175-44fe-9c8b-2fb27452307e,2023-03-06 21:19:33,Chargeback,Central PM energy room next.
e31f2bf6-c13b-4263-8562-5a3319a37284,49b4da1f-8bc7-4b42-b2d9-1d0df3263871,2023-01-12 12:15:21,Chargeback,Now feeling real lose participant.
92bb4bbe-643c-41e9-abc4-f5afce5a2ed6,e33e5f9e-2092-4f0c-b066-8b64d7fc7783,2023-02-27 17:19:44,Suspicious Activity,Prevent one day order probably.
bd9694bb-8cf3-4970-9c7d-b34459699569,858a7e9f-ecb5-474b-ad09-13445bb34cc8,2023-03-13 03:46:39,Chargeback,Out population pressure.
cb565c17-4f25-4f74-88ea-5f66ba304efc,191a14f5-ff22-4030-b776-1c0343d3ebbf,2023-03-01 07:12:07,Chargeback,Three wear growth memory order.
4fbd1879-446b-4c2f-be82-b205f489af83,ed408650-cb26-4a80-bb4c-54218a757b58,2023-03-23 01:46:22,Chargeback,Talk soldier order.
e0a65bd4-fca3-4ec5-b642-2ec3941a7977,a59e8cf7-c0f1-46e2-b719-296c7a2773fc,2023-04-10 15:53:44,Suspicious Activity,Indicate case to before state before suddenly.
14b4cb79-ff97-4b19-99a8-ebff1f7b45cb,601e5798-aada-4389-adf4-4d358e891a0c,2023-04-05 05:14:27,Chargeback,Much establish team project watch.
81e65f54-2128-4823-b6cc-7944dc551f4e,bc83c4ea-bdf7-4889-a361-5534d2d50d20,2023-03-15 00:30:08,Chargeback,Tough deep heart.
b6ece545-8ce8-49b3-837a-23dbd682af80,d40e0fce-4691-4e3e-a7ee-7111d299ca4f,2023-03-06 07:09:18,Suspicious Activity,On reveal right reach office example.
28191d80-2fce-48c9-8289-87bf8422712b,4d8ec3d2-7b97-412b-95b7-c08ee9b81954,2023-07-29 20:46:14,Chargeback,Old apply charge item attention response author.
73d4c4a8-d483-4ecc-b017-9ed3517e15c8,9e524981-70f2-4c77-a345-6b644e8305fb,2023-02-18 16:04:51,Suspicious Activity,Its process foot time they break.
68846ea5-ce0f-4daf-b57f-7e2aeaa3dd5a,83d0a769-c4a8-40fb-ad63-68571cffbb9e,2023-04-21 09:21:42,Chargeback,Want if quite kitchen turn perhaps.
a1758ae5-3aa9-413d-9b7e-5d61055acf55,eb971f8e-8fb9-4fc7-b912-5e05b6261d30,2023-07-20 21:38:17,Chargeback,Space relate writer third left.
b58a8bf6-30bf-4d31-bf2e-02f5602e3854,2a91f400-e084-4476-b244-6eaf1ecb52ba,2023-05-02 13:02:34,Chargeback,Gas prevent woman change per off wear message.
04710c4b-2b65-4335-9dfd-e5cd67768acf,35305287-27de-49ac-8825-e253ad5e9609,2023-06-27 22:07:30,Chargeback,Remember third reach teacher morning trial hand outside.
02e4979f-13c5-4356-81b9-ab796630f9bf,01c3058a-f509-40cf-8454-08b7d8c5cf45,2023-07-15 19:17:15,Suspicious Activity,Those either recognize including smile painting.
a99deebe-ee74-4ba6-953b-8b10afef3473,67783a56-0e3c-48a0-93da-6ff6dec1bcbb,2023-04-01 03:49:42,Chargeback,Amount seat animal create large visit environment.
202a9873-7456-47e5-8d9f-6e7ed0eac83e,30c29288-848f-401c-b5e1-900eefb9722a,2023-04-25 22:40:54,Chargeback,Mother size reveal surface.
31b86d2e-e100-441b-ba19-91bef3750910,18761307-75a2-4919-8986-953d02bf2311,2023-01-14 05:07:22,Suspicious Activity,Hand arrive film example group.
e4d86a86-b70f-4a22-99e4-1f4f50e6643c,1911ea8d-fee2-489b-b2c4-6b475dc0caaf,2023-08-19 02:30:27,Chargeback,Bring sea international kind create.
fd1032b4-e4c6-415e-aaed-761e24929fd0,3cdff6b5-3997-4cdb-a187-630b61f68545,2023-07-13 22:56:42,Chargeback,Police idea Mrs American amount.
60ac3540-3ed3-4bac-b15f-73525c5f27f4,56534122-dbdd-4183-afc9-5c14f51dea99,2023-04-04 02:57:59,Chargeback,Common car well budget meeting.
a3e1975d-ea41-44c8-9e66-be99f5c0e277,9c8e7d2b-6273-4635-84c2-dbb669b6acc6,2023-05-29 14:12:16,Chargeback,Health two phone surface lead why fear.
f5dcbc2c-a8ae-46de-9584-99dacd49a85b,2261de47-5775-4dd2-894f-aa2f34f13933,2023-02-26 04:55:29,Chargeback,Give enough sort provide behind black.
0174a106-283c-4930-8f77-4296753950b8,0aaee701-32f9-4217-9f7b-c8bd9e6bf36f,2023-04-26 04:51:29,Suspicious Activity,Country mission increase involve.
8426de5a-aa9d-4859-a312-629021ac33f1,e34b4516-5ca8-4e79-a173-34362661669d,2023-07-25 19:35:16,Chargeback,A remain at threat event nice three.
ffc5c269-73e8-406a-a39d-335f253d13ce,b8062763-fc23-4851-bcfe-e755800a6463,2023-07-14 07:27:59,Chargeback,Line prove within budget safe piece.
b52e27a9-fa66-4cc5-99cc-8843669e9d8e,3076c6a7-bacd-4bcb-9b3e-bc09faef0830,2023-05-24 20:16:04,Suspicious Activity,Kind his television concern increase.
545fc9cf-0aa0-4a27-90c2-95fe91f8e2b1,b4da6997-1def-43fc-84a1-736c20390391,2023-01-09 06:55:45,Chargeback,Speech understand live down language never produce.
de21a328-33d7-4471-99a8-0b3856eab4ac,a11364cb-c706-4c0e-abe9-b1a0cba2ce07,2023-07-10 01:35:57,Chargeback,Imagine people significant ball sport act pay.
bc0a34db-9a82-4d9e-9f89-bdba2d58d5f4,f0c977d8-da56-4a36-a6b4-4423e6af27fc,2023-06-24 01:48:58,Chargeback,Reach television much have far.
ba09df8f-d069-4f9a-a219-55c811d0d7a2,71455f6a-0a59-45a8-8fbd-6c1285bc178a,2023-04-28 08:26:12,Suspicious Activity,Interesting political stage hand usually like can light.
a47d921b-df33-42ed-b0b9-0aef80671625,480ac252-7410-4a52-86df-dfd474f4d7ca,2023-02-07 12:21:42,Chargeback,Necessary available same threat west.
8af6088d-ffc3-4167-8120-6a881e5fb58f,ef3ab806-6676-49ed-a16b-17a712e7a1d5,2023-06-04 00:31:34,Suspicious Activity,Thousand TV miss after western.
85fc86df-c29a-4b9c-bbfb-5f6411c472ef,22fe81b4-0831-42db-a897-291c1b8e53bf,2023-07-30 01:21:47,Suspicious Activity,Speech strong industry experience talk candidate way but.
e7548034-deae-4ffe-a6c4-6051f1ab330c,8dd2f560-c2a6-43aa-8d2f-a4194bde5e3d,2023-04-03 16:31:50,Chargeback,It meet process car meet general ago.
2e9d334c-5fa0-446e-b5c3-38054d97023e,4f79c548-5d21-4577-a8b2-5531940e6456,2023-05-30 10:33:20,Chargeback,Child meeting race.
995da1fd-3c77-4e2b-9494-2656e079f0d4,89f5fb8f-bd22-4df6-b490-6644ea56b691,2023-04-22 23:06:44,Chargeback,Magazine assume way top.
b8ec569d-e0e2-4ea8-bf1d-68e7976d11f5,88194853-b6c0-42a1-9bf7-d1d4886076c8,2023-01-19 10:14:02,Suspicious Activity,Computer provide happen a.
8d005634-c5cc-4a6c-ae38-a46d8f17edab,1b811cc1-ef70-4159-a898-309404def72b,2023-03-03 01:32:37,Suspicious Activity,Quality amount space small cultural.
6ef88b68-064d-43ab-a60e-5bf50619f00a,5e39107d-780a-4c75-a3e5-b30419add248,2023-05-10 08:25:00,Suspicious Activity,Throw arrive daughter record tax south state.
7b71a5bb-9b5f-4274-ab6a-584e533265fd,f2667cd1-aa1c-4c5f-ace3-94a51860aa7c,2023-08-01 11:58:24,Suspicious Activity,Not sort store concern spring summer.
0aedbd42-93ee-4c84-92a5-1e29a97974e5,51456736-57bc-4a6e-9340-3f24df64e60c,2023-03-01 10:20:36,Suspicious Activity,Everybody list board American establish size so its.
268123dc-57af-4124-9239-c7f74f91c2d0,30ae3355-cbcb-47c7-890a-ac565a71fbe5,2023-03-26 11:52:51,Chargeback,Every hard body loss hot whom build.
a4b7ac75-b956-4884-86db-c9c277fa80dc,89ce65c6-bd3d-41e8-b1d6-e270538b4cb7,2023-02-18 03:12:14,Chargeback,Sport company last resource.
cfc2106c-b93e-4937-8178-5a0cf77599ef,2166b448-04cf-4ea3-8bc7-f230e06f2e35,2023-07-03 13:45:00,Chargeback,Wife set brother whose author discuss play.
f27b3402-d39d-4089-b3e4-bee64651fbb7,548f3873-9b54-4b03-b0f5-58130e501901,2023-04-03 09:27:48,Suspicious Activity,The ten test street politics wonder.
a9036ef1-97d1-45f9-913c-764133e18b9a,87b903f8-d87e-4fd9-a0ef-61204eafa369,2023-03-21 19:49:28,Chargeback,Group fear decide daughter house everybody green.
5f7ea928-e75e-4bd1-bd89-1e4b3eb15ef7,8e1a7865-8635-4fbe-8304-8e8eeb223f3c,2023-06-18 03:18:48,Suspicious Activity,By even professional they all somebody western.
69044994-1b43-4065-a384-2952e5504179,a83575f0-425b-428b-9169-7532f2addeee,2023-06-16 05:33:10,Suspicious Activity,Anything father play lead difference.
476e6dfb-68a2-4d93-ae75-6e905ad12e34,d294d6e1-d28b-4c87-bde2-a945e34f188a,2023-04-30 04:29:08,Suspicious Activity,Degree plan ground talk choose.
4584b06f-f6ac-45fb-a31f-76e93bdd17d6,721b1bb4-7084-4a0b-8523-0d8a5138beba,2023-07-03 04:57:28,Suspicious Activity,Concern data most we fire.
561b6663-e9be-46c6-a19a-5a607c792df3,cc4fa1b4-6bb2-4e2a-97a3-753a8398ffc2,2023-07-26 05:40:26,Suspicious Activity,Result head PM allow.
2d431039-c283-46cf-a26e-f36595ba2e03,50acdeaf-20b8-4fe3-9764-63ed72b1ab3a,2023-06-09 13:51:42,Chargeback,Impact can oil wrong call plant design.
22da781f-0474-40c5-8bf8-d30c4047dcf1,c35006fc-964e-498b-9b69-8dd871810e56,2023-04-19 01:00:11,Chargeback,Risk condition same time cause.
78a966a2-edfa-453f-8fe2-e0266e8fff09,ba993f86-1085-41af-bdea-7678ea8aca7a,2023-04-02 14:13:47,Chargeback,Indicate option discuss crime prevent between support.
125bbbb2-8e24-42e9-9b61-973f64a5ff1a,441e7b69-a8c9-4862-9865-45ef23e10d21,2023-06-03 03:50:49,Chargeback,Sort ready third move.
d06cb178-47f7-4655-9cde-73c48e2febcc,11cca0b6-f1af-4a9a-b069-71c8470d2657,2023-08-03 09:11:55,Suspicious Activity,Fall pattern since.
4757ed9b-c8db-4cdf-b56e-5299370faed1,d668d8bb-1ba8-496c-9510-821c09c73f7e,2023-08-04 19:33:38,Suspicious Activity,Window shoulder if wall above.
e650399d-47ee-439b-b7a6-d4d9066932d4,831314fa-2beb-45ef-951c-1e6b1d76d077,2023-02-24 19:19:07,Chargeback,Three challenge guy.
76d4bfb5-6306-4f41-bfe5-1e869490e41a,33fcde68-5cd8-4810-a761-755b65bfd67e,2023-02-06 00:53:33,Chargeback,Son message economic yourself want admit official none.
a70322ad-d6c4-4315-b44e-46da643aa618,0d82e629-4a69-4c8d-81e6-e4be2380e192,2023-04-07 13:49:03,Chargeback,Southern school analysis energy.
a56abfc6-94b8-4bac-8043-b8830b1c9a79,c79b114f-2ef2-45d3-9b49-4128a90e3919,2023-02-27 04:26:56,Suspicious Activity,Operation treatment run strategy about individual.
9b326590-77d3-4013-bc52-c13f0394afdc,24b2e1b5-5863-456d-b151-9b418383b229,2023-08-17 08:28:56,Suspicious Activity,Address factor establish hotel.
5f4ea75b-8c54-48d2-b71d-7bf83749e0dd,62b94303-fcce-494f-9eac-30aa0eea8584,2023-06-25 18:26:46,Suspicious Activity,Republican candidate commercial each truth subject.
93e5442a-e974-4d1a-b2cf-f435c219a59d,d4c26f22-dbde-42b6-941e-32764b00fa97,2023-05-17 05:12:44,Chargeback,See use father town.
ccec25f8-e5fe-4286-a3fb-a7736e59638c,9213aa98-5d47-41ca-be45-fb57f707c997,2023-08-15 06:13:23,Chargeback,Concern allow discover.
1d38a782-2415-44cc-8834-029b48d7f8e2,64041eff-d9c0-473b-8b00-cea6498bd282,2023-08-07 15:53:49,Suspicious Activity,Increase decide set local avoid who group.
f16ee82a-b8c6-4b57-a1dc-0f71edb2b7ea,68361aa8-fd11-40dd-beb8-7d82a012dd18,2023-05-26 05:23:04,Chargeback,Wait toward just name early cut toward.
73b7b9cb-a0c7-4e6c-a5a0-185078d76832,36b10d18-3b4d-4403-9f2e-b33e50150edc,2023-04-02 10:11:34,Chargeback,Treat body hard develop TV current reduce.
368c9bb3-01f0-4476-9bc7-67560d1b90a9,956195ad-184c-4483-97d4-7182bc9bb6bc,2023-08-10 01:06:55,Suspicious Activity,Them should shake home work.
22e68e5e-9cc9-404b-b309-2d8a7c1e2be1,5984abd8-c88f-4d4e-b04e-ac1e2db4db73,2023-03-12 05:38:20,Suspicious Activity,Officer cell nice every certainly somebody nor.
01d60fac-83d9-4a5e-a194-65a6471a43ed,1e64d132-7ba6-4dd8-891d-c77d26d0dc32,2023-01-23 21:48:37,Chargeback,Republican star year task.
910dbacf-718b-4169-822c-e2fe49c88722,57e7a1ff-2f9e-418b-aaba-1d0ee8bbf15a,2023-07-28 09:46:51,Suspicious Activity,Quality attention identify network meet blood down live.
bf8c2e94-8121-42e3-afae-c411c2a1270a,2b340c9a-aea8-4f6a-9f5f-9dba71299f04,2023-02-20 10:26:12,Chargeback,Add laugh may blood push memory.
6d61ef42-e6cd-4b3b-a3de-01241df60fd1,b3800bf1-65e1-4149-a27f-98694f57106d,2023-07-25 15:42:06,Suspicious Activity,Age call perform modern.
fc1a4e15-350d-4661-a10c-815ca45a34b2,6a409b69-68eb-4c08-8939-1321e9e59db7,2023-05-04 02:20:41,Suspicious Activity,Already technology difficult little data local protect response.
1a91743f-4a03-4d39-9a77-4f6a8b5cb1fe,86742408-69b3-4f9a-978b-1d21dc28f6ea,2023-01-21 09:03:54,Chargeback,International social my administration serious.
95a56d5e-2ea9-4c80-81fc-ee08a69ef6a8,49be81fe-2c6e-45bd-8b45-fb101dc239da,2023-05-27 00:52:34,Chargeback,Understand follow three second because collection mission cup.
52a4345f-e1a6-4c4b-9ae5-31ca8b82a295,9af91338-cc8f-4b2c-b340-eabf2cea73ab,2023-04-03 05:45:40,Suspicious Activity,Stage product everyone number effect.
0841f3a3-2653-45b0-a918-6c1fa38ba4d8,d37255f4-fc2c-4134-a5b4-b74fa4492ae1,2023-05-22 19:36:03,Suspicious Activity,Property yard pick quite Mrs fight brother.
dfa7b0aa-3226-4120-bd2e-b3594b0d8fbd,cf7cf8b1-5f50-47fb-aa52-158411b65e03,2023-03-15 22:00:54,Suspicious Activity,Wish source ahead such nation station note.
7aedf60d-4020-4630-831e-5c965f11ea00,35520aff-5e4b-444b-930e-7eccc52cde17,2023-01-28 19:18:57,Chargeback,Mother everybody medical part check decision no.
00422d2f-673f-4e82-83c7-41ff6b19e93d,8b841ff1-9c49-4077-b7c9-d137b962e86b,2023-07-15 16:27:14,Chargeback,Look project speech those run such price.
5f191737-04b5-4b96-8f3b-2b7c6c4f335d,9676d770-15f1-4efe-bd1c-f09594ac6f8d,2023-01-20 18:22:49,Chargeback,Laugh bag audience fall its professional rise.
4a050d92-c29c-49c9-af2d-19297c552065,b29721f4-b9fa-47d4-ae22-467766861fe2,2023-05-15 00:17:57,Suspicious Activity,Research represent environment.
eb622646-ecc0-4385-aae3-6f0f576376cd,abe9c053-05dc-4ec3-b870-6929e53c46ab,2023-05-06 08:42:34,Chargeback,Plant government individual score director series.
25635322-cd25-4e15-afaf-7271f349b1ed,8393f77e-86a6-4724-8827-b22b9952029d,2023-03-29 17:07:44,Chargeback,Goal letter standard poor enter discover shake it.
542fd6df-0620-4bb2-aadb-3bac2999c2f0,39a8395e-8934-4f16-aa3d-2eb11f5d56c5,2023-04-04 17:34:43,Suspicious Activity,Standard mouth memory interesting raise need.
9fdb7127-e3eb-45ca-93ba-c8a7a082e000,1c7a2b37-2b75-4259-a51e-808400f7eef9,2023-03-25 11:23:23,Chargeback,They someone blue summer foot role.
db809af7-6946-429b-bd70-271a92221246,f3c62bc9-85cf-4ce4-9f64-d5b59e0c5ed4,2023-04-21 12:13:25,Suspicious Activity,Become analysis everyone ever.
21d3f038-fa0d-4d9f-a3c5-276194dfb384,19591077-8e46-4921-99ce-76934f230981,2023-07-27 12:14:07,Suspicious Activity,Industry top pattern change majority community.
cf385994-3dd7-475b-9321-cbb452a9c0a3,be827fb3-6c06-42a1-992c-5ab9f1a83407,2023-05-18 08:24:10,Chargeback,Son pattern people.
d1525590-ff2d-4d5c-a972-87ca27e5a339,1045ad5f-8919-46f0-93bb-47c2c0c08657,2023-08-02 01:26:50,Chargeback,Become indeed a partner put election.
9a768708-6cbe-402d-9fc3-c8dde1c8f041,f33c23ec-24cf-41e2-bda7-49e8600f3a28,2023-04-15 07:18:03,Suspicious Activity,Project inside brother though top describe none.
afb4282e-cfcc-47b7-b2d5-d87657db5498,12160094-5644-4bde-8267-2e82e51ee6fb,2023-03-14 20:02:54,Chargeback,Land through hear heavy feeling.
7b11b7da-7b30-4034-bbec-509d9b47fdeb,5dac29d8-ad3f-4add-b884-7920ea1c2406,2023-05-06 10:11:22,Chargeback,Above send data government enough up high.
1427a698-b609-45b8-a1a7-2bc1bb61c602,b33c8660-dfcd-4e48-b0d0-69f730f3262a,2023-04-02 06:02:59,Suspicious Activity,Yet law choose manage believe.
9a9a968f-a217-46b7-ab7c-6048db0c4c44,8efb2f0a-1032-432f-972e-6ec3dc8b994a,2023-06-23 07:06:55,Suspicious Activity,Training movement cultural second.
a93bf1a3-c7b5-4727-9a9b-54a25f44dae7,d4d52a1c-7bdb-45d3-88b9-2b1170af3788,2023-07-06 13:48:06,Chargeback,Source common never through increase also hear.
d1482ed9-956b-4c01-ab15-41498910ea24,8e2e22f3-68a7-4c96-831f-3aafaf40299e,2023-08-10 19:07:27,Suspicious Activity,Debate job usually half.
c84d2baf-d6df-4b35-9788-cebbc38b6261,0931ef4a-0b40-4090-bb81-cc103d6a8a49,2023-01-28 20:58:40,Chargeback,Our never different expect brother dream though.
e7b29add-807f-4bfa-aeb3-fb82f083d035,9727030e-7364-4cef-bee1-0d02c1069806,2023-07-01 09:35:27,Suspicious Activity,During on strategy live nice government stand.
7b3cc8f2-344d-454e-ac6c-f65fb31fdb9f,f4456e8f-48d3-4c37-8fc0-35a8bc4aaf26,2023-04-04 17:37:59,Suspicious Activity,Think degree scene adult rich.
5668ac5c-c416-4140-939c-d5db544d7274,d4cd3262-2c2e-4f85-bdea-2d62ff1ab426,2023-07-12 18:15:24,Suspicious Activity,Onto manage laugh space.
fd8b3652-3b9d-47d7-8255-ab5e20492837,d1581848-b01c-4f37-b51c-165c5f4302f3,2023-04-08 11:48:55,Chargeback,Collection season sure.
cc8b5c87-a3b4-41d3-b982-4cf41d2368e9,137b67dc-7098-426a-9921-76c6e94f6f0b,2023-06-24 00:50:35,Chargeback,Trial statement subject walk through record.
7272e927-c1f0-4dff-b33b-f75ea2b29ffc,80a7f0ff-fec1-44e4-a83a-a6e9753ed0ea,2023-05-04 23:24:57,Chargeback,Door situation fact Democrat safe reduce.
cdda65bc-7157-4795-97b1-d5e260d96b26,a7b73146-3759-41c0-85cf-97c748e44f81,2023-03-07 21:02:45,Chargeback,Ten coach success standard study.
cb194602-37d5-48dd-b319-02fbbb2d3aa3,8b25c4bf-7db3-49e6-baa1-46bf5f4bd736,2023-04-19 15:12:06,Chargeback,School use particular without economic attack seven.
1c06a7dc-e42e-4c21-97b1-11fe6155abe2,37d06846-49bf-4528-9a54-f9e558ef916b,2023-07-07 04:15:43,Suspicious Activity,Still player provide wonder.
66634148-d6a9-4d71-84df-5a91d3aec0e4,f9d248a6-56a5-4ed3-b429-773fbc0f14d6,2023-08-15 21:44:43,Suspicious Activity,Its skin everybody citizen professor.
8c8ec061-e751-43fa-afc0-504cc529b88d,62f8e0f2-1c8e-4138-9ac2-9d73704f186d,2023-07-16 01:57:22,Suspicious Activity,Message now cost effect media heavy sport seven.
34563649-0350-4507-b279-41a1216bcbe5,2f01a34f-2dc4-4b33-9c45-85158664ee7f,2023-04-20 09:12:11,Chargeback,Century either professional rock I hour grow.
6cf366a2-e46d-44e5-8fd7-226c65e5cebc,c4ae854f-2b57-41f4-9f50-c2a4434d4752,2023-06-21 19:02:34,Suspicious Activity,Here college camera age seven wide none identify.
76d34ae5-f9db-42a5-a99f-2089e90ee8c2,69f7d7d8-8b7c-4471-83e9-0d59d79a7378,2023-04-01 16:53:18,Chargeback,For time ready nearly low TV.
6bd7d78e-e3ba-4d1f-8c94-c67572110034,b8604888-23f5-423f-be7f-d8cb2e2901a2,2023-04-03 17:05:40,Chargeback,Lead drug president shoulder score.
da795106-5909-4957-9f22-e6c97b393393,abe17ff8-ecda-4894-807f-947b2a7599c3,2023-08-16 03:44:55,Chargeback,Image who true among son quickly town member.
2a5c5804-90b5-4305-92fe-92e62bc2f41d,54a3e566-d461-42de-9d8e-e5a6aee17c28,2023-08-09 01:46:18,Suspicious Activity,Lot its dog water.
038aab34-4452-4ad5-a5a5-99d8f0ab3974,d08b7e26-e507-4032-9622-41fb1da8ee50,2023-05-19 08:59:55,Chargeback,Western deep eight.
83aa2462-ddb1-40de-b819-52ce6c1d928c,b7f95ad3-d990-49de-9dfe-45211851fa15,2023-06-09 09:55:15,Suspicious Activity,Cultural home machine feel position thought.
1aebe52b-915f-4cf0-b9c3-9555a92756c6,6b3398fd-1092-4700-9fca-29919ceba548,2023-05-05 11:49:15,Chargeback,Gun push no want.
471fdb46-a1d0-4da6-b784-5d6353b5cd95,0dc3a5c9-86b0-4a7f-8cb0-8f3911b517dd,2023-03-24 19:27:59,Chargeback,Institution scientist tough one individual impact.
ea369a5e-85d0-488a-8285-ec0f984ef459,af15b581-8a16-4d48-9606-56b614e099b7,2023-08-09 19:25:07,Chargeback,Approach wait music prevent partner.
9295f58e-12a9-415e-9b17-c618129880c9,1c0c8ccc-bd8c-4e82-a480-e53bb186a871,2023-03-19 01:50:30,Suspicious Activity,Pass which benefit far strong plant daughter painting.
625d9510-e8bf-4574-838f-7ab3c94bb8a1,9b862e0e-2527-415d-b05c-a317ea93f3e6,2023-03-08 17:54:57,Suspicious Activity,Third action us final ball hundred.
a735b3d5-c698-4cd4-be01-d37df1ad8bcb,63d05eee-d74c-4d99-91f7-8120ff10f7e7,2023-01-29 02:47:10,Suspicious Activity,Race attorney finally full matter.
78be1e8e-0443-47d6-906a-47912c9bbad6,faaf00e5-a5e1-4fea-9186-1803f670cb6f,2023-04-28 23:52:59,Suspicious Activity,Take money avoid away top five together.
9f770a75-5811-4c28-a350-5c4cd2ab0462,a8dd18d0-a215-4100-bbd0-33cbd17d0c21,2023-01-01 00:12:05,Chargeback,Act wife month physical official letter challenge.
1e44d12d-a947-4d5c-8d27-8b11824317b3,0a24af9e-6a3c-4a68-81e7-c418a8978fea,2023-06-05 05:54:22,Suspicious Activity,President anyone research lay human happy.
49b84433-bc8c-46b4-b74c-afccfea0715d,70105e5a-ff61-4d3a-ae8d-6b85c0358dbf,2023-04-23 05:45:14,Chargeback,Notice hundred according middle kitchen.
862f47e1-fb80-49bc-92df-9e35901d4514,7c8a714c-4441-428a-a4d3-95df9812ebfe,2023-06-15 22:48:54,Chargeback,Right data far generation agreement only indeed.
a0472ee0-9198-4904-a0dc-05c40c3bac67,f1a6bd7d-e20d-43f0-9510-76f1cc9a9aad,2023-03-22 01:36:40,Suspicious Activity,Need think character list data experience.
116642eb-cf90-426f-9f21-25f4f253d8bd,457ae173-a201-44f9-838d-36c868c8bb57,2023-03-14 11:02:14,Suspicious Activity,Remain live environment eye.
d5258f6c-e2b5-45df-b9c8-3eaecb0aec5f,7f1ca1e0-f4db-4e27-b33d-e6326d36574e,2023-04-06 06:47:27,Chargeback,Including view machine quality agent.
72f2f7d3-c1ea-4f84-936b-b8a49e786199,5ef8a5e6-10bc-4372-980c-2a5cb0c6222c,2023-01-10 21:28:39,Chargeback,Night part into building try.
d3e3f354-22d8-404d-bf8d-07c8909df700,8b619c3a-d5cc-4aa2-95c8-9075c5cb614f,2023-02-03 15:01:32,Chargeback,Campaign its true turn air.
6667aae6-69f6-4d39-ae47-15395c41ecdb,e43dff39-f506-494f-a54a-a4a01d75b632,2023-03-17 20:00:39,Suspicious Activity,Miss office learn follow hope dark.
e540ad16-f0ec-42ed-b963-0a248a8d127e,51ceb882-2e66-43ea-9d2a-7e2141d05683,2023-05-07 17:57:16,Suspicious Activity,Tough light military store.
933b9ebb-f936-4654-8cf1-a5daa24ca35b,5eac346b-ec56-474c-a0f3-2f8ed67b8759,2023-08-20 14:52:11,Suspicious Activity,Support from adult production source.
cd4ba682-2464-4106-93ef-80401e64b5f0,c4b40743-921c-46a8-9ba7-2b1ba4301f5b,2023-07-25 08:23:41,Chargeback,Receive exist newspaper space feeling rest.
3421d7f1-ada2-440a-a36b-8e6ae45ca678,1dd1e4d4-0ec3-41d2-964b-b27d1c5bf2cf,2023-06-17 06:35:19,Suspicious Activity,Whose receive condition its color opportunity forward plan.
dfaeddd9-ab07-4d09-9e63-dc8af2d9928e,bb4b30a0-f8f2-42e4-b961-840f64ab03a0,2023-03-18 23:30:09,Suspicious Activity,Short full others establish staff big keep.
3efac606-1209-4021-8c96-b887c1486650,7f62d51f-474b-4671-bd48-4afa59ab584c,2023-05-03 06:35:08,Chargeback,Career north data collection how it.
