Fraud Alert ID,Suspicious Transaction ID,Alert Date,Alert Type,Alert Description
2d04a997-6f65-4525-8ca6-aabfb6b98906,0df06732-5c28-4988-a055-1f62ff63a8be,2023-05-26 15:32:51,Suspicious Activity,Go sound sort eat national single.
0587126a-5e73-4061-8dc5-728353101a19,061e58c2-703d-4ecf-a8f1-253dbfc8f9a5,2023-06-14 08:41:12,Suspicious Activity,Specific positive television end key finally.
56407764-e897-44b7-a1d9-788fa0b3b7c3,783ea745-cc80-4afa-bb85-4863329dca4a,2023-05-05 04:49:46,Chargeback,Growth cold need Democrat political gas produce.
dd2530a1-6c51-402d-8e8a-1238edc496c8,8c56b889-8e67-4e63-8458-2b3d83229b15,2023-03-28 17:25:29,Suspicious Activity,Office third never public term lead.
4cb89119-64cc-4026-a5c1-0ed63a768433,c9623186-0e54-4da6-86ff-21f7e63fce3d,2023-03-08 13:12:04,Suspicious Activity,Market our respond heavy.
3ebafd2b-572b-4f60-83ab-dea2ed852823,b7fd9453-0a41-4fb9-b209-0826f7781d05,2023-01-16 12:32:22,Suspicious Activity,Mind word staff common.
2f6ba028-0d67-4825-b82f-1ceb2c118a55,32918bbf-cca3-4080-a41e-553120d5bf5d,2023-01-17 12:25:03,Suspicious Activity,Board lose summer lot collection people we.
ed89cb27-3bbf-48af-888d-46836adfd04a,216155c9-7259-4f07-a179-c4127ee173b9,2023-03-22 07:19:28,Chargeback,Oil north available pretty behavior customer beat.
e75d5954-3868-4dd4-8eb8-d43895114433,463ebe9c-82f9-41da-9358-75e77f8d606c,2023-02-01 08:27:37,Suspicious Activity,Design why science foot.
8d09330f-60f3-4c6d-859f-33acab159d5a,a478f667-03b4-42ed-a5a5-1d12b491e2e4,2023-06-05 20:22:43,Suspicious Activity,Determine letter tax.
087e6071-d094-4542-9491-838e15dc160d,d370653a-e859-4e7f-8850-83ee175c58bd,2023-01-11 02:54:35,Suspicious Activity,Series seven free hospital student that.
16a169e9-109b-42de-803d-b28c200bea10,19937031-b1f7-4053-b8c3-968aaa4c37e2,2023-05-08 09:58:43,Suspicious Activity,Impact evening different room must discuss develop.
a77869ef-0a2c-4e92-8674-fe2645ada62b,1ad74af7-27e2-4da5-ad32-7e252ba55733,2023-04-27 01:12:54,Suspicious Activity,Mean professional weight stage stay foot create.
5ba1a467-8347-4e2f-b207-7d49ecf03037,532916cd-62cd-4288-a288-efb05f772d7a,2023-01-06 12:56:12,Chargeback,Nation risk drive defense as exist course.
02d6c10f-d75b-4f24-b64d-1b8b1b67cbe0,ad290512-5170-4405-88a4-050e33f67951,2023-06-13 03:17:37,Chargeback,School together tree environment week interesting majority.
be19b8b0-15da-40d9-bbbd-28213513cc5d,a8ab1aa2-f5a3-4071-8ab6-3d3fd8e6da23,2023-05-27 07:17:52,Suspicious Activity,School structure hold policy nation page him.
c2ac7ceb-2fc7-4d94-9219-f994fd7dc7f7,5228b041-4d69-4bf6-9e45-442ce899691f,2023-06-09 06:42:16,Suspicious Activity,World whole rule fill early talk shake.
3d44fd6c-8ad6-4833-b956-4b9a8d4782f6,a8d33431-e31f-4e4b-841e-c369236b543e,2023-01-19 21:23:39,Chargeback,Style common direction month lose play.
1401be93-d37b-4f40-bb9a-31c2bb5d6b8f,14315a38-b99d-4b04-bb5b-0230396f2108,2023-05-07 21:18:28,Chargeback,Police reach fly college.
473ed7a4-9068-4667-917a-1c6e3023e0a8,18a28df8-a6bc-43f6-8187-6185b10dbe3d,2023-03-23 00:32:29,Chargeback,Fast song seek join.
e5255acb-d7af-4e3e-bae4-260575c31c74,4d44bc01-15ef-49e2-baf8-f39a52cad201,2023-03-21 23:44:35,Chargeback,Woman practice see partner drive business either.
d974d112-b0f3-4f7d-aa66-3b1435c56fb4,d56a513f-8301-47a2-9a31-06ad224f4c9a,2023-05-10 21:00:51,Chargeback,Trip idea open court.
be4f0276-db83-4245-8d5e-be425865c2f0,61fa69df-3fbb-45fc-bd22-ee25b998883a,2023-06-06 12:54:07,Chargeback,Either right firm current make.
614b8a25-0384-43d3-b863-2468ca4fa762,5c730a94-397f-4df9-a35f-3eb12a25e49e,2023-08-05 17:08:58,Suspicious Activity,Central instead others laugh.
d2a53bf7-715b-4ebb-9960-d46aa08bc8ef,067c5fb1-6860-4bbc-bea0-0bb2f59f7f7f,2023-06-14 12:47:00,Chargeback,Through magazine energy method consumer tell itself.
62718ad1-74e2-4a75-b94f-d5d9e0591a10,c4e2813c-cc40-4976-9a55-34b34ce27056,2023-01-10 05:18:06,Suspicious Activity,Data about special assume decade rather.
0c517062-3dc6-49a8-833f-859416833704,ae945881-6456-475e-9fc5-a0ada4773d4b,2023-05-22 05:38:59,Chargeback,Employee actually sure Mr pretty company cut.
9f1335a6-4dd6-4be2-9f53-0d74ae0e082c,8ca61ea6-1d1d-48eb-a00d-0d8f01545a16,2023-01-27 10:50:30,Suspicious Activity,Training in man structure indeed group smile.
1eac3e45-6f7e-49dd-ad6e-fc0a1f50c18e,a8d33431-e31f-4e4b-841e-c369236b543e,2023-04-16 17:24:23,Chargeback,True body democratic government soldier church describe.
7600fd5b-ec17-4df2-87f6-df11b2f9201a,41a48b47-b21e-43f9-8104-4e4fcf355a02,2023-03-23 18:54:42,Chargeback,Inside impact season how.
bbf7c81f-b217-42aa-984d-1fef3ef0414b,a7a1dc77-d6a4-499f-99e1-8bc939c28f95,2023-05-07 09:30:44,Suspicious Activity,Compare discuss give fund.
b22aff0b-d1fe-4424-bef4-4f803c4c563e,b56c1262-7c41-464f-bfb7-6af74703f601,2023-06-28 15:34:00,Chargeback,Property development near now direction year.
8a71052d-0c07-4bcf-a5f6-8579d6bbf753,3b9ceef0-78bc-4246-a60f-b8c9c1b9e8e7,2023-01-21 03:59:08,Chargeback,Region baby dog social.
3f24dbc6-c191-4fd5-903f-1782802bcd43,6017bae4-b289-4cf8-88e4-f9ba643a9f01,2023-01-19 17:47:17,Chargeback,About animal sign window each.
444aa73a-5783-4edb-a9ea-4e9e5f1c26b7,6d7c891e-c4f9-4af3-97ee-ba7f04d45374,2023-07-12 18:03:07,Suspicious Activity,Sure spend central sign boy beautiful.
f9178a86-00df-45a9-8d23-0c022b9e7917,2784e1b4-a2d1-47ff-8b0c-74c156c1d44b,2023-08-14 01:24:30,Chargeback,Bad significant dream computer light decision.
e24f2e6c-514e-426a-b17c-eb0ae5b64998,0d60a10d-6153-4282-b6e7-db3bca17cc05,2023-07-16 08:12:02,Chargeback,Later agency guy nice message but site.
2914a86b-b478-4fa4-b892-65c6f6185292,c003c2aa-bfa1-401d-98bd-5be2967f2ef4,2023-01-24 01:11:50,Chargeback,Poor direction recent follow.
e8d92463-fb48-435b-b76d-0fb75bfad668,62f5ba94-b146-4b5f-b1ff-7da65c5b626a,2023-06-02 02:08:52,Suspicious Activity,Foreign common else full generation court wrong.
af67b6ab-f830-472d-aed1-677aee99fbdf,9c2ed665-fd6b-4a77-98cf-d15f794e8569,2023-06-24 14:30:44,Chargeback,Choice recently travel financial movie.
cdbd4f3f-3f3f-41e6-97db-694fd85262dc,1254cca9-4386-4a4e-bafe-714b61ed8a5f,2023-05-23 15:56:18,Suspicious Activity,Never guess human stage prepare.
6d8f022e-dee2-4258-a06d-d77191dc38f4,29205749-1d71-4777-851f-68c6c0316e42,2023-04-24 01:08:09,Suspicious Activity,Political middle record couple coach him ball eat.
8ff42253-a719-422f-bd89-932351e35e43,55451f3a-df6d-4e32-92a7-2f0ca5d22fbf,2023-07-11 06:32:59,Suspicious Activity,Small eye wait education.
a427e7d4-61d7-4cac-af4a-9fbd17572839,bd07826b-b919-45f6-9c55-ff24a0b53dea,2023-06-23 19:23:38,Chargeback,Team others figure animal middle myself political.
7a9bf253-4275-492d-9671-5b96d1b410ee,d4e75fa9-c6c7-42dc-9ccd-f48f5f86579e,2023-02-24 14:10:37,Chargeback,I administration tax few adult able.
80c2aa1b-bb26-4b1c-89ef-2641a3d8f8d3,0581f73c-7d64-4753-9783-afee7981c66b,2023-06-11 06:37:07,Suspicious Activity,Customer process since theory buy company.
5a8be6bc-9f90-4041-8ed5-3e65bd33aaef,aaa0a07b-c672-4c9e-ae90-42100c8aa3f2,2023-03-05 20:57:30,Suspicious Activity,Land population up speech.
b2521c71-a94c-4279-bb8c-cc3ac360bfe9,89c0f8b6-58a3-4884-8a16-f6a76d3a2607,2023-04-22 18:26:30,Chargeback,Anyone can indicate seek work determine group.
1200d501-5737-4565-80f2-3191d8fb7bbe,0f27d4b3-c841-4a99-ac3f-803f63603641,2023-02-09 11:41:25,Suspicious Activity,Spend generation cold also treatment fill loss.
dc90d172-7f16-4d96-8f43-7ec2c5ff455d,5f95ec0f-aab0-4056-a96e-8dc859f3c0df,2023-07-31 06:07:23,Chargeback,Ok run onto career task public.
85bf8c4e-2363-45df-b800-f963d4c7567a,1fde529a-15d0-4019-b680-78f627981887,2023-02-09 13:24:43,Suspicious Activity,On in skill experience economy off.
f50997a5-f381-4ec4-8cdb-c0493fa3301b,34539c91-3d9e-4904-aa25-e0f5b25d983b,2023-02-25 03:32:48,Suspicious Activity,Bank take skin sort position identify how.
bc208c2c-e9b8-4c77-9e5a-09e6a224894e,b0cc03c7-d719-4cba-b5ee-89a37eb73e62,2023-06-13 21:27:36,Chargeback,Little too check police discuss decision too learn.
ce921286-ac79-46e7-867e-b708e6f6fb26,c4e2813c-cc40-4976-9a55-34b34ce27056,2023-02-26 02:21:16,Chargeback,Agency rate within part analysis despite.
90614ff4-2aca-4147-9ad8-3178daf5f352,54b55ed5-6981-4122-8068-9be880f6a728,2023-02-16 23:03:52,Chargeback,Speak whatever number yeah authority only buy.
dcc0c1df-aefb-40cc-a4ec-f16c99f06cc3,9d1b89ce-a3f3-430c-854f-c73e62040da4,2023-03-29 11:44:03,Suspicious Activity,Short voice western fill foot.
14fde42d-e082-40c4-86d6-8b9d8e77000f,7045e8fe-668b-4fdb-8687-7d684efa2aa4,2023-07-07 04:26:37,Suspicious Activity,Economic tonight affect offer chair position.
a5fb4cb2-cff3-435e-98ea-0aaf55d4a466,209b5c3c-eb84-4f20-975c-9dcb65c55a62,2023-07-08 07:18:15,Suspicious Activity,Service unit today quickly ok opportunity be.
1e8ac97f-2a10-4f1a-aba0-e225701c85f6,eb70ba7f-b2d4-4b8a-b191-c2f424d788b6,2023-04-14 13:20:27,Suspicious Activity,Fall friend your gas.
8ae5ee1c-212a-4d87-a2ad-641b75e00bcf,3524db9a-f397-4f60-bc6b-4fd09ac4a804,2023-07-18 19:11:03,Chargeback,Better eight might song.
e5239d97-85e8-4876-9d60-5461b6c0091b,1c51c53c-a910-4233-8c14-348dbc92bb8d,2023-06-25 06:58:58,Chargeback,Choose attention nor day research.
306dce31-45d7-4f8f-b164-42dba5b64b8d,9500a932-8342-4edb-85d3-496f7ce9bb85,2023-07-11 08:44:58,Suspicious Activity,Hundred image strong white than.
88c5a9c3-71ef-44cf-bb93-4327dff19a4f,b1048fa6-0869-4b9c-863e-5ddd640cdbba,2023-05-10 01:07:21,Suspicious Activity,Shake mention outside alone wide would any all.
f4c69ad3-a088-428b-b1b1-a67ba7b4def7,5bb77453-cdda-4501-aeab-8c60b135dc5c,2023-04-20 19:22:19,Chargeback,Who role difference cause country.
fecbdb87-91b4-49cd-bd9d-2a0f3d40dddc,4dc50f18-76d6-43f5-ae51-509eff3d52f6,2023-04-07 13:47:09,Suspicious Activity,Other many entire worker beyond report debate relate.
eb1953c0-bb4a-4a0d-8a28-49f581dfbad3,07a2196b-abc0-4eec-a982-ec9bc7ff2f9f,2023-07-15 21:22:27,Chargeback,Bring specific common center.
49e13a48-495c-4e47-a96b-38de7e887db2,ca01f536-906f-4d24-9993-dd29a90c1a06,2023-04-04 00:32:42,Suspicious Activity,Whose impact democratic them.
af213610-2150-4d6a-ad90-581fe45bedc5,dc3ea49b-9005-4bf5-8534-30903dca6510,2023-06-13 10:19:43,Suspicious Activity,Occur hear practice long training organization traditional.
e0ff3bb6-0ee4-425d-8d08-2a30f144be05,6a886e91-a990-44e4-a6a0-b8f8a1e20f37,2023-03-27 05:59:34,Suspicious Activity,Year door yourself light course political.
cac9b328-b618-4e6d-b589-b8be20aa6f60,b59ed2c8-9d20-4855-ad6a-d668b9cd818e,2023-05-31 00:27:19,Chargeback,Science water lead film car wind.
ceed55cb-734c-4f17-b86c-34bdcdfd838c,beecfa88-4d36-494a-ab9a-04df7d69f490,2023-05-13 19:51:15,Chargeback,Green Democrat much institution star.
aabc87b6-446c-4640-9ba9-b628fa0f776c,97657782-8aae-4048-9718-4bde49f8ef7b,2023-02-08 00:29:48,Chargeback,Relationship house particular different unit kitchen.
aac82e61-d7fa-4425-afc6-8950e2ecfc69,997e95f5-2683-45f6-bbd7-4a4e5c969b0b,2023-07-12 10:00:36,Suspicious Activity,Yeah pattern big drive reveal year today.
88220338-153e-40ce-9552-2ac12c1d98f8,b99445ab-8192-48c6-9e58-975dfd3a6a2c,2023-05-29 04:44:47,Suspicious Activity,Tree wife guess environment house much animal scientist.
393eb340-1e25-4ea8-a448-b37a4a6c1b41,b0d344aa-bb72-46f4-a896-b6272aed4b37,2023-01-26 11:35:29,Suspicious Activity,Set brother ability enjoy kind.
9f2a72ba-2554-48a4-87c2-d12764855fd3,7624c254-ef48-46b5-bcd8-1f5a8b077ccc,2023-07-22 15:34:14,Suspicious Activity,Site certainly each keep across miss ask.
bcb09d73-f6de-4755-81c1-4c4b068aaf38,6cb1b14f-8078-45a9-9929-536795c56df6,2023-05-04 20:22:45,Chargeback,These themselves anyone be action speak.
8a8d8ce3-8dc5-47be-8504-5e98804b60d5,5ecb432e-4ed9-4d77-8a03-f559c5fd9a41,2023-01-24 20:31:10,Chargeback,Write professional simply official light.
220c806e-c577-40aa-a52d-8527c74b9127,59633264-abae-40a3-89fa-6f284de2fb3b,2023-06-08 15:50:39,Suspicious Activity,Positive than perhaps long.
e996b74f-9ece-44f5-bce2-a1f5bbdaa584,4b1a14eb-31b1-45be-9976-3ef25d78afd9,2023-02-15 12:28:42,Chargeback,Couple present seven without blue.
2b8cdec4-397a-4342-8c58-5b575761fe05,8a3be812-5b73-4c45-9816-fe273b492e9c,2023-05-04 18:03:21,Suspicious Activity,Sound itself treatment.
63114f98-0110-49a3-a75b-0c98ff942202,2b5d56e5-6814-43b6-9a84-4b8c11d4281c,2023-02-19 10:11:28,Suspicious Activity,About despite book when film player after.
5efe301e-76b8-4ff3-b07a-5e141c1c8d80,f1f5536c-f026-4b1c-a3f7-611289f95fd6,2023-05-20 15:30:39,Suspicious Activity,Nearly sense office.
f61669da-fd1c-46ee-b0ec-a9ae403d40c3,5d00584e-8af3-4323-be4a-50ca06066619,2023-07-15 10:14:56,Chargeback,Right Mr study figure.
b9910be2-46f7-4cae-8168-6cf29f4b065b,b25d5ef8-b777-402c-8157-e83eb5f64b11,2023-08-20 13:19:43,Chargeback,Development hope rock health environment body customer.
ef99d509-69ad-4b73-810b-b7a23ec6f10d,a4a9d16d-512e-4fad-9639-aee2130140fe,2023-08-08 17:08:33,Suspicious Activity,Current instead article meet century manager score exactly.
d1cd2345-7dbb-4e1b-834f-504580ce8e18,1f2885c7-b432-4f0e-978d-21ce06e5feaf,2023-07-12 02:12:09,Chargeback,Imagine manager race.
abf08735-7ce2-43c4-85bf-70c20d664f22,7624c254-ef48-46b5-bcd8-1f5a8b077ccc,2023-06-25 09:40:04,Suspicious Activity,Firm page stay really friend.
330375df-0d98-4a58-9f6d-e982d4ea7076,c9623186-0e54-4da6-86ff-21f7e63fce3d,2023-03-03 21:46:28,Chargeback,Return alone able item dinner.
81b1b67f-ca8f-4fdd-9e25-fa9ea2f0b73c,323915ee-70a5-4b04-9d42-e6cd962e7273,2023-05-03 11:35:52,Suspicious Activity,Buy training continue.
39e92fda-ef67-406d-91aa-1b32da3ffc91,eda0f04c-ca94-411f-ab98-15e15a6aec28,2023-05-13 12:35:22,Suspicious Activity,Safe check possible about coach.
0e792d8b-730b-46b1-a0aa-8f7b0f21cd5c,61fa69df-3fbb-45fc-bd22-ee25b998883a,2023-05-08 15:05:54,Chargeback,Mind fund top together recognize chance.
45933558-6f9d-4ba4-8442-1449ee24dd79,e1da415a-1b69-4eee-88fa-1be9ae1f4c7f,2023-02-01 23:12:30,Suspicious Activity,Hair subject look police.
eefdeb01-df73-492f-a57a-f162381065c1,349726d7-9f0e-4cac-a0e0-fcb2a7e7e3d5,2023-01-28 04:54:31,Chargeback,Must young over easy pay.
c356d0f6-7de2-4047-bbf5-7ceb7103567c,d5bbef64-5065-4727-a68b-46c1bed2f69a,2023-08-09 03:33:33,Suspicious Activity,Pretty to table throughout.
3884983a-dffa-459b-b349-8328c6ca502e,9d95a546-b8a9-43b2-a2a9-b589543cec4d,2023-01-29 22:23:21,Chargeback,Discuss small study some look letter factor.
c3bd1625-4f8b-4028-886d-5eec3689e135,9fb7a2fd-1dc2-470a-b316-62cfa6768b3e,2023-04-26 18:35:51,Suspicious Activity,Operation experience ahead field second various.
1597c9dc-0647-446b-b106-b164c48460aa,88236e0b-d4ba-4727-ae7a-b177bba41622,2023-04-24 22:29:33,Chargeback,Question fly stage up simply dinner.
9766a74a-6c82-468c-9405-3b8d3b512f6e,4d4390a2-7885-41b8-9563-8acb64bd2477,2023-07-16 06:16:00,Chargeback,Social fast piece strategy common during.
adb4bd1e-8e58-4156-ba13-ca331af1a348,024ddd0e-a40c-43fd-bf69-c1047759d4b9,2023-08-11 16:16:56,Suspicious Activity,Manager performance experience affect throughout.
51a9d59d-58ba-4f3b-8b7d-31eada143914,3a88003c-d617-4b80-afe0-d937bd7089cd,2023-02-25 20:00:32,Chargeback,Family song television story American professional.
5484fcbe-e52c-4dd5-a170-de0b4029580a,53569791-61fe-4e82-90e4-2e043a4698e8,2023-01-18 23:09:26,Suspicious Activity,Surface some surface ten attack fall conference.
88928936-e89c-43b9-8b01-981e175b50be,438405e2-ebb5-4ce7-af1c-691c4482d1b5,2023-03-22 22:23:36,Chargeback,Until organization sing culture turn send.
3aa6c94d-c562-4c59-bab2-c13210e44fe2,8292bb82-408c-4f7f-a529-c74077c57973,2023-07-12 16:00:39,Chargeback,Even vote science.
996c099f-126e-41e1-a9e6-2f2f772b67e7,e4731bf6-62e1-4df7-97c5-02296c270998,2023-05-03 13:10:25,Suspicious Activity,Thought travel add order interview.
173486de-0e11-4008-88eb-0da33a22a345,ce03fbd8-3f1f-4ad6-96a2-95899cc90182,2023-01-11 11:03:00,Chargeback,Today condition since.
49915064-6189-4ddc-b007-0dafaa88a860,1fe58668-b3c8-4710-9a3d-c808beacb672,2023-05-06 06:45:04,Chargeback,Ball seven style lay body.
bae1be51-9fb7-4c38-862c-02182db72383,eda01168-2b15-4627-9d1f-a1a3b4666457,2023-04-07 00:25:05,Chargeback,Station time serve strong.
e0c3afb7-2baa-42dc-b4bb-227460f128dc,d103f16b-e2e6-476e-81cb-199bac278b7f,2023-08-10 09:41:47,Chargeback,Quickly plant near discuss relate pull respond.
6627fcea-b67a-4385-b263-ebc96900f44b,02fdf4ce-75eb-4383-bb8c-f4520e4ccef1,2023-06-21 20:08:48,Suspicious Activity,Quality water five firm because record.
122890e7-9378-498d-857e-226fbbd392ac,dfbdea38-455e-4ddb-8049-abc0ea5bfe51,2023-07-13 06:40:41,Suspicious Activity,Nor involve relationship really.
8ff64996-d7ce-47d3-a577-536af6fdb315,a4cf093b-10a8-4def-a822-8a057a21a18b,2023-05-12 07:04:17,Chargeback,Religious kid mouth plan structure tonight avoid field.
1b70849d-a05f-4544-a5c9-a7c0012cf6c1,813428e9-5142-4dcd-8cdb-b4446acb2865,2023-03-26 09:14:54,Suspicious Activity,Man Mrs I trade side side.
100dc0c5-bbb9-4abb-8e90-379e4c8e9900,1799ef7a-6fa7-40dd-a020-0174ad428c65,2023-02-10 17:17:18,Chargeback,Later yard happy music collection central dog.
5e9e4728-e5af-456b-b96d-290036818edf,33f5c519-2dce-40ab-b3f1-6412a6aadf5e,2023-07-13 05:56:48,Chargeback,Less case option political suffer site fill.
a4909929-8865-477c-a0cf-9735334eb1f4,c9623186-0e54-4da6-86ff-21f7e63fce3d,2023-02-22 09:15:36,Chargeback,Accept main cultural keep wife speech.
77bd137c-77ef-4339-bc8e-b823401295e8,bde0ff5d-bceb-4b90-bd3d-46bd63366087,2023-02-16 19:44:05,Suspicious Activity,Store look reduce music where note.
08370444-399c-492f-a7e8-e4b90f226c17,84f440af-14c3-4b00-b77a-05e76e019d7a,2023-08-19 09:14:22,Chargeback,Dog black cut argue interview until model.
1d2e4c65-a506-496c-aa1e-f9668e8471ab,44c1a7f2-6a59-4c67-b950-9fb033ede744,2023-07-21 07:51:34,Suspicious Activity,Walk their security instead field.
22c7ddb2-149b-4697-85f4-94abd22529e6,cd7cd4d9-ad63-4589-88d7-944d60a75d32,2023-08-10 23:05:13,Chargeback,List pass mission seven everyone gun add.
8bbde738-31b9-49c5-8a54-4682832aa5d8,2576b315-af94-44b9-98dc-04f1f05a461d,2023-02-17 10:06:20,Suspicious Activity,Try occur lay citizen allow meet it field.
28c6cd8f-0124-4b51-ac81-5dec251947b9,2fbc6242-025a-4e1a-a7c3-de6afe714f32,2023-05-30 04:22:04,Chargeback,Hour admit identify western despite remember inside.
fc59fb82-a93d-45e8-8a45-0bc98f74a27b,42c3192a-f05c-484f-aae3-5a41238e27c6,2023-06-01 06:57:40,Chargeback,Center quality by spend anyone.
69d90d90-19ad-42e1-8a97-1dbbdcd840f9,604e568a-bb29-4d8a-9984-2b631efa6227,2023-07-01 09:10:36,Chargeback,Better us them detail across pass.
2a97352b-f541-45e2-af90-5c436d9cdfde,f5e77eef-427f-4239-bd00-4104752ec4a1,2023-07-25 18:39:50,Chargeback,Heavy lay president large look lay soldier.
cf448828-afe5-4e6e-8e4d-5e9fee0121ab,92a6aceb-5027-4a45-aa93-647dd96d5562,2023-07-06 00:12:46,Suspicious Activity,Each front address remember matter they agent.
c47a3b75-5660-4ee7-b20a-29ffd549e3c5,10fa3681-0406-4a49-bde1-5915b11dc88d,2023-06-18 08:50:02,Suspicious Activity,Her marriage wife stop pay anyone.
7f7e0221-e17c-4554-be8d-c011d011c3e5,d264a3a0-5f07-44a8-b325-1ac608f30f56,2023-06-02 10:33:05,Chargeback,Recognize base great reality about.
65d1b766-2e8c-4a54-9698-8939439247fe,cdc13ebb-91ef-4ad4-9da5-64e96206597a,2023-01-20 18:40:53,Suspicious Activity,Walk right on development.
ca435d69-8ea2-496a-b57e-3c3a7e4b04f1,eee17042-46a9-48d2-9a71-16fa7e00ff30,2023-06-25 13:20:28,Chargeback,Religious forward none federal later body.
67de1cd2-9206-4645-959b-86ddf304c3ab,1cdb317f-a17a-47cc-bf54-0f35cce9db57,2023-08-16 20:10:32,Suspicious Activity,West general century positive great go practice.
eb3c75ab-a216-488c-97c9-b5db6bfa22a6,fc0389bc-0be6-4365-accb-e44fab94861e,2023-04-09 20:01:29,Chargeback,Check enter view sound impact.
b7258940-9229-4542-aa5f-c67d78cdd736,3b6c5a67-dabe-4a12-b22b-fa4c95ea79a8,2023-04-27 18:17:34,Chargeback,Miss seat back west.
8f941ae7-1bf1-4f7c-9ac3-d640bdce64e8,f7dad4a1-6dd2-40e4-ad5c-50abf4376751,2023-07-04 15:07:43,Chargeback,Half else build billion not half season.
e0c23759-06db-40c0-8c2d-67190528a579,c554bfea-9bd1-4095-b77b-4da246415e30,2023-06-15 22:48:34,Chargeback,Change anyone chance night act.
f42b8572-5934-4761-9ab7-a9e0cbc786ff,b720c251-8685-42c5-a796-c7afe399199e,2023-05-17 21:02:44,Suspicious Activity,Bill spend trial wonder account full.
002db9d0-554c-4d60-bebf-dc72e6ef17af,db05b8d2-f4b4-4987-9dfe-54ca0ba60ca9,2023-01-27 08:24:50,Suspicious Activity,Even might will world audience.
257cc27b-0df0-4ec3-8d5e-c4a54da264de,2c78fe9a-ccfd-42f2-9610-c270ad0f0821,2023-07-14 19:58:46,Suspicious Activity,Argue student news wrong type term.
c5107daf-fd39-497e-8098-265aaa8d2b51,3c0b2651-872b-4003-98cd-f18385642351,2023-01-03 17:51:18,Chargeback,Quickly together there money tough theory food you.
39199127-c186-4640-b5a7-0a625ed8d2fb,77102a26-3b35-4fd6-b040-fcc80b3aa04b,2023-05-18 21:22:28,Suspicious Activity,Most rich foot everyone civil.
6c39ee01-a445-411f-8ae0-7d0ebaf8c967,edb9f858-1e2d-41bc-b92b-ffa7ec2e1cc3,2023-08-05 03:32:40,Suspicious Activity,Year ready police thought.
8fea0474-5b40-46f0-b025-21db495b106a,f85a946b-efd0-4a9d-9375-1dba1934654f,2023-06-20 06:08:30,Suspicious Activity,Use safe field training.
492c93bf-8b4c-4676-bf7b-7c1da3499189,ae0fc6c1-3dfe-490c-89e5-cef7dfbb7bae,2023-02-18 06:04:45,Chargeback,Training make issue fact take guess.
e6890a2e-c8e0-4888-89a2-f0c18985024b,a1bfd2f1-f259-40a4-b3ea-e664d6418b8b,2023-05-07 07:16:53,Chargeback,Product from pretty film professional.
436eb325-4634-4ef3-8438-de305dcbc257,938ba69c-f352-4cf0-bd2b-79c5969d35bc,2023-02-24 19:30:41,Suspicious Activity,Economic fear meet point available heavy rather.
7cd36aa9-18e9-4024-8225-3f1fa37f2b8e,3b080b33-938f-4d4d-b4cb-f150df8d3dec,2023-01-09 07:38:00,Chargeback,Sing own speak coach strong.
2702dc19-0050-40ef-860d-8fa279c1cf20,7bf6566c-26f4-4154-b91c-42f50bfb7191,2023-08-15 20:56:16,Suspicious Activity,Just however learn event feeling.
bc47bd2e-4c8e-485d-b80f-2fa38e714bce,7f5166ba-5f71-44fd-b04b-cdcd57f9ec42,2023-04-15 08:57:51,Suspicious Activity,Town artist conference appear until wear true.
54cea7d2-1afc-48a0-aa81-83777865c8aa,b98fca82-af23-4c32-9381-dd03e0345911,2023-07-19 06:16:14,Suspicious Activity,Fund under country relate campaign.
685cf94c-4feb-496b-b5c9-29134c1ca29a,0b7968d0-015a-480c-81f8-f2d1c926bbce,2023-07-28 12:01:04,Suspicious Activity,Offer image in manager culture cup include.
8fb3e6b7-09cc-4731-a2ec-96db9357bfca,471cb8bd-68dc-4fc3-81bb-c7c4cf745285,2023-05-07 23:34:44,Suspicious Activity,Peace view system begin.
907dd7a0-7871-447e-8ab4-14819712c06d,8138d9e1-89c3-4b2a-a2d4-e22cc3dd427d,2023-05-25 20:53:48,Chargeback,Rest front age race often.
6d468dc4-df6e-4538-b065-3cbc9026661d,929f734a-fcf7-4cca-8ba7-45d9a6179a9f,2023-05-27 21:34:13,Suspicious Activity,Now great central could keep throughout.
2a175fc5-09a2-4b36-9947-a9b8ad96f1ac,d6b03d03-0fc7-4632-9efc-58aaecb2a650,2023-02-14 11:08:39,Suspicious Activity,Town scientist account myself above.
57dbe827-7e63-43eb-be00-1ce5ddc708e4,1ae2ca0d-1741-456a-bf37-a3a3ac23105e,2023-05-11 03:34:59,Chargeback,Small require TV evidence church life.
5b1f631c-ac42-4c2e-94c3-203fecd70bed,f768c278-3afe-44e4-ab67-c52d1ade6289,2023-06-09 22:53:29,Suspicious Activity,Thought when we point city.
0003c823-cb6b-4313-985c-6476b5c46bd3,7cdd0594-b2d8-46d1-b0cf-42344c23baab,2023-04-29 10:13:26,Suspicious Activity,Best behavior create.
92241cc4-feb0-467a-a26b-e7df3aa0e03d,6930df08-16c0-4ad4-a1ae-1c51c4624eef,2023-02-07 04:32:47,Suspicious Activity,Option recognize need despite arm unit what.
23db19c2-c64d-4dda-ba88-f11a12d2997c,c4370914-e99c-46a6-a2a8-118b1fdd3a52,2023-05-31 16:58:39,Suspicious Activity,Sport available foot buy believe knowledge there.
cb2815ff-4374-493e-874c-454552e5cc01,50d48717-5075-4951-9bba-193ca15fb949,2023-04-12 03:13:56,Chargeback,Audience social religious better.
980c4e67-7517-4d79-876b-2add72da344b,a8061c12-8925-4c59-b11b-28f519009523,2023-04-06 15:55:16,Suspicious Activity,Long tree hundred however consider while foot.
819d78af-4f28-490d-b67b-728ca92bc989,8eb56e14-592e-44ef-8fc8-8e68515e8fd2,2023-07-17 06:34:40,Suspicious Activity,Only short leader add responsibility.
f6fe234c-884b-493f-9abd-8b1c1d2a09ab,6aa19e20-4570-485a-a66b-2c593ee52b08,2023-08-16 18:33:14,Suspicious Activity,Adult spend with still rich.
02c5ada8-16e7-426e-b3ac-6f57cbfbe91e,07c871f8-cb9b-4279-9033-5846b5deeb99,2023-04-22 20:23:25,Suspicious Activity,House about agent admit though north example out.
e1f88cd9-c013-4d61-abb5-73e2a1591e5d,ba131dec-7ca8-4b42-9238-8cc433701510,2023-03-21 03:35:51,Chargeback,Say art run box create total.
29e0bf85-ecc7-460d-9ce8-2ea1a7339310,b4f8a1e1-055c-420e-96ab-7b7a42c58460,2023-08-15 18:48:27,Chargeback,Character conference several idea may can.
a99b1afb-3be7-4646-b5e6-3704d07cc265,96559cc3-eeeb-4157-a7f9-912b00cb75f8,2023-08-21 15:51:09,Suspicious Activity,Those voice ahead doctor yeah wear.
b1157cbe-1483-4be5-834a-12a883a4d4fe,ca01f536-906f-4d24-9993-dd29a90c1a06,2023-04-21 06:04:26,Chargeback,Much forget view thousand meeting.
42051def-7cb8-442d-bfa6-39414914e6e1,3387dc6e-f3c9-451c-9ecf-2a6bc3e4d811,2023-07-24 05:27:12,Chargeback,Science Mrs where amount reason.
7ce8b5d2-2296-4ef8-b057-337f168cf005,46f67eb8-f934-4c53-81fe-3f7ab2bd8568,2023-08-02 23:59:21,Chargeback,Focus act home majority science tax.
3b167e42-893c-423b-b257-0e8601e9253c,9d99d913-f2df-4186-b4e3-f2833fe214e7,2023-04-13 03:53:05,Suspicious Activity,Republican exactly strong natural southern often guy.
816eec4c-f889-4cb3-b4fe-c4ac4db61a5d,c9421f22-d750-468a-a8e7-446a933b31dd,2023-06-14 06:45:02,Suspicious Activity,New add collection environment nearly offer.
e2be0c19-852e-441d-9953-8c795bf048ef,0df06732-5c28-4988-a055-1f62ff63a8be,2023-03-12 23:20:15,Suspicious Activity,To order require like.
04d9b58e-b32b-403d-88b4-947e6044a70e,92a6aceb-5027-4a45-aa93-647dd96d5562,2023-08-18 12:54:17,Chargeback,Over never space dinner movie traditional.
