Fraud Alert ID,Suspicious Transaction ID,Alert Date,Alert Type,Alert Description
1d79098d-4271-4be3-910b-7703dca66a20,529316c3-93a7-4954-a883-0ddf74d9b918,2023-06-01 03:06:58,Chargeback,Conference quality individual sure style listen article.
930c0db7-2a6f-4330-b7e9-a021bba3289c,19642ade-dad3-4037-94c4-a03b9af4e129,2023-04-28 15:41:12,Chargeback,Question agent Mrs situation if performance support often.
cc3f0243-5ecb-4679-a8ff-5d2a1b63e45e,080ce6a4-b3df-4f41-99d7-4359c6b6b5ce,2023-08-08 07:02:43,Suspicious Activity,Executive tell difficult deep movement everybody indeed.
35cf7047-94c0-40e2-a730-945ff6c8249f,452e5f4b-3de5-4744-bddb-d0c0bac01fe7,2023-01-13 03:01:08,Suspicious Activity,Be particularly could.
ca201dea-adfe-415a-b399-1d47704f360d,433305ba-2f4d-4403-b748-984409be4bac,2023-03-03 10:36:09,Chargeback,Market throughout meeting care impact none.
57577fea-d8d1-4809-b83a-2ac736726446,e9944472-598d-4734-98ac-58c2130d74ec,2023-07-18 11:05:13,Chargeback,Address position century past campaign effort eight.
81ab8dcc-43c0-4bab-aa6e-0e1a35a1af37,995b79b8-c797-4c03-9ab4-5dd5a06695a1,2023-08-19 06:22:30,Suspicious Activity,Debate accept fact.
b84cd592-30af-49ac-a0b4-c6f96ae9465a,e4e2e399-ca4a-4f13-8cb5-0c7211aa562c,2023-07-19 10:27:43,Suspicious Activity,Show next chance.
25234956-82f6-4b4e-afbf-90ad4af44eac,e85181e6-fe09-4688-87eb-29baa1a8b059,2023-05-20 18:15:56,Suspicious Activity,Hot force tax television positive.
f57daf91-7201-423f-a06e-f735133a9e8e,c390a683-27db-4503-aea2-2b2e8c0fd799,2023-07-23 06:34:05,Suspicious Activity,Among realize involve pass once.
3b45a630-90e7-4730-9314-770a78762026,b2d3f928-e15d-4fa6-b379-1881abe74747,2023-06-09 05:18:14,Chargeback,Myself laugh international see their red strategy.
a8f6182e-db47-4623-919b-dbe13c78a59c,ed147d15-ef44-4b91-a354-1c4da0489267,2023-04-09 16:05:05,Suspicious Activity,Thought ago son important mother tonight decision.
3e24832b-7b0f-403e-b7b4-a5f62585b651,83f9ae2e-c07c-40e6-8869-89f35460f525,2023-06-18 01:03:05,Chargeback,Quickly to drug forward strong seem economy important.
04b6e9bb-faf1-4c7d-a743-8f969a0d7b9a,f768c278-3afe-44e4-ab67-c52d1ade6289,2023-03-10 09:42:50,Chargeback,Chair look trip offer idea.
0bcfc2cb-5b55-40f9-9fb3-a79005fe902c,2ccbbf1b-6a52-4a6b-98e7-7992b9cf2871,2023-05-30 01:47:34,Suspicious Activity,Do staff high work form.
8b4212b7-c12e-4485-ace2-796c9d50a4bf,b8564bce-9861-4044-a6e3-25fbe1a99ce6,2023-01-11 01:28:46,Chargeback,Keep step just push little.
4841740d-f3b4-4254-a126-321c3ca1ea03,f5e77eef-427f-4239-bd00-4104752ec4a1,2023-04-15 09:42:27,Chargeback,Base staff field everything.
4a74256d-a360-4dd6-af0d-4b6d5bdd9617,03bfcb1c-a2ca-4aee-ab93-62aaf48db6a4,2023-08-04 11:07:36,Chargeback,Impact benefit understand dog.
72d5eddf-a096-4018-a53f-1eb28ea139c6,78c014d8-297a-407e-a8ff-f0bcf09a57a5,2023-03-21 04:43:43,Suspicious Activity,Anything range political budget table nearly wife.
8d990801-3d24-42c0-8612-57a048196591,12eb9ab0-399e-4412-9c3c-5d0ff22158a6,2023-07-20 13:05:48,Suspicious Activity,Take also bank affect at.
80e6aa47-dcf5-45b3-b7ca-3ec7e769f64e,57f24e78-8128-4397-a04c-94446612fd4d,2023-06-28 08:55:34,Suspicious Activity,Truth throughout represent low part perhaps.
9b1080bc-dc45-44eb-bc6b-23a02ca670ad,9ccca8d9-bf0f-415e-b359-d874a354fdca,2023-02-28 10:47:02,Chargeback,Method none meet rise wish begin.
28324b86-1704-4f30-bf35-495b1844488c,ef40c96a-b2d1-4027-895a-29d103bb9c93,2023-08-19 21:53:38,Suspicious Activity,Choose value color economic hour.
f9aef728-bc50-4aaa-be18-a039faba918e,eab80db7-028e-4795-aa1b-7037b26a94eb,2023-01-11 23:06:57,Suspicious Activity,Notice international country medical financial wish whose.
ea4e8c38-052f-4989-ab99-753931b63850,f6c439ec-40fe-4b1b-8286-d0962810950f,2023-01-06 21:31:52,Chargeback,Back their Mr director capital protect.
4933f829-6a7b-4d6c-ba1d-2ce10ac1ca6b,0233e7e2-ce30-44f0-a31c-5c3fd808c696,2023-01-11 00:42:57,Chargeback,Local main bill decision west education act when.
00f83c7a-fb78-4f22-83ec-c83bbff1ba93,2b5d56e5-6814-43b6-9a84-4b8c11d4281c,2023-05-03 16:59:00,Suspicious Activity,Week trade dinner recognize.
c8a80312-7a63-4566-aebc-08ace7f57d51,57f24e78-8128-4397-a04c-94446612fd4d,2023-05-29 20:08:11,Chargeback,Operation less down down.
863b28fe-6805-4382-bcb1-54ce61d07e3f,92ce9198-7b69-4c4f-a33e-17388ef03fc6,2023-02-23 16:22:09,Suspicious Activity,Word grow far.
f4569759-32d5-4bb0-91be-2bbf994e6fcc,d08ea042-5fc0-4176-a90c-1225d3f7346a,2023-03-21 03:26:47,Chargeback,Present only wind research.
7b8d9dc4-23c0-4c47-b2d5-cafe7d8fd09d,6e2d275c-32a8-4e9d-bb11-3519bf199af3,2023-07-29 20:46:41,Chargeback,Center believe mean institution stuff laugh.
f5b0948d-bb20-43b3-8e8b-910b4ae81b5a,ee3885c2-ef9a-4f27-a0a6-347ec326a7f0,2023-04-19 04:36:25,Suspicious Activity,Eight affect scientist cultural life individual picture.
8683ce66-9437-4410-85f6-1eec68fb5df2,33f5c519-2dce-40ab-b3f1-6412a6aadf5e,2023-06-08 06:55:39,Suspicious Activity,Southern know away visit nature hour.
12346f65-f66c-4681-9bab-cd6e8eda9b3e,37b05de0-2df4-4d7a-9d76-1958cf8b284c,2023-05-09 19:53:47,Chargeback,Media particular huge to skin.
dcb5589c-eb72-413d-abf9-23be8a2774f2,e7ca6c31-701a-4630-85ba-569115495cb1,2023-01-17 11:49:47,Suspicious Activity,Experience chance charge quickly appear economic.
cc78e3fe-4252-403c-89de-d04b0863683e,1d94ed04-0f58-45a4-b571-1d2e5bf8ef57,2023-02-06 10:46:00,Suspicious Activity,Only policy pay.
e86f4643-5ad0-4f29-bbf7-626c6618a01f,af549ee5-8027-49e1-a1ab-5b541e19ccce,2023-05-08 14:56:01,Suspicious Activity,Product table financial best garden performance right choose.
f12c4ae2-af7f-4dbd-ac41-3419d45e4528,5b482fb5-304b-49b1-80d9-74c7528c1021,2023-08-02 17:41:29,Suspicious Activity,Coach outside certain near stop allow follow.
2f47e25c-e06c-4be6-b364-8fd84c36a390,209b5c3c-eb84-4f20-975c-9dcb65c55a62,2023-07-30 01:00:50,Chargeback,View leg up put interesting paper.
51911c4c-500e-48dd-abad-4e2cd7e65fc3,d359d8b5-a3c9-439d-8ea0-ce6064f94e2c,2023-02-05 20:56:46,Chargeback,Rule smile entire suddenly industry price them.
fbb27aee-5f2d-4249-80af-96db41fef39a,6d1dc73f-4e47-4ccd-bd14-fcd18e90f02b,2023-04-14 21:34:38,Chargeback,Bit clearly small expect best teacher adult.
dee0adca-0cba-45ed-a670-04b6df31bb0f,b5fe90ea-8a0a-4b07-be7f-622b9c90855b,2023-03-13 14:16:52,Chargeback,Who ok future.
a1ca70bb-0be7-4ee5-b5cc-402fe5d94bfc,3524db9a-f397-4f60-bc6b-4fd09ac4a804,2023-04-19 15:17:53,Suspicious Activity,Understand response while style.
cb249ac5-6298-44af-9b77-3f32af0e780a,3ce82619-6635-4cbb-90e3-57a78cfaf536,2023-06-26 11:28:10,Chargeback,Term commercial interview send both tree.
79850d67-233b-4cb1-844a-2b640c5025f7,9981485a-5aae-476b-8dfe-194bcb94b620,2023-01-06 19:42:35,Suspicious Activity,Away up fish.
5bf73d18-d57f-4eb7-99b9-b7882c0785bc,6bc8f8e2-03bd-4e99-b02f-b8f2b4aa8576,2023-01-19 02:18:57,Suspicious Activity,Job brother place modern.
bd905ae6-1824-43a0-a046-a328d85ab3be,452e5f4b-3de5-4744-bddb-d0c0bac01fe7,2023-03-14 15:01:09,Suspicious Activity,For myself notice real me nor.
fc095028-4586-4913-a6a4-3a1dabbd182b,a1be0496-6091-4b0f-98e5-4c4dd25344ca,2023-02-08 06:31:32,Suspicious Activity,Page task whether turn we mind meet.
29b7e8a6-8e3f-43cc-b2c3-a5ebbd7ba179,f4a2aaed-07c3-4310-89cf-c93999ed885c,2023-08-05 02:17:23,Suspicious Activity,Everything spring picture ten as.
46736268-2f33-4021-9451-8b51a4a69336,faeba67c-c098-4133-8cdb-0f2376a57fc8,2023-01-02 00:02:49,Chargeback,Training score from.
cad10fe7-1ba1-43e2-9c19-22d4fe5927ad,d71a2113-50c5-4161-98cc-d62aaaab94b4,2023-05-25 03:51:58,Suspicious Activity,Thing that star movie only create admit.
b059aa12-bc2c-48fe-a72a-996434311837,370473a8-dcf9-410e-b502-b7a93b02d94a,2023-06-23 01:55:16,Chargeback,Large score interview recognize subject industry.
146f89e8-e69d-4755-add1-7cc88a63bab9,ae914e85-d4b2-4b98-baae-f89697da99f4,2023-07-19 14:42:50,Suspicious Activity,Response white teach trip organization.
97796251-6874-472a-8a58-94814886ea25,07f79f48-edcf-4227-ae22-384e4c27b89b,2023-03-23 16:41:19,Suspicious Activity,During design amount couple fly.
d930b4e1-b6b2-4ef5-b71c-e29e97598f7d,3f9616ef-4598-4985-9a5e-35d5d75f55bc,2023-01-07 03:30:36,Suspicious Activity,Finish pay seek.
f314e0d6-cc98-49dd-a264-f35d19a093c4,3c62e16f-a055-45ea-9b71-3938d4139f76,2023-03-12 11:52:24,Chargeback,End personal call thank truth.
ba489509-a706-4984-beaf-fea0b4028913,d4f8020b-aeaa-433e-8476-269ce58f0c7b,2023-03-24 14:31:47,Suspicious Activity,Wife term increase team commercial approach tell.
b8b7adc2-e3bd-4ed5-a659-36c3ec48e836,a7a1dc77-d6a4-499f-99e1-8bc939c28f95,2023-07-25 14:47:19,Chargeback,Kid opportunity maintain mission individual change.
6b7c7246-add5-4f9e-84fa-dc1f2df4e6ea,5228b041-4d69-4bf6-9e45-442ce899691f,2023-01-22 08:15:47,Suspicious Activity,Middle task own material begin present.
648c3c11-0768-477f-a341-68b42754b5b4,14315a38-b99d-4b04-bb5b-0230396f2108,2023-07-17 08:21:49,Suspicious Activity,Relate before reality everything.
ac43fc9a-ca45-482e-9d04-169605f9fb4b,77102a26-3b35-4fd6-b040-fcc80b3aa04b,2023-04-27 02:30:05,Chargeback,Home different break school color.
bac948e1-8dbc-4383-a56a-d9173416bd0b,7f5166ba-5f71-44fd-b04b-cdcd57f9ec42,2023-06-27 03:58:30,Suspicious Activity,Nice rich admit.
67751e96-265c-4d3b-8769-9323ce52eabc,00ab853d-a0ac-454f-9d7a-a516474f13b1,2023-06-30 14:35:56,Chargeback,Support throw charge another.
89d86550-d2b6-4386-802b-24b17e2913ff,d9c7b2cd-85af-4453-b35e-8ee8390dc4cd,2023-05-15 09:00:11,Suspicious Activity,Success audience official history alone interesting.
250c33f8-2c0b-4200-8ee3-67a66af85575,995b79b8-c797-4c03-9ab4-5dd5a06695a1,2023-05-22 04:55:59,Chargeback,Control study whatever one admit money.
8bc87a9b-b3a8-4b02-aef7-a0b17bdfdf88,746a51b0-bbf2-4d65-bf4c-91e7a7acbe2d,2023-08-01 12:46:46,Suspicious Activity,Floor partner spring executive break blue.
7c5acda3-3bd9-4326-95ba-fec987e71ddd,fbc2d66a-aa15-4849-a5ed-8a957f3cba26,2023-04-06 04:51:32,Chargeback,Indicate scene involve protect computer.
9f3fdac0-46e5-456d-ac65-9c4eebf58119,2ebe8d5e-cbfb-42b8-a38b-5fe707a0c163,2023-03-15 17:37:01,Chargeback,Seven society system.
33e3243c-acbd-4bfc-8804-a9aa7b706489,e7ca6c31-701a-4630-85ba-569115495cb1,2023-02-23 20:12:49,Chargeback,Computer decide instead.
8153989e-a450-4a11-8548-90241a52afe2,8f264b7f-f150-4231-b0ab-8692e8259b36,2023-03-11 07:13:40,Suspicious Activity,Day American teacher front.
efc1cba3-75f2-42be-8933-09509905b134,a81ba34f-5bf6-4cab-9227-7f5b4bb3582e,2023-05-21 13:31:11,Chargeback,Cup actually protect under.
0a7a2162-6c47-49ba-810c-b4c063f9eabc,1397fd28-c8ef-4bf0-97d9-78f2a020f493,2023-04-01 04:21:25,Suspicious Activity,Partner none city tough party sort.
a0860d1b-a3cd-4352-a3f4-3bc4622f76d9,7bf6566c-26f4-4154-b91c-42f50bfb7191,2023-06-21 16:51:52,Suspicious Activity,Manager break evidence my behavior simple source might.
4da9e4ff-2e43-4729-9295-cbf9476496ee,a326f78a-4a7a-4e1a-8549-a539df5ce391,2023-01-20 14:50:56,Suspicious Activity,Old enter option decade end.
eacbd622-d82d-4348-8f7c-b4c403473bc7,6d1dc73f-4e47-4ccd-bd14-fcd18e90f02b,2023-01-18 04:25:30,Chargeback,Relate green where performance run plant produce.
c3a3630a-4ac5-45ca-96a4-677ca268ac9c,23ad4f1b-1e03-4c09-975d-b813c3c39f52,2023-02-24 19:35:21,Chargeback,Detail off increase mouth though.
6708248b-7c07-4fd6-b7e8-7a388532aba7,b74f9bda-9057-4eb9-b3c0-a1067f305714,2023-04-30 09:34:12,Chargeback,Successful maintain tonight security song.
6c73b3e8-badf-4189-9cfb-43a3ddd84e20,5228b041-4d69-4bf6-9e45-442ce899691f,2023-04-15 14:25:01,Suspicious Activity,Clear sure administration head since.
1d3d2652-9f5f-4de6-9d17-ed2432d02222,f42f06f1-8bdd-4814-9112-5bef035611ae,2023-07-13 05:03:25,Suspicious Activity,Direction science clear pick.
332b6d52-74be-4e3e-ac5a-71b8356303fa,edb9f858-1e2d-41bc-b92b-ffa7ec2e1cc3,2023-07-10 16:40:26,Chargeback,Professor three arrive laugh majority trouble show.
e4621058-e200-407d-a125-4ddeb7d379ff,0581f73c-7d64-4753-9783-afee7981c66b,2023-04-29 00:58:14,Chargeback,Candidate raise agent including.
490d055b-520f-4f42-94ca-2db83c11c90e,425e89c0-2dfa-4bec-b215-973685752d24,2023-04-06 09:07:26,Chargeback,During major far some Republican.
2a066b9a-f336-4cf5-b3ae-9898d6de2bbb,88236e0b-d4ba-4727-ae7a-b177bba41622,2023-04-22 07:39:05,Suspicious Activity,Material serve party everything red clearly quickly.
215e7efa-a4a0-4e7a-9cd1-9d1a360b2bfa,3ce82619-6635-4cbb-90e3-57a78cfaf536,2023-04-14 05:37:16,Chargeback,Pull financial green to meet two pay.
634b2043-513e-4a32-bb50-e1168d9d0490,5df3e9a7-0f1d-4282-851e-c68c2353f64d,2023-03-30 13:15:40,Chargeback,Same address positive hundred out.
11636b7c-dd43-4927-bedd-ef48a3cef8e2,57b496cc-2943-4cf2-a814-ea15388adaa9,2023-03-07 14:01:11,Chargeback,Feeling type top receive same later.
9fe9cb39-5a12-451e-a5ee-b8a06399d44e,e2ca7ff1-c4f8-4390-a2fd-6c7e7ec72138,2023-08-14 13:22:36,Suspicious Activity,Seem three page allow college national society.
ad8497ad-3cd8-4c3e-b985-432f1ca88e22,8b060c09-754c-4ebd-84e7-a93842687cb0,2023-07-20 20:55:14,Suspicious Activity,Eat popular election along high.
348eed16-67ce-4588-830d-da2fa1da15f6,431c7e02-afdd-47bd-b747-0d3e034b4813,2023-07-06 13:05:11,Suspicious Activity,Fall fall might five piece.
b6e8e5e4-daf4-4194-b1ce-fe4c6dd12522,83f9ae2e-c07c-40e6-8869-89f35460f525,2023-03-02 20:41:49,Chargeback,Baby Mr so PM.
3cecca5a-d16e-4159-a058-b71c5e886f30,29e72f92-d4b9-4161-8fc4-c18d348dbb03,2023-02-03 00:20:25,Chargeback,Material admit human fund property.
8164bcff-59c1-4230-a7d7-1a5f9fb472d7,361b30d0-2c7e-4e69-9a13-ebb9d8ac6e32,2023-05-11 17:35:41,Chargeback,Opportunity box because friend laugh man.
43eb628a-d55a-401b-b997-0c8942b7d267,8967d534-81ee-4657-87fd-4ea52f6e96e1,2023-08-03 21:33:13,Suspicious Activity,However personal firm story your your.
a6ca9b40-2d6f-40f1-a08b-4c8822d3c411,be77b41e-70fa-4cff-8d10-6a4894912446,2023-04-16 12:18:33,Chargeback,Note school agree sit.
67f6c422-77f1-43d7-9479-2b8e28f8f8cd,31d25d84-d9a1-4dfb-846d-3ceae71fb663,2023-07-06 04:39:05,Suspicious Activity,Find action whose name must decide.
d71f0201-53db-415f-8a54-fd2cc51b6dbf,d6b03d03-0fc7-4632-9efc-58aaecb2a650,2023-01-01 17:18:51,Chargeback,Relationship case agency reach task phone home purpose.
afb0f273-6a1a-4074-ae2e-0658809774b1,24a3494c-99cd-4247-babb-ff797e015a4a,2023-03-12 22:54:11,Suspicious Activity,Beat vote physical share receive action improve.
8598de96-be03-4f7a-93db-453dae5dcbed,24a3494c-99cd-4247-babb-ff797e015a4a,2023-06-16 20:57:38,Chargeback,At sure tonight top.
680e4130-a1f8-4914-81b5-5918e5156bd6,1169eb70-edcd-40d2-81d6-b913f6ec5486,2023-08-03 11:44:13,Chargeback,Listen six trial final.
6e1f90b8-0747-47f1-a1b2-90c444eefa57,650f1f73-a875-474e-b199-7c841dabe744,2023-05-10 09:05:22,Suspicious Activity,Race business article describe.
0f41cdaa-7664-4ebd-bc67-7bbc801d1c90,9f6c34f5-09de-4138-ab43-89a0657560c2,2023-04-16 09:17:07,Suspicious Activity,Character former play other who property.
4e8bcf65-2aae-4e50-85b6-8023e64c322d,2193eaff-67f0-4f09-ae10-95c8cf312b57,2023-04-15 05:24:22,Suspicious Activity,Image deep interest land property put look.
8bb2f242-49a6-4e6a-bb25-fb53f5ff7395,b1da7886-9de5-41a6-90e4-123ae716e6f1,2023-03-14 15:47:08,Suspicious Activity,Himself test rate day generation amount special.
7b28d243-7cdf-4d62-84a5-5e2a8c21b2b2,e620e669-d262-429d-adcd-5f4e9be6e73e,2023-04-12 09:04:47,Suspicious Activity,Since thus beyond entire step require defense.
61ff007e-0519-4220-b3d2-77cfac0d8474,969e77b6-4436-48b3-895e-661cb422178c,2023-03-10 07:19:47,Suspicious Activity,Contain matter couple simple model.
ef6d4c08-9f27-4b84-a47f-2f7aeff7f0c6,fee16b7b-ba09-4ca8-b284-7237f3c178c8,2023-06-07 00:59:33,Suspicious Activity,Beat some safe spend well.
b80bf36e-14f3-430d-a69b-db60a88bc5a1,b25d5ef8-b777-402c-8157-e83eb5f64b11,2023-01-21 11:19:44,Suspicious Activity,Despite whole girl father start standard.
3905c8fe-2f54-4076-9a87-4616053d1658,fff21a0c-ae49-4d9f-bde3-687987df03fa,2023-06-25 03:19:31,Suspicious Activity,Several adult painting week family worker tree.
297cd207-c3de-4cf6-bb2a-10287feca351,5cd05d7e-3d2a-4783-b75c-49f55c685187,2023-01-23 02:51:00,Suspicious Activity,Without network recognize yard perhaps them own enough.
f9779753-7b0c-42d0-bc1b-94fcd55e932e,02fdf4ce-75eb-4383-bb8c-f4520e4ccef1,2023-06-23 13:08:40,Chargeback,Foot free time than market management.
beb8f9bb-3a1a-4d53-bf39-54cac4624937,3ec82372-549b-47b0-afa1-4fa74cc24b44,2023-05-03 06:02:01,Chargeback,Project education kind outside three.
9b844e59-bbb1-4ae7-a6cf-56cbd819492d,03bfcb1c-a2ca-4aee-ab93-62aaf48db6a4,2023-03-15 15:50:55,Suspicious Activity,Who size recently history.
c16c3acc-8349-4366-9995-ee154523a55f,9edc47ae-d9ab-4431-a79d-2973db2d1e47,2023-03-24 17:30:18,Chargeback,Lawyer require black coach.
b9bfea75-2ba5-4e4c-8b12-b0dd39be22e7,ce03fbd8-3f1f-4ad6-96a2-95899cc90182,2023-02-02 22:19:06,Suspicious Activity,Fill attack tax experience.
6d151c96-6d95-4400-a019-9fd71e9dcad7,1d0247bf-988c-4e0e-9088-d66c6485e3e4,2023-03-20 03:59:38,Suspicious Activity,People quality usually skin try.
51c29d70-6b97-4868-bea9-9b133b18bf34,46ff163a-8b31-4074-9fae-7c436413cbc9,2023-05-27 02:50:43,Chargeback,Factor own heart.
27f31f5d-425b-4941-a829-34e8e4a6de47,19937031-b1f7-4053-b8c3-968aaa4c37e2,2023-04-17 18:51:58,Chargeback,Unit lay among during everybody everybody.
25cff06b-6487-4fbb-beb4-238724c28fda,112b3f8f-e1f3-495b-970b-f45f89e4c40f,2023-06-28 06:49:59,Chargeback,Eight amount pull risk good.
63b76baf-5a8a-43a0-b0bb-008426ab2828,dadb8e9e-2509-4831-9875-31112a7bfafb,2023-03-16 04:51:37,Suspicious Activity,Early room from family local.
6dd8d890-5df6-4705-aa9f-5daf10cb58a2,216155c9-7259-4f07-a179-c4127ee173b9,2023-04-11 00:05:37,Chargeback,Administration sort type low.
0a170d45-2e7a-49a9-9f78-7ea6c8db65c9,32672b3e-ea9e-4d3a-87b3-6c23f4fdc77c,2023-03-23 04:08:55,Suspicious Activity,Learn argue star some city letter itself.
5c8194db-42d0-423c-845e-d4f55e596efc,f482e8e2-e0d6-4e38-ac4d-1d243b4414e2,2023-08-13 19:24:17,Chargeback,Guy artist fund man.
cb0468ba-52e6-4104-87d0-b88d639c9362,e97c02ac-9ddd-4ffa-9e57-92b391daa7db,2023-01-10 11:21:28,Suspicious Activity,Citizen contain idea dark condition choice.
90f283c8-43c3-4dd0-92bd-1e021120f63c,375534c3-e848-49a6-9000-29b21dd3fc01,2023-06-07 23:24:26,Chargeback,Inside bed mention young.
037d1ddb-073a-44bd-a2be-18b15c042908,1f95351b-80e7-4d68-95ab-f91fc6f185e6,2023-01-14 21:29:53,Suspicious Activity,Able benefit already such write bad level.
27a4058f-9d87-45f4-8a19-7c30463bbdd8,b2137c90-f587-436a-8c31-926d6f14bc89,2023-05-01 23:36:57,Chargeback,Onto sport subject key week once policy.
019c50e9-084c-4f1c-8467-ce7dead91a89,bbaa2b65-9844-4cb1-ab1f-3ba3e68f0059,2023-03-29 16:28:17,Suspicious Activity,Price surface water very teacher.
73021cd5-eb4b-467c-8b4f-073d23765555,ada8daf0-4cf1-40c9-9dce-57c83b473557,2023-04-12 13:33:09,Chargeback,Yeah business church receive.
4f8aa299-1e78-4797-ac1d-46bed18756d3,fe8c87cc-69e3-438a-a242-8134aa92c2d0,2023-02-11 19:45:50,Suspicious Activity,Another financial huge together.
2e4e36f1-85ff-425b-840a-f17fe1daef49,e1da415a-1b69-4eee-88fa-1be9ae1f4c7f,2023-06-27 13:51:11,Chargeback,Evidence head player floor inside traditional get.
18adb015-03c1-429a-9c67-0d17ab67d5cf,86c07c5f-afbf-4338-a406-994acd6b8f14,2023-01-26 09:21:46,Chargeback,Hold social federal single person.
b1564dc9-841b-427d-b024-977478334ff8,75222354-b3a8-4812-8916-ca13da869f42,2023-08-14 01:10:40,Chargeback,Little garden each admit study fish.
fe30618a-1a4a-445c-be3e-781e8642e670,dd26b4bb-3387-46d8-accb-759e8e0de74e,2023-08-03 15:06:48,Suspicious Activity,Rich medical son morning catch.
6d4629eb-8eed-4912-a8f1-26f5ab689964,e4731bf6-62e1-4df7-97c5-02296c270998,2023-03-08 10:24:41,Suspicious Activity,Seem large decision fight eight.
9240d4e0-b695-469e-b1de-8c54128f7ad1,d72c5512-6d2d-4f4a-bdbb-97a8c92640eb,2023-05-09 19:24:36,Chargeback,Success my less detail trouble these.
4467497f-89e0-470a-b17e-b6a1c010e9d1,861a3a9e-a0d4-4246-b3f6-a41cb852f436,2023-07-09 09:45:24,Chargeback,Fear as final miss successful property.
1b9504ad-2703-486a-83cc-ef62202ccf55,9f30b093-e4e0-43f6-8943-27624b862b74,2023-02-14 10:11:38,Chargeback,Simple since place professor center.
de32d2c6-be42-48ad-af2e-06a9e48db2f6,edb9f858-1e2d-41bc-b92b-ffa7ec2e1cc3,2023-05-07 06:09:23,Suspicious Activity,Mrs measure performance speak eat save.
22ca44b6-4c3a-4d26-afcf-e2b341b8db88,458b2ce9-b304-42f9-83a4-44e26281550d,2023-05-13 13:29:44,Chargeback,Different space culture.
ee2583b3-1895-4626-953e-14ce24663f20,b7dfb613-d29b-4938-b01f-e4e94a33dc21,2023-03-21 17:38:47,Chargeback,Leader bill near notice accept.
ef5daca5-6893-4a8f-a74d-4b342464e4b8,0d8818f2-34ff-4dba-a1a5-fa5fd931d66e,2023-07-27 05:35:00,Chargeback,Send at position address.
7c000014-2fb7-4b4e-940d-c3680c71518b,01d0f651-4f8d-4621-b00e-a4f56bb0efe8,2023-07-01 00:03:03,Chargeback,Consumer special hold college never community.
488a31f4-ca58-455e-ac12-c3ef80ea3ead,2d2f4862-7a24-44e6-9695-2a742f6fd3a2,2023-01-11 13:39:48,Chargeback,Open traditional audience particular.
17675eba-2476-4d3d-baef-595592422bf1,23ad4f1b-1e03-4c09-975d-b813c3c39f52,2023-04-13 15:33:55,Chargeback,Cover provide realize pull rest.
11c0a1c4-30a6-4187-84f7-dcdce966520c,cf09c698-05a4-4e0e-bc2d-e7cb446b0317,2023-02-04 23:53:19,Suspicious Activity,Late future lead treatment leave study me.
a88fb3fb-a765-4b4a-a18f-de3193e15851,19325889-79ae-496e-ac52-84308d153190,2023-02-15 15:34:11,Suspicious Activity,Activity road war leg become east.
ab1ab1fa-f5af-48b6-a386-3cace3c263cf,e237d72b-90d2-4390-a2e2-d0ccc48db495,2023-05-16 16:58:48,Chargeback,Necessary figure watch business never clear stage five.
538ee7d6-29cb-45ad-a96c-746c03d4aa43,2193eaff-67f0-4f09-ae10-95c8cf312b57,2023-06-13 18:00:19,Chargeback,Red follow toward not expert least.
0a45fed7-9c28-45e2-ac8a-b7c95c065bbf,361b30d0-2c7e-4e69-9a13-ebb9d8ac6e32,2023-07-06 10:29:15,Chargeback,Daughter plant or tell box like college.
ad68c01a-e9ee-4388-8cbf-0f8424ad5c3a,991a3e94-00ce-46b0-b44b-bd4490f8ff18,2023-06-04 12:23:57,Suspicious Activity,Wait part loss stock election late.
5258e977-0b85-4be0-aa5e-9ece97913803,471cb8bd-68dc-4fc3-81bb-c7c4cf745285,2023-04-24 15:30:16,Chargeback,Home do pick ago thought.
496ad9f2-55fe-4183-88de-7d6ae20902f1,b0f58c03-09af-4ff8-a3c4-63b143615709,2023-01-31 17:32:44,Suspicious Activity,Song always action father.
dfd28a8d-2ee1-432f-bcb8-d49c62789984,86b37fd3-8729-497e-8473-4dba7af1ec4d,2023-06-02 10:06:43,Suspicious Activity,Develop according wall senior environmental drug these effort.
457d990f-ecfe-444f-aba0-c9a4b9be4998,075bd63b-05e4-4538-81c3-c2d14f05ad05,2023-02-04 06:09:52,Chargeback,Partner should who apply apply.
d5a585db-cfb2-485c-aa07-f5c0b95f775b,ad4ab4a7-1bf3-4a6d-a287-236aec6a4614,2023-03-30 16:10:22,Chargeback,Ago own read behavior responsibility fly start.
26244c94-21de-4761-958a-483c724f30be,9fa5ec3f-b03c-4a83-b68b-ea4780b92d25,2023-05-30 04:25:14,Suspicious Activity,Arm world sell case stand.
e3a58098-1971-47f8-8ff1-6ba4b5d89086,21cbe5bc-a724-4f12-a946-56676b14deeb,2023-01-15 23:21:17,Chargeback,Travel early current factor magazine mouth year.
f19785d7-1c3e-42ba-b9f7-a163d9967ff1,35d2b354-fa01-4fdb-a032-dd48961779bd,2023-06-15 14:49:06,Chargeback,Particular success life million.
27b7867c-59f3-4b98-b728-d295a951e4d1,1829b6c2-2f88-4ac6-a58f-0d302e81a821,2023-01-17 01:22:50,Suspicious Activity,Issue list single million individual within nature hard.
7e695aea-6345-4c59-806f-af0a8eb3273e,638a78fd-2f22-4e8d-8430-b09f2ebe0e09,2023-08-07 20:21:35,Suspicious Activity,Treatment outside always party.
f70139cc-bd74-4da7-9b88-c36162ef22da,d72c5512-6d2d-4f4a-bdbb-97a8c92640eb,2023-07-13 23:59:50,Suspicious Activity,Remain produce military this week race tonight explain.
bf384e9c-ea25-45e2-b782-5337424691d0,2784e1b4-a2d1-47ff-8b0c-74c156c1d44b,2023-05-16 02:43:54,Suspicious Activity,Court entire whose marriage bank impact.
1750201b-5b9e-413d-b3d9-5b8e50ea4fdd,22616205-eef3-4d49-9fe5-7e633d7cc410,2023-04-19 18:12:58,Suspicious Activity,Language treat book church.
9369df3b-c0a9-49f2-b0b1-d00065be60fe,fffa3f7c-b1b1-4096-a32c-fdc6ff295ee7,2023-04-06 15:46:31,Suspicious Activity,No identify other number.
7b9cb8c9-a544-4d4d-8617-dda130bea58a,5818f10c-0806-410c-ab94-02a8e3631ac5,2023-02-25 00:18:26,Suspicious Activity,Should across same grow according race charge big.
e343bad7-d25e-4a71-9c1b-f55b6827c98c,31e3122e-8136-4b73-bcb2-0621d9e5056b,2023-03-08 11:51:46,Chargeback,Director idea here sport easy should step.
b3b5706f-c30d-4582-a5f6-2db739ec72c2,20cd1a89-ef59-466e-91fe-cc5b539a3915,2023-06-02 00:00:20,Suspicious Activity,Safe focus this direction three age relationship into.
8d713457-92c0-4565-998e-2dce6fa3889b,60538fde-8e4f-4162-958b-b76f8daa2a0b,2023-08-06 17:35:09,Chargeback,Police attention structure join song onto daughter.
562ae918-8031-4727-b468-c56b1ab264d9,c4e2813c-cc40-4976-9a55-34b34ce27056,2023-02-24 10:58:03,Chargeback,Approach case car structure team behind.
8074ab70-e77b-49ca-a151-bfd4b5d6e67c,4eb88f27-9a7c-487b-be7f-b086d1dd463a,2023-01-06 18:06:50,Chargeback,Alone education operation might right.
b01618f8-0e09-4088-b8b2-4e212b68ca19,f6b27b7d-544a-44d4-85e1-5373a2a09dc5,2023-04-04 10:02:06,Suspicious Activity,Movement trial any such argue discussion not.
f5695cd1-ae0e-449d-b624-c9c9d76166fd,e539d4c0-7077-49b5-9b70-c2a304e8c7f4,2023-01-04 06:00:26,Chargeback,Leader to life I bed look.
7820f696-16a2-4f8a-9a6c-e2e14ba627d3,c552bd53-9cff-4fed-9ef4-8d3d474b6f8d,2023-01-27 16:46:24,Chargeback,Mission dark record miss see.
c56c33e7-e900-4822-858a-21d4fed5f4bb,198ffc14-79e0-4ca9-b6d5-a9a5b76c7dd7,2023-05-11 21:19:40,Suspicious Activity,Service dinner arrive describe.
460b8a09-39fe-4b6d-ad16-916e679d3553,14315a38-b99d-4b04-bb5b-0230396f2108,2023-03-13 08:01:21,Suspicious Activity,Cold attorney poor mind avoid conference poor off.
