Fraud Alert ID,Suspicious Transaction ID,Alert Date,Alert Type,Alert Description
970ff5af-c586-4ddf-bb0b-2687dfc08485,ca01f536-906f-4d24-9993-dd29a90c1a06,2023-05-21 13:04:51,Chargeback,Remain value guess plan pick experience miss.
2574c034-a4c5-4ee8-8a51-d42cae433372,997e95f5-2683-45f6-bbd7-4a4e5c969b0b,2023-07-26 13:08:41,Suspicious Activity,Security clear agency including gun through discover.
56821344-4721-4ecf-a0d5-d9778fa91b82,e56d166a-307a-4b29-9217-6b7ab4b2f050,2023-06-17 14:44:16,Suspicious Activity,Professor sport trial interesting.
18612011-dcdd-4069-87b5-183729443810,783ea745-cc80-4afa-bb85-4863329dca4a,2023-03-11 17:26:10,Chargeback,Poor admit agree mission stay later.
d9422145-0555-4067-89d2-faf8bf295906,0581f73c-7d64-4753-9783-afee7981c66b,2023-04-17 07:05:20,Suspicious Activity,Half too much market body watch.
d2c13c2c-faed-4704-9c8a-6f9c2842b95b,c86f5e2c-b31a-49f6-b12e-b3a06b924714,2023-04-05 02:46:30,Chargeback,Each assume figure.
1cdff3b3-ab1d-468d-bc89-771e377956ab,6d1dc73f-4e47-4ccd-bd14-fcd18e90f02b,2023-02-10 07:00:59,Chargeback,Few concern program study coach value born specific.
27a0b1ce-cde2-4bb4-bdd6-a5f492d1f1ec,e46f5369-7d84-41bd-bada-7b35da5b0257,2023-04-14 11:35:14,Suspicious Activity,Join box sit meet treat must consider.
e8fb7fb6-0856-4f2d-8a05-877417aaebbb,d2d6b09b-f013-4c49-9be4-81f35d6afc60,2023-01-12 03:11:45,Chargeback,Claim town where end west white your ball.
47072162-5e5f-45f9-96db-db844eb239dd,51af1841-0b5a-4fd7-ad22-b438bb0a32de,2023-01-23 23:23:36,Chargeback,Quickly claim rock sure allow perhaps successful might.
576db3a0-d764-4e0d-90af-1343133057f0,7bfcb4d6-ead7-4a24-abd7-5ccadd1f28c0,2023-02-03 09:17:41,Suspicious Activity,Type need age stock wonder true.
6d7d8ff6-b2f2-4ee6-b7b0-77341de5c467,0d8818f2-34ff-4dba-a1a5-fa5fd931d66e,2023-04-27 00:02:48,Suspicious Activity,Reality book relate year during skill amount clearly.
4198d13b-a003-44be-a6df-8d866905e8a7,f733d587-0b2e-4a60-a40a-687c4f9d638b,2023-01-10 19:28:47,Chargeback,People simply plant Democrat organization.
ca8ce6fb-6446-42f4-af0b-2ed17cdaf532,5b28ec57-e0a1-4eac-bc85-8a6c8db0335b,2023-01-01 14:58:48,Chargeback,Resource whole whatever.
9013b76f-4ccc-44b6-82f6-f7523b1f4f28,5cdce634-0062-4f55-9c3b-01a81e7c42dd,2023-05-08 04:33:44,Suspicious Activity,Art board easy however ok.
41944c64-5614-44d0-9cde-b287d6f5657d,a1b79f6a-efb9-40df-b61f-2e73952b1aea,2023-01-06 09:09:35,Chargeback,Work daughter up shoulder.
3fa9714e-539b-4195-bab7-90f582d026da,2eb2258d-609f-4c7e-87a7-a6231ec3e7d1,2023-07-05 15:09:38,Suspicious Activity,Even live Democrat age enough trial up.
e8a5ae1b-7140-4d9d-98b7-8ded1aeaef32,d2a4362d-2e59-4f09-b4e8-d6d7621c00b6,2023-08-19 16:37:36,Suspicious Activity,No answer protect open rate walk.
a2f194a9-55a6-458c-af11-78397aea9a69,7ac431f9-7fc0-421e-a2cf-fbe498a4feef,2023-07-08 00:57:41,Suspicious Activity,Major protect run able popular.
5fddc285-a2f5-4e96-8791-c1cafc8ea705,c24e66d8-5a38-42aa-bd64-ab3ccc831ed1,2023-06-11 00:38:18,Chargeback,Difficult mouth thank country.
35e097f5-3cef-4bd7-bc3c-2250a1bd5867,02a7431b-eba1-42ae-b803-6e13d13027b7,2023-07-21 12:35:41,Suspicious Activity,If store article there per on road.
45ea771e-8661-4c63-9864-07efe8fcd6da,00377c12-fa3c-44bf-ade4-0acb2b1abc1d,2023-04-12 13:17:13,Suspicious Activity,Wish face Mrs respond.
dcd115c2-b0d5-456c-9630-60e7772bf02c,3387dc6e-f3c9-451c-9ecf-2a6bc3e4d811,2023-06-07 05:51:41,Suspicious Activity,Gun mouth girl would.
a44a75a0-b8cf-41f6-9a1e-9b1b77cdde74,0215beeb-c1c7-4dfc-a0d4-fbb48d0d6b3f,2023-03-23 15:53:20,Suspicious Activity,Either true theory much argue.
ecb192f7-838d-4e35-bb71-59ecc4bb2f8a,834253d6-04ce-4971-8555-d9e5ba00296f,2023-07-16 06:35:27,Chargeback,Child industry degree arrive employee strong many.
7e103d20-e9eb-4c9e-a3d0-ad1f48cf9a98,3db0600f-afa3-45db-a5f0-8f251af5104c,2023-06-25 14:19:40,Suspicious Activity,Fear program agree couple already food.
19c8ab34-7445-439d-96d3-913779099628,bf4d08e2-2498-4709-a671-deac89ec94f3,2023-05-10 18:24:24,Chargeback,Cost page girl.
74aea19f-47dd-44ac-923b-7f73ce520681,3ec82372-549b-47b0-afa1-4fa74cc24b44,2023-03-04 10:15:43,Chargeback,Scientist because item itself ground candidate.
da299499-217b-415a-98a8-e5064e6972ed,024ddd0e-a40c-43fd-bf69-c1047759d4b9,2023-08-13 02:30:44,Suspicious Activity,Whom thing occur section.
44d3ab45-6fc2-4600-b222-7474d79c3e7c,c3d21a92-5510-42e0-88b1-c5dd72749c49,2023-07-17 19:34:02,Suspicious Activity,Family science name every dream industry.
c023c304-88af-4200-ae9f-e88a44695951,41a48b47-b21e-43f9-8104-4e4fcf355a02,2023-06-10 20:30:24,Chargeback,Painting bank understand admit democratic public carry.
1aca7c4f-2819-40ad-9eb9-899122dc72f4,cbc61b52-81ff-47bb-b930-5273f9ef1cd1,2023-01-31 08:06:37,Suspicious Activity,Every me letter south policy source organization.
fb0f9089-5db3-4052-869b-2757ff4a1ffb,5fbfef50-6bc8-4061-b8d2-caf2870a3e67,2023-06-16 22:36:15,Suspicious Activity,Of score speak him myself.
b9e7c4db-1df8-4ac1-8553-02978cd471d4,bd54f555-cba5-4c54-975e-5b9d9626fc51,2023-01-13 02:39:02,Chargeback,Than of through think.
cb4c986a-0850-4112-afa2-973ee2acbb95,b59ed2c8-9d20-4855-ad6a-d668b9cd818e,2023-06-01 05:42:44,Chargeback,Cold summer whether peace sit summer.
5f5c105e-1f6a-4977-be6b-0be2c71abfb4,c9421f22-d750-468a-a8e7-446a933b31dd,2023-02-20 21:41:48,Suspicious Activity,Talk source item three hotel lawyer we.
dbac8f13-362e-4ca0-92d0-940a363211ad,29e72f92-d4b9-4161-8fc4-c18d348dbb03,2023-05-29 14:00:38,Suspicious Activity,Morning half pretty identify shoulder standard.
82234e24-67eb-4eaf-961e-b0b9bacd0d44,24dbd40f-a981-4981-9c98-302fd49a505b,2023-01-21 23:48:37,Suspicious Activity,Fall need opportunity nation.
2a32cb76-7a04-4589-8962-63b506458b06,da9c24b5-be08-4e77-aa62-0f4283edaf7f,2023-07-23 01:27:35,Suspicious Activity,Own peace poor news.
359fa813-530f-4bc3-8030-d2a08c5dc779,bd54f555-cba5-4c54-975e-5b9d9626fc51,2023-05-31 04:57:43,Chargeback,Way thank approach consumer often drive letter.
baf2cbab-798a-4b20-8f0a-be469a837d1c,910c87d5-458d-4c06-9309-45115dbdfc11,2023-02-01 05:04:48,Suspicious Activity,Former source career sing.
6662b5c0-aa43-4451-81d8-e67f43d7c590,7f18158d-43e0-46d2-b6e5-ca6a91a29fb1,2023-07-23 12:04:06,Suspicious Activity,Money just girl beat property address.
c0b17e96-c45d-417d-b7a2-d7118421f65a,773ed5c8-c85a-4d94-8be5-02cfa741dc3e,2023-02-06 15:59:54,Suspicious Activity,Fish through accept of current.
a162a15a-2a3b-4d89-adf5-d8f6abb2d206,88168433-d8d4-42f0-aa53-fa7ed45d0dcf,2023-01-26 09:32:20,Chargeback,Plan another project add director beat.
21cbf23b-8cb9-4825-9a3c-4fed147c89d5,9ff0d080-b9e2-4611-9c16-8e96b6e22ef3,2023-06-08 12:17:44,Chargeback,Serious support three score tough impact.
b2e99f64-d767-421b-8723-9dab45647cc4,eb2e18d3-a757-4698-b405-cb39fe43eb2b,2023-01-02 17:00:51,Suspicious Activity,Plant necessary however before.
63b85be8-6ce5-4823-8f23-dba130211c84,50f4e0a1-7dd3-4c52-8380-6e9d28019142,2023-02-10 23:14:09,Chargeback,Site election energy magazine.
e99925bd-7550-438c-a430-90fcc38df69e,425e89c0-2dfa-4bec-b215-973685752d24,2023-03-20 17:12:03,Suspicious Activity,Son industry challenge join management away customer.
18c9af1b-b82c-4455-b529-f134442ed88f,1defec02-3be8-40d3-bf37-8629018852f7,2023-07-29 11:03:07,Chargeback,Unit become position smile interesting authority.
0ce92a35-6828-4806-bea2-a7525bcf67e2,41a48b47-b21e-43f9-8104-4e4fcf355a02,2023-01-21 18:48:19,Chargeback,Term brother another everybody at recently us.
3d7b2b9e-ac20-457e-9a00-6adcab857199,1169eb70-edcd-40d2-81d6-b913f6ec5486,2023-06-25 10:08:05,Suspicious Activity,Own ask chair book.
21c62928-2a6f-420f-979d-85f140bde152,63c37a83-d27e-49d0-8dd8-70d61b013dca,2023-01-01 00:45:31,Chargeback,Unit turn go clearly present protect blue.
f76320f8-6e62-4d90-9fd8-d2a468684e8a,d2a4362d-2e59-4f09-b4e8-d6d7621c00b6,2023-02-22 13:08:12,Suspicious Activity,Difference six many agree interview.
3b78c5f1-5de1-4b31-81ae-cff9011eeb97,3a88003c-d617-4b80-afe0-d937bd7089cd,2023-06-04 13:45:42,Chargeback,Different history series blue road think win fly.
e42391c5-4a4e-4c17-9973-5b448b375c17,6a895438-f74a-4d0a-aab1-90b76dac1e6e,2023-05-29 05:51:11,Chargeback,Truth serious yard campaign bed new.
d92cf76f-45be-47df-b8b1-01b901604d01,6d842776-49bf-47fd-a4b5-df41666b07bb,2023-04-27 17:35:42,Chargeback,Huge officer but offer great administration.
4c79d4cb-52a6-46ce-b768-adcebd0d9a3d,70c0e34b-c1f1-4996-9663-1205ae5963c3,2023-03-17 08:37:43,Suspicious Activity,Around yes despite rock yard.
7eda90f0-e017-48e9-bd7e-d9059620ff7f,00deea60-9771-4e40-8e5d-74d3839b77d3,2023-06-03 18:01:26,Suspicious Activity,Memory course order loss.
4069ffee-7788-4ab2-a63b-a2b6ee3d4f7c,e6d17d30-a224-41ad-8a3c-737e256a8986,2023-08-20 15:20:08,Suspicious Activity,Help happy meeting industry save admit word.
e80f2436-deb2-498b-bd1b-23cf1afd9d33,db83361b-bc5d-4d7f-9f50-19ef14d9d8ef,2023-04-12 12:25:26,Chargeback,Picture responsibility record certainly third.
64aa4d9a-6d52-44a4-b8ed-082ee63a236c,7ac431f9-7fc0-421e-a2cf-fbe498a4feef,2023-06-12 00:31:19,Suspicious Activity,Enjoy rather rest almost shoulder join.
ddd35d02-d153-4b54-a51f-4339fc897467,afc4b2a4-2841-40a9-bf87-6e222f76268c,2023-03-14 18:57:17,Chargeback,War address sign process run.
5ccfbdab-76c1-4095-b7fa-e67638e8f2cd,19642ade-dad3-4037-94c4-a03b9af4e129,2023-04-29 07:03:37,Suspicious Activity,Coach seek list close money participant.
20c1ea19-99d2-4b63-9196-28f0d7c7b71c,43c8927d-660d-437f-9ddf-f28c407bcbd0,2023-08-07 03:38:12,Suspicious Activity,Land start already outside knowledge.
5ac0e97a-e19b-4a73-a284-d8d128978204,80857712-0518-432e-928e-e06f88da65ff,2023-07-25 01:17:10,Chargeback,She door image fill want create later dark.
73690c60-7803-4217-854c-68efc70d8a26,99a4b9b4-3009-4fc2-a821-8e377d3e7d4b,2023-03-24 22:49:11,Suspicious Activity,Pass find bank defense but offer.
af12e8fc-6230-4fc0-af6c-10aa45836c63,e9d0b264-c6b9-44ca-8caf-ad9b6dfe0f8a,2023-07-07 17:31:03,Suspicious Activity,Call modern he person government possible win.
d34589f3-c919-47d7-84bc-c2c8854df2bc,ecdcc61f-b312-4dac-a517-6351f27f03bb,2023-06-07 14:16:55,Suspicious Activity,Goal nature scene like huge keep.
564d40f0-f2ab-4231-9785-5afe7d6b2da3,0b304326-6c46-4530-b16b-f16b93ad48ba,2023-06-02 18:57:51,Suspicious Activity,Difference someone personal send whose hear.
85942423-54ea-47b9-b53b-e458bcddd79c,47b01f25-61bb-4338-8545-956e252d8213,2023-02-10 08:46:33,Suspicious Activity,Data item us might population decide job TV.
707a190a-0809-4658-a6b5-271779a3ce74,32416076-7007-4af0-b81a-10a8247facad,2023-08-06 13:21:28,Chargeback,Nice lot stop seven perhaps security beat.
94404242-2b72-4fb8-8e45-f10a94d18a34,57b496cc-2943-4cf2-a814-ea15388adaa9,2023-02-23 15:45:17,Suspicious Activity,Region market rise buy.
f07209b7-5fa0-4621-867b-bd8b52ed54ff,c5a60f7e-7515-43cc-827f-b1baa899a500,2023-04-28 10:34:05,Chargeback,Young nor player be spend.
af51e8b8-84fa-43e7-95e0-24d024e1d8fa,574037b3-42ab-4866-b0cf-47d2e4134486,2023-02-08 08:03:50,Chargeback,Present oil buy control quality available the.
06279536-7d66-4d9c-a9e2-6d6cb2b0cae5,6f0be31e-670e-4f56-8252-651fbaf1d047,2023-06-26 19:19:04,Suspicious Activity,Draw employee example ever discussion.
e7d66bbd-398a-4272-8309-d1bf8cba7b6f,e4541e24-5600-46fb-8514-b74152f94f0d,2023-07-06 06:16:10,Chargeback,Political several all decide.
3070192c-9ca6-4211-9ad0-b6be58ce8946,0fa32ddc-7d0d-4f93-aa50-1aed1d030cee,2023-01-15 20:36:22,Chargeback,Republican staff may rule lot.
a5c23aa0-94ad-4b18-a35d-9e69de40bdda,b59ed2c8-9d20-4855-ad6a-d668b9cd818e,2023-01-25 14:08:48,Chargeback,Suddenly bank manager property example.
c8028225-1994-4fda-b12e-4a00a42c455f,347ecefa-d116-4e41-8846-9747fdd1fd6d,2023-06-28 10:26:23,Suspicious Activity,Case food especially evening sort theory before off.
260d5646-69c1-47ea-9d36-f8f56f0beeb7,88e1006b-da72-4c79-9f22-c71cb983a25d,2023-05-06 23:11:33,Chargeback,Capital seven probably power prevent.
122c3897-b3b8-404e-8acf-5324fb13d8a2,8fb12e11-c45f-4968-bd9b-64295a2da085,2023-05-08 19:31:36,Suspicious Activity,Every information growth situation soldier later leader.
a0f61751-8505-46c5-add6-c116f0cb270d,942c4407-d05f-45eb-8da5-900dca24b02b,2023-01-12 20:52:44,Suspicious Activity,Movie song support.
a2457b42-2cf7-4a19-b80b-0cafeb26ba0d,d72c5512-6d2d-4f4a-bdbb-97a8c92640eb,2023-01-21 23:26:18,Chargeback,Military key after amount factor them develop.
d11e03fe-01f3-468c-b7f9-afe557120038,cb766214-3953-4777-8078-e7a6fe93519e,2023-05-04 21:38:22,Chargeback,Or example stage every.
81d1185a-e6bc-4b4a-bc38-b183ae52d3ae,6e2d275c-32a8-4e9d-bb11-3519bf199af3,2023-05-21 21:48:44,Chargeback,Moment entire visit source quality different.
0a93bb62-450f-46fc-96fb-fe4f851652c4,0b304326-6c46-4530-b16b-f16b93ad48ba,2023-04-18 01:41:00,Chargeback,Write blood might force phone recently what little.
2a6db2fe-bcdb-4676-851a-f505097fd3b9,7e88f358-7479-46b0-8ae1-f5dc83e57917,2023-07-26 13:39:42,Suspicious Activity,Little later heavy people region major stay professor.
de9ff24d-d22d-49d2-8ec0-667ee4dca840,834253d6-04ce-4971-8555-d9e5ba00296f,2023-01-12 16:19:36,Suspicious Activity,Close debate can anyone.
bed65989-4597-47f4-a1fe-fb039d50b554,692ffc5f-48c7-4017-bfb1-2228cb1c8793,2023-01-30 13:14:58,Chargeback,Raise within wife give condition.
57848c30-342e-4888-adae-8a9a401ff211,b59ed2c8-9d20-4855-ad6a-d668b9cd818e,2023-06-16 03:06:29,Suspicious Activity,Condition party expert.
f520e8a7-825a-431c-9b37-5869313ddf16,5c2bf9e0-0b51-4e61-a68a-8cb5dc3d8b65,2023-05-13 18:51:40,Chargeback,Energy leader against on.
b2cd0b11-b338-472a-ac0e-08ab7c8718e1,c977b6f5-5e13-44f5-a808-2816132061fa,2023-06-29 12:40:36,Suspicious Activity,Laugh contain that summer live expect.
06e3a432-62de-4318-8b44-6b34c01d41b6,24fc1805-2c7a-45a1-ba92-ee3821ec91c0,2023-05-13 07:08:22,Chargeback,Turn husband machine himself according.
3b0e968b-9148-43b9-94ee-f250e3411cd2,71f04608-8719-4fc9-aa5d-80732535b231,2023-04-28 05:08:41,Suspicious Activity,Travel commercial too issue.
58e97d4c-d399-47d0-abca-b715eb332fbc,b09a987b-2700-42bb-8faf-0f89ec841206,2023-01-22 12:14:01,Chargeback,Three deep miss second.
0ec719be-83ee-454c-9771-ab86631084d9,40066626-a5b3-49f4-bd96-c5e4d7be27e9,2023-04-21 02:01:13,Suspicious Activity,Relate yard though environmental program prevent save tonight.
78a666a9-bd68-45d4-ada6-5fc8dd798593,587c0789-02af-494b-a334-4e56ead7a5d0,2023-08-21 00:44:01,Suspicious Activity,Ball per song board inside.
6edde64c-8674-40e0-840b-ea1ec55beeab,1829b6c2-2f88-4ac6-a58f-0d302e81a821,2023-01-29 20:09:30,Suspicious Activity,Wonder final despite today play.
28b9fa84-6405-4571-8a05-c64987eba5ef,670ea926-e2e0-4cf1-9cbb-cf4fdbe2f59e,2023-03-22 14:45:25,Chargeback,Only no down military general society list.
3d42a85f-25e4-4f63-a0aa-2e149be47a4b,33da91aa-eb7b-4f23-b290-3c3849ea0d5c,2023-05-21 17:14:56,Chargeback,Tonight edge foreign pass attack owner range.
e246f1d3-5a0c-4b94-9601-581ef7d96095,9f566e94-14e9-4665-99c6-11cedafdb1f9,2023-04-20 16:11:40,Chargeback,Idea project hotel agree.
a4986e33-2768-421b-9131-fb1ecd777651,7d5c4650-c81c-4bc8-b180-4e0998c443bf,2023-04-15 03:28:34,Suspicious Activity,Example coach material sister.
5618a030-e6dd-4930-bf88-6fe5f3c2bd85,0ce3c485-8b46-41f4-b0d0-c7bc1709ccc8,2023-01-15 01:29:49,Suspicious Activity,Today car late college official.
dc110bd6-c65e-4f1e-b92d-8cecf9c44a1a,fda8e0f9-d695-4368-943b-12ca683cf65a,2023-02-18 10:19:03,Chargeback,American hospital her brother.
b72616a4-64ea-4360-8785-73075af8518f,52f7446e-73a9-4a2a-a7ed-9c2230eda4a4,2023-05-08 19:51:35,Chargeback,Home player white tax little skin positive check.
b70195e5-9ac2-4d40-8b74-182ba995c4df,d915fc55-764d-43b8-8585-9cb5c1ca4e9c,2023-04-21 15:49:14,Chargeback,Degree simply treatment law.
340f5a48-74a5-4f30-a703-449a2d648ca0,c0ff7987-2e20-4a8b-9d6a-afc67cdb5176,2023-03-27 15:55:38,Chargeback,Laugh walk each exist would for report.
964e8d92-8940-4a87-8394-493749c6a031,8d2a6890-cc98-4be6-92c2-2e3c11aa01f8,2023-07-17 04:47:54,Suspicious Activity,Sure movement impact address wear war compare.
33911712-e093-4043-8128-0d1fc3486aa5,825882bc-93ab-44d3-8724-fe82d7456767,2023-04-09 05:57:01,Chargeback,Stop American serve understand international turn.
aa6b68e8-ec2b-4a65-bcf4-5a20eb158d7a,e71feb16-f598-455a-9b19-938cd192d98e,2023-06-13 05:35:42,Suspicious Activity,Protect over toward hospital hard important should.
56ebb7cf-9c98-4ee3-9d31-8fb47a860375,3470428e-68d2-4cfb-b7f6-2bad567fd65d,2023-02-06 08:27:23,Suspicious Activity,However foreign final new sometimes form.
1fb50e0f-d233-4ba0-9afc-446ce72944ea,11d08c8c-d456-4b32-8321-44e1ee024d3e,2023-08-16 00:14:29,Chargeback,Wear worry east around save performance story so.
09f2293e-f0ca-41f8-990f-387426a1e6f4,7412f921-94a3-4150-9218-c9ff0072f22d,2023-02-07 20:45:23,Suspicious Activity,Forget write control save.
4db343b5-56bf-4fd6-92c2-2bd7cf30c174,ff2c1007-8ab7-4a19-b115-3ceaa17b3055,2023-01-25 11:51:06,Suspicious Activity,Fill purpose four peace section seem laugh.
fd127e91-05c2-4c4c-9554-e1d2b9c33898,e526dd9a-2bd0-4ad0-84ff-8180823bf61f,2023-08-21 03:17:38,Chargeback,Movement per century.
5f23ee80-f67d-43d2-81c1-576c33db430c,ba131dec-7ca8-4b42-9238-8cc433701510,2023-03-25 08:12:01,Chargeback,Take difference enjoy lay sea reality.
6f3a9c2f-c1c3-4096-940a-19cd706df109,ae945881-6456-475e-9fc5-a0ada4773d4b,2023-06-24 01:27:40,Suspicious Activity,Chance at thousand base important suddenly.
ff555fcb-1ef5-463d-a66d-48f6fc40c190,548851b1-f110-4ebf-81eb-0eccf47014b6,2023-03-04 14:34:35,Suspicious Activity,Loss design anything.
e92b7e1a-919d-46d5-a7a7-533713d806c9,28e4d34f-9238-4d05-9116-12791c174d1c,2023-04-03 04:37:36,Suspicious Activity,Business hit officer fact option American nice away.
d5f6fba2-0bd0-4d22-834e-8d72bc097eaa,014862da-94b9-4d04-b240-503dbee37057,2023-01-04 16:34:37,Suspicious Activity,Fear offer your see write himself.
91c6b536-9d4f-407b-9307-ab0174ce044f,e499d327-ce36-4552-8b25-b74c2e6c851e,2023-04-02 02:19:02,Suspicious Activity,Gas down more skin.
00dcb7a4-f5ac-49e7-91b4-b80a401a3965,4a2871ac-f5d5-426d-ab7a-559f6932e9e5,2023-04-03 05:45:57,Chargeback,Throughout add everything sometimes today age.
1da60095-b8cf-43d0-b9ce-c0e14f6644a7,e36394bd-1777-4a9b-9268-3fcac5026062,2023-04-25 21:20:11,Suspicious Activity,Assume break just office international show reduce.
ed9164b6-4591-48b3-98db-275512c0e292,20f6b087-d496-4df9-b1b2-dea6c963cfc4,2023-01-03 23:50:20,Chargeback,Wish exactly food energy wife to.
5cfaae41-69f7-4af6-93a0-d5e69eb6d319,ef658792-0842-425e-a09f-f2a38a7ae942,2023-05-09 14:05:52,Suspicious Activity,American force friend increase big.
e516cce4-910c-488c-b989-31cd4981c968,7ec057d7-a5a0-45ea-bab0-9f18643b7ede,2023-07-30 11:15:11,Chargeback,Kitchen feel real teacher.
909a7fe0-91b0-4d7b-936c-676c2a9a47b6,e56d166a-307a-4b29-9217-6b7ab4b2f050,2023-03-31 10:02:21,Chargeback,Civil son trade hear always raise explain.
8ccab35e-91cd-4938-b2a6-ddb061fdbf12,0581f73c-7d64-4753-9783-afee7981c66b,2023-04-15 15:44:31,Suspicious Activity,Law interview win recognize series.
e994fe10-dd0b-4e17-b583-e81dc9857f2d,001626f8-95b1-4c76-b38d-0e0c60f2e37c,2023-03-20 01:17:46,Suspicious Activity,Structure mention peace long important so why.
884dad7c-e786-4d28-9f3d-fc377d22d851,61e2a654-5c5d-4d9c-b087-8804daaff74b,2023-02-14 07:08:48,Suspicious Activity,Low response effect large.
9780a06f-1333-440e-8c25-b93ff6c3ce8d,78c42266-3c26-46d6-bc87-513a5970a469,2023-02-05 22:19:57,Chargeback,Face prevent learn none focus various blue community.
b1146eeb-dc0d-4348-b556-aa7015b1ed6b,9f30b093-e4e0-43f6-8943-27624b862b74,2023-04-01 04:44:58,Chargeback,Much light else mind strategy.
00fa3063-88e1-48e3-a22f-553e2a581ac4,69e5829b-e364-48bc-ab5e-7b34ce1ad5c1,2023-07-18 13:04:14,Chargeback,Medical accept hand future.
f411cf4e-5895-46ec-a138-be4b26b74c82,17a7e348-4a08-4cdc-8fb4-2170437f679e,2023-03-22 22:58:13,Suspicious Activity,Her debate someone land article government operation.
e5d4c1c9-1923-48de-989b-f238d9f1bd9a,9e93729e-22e4-4843-9397-6bef3108a098,2023-01-16 06:54:22,Suspicious Activity,Big from kid word leave believe east.
56c4b5a6-29d0-4cbd-8b4f-c9535dacf67f,f534920d-338b-42bc-b7a1-ad9646758c18,2023-05-21 15:49:30,Chargeback,Someone memory it your young fall study.
e9780117-6d08-4471-be51-578900a0df20,a4a9d16d-512e-4fad-9639-aee2130140fe,2023-04-26 02:17:43,Chargeback,Event purpose care always nor forget consumer individual.
b735d175-6669-4a45-a854-49ad20f422c3,43bc1328-bd13-4ad0-98d4-4c81a241c222,2023-08-03 14:45:44,Chargeback,Design appear fact nation.
98fe6b61-d49f-4430-848a-fab60d7eb1b1,bb42399d-4335-4792-8793-6d6d859033a1,2023-05-25 21:49:18,Chargeback,Fine gun price language report position scientist.
1d63a466-9110-41f4-bb6a-a7afce879c8f,bdc19d04-790f-4483-972a-1e0c014306f9,2023-07-07 18:39:40,Suspicious Activity,Close apply process should.
f2f5121f-aa13-4c25-95d0-575e38373588,4b50e64f-7439-4e34-b0a7-20bff7ae796d,2023-02-01 00:52:52,Suspicious Activity,Accept different line can mouth.
75a1c114-9137-4abf-bf44-ba7940589b4a,4d8b2d50-1ca3-485a-af0c-5328e945621b,2023-07-10 03:00:23,Suspicious Activity,Sit provide speak activity leader power pick.
09727884-d3b0-4abf-8d17-60be5efab01a,cdc72a4a-89af-48eb-818f-cc6523f84dc9,2023-05-06 06:14:02,Suspicious Activity,Arm build knowledge very democratic commercial seek along.
dac8b671-5fd9-4bac-9969-05b53d38ed65,3dfa48f2-35b7-4b17-ac6a-d7647b5759b6,2023-07-13 08:01:18,Suspicious Activity,Million bed action trouble he concern.
53a4dbd2-86bb-4094-915a-d33cb4141019,f12143ef-8183-4e2a-a764-cc22ab4083ca,2023-06-02 23:40:20,Chargeback,Management indeed property understand factor suddenly some.
db752a79-f653-41ba-bb04-ceb90f3fd386,21e3514c-664f-472c-b349-5b2e4b6fc916,2023-03-30 10:59:56,Chargeback,Hot catch teach else skin.
6bc76e54-e6bf-47d8-84ab-ee2c9cd2b144,b98fca82-af23-4c32-9381-dd03e0345911,2023-02-28 12:19:10,Suspicious Activity,Court weight between full.
7ce85b72-6e4a-4d99-a009-b6465e17b815,c707650e-6499-4be1-b229-1ef300e35b6b,2023-06-10 02:02:49,Chargeback,Face whom memory quickly condition be under.
05ed89c9-a5ca-493a-a537-3b45a7cea79c,0633ad3c-4b7a-44eb-8e6d-4e56c33d0b43,2023-03-21 06:23:16,Chargeback,Upon simple debate response within.
cc43a949-2a2b-488c-b06b-f159abade365,7f5166ba-5f71-44fd-b04b-cdcd57f9ec42,2023-03-16 07:06:11,Chargeback,Choose front half necessary.
79d23d56-ad99-4e0e-9f6a-ce7b43f27c07,471cb8bd-68dc-4fc3-81bb-c7c4cf745285,2023-03-19 12:00:21,Chargeback,Forget economy movement front trial.
5eac200e-c15e-4377-9eb2-6d4a04a90b1e,fffa3f7c-b1b1-4096-a32c-fdc6ff295ee7,2023-07-28 10:54:16,Suspicious Activity,Car work civil will plan.
163ac4cf-411d-4be2-ab49-a08ed381d361,9f30b093-e4e0-43f6-8943-27624b862b74,2023-04-27 19:03:13,Chargeback,Person then piece attention laugh.
10603fe7-4990-4f94-a93d-e366f9d411e1,e7ca6c31-701a-4630-85ba-569115495cb1,2023-07-16 18:12:02,Chargeback,Ability image policy which.
ec703f6f-33e5-4a9b-a396-559b174b8d56,c6b82c86-d9a2-42bc-a588-9f07bcb634e1,2023-03-19 23:56:10,Suspicious Activity,Democrat various economic home room class.
a72b2ef8-2fc7-4f12-bae5-f86aacf41f22,e97c02ac-9ddd-4ffa-9e57-92b391daa7db,2023-03-17 23:24:34,Chargeback,Major hospital down try.
23c36748-d04e-4d7b-a503-ddee5fee349f,8e5f4d6a-f7ab-4a8c-860d-0e5ce837dc40,2023-07-02 03:07:21,Suspicious Activity,Expect arm including I.
d45cfbf5-46ed-4578-b23e-314feb265f6a,ef40c96a-b2d1-4027-895a-29d103bb9c93,2023-01-30 01:03:13,Suspicious Activity,Population whatever argue argue option score.
9f6c4afd-7b90-4ce7-b4a0-edff426dbc76,07d9ed8d-d590-4340-8449-cd5e8b9f2e45,2023-01-07 05:29:36,Suspicious Activity,Task miss certainly age choice human close.
22aa8166-dd10-4745-8cfb-8d3944b3bcb9,50d48717-5075-4951-9bba-193ca15fb949,2023-06-30 04:21:23,Chargeback,Energy those time fight front.
59c57bb9-455c-4b92-9068-54078ef76685,6f21f036-cc52-4714-953e-621486234be6,2023-07-04 19:11:25,Suspicious Activity,Idea member low know upon management current difference.
1a6b7d89-5d1f-42ec-b898-f21fe81344d9,769c274b-42a7-49d9-9be8-eff35c5cbb8a,2023-05-06 21:36:23,Suspicious Activity,Author remember data strategy majority nearly wife.
c526e460-b9c5-4b7b-a0e6-1b52a744cf4e,0be3fa60-6422-4012-927e-54ca90d6695c,2023-07-16 08:05:44,Suspicious Activity,Option break official hold challenge tend.
1ed25b54-975d-4282-a72a-5b73966d8c0d,424077da-dd57-4021-ad74-62421db1b34e,2023-07-04 06:33:57,Chargeback,Similar again less happy of power.
8c50f121-de57-4b13-aa8c-de08157a3720,c49b1c3c-029d-4e91-8b64-2429e60aa368,2023-01-21 07:25:41,Chargeback,Can evening actually participant recent current.
3b7e7c1e-b8d4-41d1-8255-0552fea60568,7bfcb4d6-ead7-4a24-abd7-5ccadd1f28c0,2023-08-20 19:55:54,Suspicious Activity,Two painting public yet.
3a153ba9-c7ed-4f24-8253-bf8b6a725fea,fa26cbb8-f921-4d4d-9dc8-4ecf686ce047,2023-05-22 10:41:17,Suspicious Activity,Truth Democrat join thousand.
d3b63ed5-67e6-4273-a2eb-e422b151dee8,ea15c679-c647-44fa-9192-9c6d22e757fe,2023-02-12 18:43:58,Suspicious Activity,Late close four suddenly win must training.
fe3e1df9-9a64-40c6-9a3c-dd9aef814808,fec07afc-0927-4582-afb9-4ce4ed82064c,2023-03-08 16:02:57,Suspicious Activity,Cut home other instead wonder agency.
6da84975-3ec6-4a42-9f38-05da8c7be8e7,a0f9ec4d-2c56-484f-b038-23b971dd3d0b,2023-05-14 15:43:30,Suspicious Activity,Why hour fine tax program.
dd73f918-34fa-4e24-a103-60784ef00846,ae0fc6c1-3dfe-490c-89e5-cef7dfbb7bae,2023-03-23 08:43:40,Suspicious Activity,Test economic likely service society fine firm.
1a5cac43-3490-478d-bf9a-0e1847d0749d,77102a26-3b35-4fd6-b040-fcc80b3aa04b,2023-01-11 19:03:49,Suspicious Activity,Young beautiful two someone ask up mission.
ffc8e420-8936-4193-84f2-5ffba5e24e07,5c730a94-397f-4df9-a35f-3eb12a25e49e,2023-04-24 20:25:50,Suspicious Activity,Miss responsibility follow before wall least.
