Fraud Alert ID,Suspicious Transaction ID,Alert Date,Alert Type,Alert Description
95fea029-383e-4632-95e5-2e73ef69ac1a,2fbc6242-025a-4e1a-a7c3-de6afe714f32,2023-03-24 04:45:12,Chargeback,Single candidate to position phone song ago.
21d17bb7-39eb-4329-81a4-e15bbf208f8b,ba131dec-7ca8-4b42-9238-8cc433701510,2023-07-01 20:44:28,Chargeback,Available gas win group response list maintain.
28fefd37-698c-4d96-9e9f-2f626368b6d0,5228b041-4d69-4bf6-9e45-442ce899691f,2023-01-17 12:29:31,Suspicious Activity,Drive style ground truth nice.
7c8f06d7-f15b-4030-9fcd-388ad4a1433a,c48fa9ee-7ee2-41ae-aae2-63d0268141cc,2023-03-09 05:48:03,Chargeback,Gun itself because experience.
4de1c4b9-7e08-49dc-ac06-4e0f7da3b7e8,4eb88f27-9a7c-487b-be7f-b086d1dd463a,2023-04-02 15:34:14,Suspicious Activity,Suddenly sometimes community own.
813b9db4-c789-4e61-8ae0-34279c007513,5b374f59-46d4-41f9-9b31-5bf953c02656,2023-07-27 23:12:17,Chargeback,Despite then common north.
2b9031e9-da27-4062-8f64-521fbcc39c87,60a53b9f-b0d0-48ef-b31a-84c33c86ec53,2023-02-02 00:43:44,Suspicious Activity,Herself produce pick after compare read.
0d98d98f-73cd-490f-a9ac-cd067982b7b1,9d95a546-b8a9-43b2-a2a9-b589543cec4d,2023-07-17 02:36:13,Suspicious Activity,Language our star trip make.
65b59e2d-d57d-4264-940a-90ef08a02d9a,0f8b276f-3a13-4e1c-952b-c0373aca3481,2023-05-16 14:50:16,Chargeback,Artist future teacher throw.
2da6a7f0-aad5-48fb-b153-7a5316ba130d,e8f8606d-0f60-4a47-ac6f-7b497373e125,2023-04-02 20:24:14,Chargeback,Open or occur expert.
a0cbf5d7-8891-4bf7-97bc-0691fed768e2,532916cd-62cd-4288-a288-efb05f772d7a,2023-06-05 09:04:52,Suspicious Activity,Response world hair old wrong decision.
9b0a8757-5a6a-4183-b697-b3383f8cb97f,4581e694-b474-457b-abf9-fb56ce8b6573,2023-03-09 02:08:24,Chargeback,Summer especially beyond dark small upon my.
43b0c1aa-9a2d-434b-b85e-211e1fadd19d,938ba69c-f352-4cf0-bd2b-79c5969d35bc,2023-02-12 19:18:55,Suspicious Activity,Prevent policy right soon.
a4c116af-d5c1-495a-8d48-52d176d94b76,4e727495-1599-4cd1-a341-e0a62c91d47c,2023-02-08 19:08:46,Chargeback,Listen again industry feeling community.
c64899bc-f079-488c-9615-f636567e7ae6,945c930e-66b4-4a22-8e87-bac2fed0953b,2023-04-29 11:48:38,Suspicious Activity,Sit seek meeting loss once chance phone price.
f03f14dc-9b47-4c21-8189-cf2d5665eb40,75222354-b3a8-4812-8916-ca13da869f42,2023-01-12 09:15:40,Suspicious Activity,Employee finish condition such main.
0c956e7e-66ba-4e52-b006-1510688612aa,2c8c83cc-9faf-40fc-9c6c-1af782988e8f,2023-04-18 11:14:22,Suspicious Activity,Box bring start opportunity each soon rest free.
51d2bdfb-bfec-475a-baf5-026b47f1bb0c,604e568a-bb29-4d8a-9984-2b631efa6227,2023-04-23 11:09:55,Chargeback,Pressure child method.
734d653b-6af9-4744-9882-3102b5c28e50,4d4390a2-7885-41b8-9563-8acb64bd2477,2023-04-03 16:06:47,Suspicious Activity,Necessary final factor carry.
1cbb83a8-a091-40b5-b5e9-1a270cd70f84,a7a1dc77-d6a4-499f-99e1-8bc939c28f95,2023-05-04 06:49:25,Suspicious Activity,See bring black guy.
afcba1ae-c8db-4be7-9fa4-ac66879e4fa3,d4a04067-edf7-4327-a4c8-a2952f299c41,2023-06-08 03:26:10,Suspicious Activity,Job thank job herself prove after join.
e8d22ffc-54b0-4c2a-ba1d-2704cd5ecd81,66ad87d9-6ac4-4cd8-955f-c9a608410072,2023-01-21 07:57:48,Chargeback,End line dream student hundred.
ee57b68a-1ede-4254-8e7a-e6062a63d1f8,21cbe5bc-a724-4f12-a946-56676b14deeb,2023-07-07 18:51:17,Suspicious Activity,Hope budget well.
5bcabe6b-8ceb-4436-ba5d-1dd20d781515,61a80f6e-1038-433d-8888-09ede6d0a0b1,2023-07-27 23:59:36,Suspicious Activity,Player perhaps short occur happen.
2e4b1811-2110-4a42-bebf-1b4df6daba80,387b5698-18e8-4e83-a812-fdc1334c7421,2023-05-07 21:54:15,Chargeback,Until including story.
3dc39ed5-42d2-4fb2-99d1-5cef11d512f5,0ffb0f65-1b92-4e4a-966b-e2133f2ebe11,2023-02-17 14:33:32,Suspicious Activity,Wear skin toward special per song certainly.
db67d845-609a-4bbb-be04-185452e21a1d,83a23983-1779-4b7d-b6e7-4a1966b2d40b,2023-04-11 16:11:15,Chargeback,Language perhaps face particularly leader.
b7bb0e13-a9d5-42d9-b646-f6e5d25013fa,cd068592-8523-43e0-87c4-5ba52f9ff226,2023-05-15 04:31:36,Chargeback,Open sing religious later consider left.
1577e01a-495e-475d-b32f-12bfcb4e7b20,331fa8d0-c9c8-4fbf-95df-a8894e026a87,2023-03-06 00:50:08,Suspicious Activity,I hand home every size director evening.
14cfae8c-ef52-4308-b32f-410c8f96eed5,fbcb04f9-7d86-4ff7-a8a4-78fb4375f361,2023-08-06 18:14:01,Suspicious Activity,Hold push security free see each.
79f515f3-ee8e-484b-a29d-03105606ea54,1abd3db9-0816-4afb-843a-63635b845dc1,2023-04-11 10:44:44,Suspicious Activity,Provide want teach beautiful.
36c56bae-6f41-494c-baea-a8885bec8d3d,c390a683-27db-4503-aea2-2b2e8c0fd799,2023-03-02 11:14:35,Chargeback,Serious become central public ahead.
4904b35f-a874-4101-a349-4b0c2cf22352,155f5dc5-c3b1-424c-9e54-67fad721c2df,2023-01-16 15:07:29,Suspicious Activity,Film discussion today box nearly have ok.
2c03822d-ab17-4ea2-a0d2-f979aa71be91,5818f10c-0806-410c-ab94-02a8e3631ac5,2023-06-17 07:17:25,Suspicious Activity,Range Democrat history hand understand parent policy.
db18fac7-eba6-4218-9486-3851df506e85,0fc580b7-da8c-4a42-b92a-9cb0f7cad69d,2023-06-26 18:14:47,Chargeback,East service world wait.
9e3c9c9a-b112-48d3-ba21-36d14d589cb9,9f566e94-14e9-4665-99c6-11cedafdb1f9,2023-01-26 02:49:42,Chargeback,Right lose nearly our pull.
af4a7a72-1451-4c30-a827-92b50e43317a,89bfb6b2-c5a5-408d-a740-ec87294487cb,2023-03-11 13:49:40,Chargeback,Suggest what wife drop.
dd87df85-741b-4344-bcc3-36507b8ce214,5ecb432e-4ed9-4d77-8a03-f559c5fd9a41,2023-06-27 15:30:14,Suspicious Activity,Miss I fill like hear.
2481a93e-4223-46d8-b690-02f027fd041f,8b9fcaf1-6345-4264-b96d-cc6c5d15465e,2023-04-17 02:58:02,Chargeback,Building deal fast two middle very.
5f2d63a4-51dd-41c5-8e73-855d6dbac7a7,572083c9-1a8b-40ae-bd0c-c9a73f24fc9d,2023-03-27 08:53:53,Chargeback,First to reduce bill behavior.
e6c3ce33-0f0c-4536-8a17-1afb697a0061,024ddd0e-a40c-43fd-bf69-c1047759d4b9,2023-07-26 00:19:18,Chargeback,Treatment process prepare deep.
ad63bc28-9221-43c0-96d0-51df9098008c,0f8b276f-3a13-4e1c-952b-c0373aca3481,2023-01-15 08:06:15,Suspicious Activity,Age child laugh in offer he fall.
15853947-995e-4eab-b0e2-c6b411e70d5f,36a652ec-2ecd-4502-b879-a3a4d9c1db06,2023-07-26 21:43:52,Chargeback,Sign again prove popular system.
a35a69c1-479e-4cc2-814f-ba883d0b1298,f85a977b-2eed-42d2-94ad-3a56e552ffa8,2023-07-17 11:13:23,Chargeback,Whole bill practice finish nearly through table foot.
23130e5c-bad4-471d-9a92-ee6b6723e8c9,d8745698-a27e-4067-af7e-67eef83a242e,2023-07-20 23:31:56,Chargeback,Number source system event police simple town ago.
35a5ae29-5377-47f2-b765-2d2c0d6eec87,6001caa9-9074-40a9-8eb1-ab2a31bd66a8,2023-01-03 17:37:37,Chargeback,Prove able drug health body because week.
6f1dbc4f-dde5-4a3f-b0cc-086715cd9105,77241124-e5a3-4ed7-9d08-e47de1ec050e,2023-07-07 08:43:06,Chargeback,Early notice trial along.
27bcbdad-10d5-4364-811e-3a85ff584741,e4091a77-a48f-46be-984d-e919eccce6d9,2023-05-09 01:01:05,Chargeback,Foot break various human serious.
690fc5d8-c90e-4f93-b09d-f2c64291d82f,323915ee-70a5-4b04-9d42-e6cd962e7273,2023-02-10 06:24:19,Suspicious Activity,Air far environment.
3937feeb-415e-4703-a6f7-7863c30732bf,31e3122e-8136-4b73-bcb2-0621d9e5056b,2023-03-03 21:51:02,Chargeback,Will career open night.
b2279e5a-4587-4d9e-b1db-67167c2f0ef9,b12442e3-281a-4210-b398-a1eea7cfb824,2023-07-20 18:32:20,Chargeback,Reach we term.
a4cb100e-f53e-41af-b4ef-6a4283c314c1,8292bb82-408c-4f7f-a529-c74077c57973,2023-07-22 06:26:49,Suspicious Activity,Great hit hair though maintain election.
28ad7353-b121-488c-a7d3-7286e1bfdd01,b720c251-8685-42c5-a796-c7afe399199e,2023-05-21 12:38:30,Chargeback,Activity sell section dream billion whether.
fedea951-9ba2-4f6b-9aaf-d5a38e2ba3df,632e0113-13f3-4163-81fe-5bcc4bd5ba58,2023-08-12 21:51:18,Suspicious Activity,Have contain impact movie.
1eb03f1f-b62d-4583-9c45-b35c997cdbbe,670ea926-e2e0-4cf1-9cbb-cf4fdbe2f59e,2023-05-30 03:33:43,Suspicious Activity,Everybody four source.
6a53d4d1-6abd-495d-a2e9-1106aff9a9dc,86cfa44c-4b1b-40a6-8da1-b8b03d9b7c73,2023-02-18 15:28:17,Chargeback,Answer pass however maintain resource head already rather.
9acbadaf-37b3-4fa6-9032-e9cb41a9d589,c4d8591d-860e-4c92-8569-887cdd488481,2023-04-08 06:29:24,Chargeback,However today reach make.
22ef33c2-9e3c-4e75-8c59-c138a6c72d89,f6c439ec-40fe-4b1b-8286-d0962810950f,2023-04-09 04:12:32,Chargeback,Structure speak never heavy ball across long.
68cd82f5-acd2-4109-bfb3-e9058ffe04e8,752f8bde-c343-487e-a30a-af485619b5b1,2023-06-27 23:01:58,Suspicious Activity,Very husband practice return degree.
14fd7c11-467d-4705-b81f-41d572919ea1,5b482fb5-304b-49b1-80d9-74c7528c1021,2023-07-14 19:45:30,Chargeback,Free charge old hospital everything reduce.
4ab8d187-47e5-4525-adb8-46407b02b661,19f259ce-ca80-42bc-8824-aa0a7697afb9,2023-01-04 07:43:12,Suspicious Activity,But argue particularly next full space.
efa97f4f-8c26-4793-a30f-a33be359addc,4cbe4a08-7e36-4aa5-be6f-4ae86908ac19,2023-04-11 22:52:49,Suspicious Activity,Must central feeling entire enter would.
033eea56-c96f-47de-b0f7-85ff534cf29b,ca349283-9ffb-457e-9f9f-539a191158d4,2023-01-14 18:57:43,Suspicious Activity,Pull low reveal member control.
7564731d-734c-495c-b0a0-6e4b570de9c3,f137ac2a-596c-4b63-ad6d-b433cbccfd0d,2023-06-27 05:07:05,Suspicious Activity,Travel final late become method.
bca3a09c-eef9-4753-ba57-cba072218092,ea15c679-c647-44fa-9192-9c6d22e757fe,2023-06-27 00:11:54,Chargeback,Guess send who street force.
ef609ef5-f360-491e-9b99-be4392074b26,6aa19e20-4570-485a-a66b-2c593ee52b08,2023-08-16 15:02:37,Suspicious Activity,Sometimes important interest wish compare director.
333cf7c2-ca96-4600-a06a-043a02defda0,53569791-61fe-4e82-90e4-2e043a4698e8,2023-03-18 13:25:05,Suspicious Activity,Teacher food Congress standard.
c8ec3485-8717-4893-a7d8-c115468fcf51,71d2fa88-c7c0-4229-9d08-800ac4bb13a8,2023-01-15 04:17:48,Suspicious Activity,Always authority probably apply strong wide deep.
03e31e6f-78de-44ad-946b-eca76eaac326,af549ee5-8027-49e1-a1ab-5b541e19ccce,2023-08-19 08:51:51,Chargeback,Budget plant black entire thus.
483277e8-3781-4039-a2bc-7b19894edb40,5f95ec0f-aab0-4056-a96e-8dc859f3c0df,2023-05-19 23:31:58,Chargeback,Small teach front onto tax ago.
27bc6bef-8380-4ff3-953c-03b6ddc99f60,3524db9a-f397-4f60-bc6b-4fd09ac4a804,2023-05-31 16:04:52,Suspicious Activity,Mr room in position apply ok.
a21413d9-b6a8-4904-9691-d76c32f3cde8,f3eb627d-36dc-4491-b3be-f664e46e40db,2023-07-18 16:08:42,Chargeback,Machine thought traditional single.
a5a84186-7717-4af1-ba82-7820ac1518e0,e539d4c0-7077-49b5-9b70-c2a304e8c7f4,2023-03-01 20:43:14,Suspicious Activity,Future away above run most sea too ago.
06b157d0-a239-444d-aeee-1d08bc884fcf,0aefebf9-e5d1-40cf-ac66-42de96e8ddea,2023-08-01 07:52:50,Chargeback,Such design me buy like.
ee8124c5-dfa5-4b53-9c92-336dc9fc51c6,61e2a654-5c5d-4d9c-b087-8804daaff74b,2023-07-21 20:35:17,Chargeback,Figure hundred ability south another him office.
d6a942a1-8838-494f-88c4-1ca8e47c3b48,2e4de3e5-7bd9-420a-9fb2-ddf6a71b0422,2023-07-08 01:40:12,Chargeback,Business low sense animal seek.
b90566a2-95bc-4020-ae41-03d97a632875,6a04e50e-e19b-42fa-b76a-eda654a701ab,2023-04-05 04:05:11,Suspicious Activity,Possible animal environmental write size group town.
f79ae3ea-6cec-4603-a050-c5ad933855f5,29aa49d3-3272-4833-b9e8-d74bfa02a92d,2023-02-03 16:17:16,Chargeback,Congress beat difficult not sound nothing begin during.
6a5247ed-62b0-40f6-b763-3979523668c0,a326f78a-4a7a-4e1a-8549-a539df5ce391,2023-06-24 20:51:40,Chargeback,Site call trial lot section series idea development.
65ba9413-20c8-48df-8263-f5503a1a72ad,be77b41e-70fa-4cff-8d10-6a4894912446,2023-04-25 08:52:18,Suspicious Activity,Prevent reach seven none poor ready sometimes court.
79f7c6c0-56e0-4349-a8c4-508870a95705,fa26cbb8-f921-4d4d-9dc8-4ecf686ce047,2023-03-02 11:22:07,Suspicious Activity,Add education hard two leader nothing yard job.
22d23d13-bb56-4216-9d9e-1e166acc727e,1defec02-3be8-40d3-bf37-8629018852f7,2023-06-23 12:46:22,Suspicious Activity,Never where two red opportunity style activity.
2a1e7c15-325a-4e1a-8f80-54d546703dbd,e6d17d30-a224-41ad-8a3c-737e256a8986,2023-08-08 18:52:14,Chargeback,Good former take kind opportunity parent.
d9ed74e5-7dba-479a-a1ec-a4d37ad8dd5f,0aefebf9-e5d1-40cf-ac66-42de96e8ddea,2023-05-28 12:51:08,Suspicious Activity,Concern our view.
3ac9d972-f0ea-4e6a-a748-aee151dd8c0a,76905930-42e1-4223-aead-6ed450481642,2023-03-24 01:30:58,Suspicious Activity,Civil on all early onto campaign throw.
894ddc41-b3df-4b1a-a156-4d21b198cf07,d79e599e-a9c2-4c39-b44d-cd77e1d48539,2023-08-07 18:44:13,Suspicious Activity,Class writer even first.
f410ef97-b621-464d-ba33-8724fd803973,5b9d093d-02ca-47a9-851e-34a31a9c303a,2023-04-17 16:48:26,Suspicious Activity,Fly author remember son.
088d0e81-efd3-4654-96e8-7229f37ccacd,d264a3a0-5f07-44a8-b325-1ac608f30f56,2023-03-27 05:09:08,Suspicious Activity,Social activity opportunity down enough arm.
34edce79-af97-4e5f-afb4-6603d546d40d,3470428e-68d2-4cfb-b7f6-2bad567fd65d,2023-06-13 18:30:55,Suspicious Activity,Dream back before.
02c17c30-95b9-4976-9e87-814edf12e6e0,94a4ba03-5e80-406f-987a-dc4eb0a0e238,2023-08-15 09:20:22,Suspicious Activity,Enter a view back activity give it.
62ad1305-9b73-4717-9048-2790510f8134,ba18462c-cf99-4d60-8646-efb0d92ba700,2023-04-26 21:46:27,Suspicious Activity,Back game enjoy management television former.
1c202d22-618e-4064-9cc8-2df9c1dd4cae,e068def3-14b5-4976-8a69-c5fdec0f936a,2023-02-27 00:03:24,Chargeback,Green assume dream establish.
0475df82-e87e-43ad-86c9-9b114fd97d34,1e896f1a-409b-4e0d-9054-4af3a06a171b,2023-06-14 23:25:56,Chargeback,Face after realize force say.
f4e61b87-4fda-43e2-96ec-d0d5e0706b5f,8b9fcaf1-6345-4264-b96d-cc6c5d15465e,2023-06-23 14:07:34,Suspicious Activity,Task paper really actually something show opportunity language.
aa33ac39-bbb7-4481-b2a3-23175b518689,2d90c5f3-5454-4d34-9944-cf6f9720cddc,2023-01-03 19:50:21,Chargeback,Talk side may near particularly maybe.
82242bc2-4d21-4309-a1e1-407a328f6541,9d95a546-b8a9-43b2-a2a9-b589543cec4d,2023-05-14 14:33:54,Chargeback,Realize begin deal close everyone single anyone.
20a3f77e-c0c0-451b-b325-f77539a6f2d5,bd07826b-b919-45f6-9c55-ff24a0b53dea,2023-04-01 17:26:37,Chargeback,Six to sometimes probably crime these.
7cabe81a-f210-4fd0-882b-b2a3093fa87e,9981485a-5aae-476b-8dfe-194bcb94b620,2023-03-18 04:10:56,Chargeback,Ago impact action test decide sense.
aecf3aed-2a6d-484a-8f74-a9e9b8a5e7bc,8dac9b72-ba82-42af-b5ca-29a4b86046f5,2023-06-15 07:08:02,Chargeback,Fish avoid law discover in situation.
969fa931-d639-487d-98f1-a9a9bc31a7d0,f46448db-c258-4dc8-a62d-827b45ed6d6a,2023-03-05 17:20:48,Chargeback,Especially own bit.
097ddb23-843f-4bcb-92a7-d4949bfb8717,92109159-a562-4124-a79e-713830649042,2023-05-13 09:15:11,Suspicious Activity,Product recently car car.
343f170a-e7d2-44a1-99b7-a0d5ef92319d,963f89b2-305c-4634-925f-4de7d52d802a,2023-06-16 18:31:38,Suspicious Activity,Attack whatever attention letter even firm wall arrive.
a6eeea04-4c5b-4eb6-a630-2a3680c48cb8,da9c24b5-be08-4e77-aa62-0f4283edaf7f,2023-08-11 04:56:02,Chargeback,Forget program court town benefit law.
fd293b41-cb51-4a33-aa97-1619b1bb1739,4dc50f18-76d6-43f5-ae51-509eff3d52f6,2023-04-04 16:18:01,Suspicious Activity,Call once unit.
5c7f0a20-fc3f-4e64-9fd6-17ebfe234256,bf0a5cdf-1d2b-49d7-a328-fd608b0c9ea9,2023-04-08 06:10:48,Chargeback,He Republican thousand while can religious member.
9f4e69fb-7f1b-491d-b385-cf2761f84b50,70ef28d2-7454-4698-858e-a9df239e0282,2023-06-06 14:38:51,Chargeback,Provide recent law stay attack.
b5a88611-3176-49a3-bfb3-c2f253d1329b,2685138e-85bb-4b1f-af8d-65a1f9d69492,2023-07-05 00:26:18,Suspicious Activity,Itself both trial third two.
427a50be-3aef-494d-a38f-34cc05c86926,10fa3681-0406-4a49-bde1-5915b11dc88d,2023-08-02 17:39:13,Suspicious Activity,Power religious send dream.
c6ad2860-6eed-4f6e-9012-5e795db053bc,02f83b40-1f41-4b54-867b-a89c3c2cfde1,2023-03-13 16:45:29,Suspicious Activity,Science return owner.
b77dc749-d0ca-4802-bc30-adb19c2cc6e9,2429b882-bbb4-49b2-be6c-2d1825c58109,2023-05-13 07:44:54,Chargeback,Impact now process real plan.
36fb22fa-05e9-4237-a229-8082d4c8b951,773ed5c8-c85a-4d94-8be5-02cfa741dc3e,2023-01-14 01:59:14,Suspicious Activity,Price good course account question chance one.
b938bacd-b1a6-4e18-8fba-ce89eb55731f,5388a05a-0d63-4cbd-8a9f-1255a82364a1,2023-08-13 03:50:25,Suspicious Activity,Red century catch must door doctor daughter beautiful.
557aec9a-2a0b-42bd-89a5-22d25202d5a8,be77b41e-70fa-4cff-8d10-6a4894912446,2023-03-31 06:46:26,Suspicious Activity,Large what final position officer fish.
a45b2c84-075f-471d-8fb3-3051c6f4ca56,b435adc6-d3e3-4cb7-b758-d4ce0be8ce67,2023-05-20 02:38:53,Suspicious Activity,This few environmental too assume.
3d4746fd-b624-484b-8fbb-c0ba1158738f,c26c269d-079f-452d-802a-2c8e56f59c79,2023-07-21 08:31:34,Suspicious Activity,Race beyond where seven open.
c26c1597-b8ad-453f-879e-b72957d31f7f,cdd35637-0341-436f-ad0c-91b54df2be86,2023-04-05 15:26:48,Chargeback,Detail community worry report oil.
0f6ed2d2-8b52-4827-bc29-8596f2d139b4,f4ebc138-4292-47bf-b7dd-a20c75b7e307,2023-04-27 11:03:11,Suspicious Activity,Box you truth decision candidate mean.
736bcb1b-70a1-4f12-960e-0ddc24c67212,391cc94e-f911-49b1-92c5-32084a139f07,2023-08-12 22:13:41,Chargeback,Tough hair form south these century yeah different.
10c51897-30f3-4d50-be93-b8e2a0136b83,d5bbef64-5065-4727-a68b-46c1bed2f69a,2023-05-02 23:40:36,Suspicious Activity,Behavior yard responsibility smile offer road.
5f2ca1c0-c077-431c-91f4-dd8e61f0b965,7ab4cebd-4957-490c-b2d6-c80232e9448c,2023-07-25 02:56:40,Suspicious Activity,Child smile national consider.
78f5c57c-4212-438b-b90f-307de8e7ed1f,85ffd92d-02bf-4b6c-b218-b710615d944f,2023-04-21 07:06:29,Chargeback,Store foreign give now.
e307a14a-d58d-48da-b36f-7074a2d73ffc,db05b8d2-f4b4-4987-9dfe-54ca0ba60ca9,2023-07-26 03:45:44,Chargeback,Charge reduce to close.
e3b98be9-2da2-4396-bb91-ec3873a11152,7412f921-94a3-4150-9218-c9ff0072f22d,2023-02-23 03:26:55,Chargeback,Wall physical cut group check study serve result.
9f58a80d-241d-46d3-bf46-529a41bb438e,db932316-dc87-4a5a-b36a-a8dee467fdb3,2023-06-17 10:55:23,Chargeback,Field tell score it nature collection none.
7931b200-8b63-4167-9735-f0b1f72f611e,9f30b093-e4e0-43f6-8943-27624b862b74,2023-07-24 09:09:42,Chargeback,Event strategy name speech.
a70dca50-eccf-4a00-9e94-a40eea94c600,6d7c891e-c4f9-4af3-97ee-ba7f04d45374,2023-08-11 17:17:07,Suspicious Activity,Major more fire leave process article indicate.
a358006c-fbc6-4cf0-8666-d146314b4b1d,8277b70c-be8c-4fa0-8438-4e9e0782279b,2023-02-13 20:03:05,Suspicious Activity,Son to involve.
95b8fb29-e61b-49ae-bcfc-8ff0a9cba2c6,d77692f3-25c8-4c7d-ba9c-51f7a53a1285,2023-05-01 01:42:45,Chargeback,Effort wind against manager law today.
2e9b4d0f-6792-4f55-9749-c6cd9e6488aa,5759cbe3-c38a-47e8-bf84-af990bb8e569,2023-04-25 12:15:32,Chargeback,Example class plant class red positive hour.
7301407a-1287-4c2b-9aa5-efeac608fe21,1c1e35f8-a82a-4eaa-ae7c-095851408842,2023-03-30 17:56:10,Suspicious Activity,Management job hope either change trip paper.
e86bfa94-f4a6-48aa-994f-f74c7c0ca60c,1e940788-5841-4895-88b0-37bfc0cde849,2023-03-04 07:44:51,Chargeback,Adult hundred inside others kitchen ten.
2b772fac-605c-4b65-805f-679f456a42a2,c7fc04e6-4c1d-46fa-82cb-30c2c23c1b96,2023-02-23 19:30:49,Chargeback,Should have speech.
3dfaf0c6-10a1-4fd0-b8ad-0418d0287588,a6d2a40f-8145-4e3f-bf87-2cad453e49b6,2023-04-30 14:36:47,Suspicious Activity,Day into movement site cold represent.
08a172a5-c941-41a1-9e92-2e834e884051,cd7cd4d9-ad63-4589-88d7-944d60a75d32,2023-05-14 11:12:40,Chargeback,Quickly capital baby project.
b820b2d0-551e-4d78-87a6-c7dff1f9cdea,a4cf093b-10a8-4def-a822-8a057a21a18b,2023-01-22 06:12:55,Chargeback,Town base as nature hit.
80d39074-19a2-4baa-a4d8-bee039806cc3,375534c3-e848-49a6-9000-29b21dd3fc01,2023-06-11 13:56:08,Chargeback,Financial see should sport positive.
e0748c61-d6da-4967-a842-c33b2d0f635c,fff21a0c-ae49-4d9f-bde3-687987df03fa,2023-03-15 23:30:58,Chargeback,Market interest yes will friend official blood.
bc59ab85-e901-4f93-b040-bbca6588451f,438405e2-ebb5-4ce7-af1c-691c4482d1b5,2023-06-01 01:18:27,Suspicious Activity,Mission eat water out term door middle.
42a2359a-2b5d-46da-9a62-f9a547615263,8f8f5e3f-f997-4a69-9375-9ce53eeab16a,2023-04-02 04:42:01,Suspicious Activity,Always southern still catch.
bb2c961d-8158-4483-b6f8-9007b2df03da,76b2fe79-bf3b-4747-bad5-3e9311cf0b59,2023-04-16 15:59:24,Chargeback,Tell current half process old couple red.
72e5454d-dd61-4261-921c-7b039eb4e5c1,fbc2d66a-aa15-4849-a5ed-8a957f3cba26,2023-07-19 14:03:18,Suspicious Activity,Environmental until serve share require book.
bb34283c-c2dc-407e-b946-88463b8217bd,dadb8e9e-2509-4831-9875-31112a7bfafb,2023-04-12 13:18:50,Suspicious Activity,Wait station onto in.
008f0fa4-2c7f-405c-9e95-1923c572ac25,02a7431b-eba1-42ae-b803-6e13d13027b7,2023-05-25 12:29:07,Chargeback,Simple animal rich season.
f8b853aa-3b8d-4eb3-be8a-9523b6ddd433,918e00ae-0159-4c83-90a5-d4717ecbe1bd,2023-05-02 00:57:10,Chargeback,A knowledge mind husband stage.
17c025d7-a0b3-4065-908f-5875ecbd75e9,cdc13ebb-91ef-4ad4-9da5-64e96206597a,2023-03-24 00:16:36,Chargeback,Trip late new American marriage price game.
91db1136-a1e8-4cf7-b010-bd6f394c3131,afc4b2a4-2841-40a9-bf87-6e222f76268c,2023-07-20 03:32:19,Chargeback,Man glass dinner up minute.
d8137546-a4aa-4846-bebf-3cb33433905e,c4e2813c-cc40-4976-9a55-34b34ce27056,2023-01-30 02:20:38,Suspicious Activity,Picture wide impact speech.
52f3b7e8-f115-4715-9387-d731bfed8d6c,7d4c82d5-5bf4-484d-8b00-a5cdb2e5736b,2023-01-07 03:04:20,Chargeback,Give real opportunity free.
233d11c0-602f-4084-97a7-c06012ac2bca,92109159-a562-4124-a79e-713830649042,2023-06-08 05:08:37,Suspicious Activity,Learn cover fall conference.
f544830f-4ff6-4bc8-92e6-93a388bda86e,08c5d450-d2ff-4db0-a56b-e4810a2c3988,2023-01-06 20:44:02,Chargeback,Follow something yourself statement.
68ebc3bd-82fc-490a-abe2-59c38f2cee1b,4542483b-6a29-4edb-b774-0b8c658ae60f,2023-05-22 16:46:45,Suspicious Activity,Attack shoulder identify project have draw.
762741cb-3671-46e2-9418-4fe7dd0b627a,07c871f8-cb9b-4279-9033-5846b5deeb99,2023-07-26 08:53:33,Chargeback,Body visit itself sound.
ca101987-2c27-4afa-8ab8-bc96a3bf7b83,4247a966-51e5-4cea-9c3f-90237638a483,2023-07-13 16:37:27,Suspicious Activity,Make institution window remember new society.
6bff0dea-1266-4a3e-87da-1c27a53f892b,6d1dc73f-4e47-4ccd-bd14-fcd18e90f02b,2023-03-13 16:21:37,Suspicious Activity,Financial serious crime upon blood require.
c983ba22-6cc6-425f-a965-39430dd20412,54c8f1b3-f3a2-4213-8a4a-06f5884ae14e,2023-04-01 05:06:48,Suspicious Activity,Last ball others.
024c0285-b19f-4a82-92da-79bc1124a59d,4fc36486-24ff-4b94-8ff1-696699fb2f8d,2023-03-09 15:32:09,Suspicious Activity,Item per just policy behind different.
82bcdd9c-f9ac-43c1-bc3a-85345940434a,a8d33431-e31f-4e4b-841e-c369236b543e,2023-04-03 01:50:11,Suspicious Activity,Business politics themselves age question five recently firm.
8e8154cf-aead-4ddc-9bd6-b2a54b76a763,e4541e24-5600-46fb-8514-b74152f94f0d,2023-05-03 01:02:57,Chargeback,Every just gas term now coach area.
d1996f8f-6d2f-43c3-b1c1-313efca63be6,574037b3-42ab-4866-b0cf-47d2e4134486,2023-01-26 04:28:35,Suspicious Activity,Prevent manager join huge general.
a69137be-30ca-497a-9113-2b02f827437f,048452c7-6372-49b7-89e8-6fcda595c4b0,2023-04-14 08:49:31,Suspicious Activity,Together pass create owner attention.
3e1e8d7e-d825-4282-8956-1480209893de,0a87c90d-dd65-46f6-b863-d5e68828b09e,2023-08-20 16:26:40,Chargeback,Truth trouble mean person.
e94a5b26-623b-4a5f-8268-a924f3e4bdb3,969e77b6-4436-48b3-895e-661cb422178c,2023-02-13 16:34:54,Suspicious Activity,Environmental only window decade.
3aed701e-fbd8-4efd-9c42-66143b09df2f,7f161c02-951f-4deb-bf43-09ec6c5c84cc,2023-02-24 11:15:02,Chargeback,Continue become night cell.
444f905e-12ac-4256-8e5d-6bdefa32c092,a478f667-03b4-42ed-a5a5-1d12b491e2e4,2023-07-28 15:32:44,Suspicious Activity,A letter common town attention.
53797798-04c9-41d1-93c0-78f9658a83e5,4215ebd3-932e-4113-b16d-e2dffcda8424,2023-01-28 16:59:26,Suspicious Activity,Collection can north father force poor.
54cd19b3-8895-441e-a0f8-4110d6ab6287,4e519507-9942-4e8f-9625-5b363b24158b,2023-03-13 19:59:30,Chargeback,To mother nice man think amount.
649c4ae4-ceb8-4a65-b7d0-269bffa35d8c,1e5c4a06-aa6d-4774-b4b7-3e24ab9c6753,2023-02-21 21:23:25,Chargeback,Who property there southern politics full game.
f55b047e-a50c-4064-87ef-331b96dd9dd5,03171c2b-4383-4265-9b8c-adb46761bac9,2023-03-06 20:08:12,Suspicious Activity,Realize message budget success section north enough.
48585b99-532e-4ec0-82a3-5b2bbf6be054,db932316-dc87-4a5a-b36a-a8dee467fdb3,2023-07-22 17:50:37,Suspicious Activity,Sort indeed before might grow investment both society.
7dd7f335-cf93-4220-9ade-2018dad6033a,4fa8ccbb-0300-4d49-a492-d1012390b885,2023-01-01 08:38:05,Chargeback,Side reveal game especially up check opportunity image.
6e3c09e9-dc55-4819-a8ab-87eb9d93de49,95244a56-18d5-4414-89eb-4018184fd1d2,2023-07-01 04:39:59,Chargeback,Popular party factor drug.
1c47f9de-6d0a-40c9-93ae-df2301e10a3a,057882f4-e051-437e-8d64-8e9337052250,2023-07-07 05:50:18,Chargeback,Particularly view budget affect social few.
4673d006-0fa0-4b2e-94ae-ef3c00f2ce07,2b81d9d7-8dcd-4815-81e8-07e78aacb600,2023-01-11 18:57:57,Chargeback,Newspaper if color professional purpose American.
c9c1ac31-b4cf-4140-857b-1a127e254afa,4f0a4073-8f8d-4554-9148-08024966a776,2023-06-23 19:35:48,Chargeback,Continue suffer until culture eat on report.
fc20a9a6-1348-4090-af0f-abf5feaea01f,cbad728c-e23c-4bc2-a986-44827d4d2547,2023-02-14 03:01:04,Suspicious Activity,Morning both kitchen affect bar agree about media.
0450917f-10df-4f6f-b1b3-be67075faf6f,29117e05-284b-490a-b876-ddbb36bc1fbe,2023-05-18 09:35:48,Suspicious Activity,Tough history forget chair.
