Alert ID,Transaction ID,Alert Date,Alert Type,Alert Description
532ce826-0b60-4c3d-a22c-0a132b3e5265,ea396cc9-34c1-4bda-acfb-7ea018e35550,2023-01-16 16:52:37,Suspicious Activity,Common simple current value deep information guy.
db2e0f45-1f86-40df-893b-f30384cfcbe6,242808c1-cacc-4220-9f39-585aab29d5e9,2023-05-10 18:42:38,Chargeback,Young worker executive smile over should amount.
0cdb7215-48eb-40e9-a693-98729127bb55,58c15887-54c7-4e49-970d-626565e80304,2023-04-15 00:37:53,Suspicious Activity,Go perform present people about indicate soldier.
0e9847ea-2c30-4148-b118-1af630f0943e,3bfc6b32-593f-485f-8a39-383daa78e249,2023-06-15 13:22:23,Suspicious Activity,My computer life positive.
4140e6f9-e78a-4bc6-8cb8-edd086cc2949,ff623839-ec8f-4970-9295-2c81bd45b0c1,2023-06-14 09:59:18,Suspicious Activity,Generation someone beat alone.
8f7d50bd-d4ad-41f1-8b9f-21abf8774b4f,5904e334-2cd0-4b45-96cf-9ee8cc4274a4,2023-07-20 04:43:25,Suspicious Activity,Happen yet season address order notice wife.
1481d126-bca9-4132-9805-74aec0f9a051,5e301aee-f9fe-4027-a9e0-68d5035bfa90,2023-06-28 21:18:30,Suspicious Activity,Executive can pass really clear.
c5cf7c84-a7c3-45c8-8102-fd47f7d27c5b,d1ece176-3334-4ea2-aee8-22078c192e42,2023-05-13 02:41:19,Chargeback,Network will evening art either company body.
9abd832f-abc0-4403-aeab-4f7d8fb41966,14a2e935-ccd3-4444-86b1-100d09194f68,2023-04-10 17:08:28,Chargeback,Walk often type thing.
f651286e-e517-42f4-a74e-a2ea8d410d33,06de8ea0-1449-4672-85ff-29beb4683bbd,2023-01-07 11:06:37,Chargeback,Stay white kind different pattern prevent.
d93a436d-55a0-4eb9-b9a2-b613f22cc59f,14218663-3fb0-45a0-9a96-7e74a822966c,2023-04-07 22:12:15,Suspicious Activity,Financial road my answer life like low radio.
26615208-0139-4af3-9846-da2a96e7ee53,7f963a5d-7552-4b3d-abe2-e8d8c9035029,2023-06-30 20:01:46,Suspicious Activity,Wide majority plant statement sister.
a455259b-d62a-412f-91e6-0f7b384d3b4a,debd9a33-50a7-4ed1-a5bc-4fec90515ade,2023-02-14 19:21:08,Suspicious Activity,Anyone leg any range you administration voice.
47c043ec-1925-4985-af84-30e2127f7127,53c98b87-4d51-4c29-a92a-4a0ddef66477,2023-07-06 11:51:43,Chargeback,Television light pick price relationship husband remain newspaper.
baaae3ce-7163-432d-a735-c6dc444fc6bb,e0fad9f7-f36f-4be2-8768-c37a9d7a460f,2023-05-30 05:18:01,Chargeback,Military your save admit national Mr thus.
e84cc086-2c31-45a1-8e3b-c18e3544fba4,55b4773f-9f19-470c-ab12-b05fefc46ee4,2023-08-05 14:57:47,Chargeback,Process painting next cup hear.
c8dbc5fd-5a0a-41ae-bcda-5cee6a0c4f55,aa516e1f-0af3-4f2e-9d6f-23caa7ec8749,2023-01-25 05:19:06,Chargeback,All power better large.
54846aed-75eb-4cd5-b199-88c9bd3bb669,ea8d6524-8dcd-489f-b93b-b4b95696a58f,2023-05-09 13:05:21,Suspicious Activity,Lay adult view.
6a154fe9-5a0a-472d-9e44-ad5e199d0282,b4e0cf42-fe4f-491e-8264-0475624be27a,2023-03-16 11:40:23,Suspicious Activity,Star church card better parent son.
1d5f019c-083d-4e9c-95f3-369b40b40461,252cdc54-b8a8-4568-8c80-c83a3fcd07b7,2023-06-23 00:42:43,Suspicious Activity,As authority population officer crime home.
2e671ec1-16e6-4674-87e6-61d5177cdd52,99114bcf-f94c-4f6f-b8c7-82ff4d83750c,2023-05-20 11:04:24,Suspicious Activity,Law pressure finish gas clear space simple Democrat.
2d3d080e-d810-49b3-ba6f-81b18f82bb64,f039a1b4-b4e3-46a1-9291-443b79fc61f4,2023-07-08 09:58:31,Chargeback,There popular cold foreign.
1ea1a9a9-ad77-4493-b9c2-2541be99a4e7,142be3e4-9531-4b9d-8454-dd63eca05ce6,2023-06-12 02:23:03,Suspicious Activity,Involve idea woman large sell media green.
6f99612e-b544-4ef6-95a6-e370317d3b0e,4b278dff-4cf4-4ece-a79b-08fd9989bf8a,2023-07-22 19:26:20,Chargeback,Record gas situation four sometimes that government.
ef3e92f2-ebb6-4f49-a865-1dae2ad94bd7,76baf467-58b5-41f9-a89c-75899a039f7c,2023-04-08 12:55:41,Chargeback,Ever also edge cell baby send.
c7d95368-cc60-4262-95ed-c9f78d4363bb,f36307bf-fb06-4ae2-b550-8a78bb0be2e1,2023-08-04 18:30:07,Suspicious Activity,Process look growth task area but place.
5fdc518e-7499-4e4c-a655-cf6a64ceb402,efad2e0d-01cf-49b5-9b40-6731ca3c9970,2023-06-02 06:16:50,Suspicious Activity,Herself fire wind network seat national treatment.
98398771-21ff-4684-b4ef-7c34667ba2bd,e5d32319-6916-496d-9bc9-25ac323a82e4,2023-04-25 04:38:24,Suspicious Activity,Three total would may attack sell.
73804097-9801-474b-bd82-d85c0e7efa0c,2fe09e74-bd56-40e8-abfc-358fcd511c95,2023-07-02 10:13:17,Suspicious Activity,Participant total message why.
c1ed9532-060d-4451-a941-985eccc18687,04a40f73-c7a5-46e7-833d-a03f6fcaadad,2023-02-25 08:16:24,Chargeback,Policy great event under join usually action tell.
67d07509-175c-447d-9363-0549108609e8,6f124422-7580-4034-8095-100531666e69,2023-04-07 12:46:32,Suspicious Activity,Control thus offer drop she left.
960b81a1-ebf3-4c10-bebe-ad76a7048ee4,1c492ad5-3203-4c82-a37f-559482fb6a30,2023-03-17 23:07:50,Suspicious Activity,Chair court address different high series will.
f589476e-1da6-40ec-8f45-d84e1ff1c1a7,2a80fe55-3415-47f7-a186-90fc05244d6d,2023-03-01 12:17:02,Chargeback,It allow little road full whose treat.
f921bd6b-6d51-4c7c-be4f-a648b8cde99a,fbc54500-90b5-43e1-92a7-f0899ba4c852,2023-05-24 16:36:34,Suspicious Activity,Impact trial here director black.
b98a76ed-4b8f-4e29-ba6b-72f80a8cb603,aedf2924-fa27-4822-a486-ebfef8befa53,2023-03-24 16:04:36,Chargeback,Else experience compare off several station management true.
62f430a1-3326-4492-9b77-8e95ab9e8dfc,fba1fa32-13a8-4e7b-bb99-9f78d10f127f,2023-02-24 16:31:48,Suspicious Activity,Loss arrive table sort.
93a589bc-f6e4-4096-859c-22a01d489ad4,537c7477-22a3-4bfc-a770-16528fbf7eb1,2023-07-03 00:33:04,Suspicious Activity,Age whose whose body audience sure box.
6a7ab6be-8b55-4977-8468-ff22b1459a34,fd26d9e5-2d3c-474b-894f-7067dc0ec097,2023-01-04 01:32:21,Suspicious Activity,Able force might option perform.
6b73fa98-e0b4-4984-bb25-3d868c9e3856,e9c8c0e4-7e5e-443e-a3c3-dde688f5f19e,2023-07-26 00:11:28,Suspicious Activity,Push night walk chair environment.
70a337ab-394f-41ce-bf07-087e26017ad6,f601abd5-5129-4ec3-a6ae-1115736d625d,2023-07-23 06:59:59,Suspicious Activity,Population media choice age above.
1311600e-d02f-49eb-8a04-6ae922c288f8,60921045-e852-4c47-a158-a87203b7d7c2,2023-03-30 03:12:26,Suspicious Activity,Reality account maybe list start our.
0d566252-0961-4e79-9e6b-88ac94fe1302,e36759de-b834-417a-9525-19474ff1db6c,2023-06-26 03:49:09,Suspicious Activity,Find senior relate agreement foot impact.
f0e87d1d-3386-4c10-824d-86b65f10983e,8f668cf1-a89d-4f40-8501-97b08b53748a,2023-03-22 18:28:56,Chargeback,Book property gas someone difference player song.
e0dd5312-189a-42e7-8fe9-bf03efc6d82c,fd66e8e1-5521-46bd-bee6-15958c4facc8,2023-02-25 17:54:28,Chargeback,Anyone audience hot seat they forget.
c8d41ecb-6988-414d-895e-b63d5c8d7e3d,40e07fcd-8e14-4221-a780-986ff3becff1,2023-08-10 18:06:15,Suspicious Activity,Tough case break sea what.
0e2543e5-3196-42de-b577-6f946dffb521,7057c383-46f9-4691-8b17-1fd313d406de,2023-03-06 10:13:13,Suspicious Activity,Tell behavior officer pattern.
635a627e-4be1-439c-9c14-5d8bb198a75a,4be501a7-1b44-4a00-8ba8-b82e222aa611,2023-08-18 17:57:35,Chargeback,Community continue try suggest eight majority.
4391a6c6-b63f-445b-be6d-e7d1fa59ed8b,7a06be99-3792-4c49-9913-7814c52e677f,2023-02-06 14:11:26,Suspicious Activity,From discussion agency president key child.
bb75b629-ecc0-49e4-bddf-ba83b8b88d00,c008ae5f-b8d0-47d0-a2f9-72d450bbbb80,2023-08-08 05:48:24,Suspicious Activity,Traditional culture power article newspaper.
17753053-87c4-4e0d-8689-8562dba72aaf,78c79c28-f814-4240-a07e-69045280ec80,2023-02-07 12:47:12,Suspicious Activity,Early song thought down become.
0fa2eac2-d6e7-4f2a-9315-e2babb598c7c,4b7c5bc9-c993-4eae-97e8-9c578438bd79,2023-01-15 16:54:41,Chargeback,Three type choose two form again that.
9643896a-6fb5-4f92-a88e-3f62e41d0392,08d0f7da-bec2-4679-bcce-417c48aefa2a,2023-06-12 20:52:34,Suspicious Activity,Too order hard various produce appear institution.
09b6af67-f71e-4ec5-b124-de646647086c,d0a524f3-4e8b-4e46-b0a7-d69989a9bd6c,2023-02-11 11:15:41,Suspicious Activity,Learn finish discussion day.
f794000e-b3e7-46b4-88a8-2956476e5729,d0d7ef91-94f5-4d0b-bd1f-c1faacd4b081,2023-01-30 22:12:45,Chargeback,Collection power site worry whatever church.
c817ca5a-c8c2-456d-a726-68207f4aec17,9dd493cc-cd6f-4106-9ad8-a1786651859b,2023-08-10 10:10:43,Suspicious Activity,Point whether across light.
2f89ff13-88a9-4b98-880e-6cc69579e23c,8acef6e5-2dc7-4370-aa39-9467952c3be9,2023-07-18 04:18:37,Chargeback,Window option decade across.
3b849e95-8d6f-4fe0-99fb-89d30950ebb3,29f585df-865a-44d0-88ba-8fb4fac91896,2023-04-07 11:37:58,Suspicious Activity,Usually shoulder real start.
8666b68c-30f8-4171-898d-1b8ce320784d,464699cb-6a63-4faf-8457-7e91497fdcfe,2023-02-24 06:27:48,Suspicious Activity,Experience add more positive.
6ea65132-87e5-4ff8-b5b3-bb419b215cbe,39295d84-1eb2-4f12-aa0c-657c3fd447cf,2023-07-01 06:28:55,Suspicious Activity,On worker fly stop experience set provide.
5e0dd19a-9fa8-422f-a9a4-3d379eade58f,38fd3951-34d0-4b57-83dc-83ca1bedc22b,2023-03-06 14:44:39,Suspicious Activity,Line include tax practice industry.
53f01376-b27c-46c7-b599-758faa415949,f29e9e08-4af1-4839-b2a6-6c8313b07613,2023-04-01 16:20:54,Suspicious Activity,Across safe born huge this year.
2d843286-7f0b-4975-8577-8bf28f5ff62e,3406e0ca-8b20-48d2-8a73-91902ccae50e,2023-08-18 22:21:58,Chargeback,Remember option action seven.
9e9d8f6e-9189-44ed-960c-6b4ba58cc36d,607150c4-75eb-4028-97d9-4518c66feac9,2023-01-08 17:13:01,Chargeback,Yard expert another.
59fea9d6-7cba-4617-bf4f-43f855504c62,ea942a64-4ab4-4d26-a0c2-07982fdb974c,2023-07-09 23:36:25,Suspicious Activity,Range over place truth.
5615dc82-4b2d-4556-b55d-59dd550ba4aa,d71d5abd-8159-4309-897a-f284c7ce49db,2023-05-13 02:50:14,Chargeback,Relationship interest clearly fact dark kid song him.
0a76c63e-0d3a-405a-a8a7-7e7ed7dd26b3,840865f4-32e7-4dd9-9e6f-08ab76005c3d,2023-08-14 14:23:34,Suspicious Activity,Area note worry education.
c80a2a27-0f88-4524-af11-ee3869ae2ea6,98712ea9-57bd-45c0-b7c2-bd086007fddf,2023-03-15 00:34:36,Chargeback,Operation positive campaign economic break base modern.
247b7c0f-1608-416a-a922-c142841a2556,ac18921b-8e28-4530-a880-167544192904,2023-07-02 07:03:56,Chargeback,Bag including follow if impact.
7a369f6e-7542-4ed9-85a3-fa28706e6621,0aaabced-1b76-429f-93f7-d6ee60437b64,2023-08-11 23:20:18,Suspicious Activity,Change education guess bit.
0e13ed92-a313-4f42-b27a-29dcca90717f,29d8177b-22cf-46b6-b7e9-b6ec8a3eb8cf,2023-03-02 18:26:21,Chargeback,Vote red nearly early authority theory.
49059f9b-d1e9-4e70-8fdc-eb262b6cb12e,186c79dc-a16a-4afb-86b9-18f1891d5eca,2023-01-03 01:38:49,Chargeback,Purpose democratic candidate administration small.
4fc9791c-add6-46d0-9860-505dd5b02341,cfa8157e-47bf-4343-b3f4-29054b77d19d,2023-05-22 07:28:04,Chargeback,Marriage heavy impact method message bed million.
8ed7b0d6-5295-4e64-80b7-0e37f39dfa00,69ce21d9-03e9-4ad2-9095-73a8879effca,2023-01-14 21:29:32,Suspicious Activity,Teacher race ever option wonder season staff.
561cf706-ce5c-4f6e-81ed-a1240552100f,90704228-95ab-4092-9227-3c2696a07592,2023-04-15 01:55:57,Suspicious Activity,Wonder race information power.
868b1644-a83d-419c-aeee-f446ef24f71f,0749cc9b-22ad-4620-bf87-20a8d048a82c,2023-04-12 13:56:09,Chargeback,Population pull art race reason.
2c825454-e960-4d1c-90c4-4b72718ad752,c29e2baa-7701-4f61-b86e-bce4b1efb113,2023-03-06 18:56:40,Suspicious Activity,Evening fine weight democratic.
1cd219a8-1900-430f-8b86-03f6a98f95e8,388e4535-c6cd-45bc-9c18-6dc8045abbce,2023-04-21 21:09:35,Suspicious Activity,Hot may forget dinner then history green.
b7434505-c3e4-41e2-b363-4451f7ae6fdf,4a8b9fdf-e041-45a4-bd22-fcafe634a9df,2023-08-03 12:05:32,Chargeback,Plant stay marriage night within.
aa7ecc49-8709-4f87-91e5-0be6f32554da,14024ba1-0318-453b-95d8-85dd3cc95ca5,2023-05-28 12:57:13,Suspicious Activity,Professor company our surface assume thank.
c3ae8bad-c9af-442a-950f-e891531e3b70,9f10af47-18d3-4325-a18e-e12f143b064e,2023-08-07 09:34:51,Suspicious Activity,Stay guy soldier particularly strategy allow simple.
0be54890-0263-4413-92f7-91c4eb308e25,bf0e30da-626e-407e-91b7-4313635b8320,2023-07-06 21:22:33,Suspicious Activity,Score without lot give maybe she.
031a6dfe-692f-419d-891d-52954428d9dc,ef746b41-1445-48e0-894c-e2f330505dde,2023-05-03 08:05:12,Suspicious Activity,Raise born against maintain herself.
a864f6ff-5863-466e-bdc0-a6590b04ad4d,cbf4f9d3-0883-4789-bd63-7119df507b6a,2023-04-06 08:51:41,Suspicious Activity,Develop actually quite interesting.
89315d94-a837-4427-b9ed-4850371f2236,e6d8ee16-0005-4c7a-af95-3f632deedadf,2023-05-07 01:53:37,Suspicious Activity,This management air physical.
d1b8588d-e55f-4b9b-952b-84aee542d78a,2db0ea6a-22cb-4551-9ce6-e151a9f4f1f1,2023-01-24 23:42:54,Chargeback,Bit line agent attention price detail act.
16e44ef0-f9f9-4887-9fc5-7f624543698d,5e9cedf7-43d6-4248-9e90-3ece60249b51,2023-06-23 23:00:15,Chargeback,Job center scientist theory power project.
5b6374c1-8ee2-47d3-8dc6-e3bddb190782,c4536d26-c874-4329-813c-61ad0a5bce91,2023-03-09 06:53:31,Suspicious Activity,Stage process effect time difficult identify for.
0d50116b-cecf-4158-934c-b5e7cb69ed57,35481f7c-660c-4f66-987d-2cec4dcbd069,2023-05-10 04:23:41,Suspicious Activity,Century leader data minute.
0f86a768-a3ac-4359-bda9-5b992d6b0636,627e6bb3-6965-44a2-b586-17382451c6d0,2023-06-29 06:58:31,Chargeback,Box behavior really music article vote majority.
1ffabeea-10e5-45da-8f70-693d856212f5,ec6f70e2-c7cf-4540-8120-773f9deefbec,2023-03-10 01:45:51,Chargeback,Field new Congress make.
a4372234-dba8-4791-80f9-4e5ada819cdd,cbefa36b-65a1-4b62-9539-a13de6e92ae6,2023-07-20 22:03:13,Suspicious Activity,State phone star.
e567b30f-122d-4b0a-be5b-5ab3bc48e23b,b2fce30b-1159-4806-995b-444170a9129a,2023-01-09 08:00:32,Chargeback,Evidence fight well situation security beautiful inside.
24929665-712a-4e84-873a-c3878b413ef2,06873826-8457-4c99-87c0-23c1abce1194,2023-07-30 14:20:27,Suspicious Activity,Factor article third toward school baby beat.
c7e71560-0fd9-4e89-acc2-e888f204b047,312fdfb2-28c0-410b-af53-83daf17153b8,2023-05-13 07:44:04,Suspicious Activity,Space ready month save.
0e4e7415-4974-4077-b255-eacc8e6e33b3,4cf22b84-1051-42e7-9426-2ace3ccd61e9,2023-06-30 16:38:17,Chargeback,Successful within finally through may daughter decade point.
de50b38d-e736-462b-922a-a23f26977a71,4ed442e2-2e81-4fd2-945c-d73a4e16b1bf,2023-01-01 20:09:32,Chargeback,Both career team name.
5b6c78a4-0abd-4e90-b2eb-8a5a100a6058,e72815fb-b9d9-41d2-99cb-a9af9936e595,2023-04-05 03:08:37,Suspicious Activity,Finish summer minute least certain Mr.
0caec230-b15b-498b-87ed-3ea4d057f744,edc56956-dc26-4113-9758-057bda99cc25,2023-07-29 09:53:27,Chargeback,Mr rather anything when social something.
9e2a7dfd-f25b-4211-86bc-0a8b71fd34aa,2667a70e-8af5-40df-b11f-9900d7736953,2023-07-24 23:42:08,Suspicious Activity,Test role rock wall pass decide successful.
e6b965ab-ce07-416b-be5d-424c5fb25522,60558294-a200-47a6-bd4e-6e155c6a4001,2023-04-16 08:29:12,Suspicious Activity,Sister guy grow since watch.
d1e8dc16-9e98-4f70-8ca1-94d50660e4a1,f65e4910-1821-44a1-9dd2-5f0be77a63e4,2023-01-18 09:06:15,Chargeback,Risk hot onto development scientist stand manage.
d3bf3eee-076f-4231-bf8c-4a59253e1171,2bd90db2-6ceb-435c-a8a5-3f85b09df78b,2023-07-15 19:59:33,Chargeback,Behind large big site wonder.
127cb1a6-9071-487b-ae58-4dc09d4182c9,0982397a-625a-42ae-8988-76fb404093b9,2023-04-28 16:15:54,Chargeback,Ground TV church collection he industry himself street.
347c6471-f119-414d-822e-793ba0f6757e,9cc03df7-0da4-44d1-a981-fe1ac4343e2d,2023-02-06 22:36:28,Suspicious Activity,Seem avoid look.
7f1e1e79-335c-400a-84ca-2e8a66b7eb37,ee0f4d6f-7ef2-407c-aef8-2978b0012b4a,2023-05-25 11:35:14,Chargeback,Second doctor drug meeting color window situation third.
4e1394ce-c665-433b-99ca-4f0238a9df5c,6e4e57dd-9b59-44a7-a880-23c36bc13ede,2023-08-04 09:24:24,Chargeback,Until benefit professor market.
1e2a925b-5f0e-4d5f-8e8c-be7c3f731084,9920984c-0cf2-42b1-adc1-e1ca860c8910,2023-06-30 10:46:38,Chargeback,Some side management very control.
de75c7d3-0099-4235-b685-bfa01fd4c46f,2d9e7a98-aa51-4d9d-88ba-a8e5968ecada,2023-03-21 13:46:55,Suspicious Activity,Much who lose sit many everybody various.
4f2b0fa1-ebb2-4c54-bda9-0c510a5a4c0c,67436c4e-b1e1-4f9e-ae43-67ce7197441e,2023-03-21 20:37:35,Suspicious Activity,Detail event table serious student skill.
4b1283a5-f7b0-4832-b2d4-50538df31668,87c54b32-f65f-435d-9ce4-09e488bed264,2023-08-18 08:54:52,Suspicious Activity,Grow maintain role model yourself another.
a78da400-36b8-4956-a571-ecdf837374b8,26d868e8-a4ee-42e4-a4ee-cfc2da445fa4,2023-05-29 15:22:40,Chargeback,By much matter draw work serve across network.
38fb8b11-924d-4431-83c1-6bdc6957e854,d5518b72-292a-4385-ad4d-54c9a48e851c,2023-05-25 07:38:57,Suspicious Activity,Test age always star music.
f0bca379-9a12-45e4-96df-2ceeb684225d,42fbb83b-879d-40d4-8115-a81faf33c4ca,2023-02-04 08:57:17,Chargeback,Station way make do debate modern mouth true.
3139f12d-900f-4a8e-bc40-8ec18d0f7164,869097b8-bd06-41c0-bfbf-bf4551927bce,2023-02-04 21:21:09,Suspicious Activity,Personal us little find may follow.
ea204282-c029-4afd-ba4a-68cec075f96a,6748b1a4-02cf-4a6b-a8f2-8f1aedf5436a,2023-05-05 05:48:22,Suspicious Activity,Bag page executive role administration forward.
f83e24d3-5cb6-4d4a-b463-3f5c2cd8b374,0c085e29-6912-4a9e-b0ef-0ae769c89264,2023-06-06 01:58:37,Suspicious Activity,Page worker data industry reduce sense state.
ddf64ea3-7267-49f9-ba7b-c186544ac79e,19b127a0-5cf6-4bcf-9239-de17aed1ba1c,2023-01-25 05:42:44,Suspicious Activity,Bit modern almost impact art exist.
ac9be1e1-0471-4411-a178-c4a2f96c9fa4,ff3fdead-e407-4749-9421-fb7bae88943b,2023-08-10 08:59:14,Suspicious Activity,Adult value table gun very pass.
cdfbdf29-8fb6-456c-abfd-b8527dcaf5bb,963765d5-25f8-4937-a7db-abc371245d88,2023-06-18 06:00:49,Chargeback,Shoulder spring space source.
4745b911-ff33-4646-8bde-66cba044db8b,612bc5d9-0a75-4b44-bc37-9d61884cfa19,2023-07-13 03:04:26,Chargeback,Moment customer upon buy allow.
fc22d430-e338-4751-8405-abdf2755c9a1,9c06953e-45cd-4c8c-8ea9-48ed3b051f0d,2023-01-23 10:42:43,Chargeback,Become memory pick evidence style.
4a5bcbb9-7b63-4a09-835d-cae38492a591,8c7b8156-484d-4a6d-8fd5-ce1a5fab67d7,2023-02-25 06:04:51,Chargeback,Consumer free change tend.
5e69ec70-5770-4a96-b916-501e7016bb44,20fa9010-2c60-4dc9-a34d-38396d5f33cf,2023-07-02 09:54:38,Suspicious Activity,Vote computer firm certain pretty.
dfcf7387-d1ac-45fc-9196-ddb0fe55438e,9b75a6a0-d8de-434f-944f-07541ee4fad6,2023-02-28 08:26:26,Suspicious Activity,Wide down scene.
2ce8d9ab-1513-4ad6-8a97-a13a30127d50,30351fce-2d00-4f09-ba4a-a22b09dfed2c,2023-08-15 11:29:38,Chargeback,Price language wrong represent likely candidate.
8287a8c5-8952-4507-859a-a13011e2b429,af07a4a4-d989-4cf4-aaaf-ee5f3fcf499c,2023-03-10 04:16:49,Chargeback,Drive foreign method sister support himself research.
66afccba-2c6a-4008-9893-dded26c62a9b,9c83cc41-3fc2-42f8-a42c-1658aebf0a69,2023-05-06 15:00:38,Suspicious Activity,Final level space pretty.
79fbeb4f-b9a2-4f77-b3db-3435b4909b02,07676ebf-e6f6-48b9-8599-32192c730690,2023-05-28 04:24:52,Chargeback,Property support site have.
f016ab36-ac77-420b-b47c-caf061c83ac1,d25b765e-37e8-4eb3-b510-b9745870a19d,2023-07-07 04:30:45,Chargeback,Still third three game build technology star.
df56dde9-bd92-4a77-85ec-2b246a7c8555,772a1a0d-0823-4fed-bf1b-b5ea2e613410,2023-06-16 20:27:58,Chargeback,Seek partner even red responsibility time choose.
6f00fc39-102b-465b-a3d4-afaf5f3897dd,84eef5af-5c13-43e2-b144-f51d0dce06bf,2023-07-18 00:04:54,Chargeback,Thing more consumer particularly carry everything.
f0f0980e-174e-4e8a-9e9a-f5c8ac683182,f72f5b0d-a78c-41a5-b0fc-e005689eedeb,2023-02-04 05:28:42,Suspicious Activity,Matter hear bed.
dd48d76d-8a11-4dd7-8a2a-81bcfd982daa,0c6d1d0c-66a9-450a-ade2-90b9d7966f66,2023-06-05 03:58:07,Suspicious Activity,Economy pay international their tell foreign although arrive.
c9631195-ca95-47c1-a8b7-0721f302c9f9,2ff6d938-8925-4f2d-92e7-3a380c12bb6b,2023-02-02 09:51:51,Chargeback,Step main attorney drug different.
26940767-563a-4b2c-a3bd-49dd850a0d3f,41b8fd94-3606-4611-908b-a54949ad33c5,2023-01-02 21:48:36,Suspicious Activity,Rest audience trade actually capital north.
3750858f-3610-45d7-ae30-8f497d8b2d2f,02380ccf-1adc-4be6-9f7c-e7580ae3f5e1,2023-06-22 20:34:31,Chargeback,Perform use friend quality add positive.
79e8c208-8bbf-4c4c-b4a8-5308d8099343,3d7091ef-e0ed-4298-8a91-d1cb86daf788,2023-08-14 12:08:48,Suspicious Activity,Fine pass behind close debate candidate phone building.
24b8f166-fbb6-497c-808e-71dc4f2f57a2,8085ec75-5dc9-4434-b512-619844ca1bf2,2023-03-15 12:41:30,Chargeback,Bad when network station message arrive.
16ed2387-929d-49e7-8e9e-2c4f83094d3e,d710d299-2570-4f7a-9142-9a20ff46b45d,2023-08-01 01:07:10,Suspicious Activity,Might film group party coach program successful.
584bbd79-cc75-462a-bf84-09d835072e5b,63edb866-7606-4d60-85cd-c5d06e9ab8d4,2023-05-03 07:05:37,Suspicious Activity,Those chance Democrat figure value nice situation.
c17fc929-276e-4515-b45c-f975fea478c4,14d03bf8-4265-4136-a073-93300b73572e,2023-02-22 01:48:25,Chargeback,Study issue by parent.
56b8635b-6a97-4221-8268-05bfe13b7960,43d69d87-f623-4081-91ae-2ec122d63a45,2023-07-28 15:05:01,Chargeback,Pressure old recognize article poor before.
1cff2b61-f1df-4a4d-bafb-1270a1d22930,f9e828ef-83c3-4541-98e5-2ca0d856f443,2023-04-06 11:21:44,Chargeback,Rest by check east.
2958a0aa-5f03-41ce-adc5-ee51c1cfdb5f,9f1dc922-d81e-448d-a397-203a969c49e7,2023-05-19 07:09:13,Chargeback,Low guy south born.
ccfa1434-ec20-4192-8a18-a4dee75ca29a,9cc160b1-310f-420d-bfb3-ac38bc8daad5,2023-07-22 02:13:06,Chargeback,Treatment nice wall white war sister option yes.
8e382664-3c6f-429a-9e53-4d162125f4ad,c5125846-944f-47b9-be40-e53d93e39fe5,2023-05-02 19:55:37,Suspicious Activity,Son be occur door early dark.
cbe9ce47-64af-4c8d-a958-4392ef6760c6,ad0134ed-a16c-4866-a4d9-7b82819301dd,2023-05-04 05:21:58,Suspicious Activity,Left husband guy change practice significant.
67fd3aa0-e714-4708-81ee-882fc134dc56,556564f6-d8cf-4f6c-aeae-157bfe73a8a5,2023-03-12 03:54:01,Chargeback,Build firm explain police.
c1221901-8f42-4cd8-91da-ffdf5441c8ed,88970722-5696-4a26-8573-2ac400424049,2023-04-11 12:13:27,Chargeback,Under yourself statement save require pressure.
a8f5a9bc-a9dd-4c72-9d4a-690da3e84214,dc4e3514-bf7f-402a-8fc7-c453c837d97c,2023-01-29 13:01:29,Chargeback,Item rest bit program follow human remain.
7ea0f966-f479-41a8-b112-c57f78022a94,884b475a-3735-4f70-b9d8-f8f6438567e4,2023-03-29 23:15:40,Suspicious Activity,Attack no race measure hold.
0d8392b6-08f4-47fe-a05b-09a10ac40505,a220a8fd-d227-4f5a-8fa9-9cca0ca8a28e,2023-03-02 18:03:12,Chargeback,Information leader main ability interview better nation around.
895f3080-d8a7-4a1e-b7c4-3ba85664a5c5,5c414611-9553-446f-a996-4d33237af504,2023-08-14 03:48:23,Suspicious Activity,Media oil time under could.
cbbdac72-b61b-43a6-823f-bd151166106a,81128bec-1a63-401d-be2f-557321a1bae4,2023-02-20 09:45:27,Chargeback,Defense consider arrive task since reach remember.
452ad67f-0a33-4976-8da5-f79c37918dfe,65e9758c-21a8-41d3-a127-c329925611b4,2023-04-17 20:10:08,Suspicious Activity,Add success material stay.
40ae5d60-4800-42e1-bca0-6d4e6d4640ec,48cd438e-0f13-4000-b628-ba7988a9c824,2023-06-23 00:39:49,Suspicious Activity,Sometimes room when least.
13a98c47-642f-4cb9-8939-64e695838833,a284e410-2c2e-4894-9510-c957b2e42d0b,2023-05-29 12:23:33,Chargeback,Medical job respond model.
328e3776-1e35-4805-acde-24b998a5feca,8ff9eaa7-3175-4b51-ba5d-d4a90c13c30c,2023-03-19 23:07:22,Suspicious Activity,Sound team suggest.
05b5c50b-185d-498d-8343-5aa4fe2d218e,7c11f104-358c-4180-9ef4-c17e4e6ca070,2023-03-07 02:23:14,Suspicious Activity,Push ever official goal forget so several.
9af1003d-6edc-4546-aae8-d66fbeea0550,b31e3739-0bb6-4abe-a778-15a94cc610a7,2023-06-22 11:52:57,Suspicious Activity,Culture name key action.
58b0fcac-e629-45d5-bd36-401c74773063,d45844dc-c5bf-4496-b45f-9385efc74ec4,2023-01-23 20:05:16,Suspicious Activity,Foreign year member two see speech.
fba37571-f884-4d51-905e-8e3efd26c1ae,401e8c84-22a2-4b84-95cf-e06f488e6552,2023-08-09 11:28:39,Chargeback,Fight off play.
ea410014-1fd0-42ad-a9f8-98511838c7ce,712298e7-7518-4b1d-89e2-bc5b00cabd47,2023-04-20 12:20:21,Chargeback,Phone whatever TV scientist for notice without sense.
e04dc6ee-584b-46bc-a467-0989d5b7e193,d99f39bd-975e-47f1-a5f5-7da252099d18,2023-01-05 05:59:22,Suspicious Activity,Machine everyone rule way how.
1a965b13-067f-462e-af92-0c39ab5df6e6,a3e421ca-be5c-4c52-9b1a-1f79d8b19080,2023-03-07 23:43:37,Suspicious Activity,Inside during body drug author include step.
7335d449-bf5a-42e2-86ec-9a0725fbf92c,dd053b53-bd91-409c-82dd-8a127dc93025,2023-01-07 16:33:07,Suspicious Activity,Recently specific return guess school election other.
525e80b2-43d6-498b-81a4-c6045b7bc0f9,f9a51aad-bd6f-4ad3-b27b-a2c0b7c5e935,2023-01-29 20:03:53,Chargeback,Scientist pattern thus letter word.
05fe5651-1ae2-4f23-96e3-1cc2e0564ee4,9432c6bc-e88a-43b5-a31f-be99c3287bb7,2023-03-26 04:23:21,Suspicious Activity,New forget political.
1a7c1356-994c-476a-b398-b72b0e52e25a,0cee8b28-6b3e-4e84-9aeb-3608567b3b99,2023-01-10 23:25:24,Chargeback,Charge soon travel arm suddenly fast mind.
982b28ce-801e-43d6-8d96-50b2233e1f32,9592239d-5c82-45a2-8576-78f209ebea00,2023-07-02 19:46:54,Chargeback,Choice executive sort far news partner out.
341b7bc5-b55f-46c0-8dbc-fc0a3c4923cd,ce4f5b0c-a304-48ed-b04c-9b7f4f8b35a5,2023-05-21 11:33:56,Chargeback,Hotel interesting national.
9ab595e1-2850-4cd2-a014-55d2d8eacc3d,1d44b8b1-8fce-4ba0-809c-e0bb0cb77ab3,2023-01-23 23:14:36,Suspicious Activity,Me teach stay field concern several yet name.
5d956f5c-9b5a-4435-9d78-9b0bdcd5f923,1b650803-ebc3-42de-a16c-0490de153ad9,2023-02-15 11:22:55,Chargeback,Recently recently born but thing seek office.
