Alert ID,Transaction ID,Alert Date,Alert Type,Alert Description
9f3ba3dd-3208-4e92-b1a1-bb43ad7608c4,cb91bfa4-f2aa-4349-b9b2-dd92336bb3a6,2023-07-31 03:04:22,Chargeback,Include audience onto person.
f3777be4-88bc-41e1-8491-d4a3dc762595,0bece074-0150-44e6-9238-d37f8bfa0647,2023-06-18 07:18:04,Suspicious Activity,Person yes direction represent.
27d648ab-ca35-45c4-94fa-b27c503c5694,d7de7195-03e2-4bdd-aeb2-62c48f9de81d,2023-05-18 12:45:39,Chargeback,Outside light girl idea animal turn paper.
5a365477-c4cd-47d0-86e9-cf68bfc6c0b4,86d56f75-4871-4d5b-86c6-a3c636426e18,2023-08-17 11:54:11,Suspicious Activity,Trade really movement teach.
18c30ecb-b5ed-46b4-aeca-60e9c39280b5,adcedfb1-f177-46d3-bd96-d37fde321c33,2023-06-01 04:59:04,Suspicious Activity,Against inside radio only condition film.
dd05aed4-1b93-490f-b758-23557055158f,98bdfdaf-6db9-4b7b-a441-6d1b0daf3344,2023-03-07 05:18:37,Suspicious Activity,Radio reveal staff financial.
03cfed9d-e543-46ee-95d0-ed6b44852f74,619d63c0-31e7-4b57-9f8d-9fff05d36ad1,2023-08-09 22:14:32,Chargeback,Team though nice that service really family activity.
cf49db90-d24d-4ee8-81a9-251932faf807,223c611d-4ea7-444e-9e55-b62f27789f51,2023-06-23 22:29:04,Suspicious Activity,Quality tax rock how rich instead race.
1b59e597-7f67-4fe4-924c-daa09bbc39cd,23bb9675-6c40-45a6-be83-d263abd65616,2023-02-11 23:07:18,Suspicious Activity,Stage traditional knowledge want bag economy role whom.
c1638546-135b-42b1-b237-b94b5fb91191,9f9d074c-4450-43ce-961e-b3f1dd345d9a,2023-03-25 16:59:25,Chargeback,Forget far realize cold not fight.
72f01d37-7fa7-4ba8-83d0-5475ad85a7b0,149458c3-f812-4118-9d0f-d2a4593a58b3,2023-04-04 09:03:05,Chargeback,Nice season large Mr some court.
06da4538-affb-49c8-86cd-2f39edca1041,5fb7caec-f827-47d9-88fa-01ae2c5dd4d8,2023-08-02 17:53:09,Chargeback,Organization model company itself would.
af161e4a-a639-4f62-837d-02b8d821ecd6,f2d0896a-4cb6-4d46-8eeb-8d4f4e09e1ea,2023-07-11 06:12:10,Chargeback,Make song kitchen movement scientist attention practice.
d13bd7b9-1c03-4422-89dc-3908b18fb1f2,a1887225-c52a-43cb-a796-472e28934fed,2023-02-27 11:49:18,Chargeback,Lot nearly nearly wrong short.
3506f114-5646-43fe-a78a-1bfe2ce20317,fa09ca13-c41d-4b54-b0fa-bfb1ca1db472,2023-03-28 23:18:53,Suspicious Activity,Us station along myself budget court ready.
48f7727d-57b2-411e-89a5-8ffb246d4080,546c1a7b-4da3-4b11-9af3-7682e53eb3c9,2023-05-31 20:44:03,Suspicious Activity,Seven participant southern notice.
0df392a1-e51a-4253-bdb7-105f3ce9475b,62bc0ee4-b759-4b54-b9c4-cc9e33e3353c,2023-04-07 03:00:53,Chargeback,Discuss approach room under market.
0ce71691-2b5c-4e89-9a16-bf7816061531,1c24946a-4261-4258-902f-9ed3576da1a1,2023-06-18 01:55:45,Suspicious Activity,Owner inside believe front plant tough.
d7185314-5b10-410b-a2e3-91bbc1bf74e2,6adc6052-6c4c-472f-9913-31aac52c3bfe,2023-07-22 16:49:47,Suspicious Activity,Stand culture exist and true fine.
ddbae6f8-6d12-492a-a7f8-f70158c73bb8,e23bb154-ac9b-4392-b293-2400d8ca8af7,2023-01-16 15:42:33,Chargeback,Determine professor production national.
9a33eed8-50f0-40a2-9bef-66cd97352267,a7e84db9-7370-47e9-b0cf-c88abdefc234,2023-01-25 03:52:04,Chargeback,Star blue public thus character.
413ef9bf-6ef8-4a24-9def-5f32a3e78e35,18f1e5d6-1e1c-4397-b48f-2b94d3998e5b,2023-07-19 08:17:01,Chargeback,Stuff leg much thousand theory.
a8c0215f-a9e4-4b14-b18f-7e51d14797d7,75009265-eae6-47f2-90d5-7f023408ca1e,2023-03-06 15:31:35,Chargeback,Mean ground picture new.
b76a1838-1d2d-4f01-af09-4e4c6f1fb3e1,74c3e988-6d65-4b0f-b738-4f6041fb22a3,2023-03-19 06:09:35,Suspicious Activity,Fund hit talk claim prove rule audience.
87ec29c5-082b-4e9b-959e-8131555130ca,2e22922c-14df-45da-8388-e2011487faf5,2023-02-09 22:58:53,Chargeback,Across person his poor.
d1e10f15-a261-427b-acb6-1bcb37756d3a,5367deb5-080c-48ff-9f7e-a78febd476fa,2023-01-29 14:22:21,Suspicious Activity,Base view half statement along true.
66362d68-cd73-4d7a-b673-781f4c6b1c63,136e3c4d-1531-407e-b55a-bb2db5d1a0f7,2023-05-18 09:58:50,Suspicious Activity,Myself several politics point.
851a2055-61ad-4a81-bc27-f8e193f876fd,98bdabe9-0985-4c34-8293-808c91ce2d1d,2023-07-18 11:25:06,Chargeback,Rich talk region above.
01ca90ff-03c5-4df5-ac5a-55ecc1a15da1,ea97a079-9e99-4232-a388-d38ae7de09e0,2023-07-27 09:28:36,Suspicious Activity,Career role business certain three little opportunity.
d6e1ecb1-7430-449d-b86e-c267050fcd90,50c4f1a9-6066-41a3-a368-747cc52b04d9,2023-03-24 18:53:12,Suspicious Activity,Old oil today travel business information.
c1598614-91a9-47f4-803f-d5213211e3fc,c2d510da-f358-43ff-86b3-b41af2db8669,2023-07-06 11:17:48,Chargeback,Social away garden compare ahead include possible.
ab5f16a5-0e1a-4303-9a05-e89c6e5763fa,9989ebd2-61b1-483d-bf7a-4978a3868e7f,2023-03-08 12:31:36,Chargeback,Candidate world follow car cell avoid.
b2fc9fe1-04a5-472c-8d89-fe3e41d1474b,c650878a-031e-4b97-ab41-493d3396b896,2023-03-30 13:47:06,Suspicious Activity,Child number international while agree start near financial.
b9c31086-2c25-4740-8b45-3f0487a62f7f,632d8e02-df87-4d1a-b72d-7c27c65d7d28,2023-05-23 05:10:02,Chargeback,Trouble pass risk heart also open.
c0d41c26-055d-4089-8e40-923925279621,8483875e-78ba-4d85-8fdf-820c961817ce,2023-04-24 14:10:22,Suspicious Activity,Party himself apply upon.
c49c0c91-89f9-44cd-b0bd-b3d76b38083f,4b41b0b2-19a8-4630-9561-5b6aa2b881de,2023-02-11 03:28:50,Suspicious Activity,Authority hope instead wear.
37985b57-1169-4fc1-bf9d-b4910a2a390f,40491268-3d13-4546-a55d-fc0285c06429,2023-08-01 09:17:34,Chargeback,Message difference season foreign manage save by.
dbb83384-94b7-4c91-98e6-e7d0488f6697,32a51719-b4bf-4c88-980a-c18bd7b6332f,2023-02-23 17:36:04,Suspicious Activity,Prove door explain.
43330bc8-aab4-4ce8-b947-87996450764e,88c41cb2-5ba9-451f-bb03-2262974ef72d,2023-03-23 23:59:50,Chargeback,Result store high more wife stay past.
1cc4c7c5-72f3-442f-8c7c-ba2caccde0ce,1d110dfe-0a45-4115-a6c1-d06c348e9aba,2023-07-27 00:35:59,Chargeback,Than artist single local international.
79b1e4f8-4aaf-4ff0-9784-0692f83ce254,227faf32-6666-4380-82ac-3470a7e9efbe,2023-05-02 21:34:03,Chargeback,Truth activity religious him today investment why free.
7f52ef55-b37b-43c1-b0d8-3485a8ab6d77,8f15030b-cca5-4d28-a27f-f542ed7f4f4c,2023-08-06 00:23:16,Suspicious Activity,Discover support thank strategy.
7faf5874-48e6-4b42-b761-3ba0dd969fde,3a9c1f18-1a46-482e-b20f-91ae82889d0f,2023-03-16 15:01:40,Suspicious Activity,Bed trouble old son bad institution health.
a6080a13-5786-4522-8006-d7356972747d,216a7c9c-98d0-4855-913f-e5792a489074,2023-06-09 17:13:53,Suspicious Activity,Yet north population none unit experience second.
5a382d0b-94d2-4a24-bb2b-0eaf0ec9c686,baadf330-4730-47ef-a353-2aabed2000b5,2023-01-16 11:27:36,Chargeback,He clearly business once.
8dae5a91-d6e1-4c40-8b29-5923d22149f6,0cbc531c-b6bc-479b-9afd-1bd90c973bdb,2023-04-01 07:57:10,Suspicious Activity,Soldier loss threat seat product history nothing.
cc731592-8057-490c-a093-e551f3c86914,42de3b3e-edeb-40a2-8327-f11ad9432761,2023-02-01 19:33:41,Chargeback,Painting professor who travel hand current.
5965431d-b38c-43f0-a19f-004fd351ab20,f568cf2b-42e0-4ae3-9596-772f1f644b01,2023-01-20 18:01:03,Chargeback,Call who food ago reason environment.
570af92e-d4f1-4c5f-afc3-e0d00128522b,f30aa0da-e49a-42e7-b1dc-3a410a73baee,2023-05-02 18:44:26,Suspicious Activity,Free court write especially son purpose.
dfa1b324-8248-4059-850f-fd031d3065a5,2c53cd73-8ba4-4e47-b0b0-7d12fbd3f4c8,2023-04-23 16:09:52,Suspicious Activity,Mr sense real sign.
3f3a3c0f-777e-4449-ac63-ea9797794db9,edc55e25-62aa-4a1b-9e75-984eff3505d5,2023-06-25 22:06:33,Chargeback,Admit measure operation better stay great.
4d5912c8-4833-48bf-aaf3-9edbbd2c3c68,29d68e48-6402-4ac4-90f0-6a798c3984c5,2023-04-20 03:13:50,Suspicious Activity,Way care table none participant argue.
52c1478a-66d0-4cd0-88be-8b69e1ba86e6,dfd62ee1-e4e1-4019-9357-1ffc21c260de,2023-06-03 11:15:56,Suspicious Activity,Pull charge take chance financial win practice attention.
ff0f3a4e-bee2-4c15-913c-75108273fa62,52df5ae5-b3b1-4e44-84d3-61e9115955aa,2023-06-29 07:51:49,Suspicious Activity,Around support wall according across.
abbd5b68-67a6-4ae3-bb33-0d618ce39bb0,099bef73-612f-4cd1-a14f-037ba10f0c06,2023-04-21 13:55:09,Suspicious Activity,Military son stay wait actually north.
60d60a73-56d8-4df3-9c61-5db4f616680b,e0403215-ee1a-4047-a1a0-b11f43a74d25,2023-01-27 15:29:33,Chargeback,Family the yeah as.
0d48d942-65ac-45ab-8a24-0e8493d86363,e85a8663-b61a-406a-ace5-b6f1d38e4a79,2023-04-14 17:10:07,Chargeback,Left quite purpose campaign task.
727bb5fc-3dbc-4863-9428-82fea6bf8627,9b408e95-851c-4a5f-876c-0b06ab56c8c5,2023-02-03 04:07:55,Suspicious Activity,Soldier drop school.
569ddd6e-db9f-4db2-86a4-0a7b26901449,25409ad4-c34f-404b-9b09-d9073d6e3505,2023-01-22 11:21:47,Chargeback,Education story drug.
6f786666-0356-4e71-8acb-f1177f8fa860,fd0ab2f0-cdb2-45fa-9003-57a46aa37621,2023-04-30 09:35:50,Suspicious Activity,Subject outside art candidate help three few.
82f29698-2ff9-4eb2-bc72-f91ca7f4e374,e39a3d3f-9a4b-441c-b5f9-073bf49bc55f,2023-04-02 14:03:41,Chargeback,Child foreign us.
d3dd2251-4a36-4768-80f8-02990ebbb471,2e87dae2-4556-4193-96e7-379f8ced8985,2023-06-07 05:29:49,Suspicious Activity,At ground management type cell ago need.
f93cb712-0e32-40ff-9ed3-2e24cb080771,d70b5206-b500-4647-9f9c-1be6e6625d6b,2023-05-06 02:21:32,Chargeback,Truth morning action contain most knowledge me.
9fa52e1c-147c-47e2-b16d-96a59f9cd949,f6300cd6-4d9c-462d-817d-53e1745644fd,2023-03-24 17:31:50,Chargeback,Establish manager understand make daughter.
68ce4ec5-4539-449b-b77a-dba4983bc11c,03b8449e-92fc-4f68-b1fd-2f2e61dba30b,2023-01-06 16:03:13,Chargeback,Describe material imagine.
5ad47d38-a113-44d1-827f-c34ed3602182,d5a25d42-1fc9-498a-b899-6ecf685ff33c,2023-07-07 15:39:51,Suspicious Activity,Save view material from.
9ae38913-c5db-4b37-bf4f-c0ca058c3547,4faccea2-32de-4e71-b483-0b477a811863,2023-01-06 21:23:58,Suspicious Activity,Subject our like evidence time.
a76fd493-408c-4485-b44b-2fc2b7fae2c1,36596d3e-8fec-4758-bcac-45af7c3222bf,2023-06-27 22:54:45,Chargeback,Else sign improve magazine room affect common.
33ffec43-2743-4d5c-b137-ef83c23f4101,a8d02001-7112-4612-a59d-eebeed1fa932,2023-08-04 07:06:24,Suspicious Activity,Despite community after man it.
c29feb54-d192-4ab9-afea-2a4a42d9de10,1bba46d9-f0ef-4350-a629-98e448d8a1b5,2023-07-01 03:54:16,Suspicious Activity,Great side development religious should moment.
b14f76d5-3c6d-44db-8db9-118c47ad759a,1679900d-ef8f-4a8a-a02b-8816921e4489,2023-03-01 10:49:45,Chargeback,Measure real deal occur another after.
48f20e38-3460-481f-a167-bd54c5693afd,7efe5b8c-d26e-45dc-baa2-5d08152099dc,2023-06-27 09:56:04,Suspicious Activity,Able use long family one discuss garden.
345c025c-0387-4698-b233-b8cdd08e83c5,235d55bf-966a-4a4c-a819-0601cd1afd8b,2023-03-16 15:02:15,Chargeback,Congress party paper call rest shake.
f1c8a040-ab80-4e5a-a376-fc026a73e2e0,cd8c6663-fb4a-45d6-8095-4462e5e941be,2023-05-25 04:07:19,Chargeback,Develop trouble arm left positive.
7b0a8e29-20f0-4bc0-b840-5614b9ce42e3,526ce7da-dcbf-4ea9-9956-d2cf2633c507,2023-07-17 14:48:36,Chargeback,Look set candidate address song.
f00cd6fa-3b58-4ecc-8f76-fb36883175d5,ca7637de-181d-4fb9-80e9-93bd6107043a,2023-06-05 14:57:49,Chargeback,Want situation pick marriage lot stuff want skin.
5467d6bf-ab4b-4288-b784-f8a5d19cc9eb,a72e7f50-0c50-4b0f-a373-8342c4120809,2023-05-10 01:35:08,Chargeback,Station not hotel.
9bd36b5f-1bba-4829-ad68-3f0eec891677,90701b1b-be33-4268-8fe5-f031d36f12c4,2023-06-19 05:25:10,Suspicious Activity,These not him dinner west right.
7f097b63-32a9-45b3-a3d2-071d4d0fa1c3,2e0ce886-f8cf-481b-b3d9-45a5774c6bcd,2023-08-09 08:19:27,Suspicious Activity,Trial level remember civil money.
5c8355a5-826a-4ce3-893d-f31300bfbff6,46351b26-34d8-4753-ba59-23cdf985930a,2023-05-18 17:32:45,Chargeback,Change TV with strategy past.
6371f9f5-65b3-4079-bcaf-1e3c4b5e962d,cc0404fd-b1ed-49e3-81e9-3116fcdada04,2023-05-19 08:37:44,Suspicious Activity,Speak stuff support company memory plan.
29adf7e3-a1fa-47c8-ad0e-d7181f2e33a6,0faacb5a-2109-4b2b-b970-c1b13428d2b4,2023-05-22 08:14:56,Chargeback,Professional green thousand off run.
259a1736-c117-4eb1-8da2-8b42566c226b,e37d7cb2-dc6f-47cd-b57d-1344c4b4550a,2023-06-10 18:54:07,Suspicious Activity,Series happen art buy buy main after myself.
73a69abf-b79a-4324-9409-a98e8818f4f5,58141e4c-b785-4650-b4b8-c496b09e8a39,2023-05-25 14:22:46,Chargeback,Partner break fund.
ae3106d4-0802-4313-9443-0b6cf61439c7,2384fb51-9df5-49e4-8226-23dcb5407996,2023-07-02 18:30:41,Suspicious Activity,Sport their sister around many whom.
b78fb8e6-e745-4629-be37-7101d544b606,4d53c580-c882-4cd3-8f90-3baa0d0d906d,2023-07-05 11:22:08,Suspicious Activity,Economy do draw college year south.
ddb1de2a-3c9e-4047-886d-fa8477f4ad78,2dc87faf-208a-4737-af39-8f4d40b8c0d5,2023-04-10 08:26:16,Chargeback,Thank impact question.
859b4635-70d4-4a1d-8427-cb1e00c8561d,7cbfa55f-876b-4235-8245-1be065ddd933,2023-02-22 20:18:41,Chargeback,Away future game long move bring force.
61de31ab-bf10-4f81-bbf3-daa70716050f,12e488d7-013d-4381-aff8-a14e87f3247c,2023-04-22 06:45:48,Chargeback,Raise imagine teach safe do.
69a22503-d64e-430a-a2f8-1dde39e8816f,98f65ff9-c4d1-4307-a8dd-f42fa7c402f6,2023-05-05 10:47:27,Suspicious Activity,Hope health movement cell everyone.
56a17c4c-bc52-4151-bcf4-80b065658ded,41e4d1c3-622c-4315-bb64-3d106cdf4814,2023-04-08 01:37:56,Suspicious Activity,Best everyone rise people son rise carry.
89c3593c-da30-42d1-985b-e8245f218297,86533626-9c1c-40d6-bf9a-7469b9283b37,2023-01-07 19:12:50,Chargeback,Drug group suffer cup soldier everyone off.
f16a0f60-3c18-4502-926e-b6b45c668499,ca13d3bf-32a0-49b4-ab9d-79ec922bbf9d,2023-06-23 15:09:07,Suspicious Activity,Culture notice us across.
cbf1ca32-f5aa-4e6c-90d2-90a737bba2cb,731590bc-2675-4fbb-b0dd-4ca883c2b931,2023-08-15 22:47:15,Suspicious Activity,System choose though clear discussion at or prepare.
2e508c27-aaef-4288-88a2-640ca8038d44,5e088628-03d3-4706-9e61-f49460793e91,2023-03-07 12:33:59,Suspicious Activity,Into keep peace collection.
290794e3-9fae-40e3-8492-52fb01ea5183,fed1fd85-556f-46f9-af07-da2e60c6d051,2023-05-16 04:39:07,Chargeback,Have opportunity six method plant forget least eat.
37e0d693-4eef-45e5-a0d4-5d61340e36f9,6e037fc1-a8b6-4826-b2db-0f0cb35df09d,2023-03-13 01:55:43,Suspicious Activity,College scene in job impact after message.
49786d4b-c6ab-4a36-a35f-fb0190a42a15,23d97d7a-9fe5-4d35-aca6-87dacd4d8699,2023-01-19 01:18:10,Suspicious Activity,Show project seem many free.
f278c130-54b3-43e7-916b-3eb9d7660eb0,4cd77a3c-b8de-4755-a6dd-61dc29eec0e4,2023-07-13 03:15:19,Chargeback,He return table production across.
0460451c-6f0e-40b8-b0eb-f3645d1fa6c2,12afc76b-3f36-4dfd-a507-2de2a0e4425b,2023-05-29 07:46:45,Suspicious Activity,Who speech both room develop.
9add5141-3764-4dca-8355-5e49e8da331a,c15f5022-f3ea-4783-9c6b-0c0983ce597f,2023-04-22 22:48:43,Suspicious Activity,Foot build note player.
8199585f-7c54-4c25-b465-cd5b01a9e668,d8441662-1297-4f5a-92ea-a7b49b371e37,2023-07-03 12:46:42,Suspicious Activity,Available Congress program term more list history.
0ed0ec3e-c883-48b6-95ad-d74eee76ff31,1e1aeb5e-dc37-448b-b208-ea57fe022bc2,2023-04-07 21:43:11,Suspicious Activity,Rate plant machine population career start.
19c32600-d08a-4e80-8e30-30ff074628f4,19090914-7cb9-41a7-986d-b3147ead98fe,2023-05-24 20:42:08,Chargeback,News drop director continue bad.
29baea3b-8955-4a57-bf3a-fb0852567c39,0fe6d736-a911-404d-afbb-e0fe6510ac77,2023-02-22 13:57:02,Chargeback,Son top teach its join.
c63f9a55-fca5-4e94-9388-ed595c29d5ab,2d33472d-db61-4d55-bbb1-600b61603c28,2023-05-24 01:03:35,Suspicious Activity,Newspaper resource until turn practice rest.
1ef63d3c-ea99-4bda-8b73-1a386a9ed501,c39e080c-de0e-4bf6-a164-feeb2abe3210,2023-06-28 15:50:21,Suspicious Activity,Give century yeah expect world.
0f0ec74f-eeb1-42bb-9e35-83d572c18e10,7f167bad-88fb-4e04-9f81-c6fe29dc0c26,2023-08-10 15:44:22,Suspicious Activity,Action trade chance admit him factor.
2137d8ee-1fd7-4eba-9cf1-5c61d68e3a6c,373a579e-1fe6-4e47-b4eb-700cec377d04,2023-04-29 11:39:47,Chargeback,Old ahead break yes campaign ready especially fight.
24c78718-57b3-4bde-9985-9242cbcc280d,e0a7eecc-6aa7-4df5-8f3b-74f21695ceaf,2023-02-18 05:50:55,Chargeback,Artist area head under exactly.
5c958899-7e52-4738-8a02-2d535c542489,943e3674-21f5-4a5a-b259-8fd68f7dc8a3,2023-07-10 14:05:33,Chargeback,Similar wind discuss rock report big.
e9e13b6e-2e30-457b-bf06-1cca9b0c3284,5e002737-8deb-4d4c-934d-3db85b5616e9,2023-02-28 21:05:04,Suspicious Activity,Create here really name positive.
ee3e93d5-e092-4d82-9853-963e092b2776,30709065-6d1e-46a0-b9af-833c15ef3090,2023-02-24 10:45:43,Chargeback,Find after son reason town.
b1fbff6b-f9f3-4429-9b5e-a1740ef08a5a,8bb8b5f0-fab1-40f2-a5b4-013c27058e1c,2023-06-15 01:11:03,Chargeback,Mean risk subject later fact reality case.
babc861c-7792-4224-8ccd-0ea6243bd393,64033a92-7e62-4b77-9a11-6686844d8b79,2023-01-21 12:33:30,Chargeback,Each your budget travel image article.
0bfca94b-08ea-4a8c-9e56-913553b41495,1b6560e3-8d7f-498e-8e3e-0921ed431625,2023-02-17 17:13:52,Suspicious Activity,Believe paper list among.
051a99df-25f6-47a5-8f85-130043aa9489,312dcfbb-fceb-44d8-8994-b0537b87e85d,2023-03-29 06:58:28,Suspicious Activity,Majority month begin send.
7b07b7b1-4343-4bc1-ac5e-b3d8d663b98d,670987c0-09e6-4afc-9929-dcee8e28d336,2023-05-05 17:13:30,Suspicious Activity,Explain west face rate lose box.
73670682-5af8-4900-98c2-730b215346ce,924037f6-3dde-45eb-a581-3a9512ad11ca,2023-07-14 01:39:28,Chargeback,Happy modern floor pressure cell.
7ac588df-a74c-4c96-84b2-b936014bbf23,cff126bc-a76b-4887-8ad7-f0c7c3a09161,2023-05-20 15:55:01,Suspicious Activity,Win there protect treat.
e12659a0-b591-4336-a686-706a5766d47a,7b2cf6ee-1c1f-47cb-b329-29ee09a05c30,2023-01-24 19:20:10,Suspicious Activity,Act difference account know popular.
84c58f4a-4685-44bd-86b1-0ef58612be50,d5898b9f-62d2-4fde-847b-7de602ce9644,2023-04-30 17:04:22,Suspicious Activity,So dog consumer dog discover protect appear.
03766069-56ed-4ed2-9feb-3614101f1258,3a005c56-5d5b-45e9-8db0-5367307fa30d,2023-08-18 13:18:24,Suspicious Activity,Increase change easy me control little.
48525778-75ec-419d-aad7-c44a8d9dd91b,6c666555-90ca-4e0e-a73c-44fc9dd1fa6a,2023-06-11 18:49:32,Suspicious Activity,Article enjoy stuff impact single game number sit.
50ff9444-b363-4786-812f-f9f86c04b541,d46fb153-468e-4088-8dae-e0a39af00f2a,2023-01-29 17:30:29,Chargeback,Enter strong body save.
43a322e6-cda1-4dd5-b298-aa9d462a3839,c5f1c6e2-c4a5-4735-bb83-7d8315381f56,2023-03-21 01:45:01,Suspicious Activity,Father firm stage suddenly great management experience.
2e3cd7d0-3deb-41fc-b49d-e47d0cd4220c,a11309c5-63aa-4926-a6c1-56113fad74ce,2023-07-26 13:42:27,Chargeback,Personal stock factor alone with what should.
19fe60c6-ac19-4ef3-9874-f1906c5ab43a,1305576c-d40c-42bc-8f63-095f524047ef,2023-05-04 07:27:48,Chargeback,Sing return peace already person.
b19f8dce-fcde-4dca-b63b-817c475ba226,0a700858-34f6-4376-8e6f-248bdf8811f1,2023-03-26 21:36:18,Chargeback,Throughout firm news degree.
b79cc35b-4d93-4a0a-a694-ebccbe01cbc5,e539d827-6a88-4551-ab64-d717ec21a2b2,2023-02-08 06:07:55,Suspicious Activity,Station always peace fear.
c8f2569d-ad20-4469-b2d8-3415bd89a1cd,cccd65ed-138a-4e58-8d7e-8dbe0a6c6162,2023-01-14 06:47:02,Chargeback,Return yard camera particular nature too.
2340c74b-b134-4374-b0ed-dce5c00812d6,f0288293-1abd-4199-a4fe-476a16b99d7f,2023-05-03 16:00:30,Chargeback,Success style serve me both.
8af61aad-9235-44d6-9e4c-1c849ef37ea1,59cdef45-5a21-44db-8259-7597e2071e5c,2023-04-14 13:10:18,Suspicious Activity,Within bar however safe whom.
78967d10-e7d6-4681-a3e5-cb159725d171,8d7770c5-b4f9-41e3-b2f7-e5c1c6e86812,2023-04-06 04:01:54,Suspicious Activity,Last out kind car inside.
16095d87-7693-4228-99bf-7ded751ccd0d,241e5718-73b5-4af8-b49d-e3f18fe4ca52,2023-06-11 18:26:50,Chargeback,Test relate staff standard responsibility myself.
d55036aa-5ed2-4cda-b660-60a60c1c10ff,4991ff27-cfa3-43ab-a743-866f4be76053,2023-01-13 20:54:25,Chargeback,From man write voice live.
75f890cf-4ad0-402d-95b2-f1a47680432e,d1d1c475-dc28-41ac-b94c-005fd3d37740,2023-06-11 22:25:57,Suspicious Activity,Site firm international cost continue two.
ab62cac0-5a4e-4349-9817-3a6cee9fceae,18c22f7b-a974-4f38-8868-81a24d931257,2023-05-14 17:14:10,Chargeback,Performance short very maybe will half.
5217133f-bcfa-4ac4-a5a1-cb5dfa6cd7fd,9c55594d-e361-4653-bb99-39e70a3922f2,2023-01-11 05:49:59,Chargeback,Produce term our far matter by economy.
820e24c3-d02b-4400-9d0e-43ae6f9c8593,6f50a277-756f-44d8-b676-abaa4297d3c6,2023-07-08 07:20:07,Chargeback,Term east senior authority.
ef43aa26-21a7-4d04-bab1-124bb1f7e6b6,186dec96-0831-4bbd-ba62-ca3ea7f2f45a,2023-05-06 20:32:55,Suspicious Activity,Tend stand compare edge.
d408cbc7-dabe-407b-8a6e-5c5b18224af9,0bac2e6d-5fd1-4d43-8d37-90203662ff86,2023-07-06 12:12:18,Chargeback,Want however where election chance.
b1cfe87f-2f35-4a7c-9ca6-6c1d7d137121,0caae139-064c-42da-9185-76be2c4b9b9f,2023-07-02 21:50:45,Chargeback,Enough feel five for but.
9a791640-b07d-4258-a567-7a582bd0cc27,431ea54e-4ec3-414a-806a-ace36630e28f,2023-07-23 01:04:39,Suspicious Activity,Movement measure the officer if.
a9f87172-37cb-4aa2-ad9a-960c4f5e02da,03685c9e-6bb7-4f52-9da6-5ae98c706b46,2023-03-05 07:24:21,Chargeback,Inside strategy space.
3f305f95-82f0-44ed-b161-f46426f6f2e4,782fa63f-16e1-4b63-bec4-31ad56dd6a59,2023-07-26 20:11:38,Suspicious Activity,Reality body foreign chair yeah.
33b2a70d-6711-480c-ba46-2a39deb9d704,bda7dc07-f20c-462c-8d64-1b6c8725ba6b,2023-06-09 12:45:56,Suspicious Activity,Because fight change eye big religious brother federal.
01f6234a-d567-499f-ab0a-44696638c062,1f4f4e3e-df9d-4bc2-8147-eaf0628831dd,2023-03-17 20:03:08,Suspicious Activity,Charge ground top should most wrong true.
efd5c771-635c-46d7-9e54-ca573291fb11,346373e2-aa66-44bd-99de-c589052ee6ea,2023-06-01 17:00:40,Suspicious Activity,Serious read six.
76f70947-2c5d-48f2-af8b-54476e2ef91e,cd9df22a-bfd5-4f37-a37e-b6da47d1e0a0,2023-08-09 23:22:36,Chargeback,Assume choose dinner participant current behavior imagine.
08f5f47b-b4e8-460e-a921-a405050268f2,e1a74478-9f36-4fa1-94ad-dd273a0bff33,2023-07-04 03:22:26,Chargeback,Forget total politics song region.
f424e0b6-b5bb-45a5-918a-7015a943f31f,a4c86157-7fad-48cd-b33e-587c8fb68baa,2023-03-28 06:03:45,Chargeback,Somebody my old hair.
68c6f099-2b3b-45f6-a952-160893cd1f68,041a54df-34ca-4d9e-b6ea-f381aa51fc40,2023-01-09 01:38:04,Chargeback,Million oil analysis ago ever cover.
2807eeff-c40a-4b9c-98d4-5ad8d72208cd,acdf56b7-c4da-4f09-8e13-1e2b3994082d,2023-01-02 03:09:22,Suspicious Activity,Recently bad community court plan bill.
e7b9ece2-6923-464b-b32d-b90e6f3f2891,ca0d10e6-b590-48f3-8797-6a45b7e34095,2023-02-08 13:57:37,Chargeback,But most hope they.
c17aa71c-4dab-4615-b048-78036cb6c6a5,e7b5c214-611b-4cbc-b5ed-b3a7cbecdd4c,2023-04-07 02:26:37,Suspicious Activity,Simply skill rate thought.
0d6a4713-3b00-41c8-b3ab-503b40a1e56f,586722d2-2ab0-46f0-979c-f0929af3a386,2023-02-13 00:42:39,Chargeback,Force field today use animal challenge and.
2a0d6350-66e5-41d6-bfd3-78962e43cc40,8fc28637-db16-47bf-9d54-d89a2dcc6c74,2023-06-14 08:24:02,Suspicious Activity,Subject message conference thousand trouble threat.
b1bca516-7bd0-4498-b65b-e5d3c0b562ef,354cfe1e-0c9c-470a-abaf-6bcbe20920de,2023-03-16 19:25:24,Chargeback,Style old mind serve.
d9e1886d-acc7-474c-8b98-9eb26723b808,5c58d4e9-3b58-4b23-a958-f2669104fe10,2023-05-07 22:45:03,Suspicious Activity,Recognize house point top benefit.
35d0892e-6328-4984-9e19-05175fd26874,cb506e0f-4ae6-43f1-95d9-ab85db685d58,2023-05-26 11:12:18,Chargeback,Relationship power strategy blue beyond style year.
7ba2bb9f-9d62-42e4-9e62-98378736ecbd,e21679b0-6de9-4471-9194-893ea64327fb,2023-04-27 05:21:10,Suspicious Activity,Always card ago piece whom stage.
7e8ccf59-74e0-4d86-a7db-b4d46f35c457,6faf7235-1564-49fe-85a3-7cc9af611de1,2023-06-19 06:25:04,Chargeback,Job letter major attention issue room.
de9ad528-b206-4df9-bc89-122e1ac1ec64,51e4234c-d4e3-4e6c-bffe-44f4b668f62d,2023-05-12 21:51:47,Suspicious Activity,Staff property past soon.
76839687-2e98-491a-8983-d8390f829682,ea264474-7152-44d1-b9f7-52c2deb87c9c,2023-08-14 06:07:43,Suspicious Activity,Because protect hear plan executive general.
295dc439-6358-4ccb-b3c1-a1251077cac9,8f859f5c-fa15-41d1-8f07-27d227fb6b0f,2023-05-23 03:55:51,Chargeback,Any manager treatment laugh ten.
9af43e95-606e-4906-87fe-67dbb4a88d8e,80d05499-e1a8-4263-84f6-fb930a99910c,2023-03-14 04:33:56,Suspicious Activity,Area pattern organization himself true candidate source.
5a08d336-12e2-4245-8763-031e02fd8655,64e474a6-9a4b-4267-a84f-e8b6e8756b74,2023-07-09 03:43:50,Suspicious Activity,These interest expert three direction box lawyer church.
76b3d5fd-0384-433d-a918-16cd7864f68b,53f7c0e8-dc6d-46f7-b236-557fed77e90d,2023-06-16 18:47:48,Chargeback,Only hair mention open budget.
ce0a7dc9-00f8-4604-bdd5-7b99755dd153,e30da63a-6549-4409-a220-66ff85ae8a8f,2023-01-03 03:14:30,Suspicious Activity,Thousand size guess country.
e38a6d9d-96ee-450f-8b2c-b2e2841bff2f,4662d7e5-12bd-4bcf-82cb-1024e31354f4,2023-07-13 13:42:57,Chargeback,Buy worry blood fall.
35676ba9-829c-4eb1-bcce-6cd643de79a2,018bd9c5-64ce-4c26-a7cd-ea6c4b55705e,2023-07-02 07:28:19,Suspicious Activity,Local father single pass attention.
05eacf62-51b7-42b5-a8a7-024a344d4efa,c20d3db9-90d7-4f77-a13b-2b7c3107aba1,2023-08-12 00:27:06,Suspicious Activity,Deep million because ground various grow them.
6ef0f5bb-a408-431d-a02f-616b0adf2c01,bbae80c2-5b4e-4aa8-aca2-5558541cb617,2023-02-24 07:35:52,Chargeback,Yard financial north start training.
39ebcdcb-a1e3-4fa5-ada8-cb8e13b1e94d,f8e780fc-1b04-437c-be24-55fcd1d3427b,2023-07-05 23:49:54,Chargeback,Vote five show star.
0bddc2be-3608-4e41-a34a-4fa91127333e,dc66e1e0-c573-435c-b109-1818dbe9b8fb,2023-04-12 06:15:36,Suspicious Activity,Full real trouble run.
