Fraud Alert ID,Suspicious Transaction ID,Alert Date,Alert Type,Alert Description
336cccf8-e16d-4f1e-b8e5-88ab587e58bc,b9c44d97-6ac9-493d-ab25-ba57f5599138,2023-07-02 00:06:00,Chargeback,Lawyer baby like first look everything.
f3c21525-7a60-4ee7-87e0-bf66ce99b160,c65033d3-6a70-4add-9d01-72ba7b299ef5,2023-04-27 18:53:49,Chargeback,May camera push.
b4a00034-bad6-4278-8c15-4ca7823a8dd0,475c4a02-4010-4abf-ba37-9180c087417f,2023-03-21 13:16:52,Chargeback,Fine water talk occur method participant resource along.
c657c2f2-d7de-4e37-a865-b01c63aa22b8,601be97b-af45-4b7e-8950-3b5946cd440a,2023-01-01 10:54:28,Suspicious Activity,Nice despite owner between send clear month.
4d26c85f-2cd6-420e-b3c2-a1b76ba3fcc4,3aa7f040-a0d0-4421-8cc4-c74538c30e4d,2023-07-28 00:36:53,Suspicious Activity,Chance public score science wife position.
c4206ae2-38b9-4283-a90c-475207d3f437,d9c62be1-8eaa-40d8-997a-d4f27a2a4afa,2023-02-25 14:06:08,Suspicious Activity,Visit guess law fast appear.
b060182c-2ecd-4ce4-8a26-d15bd70d9583,f1fba571-6810-41a2-bc16-fbbf0295ef12,2023-02-22 19:54:59,Chargeback,Be walk mention far pretty fly edge.
e5e39a3c-31b3-450a-b8cd-308c02b0aa43,91f02630-d48c-4cd9-9eb1-e06cb3f5afce,2023-08-23 03:47:01,Chargeback,When contain value project station authority up.
2284ffa2-0e87-4d77-8207-3d5c7bfe62ed,6ca0b06e-1f9d-4261-a286-0c4e8461bf35,2023-02-23 14:38:11,Suspicious Activity,Film chance letter alone fear actually cultural.
1ef60eb1-79eb-4448-81eb-34f8024bfb61,2455c548-7379-48eb-a7f0-20bfa7c305f7,2023-05-30 15:24:11,Suspicious Activity,Risk instead guy few imagine medical.
687ad32f-ea94-43e5-a0ad-30d1ba5c573a,4a405978-7081-4fba-a67b-5b87416b4929,2023-01-01 22:10:24,Suspicious Activity,Themselves meeting wonder opportunity whatever reality.
440bc35f-4079-44b1-bf5b-35da64a80108,a8349c1e-ba0b-4e75-b042-9b6b1789a809,2023-01-06 04:12:21,Suspicious Activity,Wide any price.
695b5a4c-f431-4f8f-8564-f5b6fe6cb374,05d863b4-6ed7-4044-8544-c30946ca4a60,2023-03-14 23:53:23,Suspicious Activity,Amount fly property however bring finally start.
54b54b37-f86e-4657-85c5-66d28c3773e1,125f3d1a-8e68-4023-9fce-12077b0b12f1,2023-05-30 10:39:23,Suspicious Activity,Audience husband always democratic some onto lead.
f63283f8-4d14-458c-818e-6d8aac327d20,063e28ef-997c-4885-a297-9618905eb1ca,2023-05-06 14:52:54,Chargeback,Better summer less.
2d37e265-d684-491c-b679-125895d5dc33,217cad74-19a5-49ec-8077-86ccf233e677,2023-01-28 05:24:28,Suspicious Activity,Sound industry some edge impact successful.
b048a81a-179d-4f41-8ad3-9863c53f98c2,3e96fc5e-3e49-4e03-a875-8176f7c61d1c,2023-09-04 10:53:15,Suspicious Activity,Fast drop section stay medical low drug.
ce7e9cf5-26a9-4271-824b-0577a3281e59,f99a2837-4ca3-4100-a234-f2ab98ab83c3,2023-05-02 09:37:37,Suspicious Activity,So score establish.
06d3c5d0-9e09-4a05-b9ce-b94f7dc4754c,2b768259-5a9d-4ac5-bde2-024ea2c24e35,2023-08-11 08:33:23,Suspicious Activity,Here until into still hold.
9af6f232-e199-4ab2-b8f7-8f89b63f32de,d0b78327-5833-4bb3-86b3-abcd9200aec3,2023-01-26 05:35:45,Suspicious Activity,Clear total establish.
a7130213-9d49-4b3e-8a6f-7baf2cca34de,ca606af5-1c6b-4bf0-9ae7-3b2afdca72d1,2023-01-06 20:31:12,Suspicious Activity,Attack yet explain our home situation.
5c001635-b2ee-4d86-a238-c8ac2175834a,a9c2eb2d-79e5-4d37-8023-f20cc87aa81d,2023-07-25 01:43:52,Chargeback,Leave argue may believe seven.
48640aa5-09ab-4ed1-8ce9-fdc3b7a2790a,508e3d3f-c658-40b2-bcd9-143a9123ed40,2023-04-06 01:06:50,Chargeback,Parent audience yet vote lot.
7364b778-8bd6-49b9-b69b-1ba6abe91074,b9492573-1c45-414c-8c10-20a60fdcb842,2023-05-18 09:01:39,Suspicious Activity,Must father early method another.
1cda1f78-d0c5-4df1-b376-1f1edc005d10,d5f367ae-f9b9-4840-8ecd-33fa265d9683,2023-03-05 09:01:51,Chargeback,Result professor suffer public onto.
137fe424-54cf-43db-9e14-1eed0631293b,00a76246-6797-4c0c-b8f1-c5afc848c6da,2023-02-05 19:37:39,Chargeback,Too after police collection past.
fefbdda3-2e2a-4184-9b28-8878dd97191c,8e799fa6-2069-4d85-a3a4-d723fcfeae56,2023-01-10 23:04:52,Suspicious Activity,Music would explain together information always accept.
46aeff9b-59b3-4409-8359-2d3c64db9a83,858956ec-014b-45d1-af48-a45c64b4238a,2023-03-19 05:05:17,Suspicious Activity,Various spend rise education available pass.
e3334d16-8fda-4cba-aebc-1e774b089e49,f445b767-73dd-4658-91d0-0f90bf851bf4,2023-03-21 16:24:35,Suspicious Activity,Structure work develop hotel avoid.
4454f2e3-255e-43cb-b6b8-015c46c88550,76137e95-5346-4014-91b8-a34c0a8a9f08,2023-07-06 19:21:55,Chargeback,You over see part series condition cold.
4de1677d-ade3-4250-8948-259118494c02,00492433-6538-43a9-8363-54fbfc5dd96f,2023-05-20 13:54:58,Chargeback,Military task until.
7f8fea27-6b14-4a54-902b-18f8e85303fa,09080020-7773-4626-a967-6f88c150c1c1,2023-03-01 16:51:42,Suspicious Activity,Conference industry strong its simple car.
8b4a472b-169d-45c0-a6ee-d1b17b313173,39b71793-40e5-4a0c-a79f-2081e00cd22c,2023-04-19 17:48:42,Chargeback,Just collection large put attack.
64001eeb-c1a1-46bd-8013-56a4c2235173,9fece33b-c718-4db0-8633-0f7130c6a0b5,2023-08-07 19:16:31,Chargeback,Already collection system leader environment national stuff.
9344007a-c966-4209-a75a-5a380384a2f0,c23750b0-e5f1-46e9-8ca4-9030323d6821,2023-07-23 14:56:52,Suspicious Activity,Involve agent by remember represent chance main.
c72da085-df06-47dc-84fa-5bb24f1e7cf2,bc93e574-faf0-4daa-90aa-ad92b2724b30,2023-06-08 02:45:29,Suspicious Activity,Read list first now this laugh next.
903d8311-7bfa-487b-9d4b-e0f54df17658,c73e7e72-cb01-448e-ab1d-cab233c95dde,2023-05-03 13:42:28,Chargeback,Born author growth could above.
4d8b1eea-0896-4075-8487-eca0b718a860,f489ace7-d716-45b6-b19f-a05271c348f0,2023-06-20 22:41:02,Chargeback,Perform before carry cup.
ad628b5c-add8-4ce4-aaff-c9b9474e4023,f18b43dd-a993-41b6-81d2-b62af5d12707,2023-02-18 07:13:32,Suspicious Activity,Soldier response along no activity bad consider.
c89aeced-4fba-4947-b78b-6a1e181e8b08,81906dce-b300-4dd2-9e09-54d03d37ebbe,2023-08-14 05:44:52,Chargeback,Above call energy.
b0d3dbae-1572-42c2-85b1-d3a5db940578,e07ed546-4c8e-45c3-b874-bc97c6a4c23a,2023-02-04 05:52:54,Chargeback,Husband include issue page provide.
2013dfe8-7823-4c68-bd2b-c06ef0b7a66b,ee36e268-f9e8-4e3b-97f2-2c303dd2b529,2023-06-02 15:45:42,Suspicious Activity,Paper mission year.
5d848a90-b89a-429a-aa92-eb99e7e0b390,7822a896-8495-45fc-ba5e-5c9b4d6f6a63,2023-05-28 05:57:56,Chargeback,She throughout sit response.
1170783b-648b-4f1a-8191-cf52bd12167a,c1d0b6ff-0356-46d2-81e3-469990012cdf,2023-02-15 16:01:27,Suspicious Activity,Actually deal standard center professional several.
f785b62d-f4bc-4055-b31e-8f19fcf3c587,9aa5dc22-a753-4b2e-b904-b5e8b3def1db,2023-07-08 20:44:01,Suspicious Activity,Wife seven list agree.
e986821c-b0ec-4729-916a-725fcd42113b,75fc5e6c-828b-4649-bfeb-d2a730d00e2e,2023-05-17 03:57:01,Suspicious Activity,Think benefit eye whole authority main live.
ec2fda11-0dc0-4d8f-a47a-90becfb9f75b,f5d8a316-2c4b-4242-bd94-acbe22eb4cbf,2023-01-16 01:36:10,Suspicious Activity,Others image hold.
8e0c122c-5be1-4149-b214-bab25384dce0,c99ce00b-c751-451a-a0ac-625e95364195,2023-05-23 11:27:30,Chargeback,Throughout other player nor a hand gas.
28b51a30-10d5-4559-be2d-b583900fc2fd,09a9051d-819a-4d3b-8536-6d3cdb737496,2023-07-29 07:31:51,Suspicious Activity,Party name during cold key.
807badcc-c26d-49eb-b074-b0169e7b0ca9,a9672509-fa71-4273-ab9b-ac39e500d5e4,2023-06-27 15:06:00,Chargeback,Despite beyond power treat easy high.
db7788df-a36a-4232-8e63-6cd84e704010,3acbccaa-4eda-4a99-a898-16ff7d7d4c69,2023-06-09 07:49:13,Suspicious Activity,Group green opportunity summer.
5ce25a3b-d69b-4dfb-a7c3-6dce9bd67195,c5d8c59c-3b9a-4a65-9c6e-7ae6bbd84a23,2023-05-25 14:51:13,Suspicious Activity,Special action hundred process eye.
e6c21201-188e-4735-aad6-6b1cc0f55d13,da05d73f-f836-4c98-babd-28d654f01789,2023-06-16 05:25:27,Chargeback,Here treatment month.
3b750632-3a0d-42a9-af2e-142e1adee11f,ce6c436b-3102-4980-a604-defd6c3ae343,2023-03-17 22:22:30,Chargeback,Sit man black especially network.
a1b7bdd8-10fc-4144-b4b2-03a156574c58,0e652d4f-9b1d-40c4-8e5c-0f5ad813b4e4,2023-05-19 02:15:52,Suspicious Activity,Student avoid affect sister because financial.
457cb54a-c3fd-4dbf-8aef-038487fdb2d6,02f001fb-43a8-43e5-b017-2c076ea370ea,2023-08-15 19:15:53,Suspicious Activity,Newspaper vote study serve summer have some.
bb5d1a57-5495-44c4-97a8-e070346f2295,0b49721e-d56c-43f1-895d-b22d0573a084,2023-03-01 03:33:22,Chargeback,Different trial word commercial wear.
3d115cf1-e057-4ba6-92af-16f7e10216ca,a5accca2-9256-4948-81ae-3f0b40ab9f73,2023-06-12 02:36:54,Suspicious Activity,Language against toward choice have shoulder become.
b9c568d3-4ce4-4bd1-8733-e2408323afd7,b2098c6b-ac10-460b-a3e2-0a428c60da7e,2023-05-31 10:47:09,Suspicious Activity,Bad capital without about inside.
cfee2ef4-cfce-498e-82d5-4c5e52a0485d,4b2a698c-306a-47af-8e4f-3fd3e7508637,2023-01-26 04:27:38,Suspicious Activity,Second poor sound year go relate phone.
7f3024ab-9641-4561-b39d-1d95e70a2536,6a69977f-90cc-4754-b8a3-4bd0f42f6960,2023-01-11 01:16:06,Suspicious Activity,Compare feel look sing this.
ef74e1ba-03f7-4307-a1b0-6a19bb971914,1aa889ba-2f6d-435d-8ac5-4ca90b99931e,2023-04-06 09:14:43,Suspicious Activity,Safe over commercial age.
fc8649f1-7096-4208-bc57-ab955ad87e0d,66625556-7b12-4dae-be83-5a7c340bee6d,2023-04-24 21:54:10,Suspicious Activity,True box general rate help yet despite.
3e149d6b-c366-4314-930e-381488a47530,b1a6b79a-5b57-47cb-bfab-cbc69ba187f0,2023-01-26 06:37:31,Suspicious Activity,City peace but couple treatment.
3dbd899c-4fdf-4f2c-a762-59200fdf9535,49272e36-8880-43b4-9847-b543b9298f72,2023-08-17 15:53:37,Suspicious Activity,Try training hold.
a23e5da5-335c-46da-a644-baaa68fe7c5d,9d4a6add-2375-431d-85ad-b82f055c6e8e,2023-03-18 16:21:59,Suspicious Activity,Employee theory town us expert see sign.
c0824b97-e97c-48ac-a41c-c515b6e216e9,eef85336-c407-4bfc-8982-9bac91c14455,2023-01-22 03:41:56,Chargeback,Risk road recognize.
26618e2e-35d4-49ff-b50c-49aa934dc16f,74779007-e4b0-48ac-a333-9f754ed812c6,2023-08-12 15:47:47,Suspicious Activity,We morning energy but.
9df4fefd-729f-4119-9159-01846831e834,8ab837fc-ded7-4ca4-8a2d-f405f5e8b0e4,2023-04-16 12:47:25,Chargeback,Scene court success answer take form.
ddf2a63c-cb48-4c2d-bec2-464a13122e96,d2287a5f-8af6-4028-b76d-6c82da46a20e,2023-05-20 06:27:57,Suspicious Activity,Stand affect manager.
84116db7-f642-49c6-90b9-7efa38b046c3,6d75044b-429c-4897-b1f8-4ca34030101d,2023-04-18 00:30:14,Suspicious Activity,Quite street join budget than together hair some.
79354542-1f71-421e-b276-f8a47e01c0b1,58cefa41-e37a-489f-a9a0-c00659373035,2023-04-01 16:01:04,Chargeback,Crime far whether play fish.
01195ffa-08dd-4419-b102-eefdef3e864b,2518d694-c86c-45b0-8740-37c70bc76a11,2023-08-13 09:53:18,Suspicious Activity,Real might house perhaps real.
1d3a4a5b-50cc-415b-8506-ec8d09d6c587,c1d0a543-c4b9-47d7-b1e3-f969ac231efb,2023-05-27 02:26:12,Chargeback,Line cold seven guy involve others.
4a82399c-2487-410a-9d24-44a7f5b5c807,4dbc678d-a538-41c5-9c92-6bf48a19be11,2023-02-24 23:56:46,Chargeback,Night onto road few near.
c1ce9fa6-8c2b-45a5-92af-919f5d39dd2f,b12d0f32-e3c3-4e1a-bd69-ea6e4276f65e,2023-04-20 19:41:15,Suspicious Activity,Type ready question cause ask magazine human.
51c63caf-24e4-40bf-a8db-e731b992c8ca,ebc5a326-741b-40f1-aa5a-968e9a505c3c,2023-02-14 04:44:24,Suspicious Activity,System possible rule option.
1f042ac0-a330-4698-ab0c-c30ad97bd36c,296d37f0-689a-4e0a-9185-1fbd0189b910,2023-01-02 07:44:32,Chargeback,Value where firm democratic so.
406b4f41-6d60-4011-976a-0864498f85a9,6bb34d01-2d44-476c-81f3-3daf56542b92,2023-07-09 14:14:19,Suspicious Activity,History trade there create moment.
a59f38e7-762b-42ab-a5a7-55589d0b85cd,d0a901c9-4ac2-4f95-a487-3a2c3dde69f6,2023-04-01 18:11:00,Suspicious Activity,Tell game interest major.
f9a14445-f005-4e49-b099-47361db7b84c,5f338a7b-a71c-4176-9d12-cd0d79c7cf86,2023-02-07 00:40:11,Suspicious Activity,Production every race student them dark land affect.
3d2b63d1-cd66-466e-88a6-9594dbd1de91,23666a3b-98dc-43ac-a631-d53d4bc2b01d,2023-04-29 18:33:34,Suspicious Activity,Modern improve commercial to wide later treatment.
d574ac76-2664-4ab1-bd11-d37bc03aed17,d7c971b8-5ac3-4917-8d31-8ae11947682d,2023-07-23 10:27:06,Suspicious Activity,Economic color property lay live else.
70581384-a33a-4903-9545-cbdbdb6b9c80,538b3587-a1ae-409b-9ddc-5f3e117bee10,2023-03-25 19:25:32,Chargeback,Responsibility drug parent across significant.
d10a2a8c-cf50-44c3-9085-c4d55ed2bac0,28be378e-4ebf-4d9b-b67a-5ab34e9882e0,2023-02-28 20:16:48,Suspicious Activity,Whom religious tonight hot.
d7a91453-dbe7-4360-ad0e-006c564942de,95d04b75-37f4-4db4-a51a-d784199352ed,2023-08-22 05:42:19,Chargeback,Could top laugh administration without similar clear.
cc34a4f7-4934-4fd8-bcc0-e4cde9579d2b,c14a2b82-90a7-4ab0-b2c3-acb1fe9df79b,2023-01-22 16:12:35,Chargeback,Dinner investment show.
aadfa511-1773-4a51-a54e-926ffa1e18c6,4ad17cd5-424f-4daa-81dc-6816543e2223,2023-09-04 02:05:01,Chargeback,Data crime use college.
f7349cec-4477-4c9d-ab78-a83df9a8c2e7,1e719174-2084-4ad3-b375-5070dc8cb941,2023-02-18 12:31:52,Suspicious Activity,Go interest friend until television.
c152bc52-5f15-48f6-904e-631fff14bea3,2f07f5ed-075c-48db-864e-e7f1367f2ec0,2023-06-22 20:52:03,Chargeback,Cup appear among law get act.
04481d20-c234-4954-8f89-67598ca5105f,5fccc113-7539-4c31-aaea-50fc801d7ce2,2023-02-09 11:31:23,Suspicious Activity,Front note buy claim.
14a5d59e-9e3e-484f-87ed-fc6ab8f8efa5,8e94c440-644b-41e6-b0d1-747d2de9cac9,2023-04-07 20:01:10,Suspicious Activity,Home generation avoid week measure own very.
326f1a02-1f12-47f3-991d-7162e585a70a,3387ce6b-a29d-4737-9ca3-21dbcf3bba8d,2023-03-03 15:04:43,Suspicious Activity,Law enough mission someone laugh.
e982bf78-2cb4-45b8-af5e-9c07b67ec7d9,6b69fd8c-00b9-4db1-a2c4-7cba58ab7987,2023-07-16 04:57:01,Chargeback,Program significant manager law world politics southern think.
93715cb0-1ed1-4778-b9df-61d09b18408e,0d5c076b-5a07-4094-9af2-9400e7e71604,2023-01-07 03:02:30,Chargeback,Idea Mrs require between situation world.
2ec88ff6-3d3d-4b05-932c-85b4f4dfe6d0,c62b40d5-e68b-418f-8294-59a40b1b723a,2023-08-30 03:33:50,Suspicious Activity,Want forward top large.
475b1dfb-8279-4cbc-b015-903d1de07b97,7fc9cc7d-c1fc-4079-9b87-12fe8ef6ae01,2023-05-02 14:37:11,Suspicious Activity,Responsibility off involve interview.
feee29d5-8d5b-47ab-942d-87db4ca898de,8f5c6c1f-0e87-463b-b7b8-92a03cc7532a,2023-08-28 14:06:32,Chargeback,Attention morning office.
dd3c949f-a677-486a-b4b3-0385423e746c,7f5f972b-5b4a-4b76-9165-60930132add9,2023-01-01 12:52:22,Chargeback,Should nature throw day throughout interest body.
e4812ccb-4bf5-4d7d-9336-f1bed5d7bea0,3b1fddca-ba27-4e1e-b321-5a27f50d6373,2023-02-05 17:37:52,Suspicious Activity,Remain too fund plant together.
f6f000e4-ed48-4e45-82a9-119daf250ff3,784cd349-5570-4775-bfe8-41a777fa1a7c,2023-06-15 10:52:50,Suspicious Activity,Film hold ahead including century even return report.
b7a1075b-caba-4fe1-86e8-95aa737e732e,03ae5178-13a9-44ca-ac6b-41e3d8a91527,2023-03-07 17:12:26,Chargeback,History if performance add.
7065668e-aa21-4e03-b6e9-a1d6d653088d,b8a194e2-4105-45df-83f6-e5954bb20511,2023-03-10 23:18:33,Suspicious Activity,Military research student use.
72002987-85b6-4a0c-a1db-bf37edb7b733,fbdf600f-8eb4-425d-9099-f3232689342d,2023-01-02 02:17:47,Chargeback,Response husband into PM produce.
81bb3e4f-fe53-44f1-a94f-3c38585a911e,df8becc8-71e4-429d-969b-6558b43c1ff1,2023-09-01 12:47:42,Suspicious Activity,Growth main effort security hope watch should him.
02a97abd-53f4-4ffa-b8a1-879e289ea295,2954010c-ad4e-402b-af8f-22725cf27b0d,2023-03-01 22:53:14,Suspicious Activity,Society lay impact floor wide cover.
00e71558-77be-47f6-9e50-f96dfb01ade2,63f7d6ec-c899-4a10-8013-888c4043e9c3,2023-04-22 04:53:41,Suspicious Activity,Degree military stay tonight figure chance walk.
ea0d94f3-aae8-425e-92f0-3110f89a1856,3f7425e3-9bab-4694-b5d5-1bad0afdbb29,2023-02-18 10:01:08,Suspicious Activity,Win appear main put when special.
758eece3-cc1a-4ea2-93e1-7fefe022aecb,17d849ba-a319-4db5-8d2a-e72ab1b70442,2023-07-16 04:24:00,Chargeback,Along investment make example.
98047d52-a733-4e5f-b063-2a90825aad21,3acbccaa-4eda-4a99-a898-16ff7d7d4c69,2023-07-25 18:51:06,Chargeback,Draw development trip the.
de034729-d1d9-412c-b2ba-65082e49befa,dbe7389c-2574-454f-94d2-1cf5e2361a23,2023-04-18 12:47:22,Suspicious Activity,Think teach government order for.
f7de60a0-bb3b-4b05-ab7b-752ddb2ff66d,0442cb59-fa5d-4c12-89b6-425b98a096ab,2023-01-31 15:28:15,Suspicious Activity,Tough charge church special American ago wonder.
fcd1dc54-33b9-451c-bde2-dc62a8ef0d7f,fb48357f-6cf0-4624-b67f-276777c38a93,2023-02-27 06:42:44,Chargeback,Look spend nation amount.
fc17e6e4-ae4d-42ed-b4b7-97e4ddc2f533,90a0a5e5-9208-4f62-8c53-1343d295ccde,2023-01-21 17:10:29,Suspicious Activity,Imagine program guy boy season something bad.
33898a44-2496-4ac2-9aa5-aa574e9d2836,bb78c9dc-88e1-4315-aea3-3bec18beaced,2023-03-31 04:43:25,Chargeback,Lot above open.
7a0438a3-0809-43be-a247-4b8e5d62cf0a,288c4cc4-e9eb-4619-9a23-bf89359cbc78,2023-08-13 08:40:29,Chargeback,Beautiful participant unit Congress skill control.
66c83850-1ffe-4626-a6ba-0b1a6bf13887,5edc30ec-237b-44bf-81aa-a257cf705533,2023-08-15 19:48:50,Chargeback,With defense her fill ago daughter.
ddabebe9-5913-46b0-8b61-edf4bf8775a4,13af1817-1f40-4a57-a679-55e413c7a2e7,2023-02-04 20:38:00,Chargeback,Suddenly individual live.
11b9630d-df10-4218-b24f-058cbfcb6b9f,4b9fc42b-17d5-479a-891f-7cc830abd166,2023-01-05 00:26:35,Chargeback,Wrong tonight ready however land care.
c429e39b-78a9-4ccd-9f27-8775f9382fbc,93237f97-b9ea-410c-bd8a-3de054d18b6a,2023-01-27 13:38:28,Chargeback,First girl type home two.
596ed5d1-2b23-4d61-b074-dd175066c5df,788deb04-6fcf-4fa8-ab41-e64d1a601538,2023-04-20 09:12:34,Chargeback,Gas approach lay story under be.
5f555ae3-5742-43e7-b751-304024eb5934,b9d5986c-17cb-4001-8c90-9ea09c19d8b0,2023-01-10 06:20:31,Suspicious Activity,Such cost turn senior bill.
b790d135-d995-46e5-98e0-2899ade3509b,229ee44d-048b-484b-b0b3-c6337fe398aa,2023-02-21 22:31:32,Chargeback,Note same recent amount push.
8f6e803e-19f1-4af5-a0b6-31d17bd7baf9,20288f9b-32a4-4ad3-9480-68c2a9983833,2023-06-02 03:04:37,Chargeback,Cost address play evening public listen.
a56a0ecd-61c5-453b-a2f4-6660fe018e5c,0bfc71c5-f988-4579-9651-3436df991d7a,2023-03-07 23:11:23,Chargeback,Program write inside region film leader indicate.
b8ef77c2-9721-420c-994e-fc3c0e765e58,d64aa23d-ca96-4e9c-acee-e3e998ddc4f0,2023-05-29 11:49:59,Suspicious Activity,National both vote better pull clearly first.
5657f6cf-b6a8-4942-859f-52b221d4a952,1f5e2922-801f-4421-9f2c-563cc2e842aa,2023-05-01 23:31:10,Chargeback,Scientist add authority family data security.
96fc4ee7-58d6-427e-bf94-b7888b4bac70,22ecc769-5156-466e-b4be-f11d4d8f261a,2023-07-30 15:23:50,Chargeback,Himself sell expect.
fe98605e-7a2e-42c0-8eef-ac1081b43b2b,e65a0a0f-097e-4076-bac3-0609a4e8d2a2,2023-01-17 23:48:35,Suspicious Activity,Whatever few determine nothing level finally Congress.
5bb1fe67-6721-41f9-ac67-e84a5cc269d6,70b604b1-6c00-4acd-a709-3754ba7ca280,2023-06-30 19:39:25,Suspicious Activity,Several stock value reason since spend least hospital.
d5758560-83ee-4a5a-ab45-a374882992ec,2fefef1a-bec3-4816-ba77-ed0447cdc903,2023-01-10 11:34:57,Suspicious Activity,Rule quality ever evidence eye.
bbaab33e-ae8b-4aeb-bbed-c5e834b7e77e,0a3f37ed-3508-4d37-9395-9d75ce1e661c,2023-09-03 05:59:13,Suspicious Activity,Compare order relate these course wind.
eb223bad-4be2-4c08-9b70-bc73bca2b7aa,a50a713b-110c-4351-bfd1-656bd54e3889,2023-07-24 21:56:07,Suspicious Activity,Apply wish series lot specific.
57b339b3-251c-4737-8d10-231fe8a77a7e,ab6efa37-6c1b-4d2c-922b-77de168bca1a,2023-01-10 08:06:31,Suspicious Activity,Theory need state want make.
4f9821a4-c928-4d96-ab1f-72b2db6bb57f,f0b3913b-12d2-4765-866e-bae2541d301d,2023-08-10 11:03:57,Chargeback,Respond might talk wide focus court morning.
a360e8d4-35b6-4d56-a9e4-fd886c090c2b,d2fcb9b8-2a4e-4753-8446-c3e33eb77ab4,2023-06-04 01:07:14,Suspicious Activity,Want fine claim write.
d2e92a4f-c917-40cc-b2bc-b7780c13dbb2,eaa7f030-e214-4204-b652-b3dbfb50503b,2023-07-25 17:25:00,Chargeback,Mouth suggest would arrive.
3aa2c53b-3ba2-40c7-939c-7db7cd4ff974,e89a9130-bec3-4840-afad-7a666adf917e,2023-08-04 22:40:50,Chargeback,Society attack show knowledge model marriage throughout.
70bdf59a-237c-4811-a0fd-bf7607215174,d0fbe3ca-cc19-42d3-87ad-a83ad300ff15,2023-05-01 08:39:12,Chargeback,Know board paper world hour south interview.
35c0ca12-fc1d-4804-b256-87b45e870b91,a5accca2-9256-4948-81ae-3f0b40ab9f73,2023-06-02 12:10:11,Suspicious Activity,Listen throw science.
86d35c6f-da7b-4ae5-ba30-4be9f67eec63,7ec2141d-1ddd-4e0f-9c82-4605ad395170,2023-01-02 08:26:04,Chargeback,Real lot foreign science personal administration song.
a67ab937-e45b-41ba-876d-768b0e6d0613,9bda14d7-b526-4542-a961-5e65b4336cc6,2023-06-06 04:02:02,Suspicious Activity,Figure where air economy of future which painting.
d08c0760-039e-4547-8562-ab0f22c3c76d,60b7df81-a14c-4264-8e01-4e381128b125,2023-06-03 07:08:37,Suspicious Activity,Player camera we nation political official.
0c82fc14-6a10-4de8-895b-6a32c437fcf5,6368ccd1-4370-4d0a-a9fa-c5c2d407d2ea,2023-09-03 17:27:22,Suspicious Activity,Building probably right bring.
9f046343-97ff-41e7-a729-e14fd11d26d3,0415f700-cb4d-492a-a52f-954efc2a1802,2023-02-04 06:47:55,Chargeback,Worry level on painting.
fd0bd843-a08f-4788-abba-7076af674fd6,1ec01efe-1cc6-4020-8e54-5d36d32854d5,2023-09-03 13:31:38,Suspicious Activity,Change loss my particular voice provide somebody.
dcdcd1be-1af0-4715-b7cf-4b9c48947d1e,023056d2-85ac-476c-a264-565ace9909da,2023-06-22 06:40:35,Suspicious Activity,We eye eight imagine though certain think pressure.
e0563746-9ff6-47b2-ab3a-7776fa7e10e8,ccab00ac-548e-4df5-84f3-a286a683fb73,2023-01-31 19:13:53,Suspicious Activity,Adult unit although.
aced8e5f-daed-4826-914d-922fe5dab9e9,bff377cd-6129-4ae5-a54f-bce56fbdd3eb,2023-04-27 11:23:51,Suspicious Activity,May staff several high.
31b477f3-4b30-4fa8-bded-193cd6d5db89,8dc81931-be61-4e70-b804-8378bd1440e9,2023-04-11 18:33:16,Chargeback,Send friend when or serve happen behind race.
cb461bc7-db30-4fc6-a351-909d98add4e2,ebf678d6-6702-4733-a635-d7b3e2c5f32e,2023-07-01 04:21:50,Chargeback,None feeling some red.
f51b122d-533e-4ae0-927f-ad8669ca687f,08eefa3c-8fc6-4b44-a45c-f4f2d95dbd66,2023-07-15 04:08:16,Chargeback,History state page much table.
2fd9a497-994f-41b4-a3a8-a5bf18b38b19,e9ce9d97-f966-4699-930e-e963acb5603d,2023-01-15 22:37:49,Suspicious Activity,Former training government senior.
dddfeffd-3ed4-4824-8cd9-e6473b40a6f7,c98a3150-3f11-4844-99ce-d111c5a49daf,2023-05-16 06:34:08,Chargeback,Officer method drive create music.
77ea56d4-6900-467f-a246-a2be66cd6ae9,19badfe9-2747-47cd-9f5d-bcb457faf8d5,2023-03-06 12:19:29,Chargeback,Me course town worry out.
721346dd-b332-4965-964c-fa08b1b102d2,98beb5ed-bc95-4578-9417-8d64bc072545,2023-06-22 06:19:50,Chargeback,Song lead trade beautiful.
354c7646-26d0-46b2-a31d-abe7bbaaf698,38019530-45eb-4f89-8fdb-f9c47364e5c2,2023-06-12 12:18:44,Chargeback,Book pretty how around apply room.
f739c877-b30c-43c7-b31c-6a34a2548beb,98a553c3-0d55-4bca-8251-a14f231474da,2023-02-08 18:49:06,Chargeback,Mention notice know guy usually operation pick where.
d1da251b-b785-4cc2-8ef9-0a59aff65193,1cfd5837-508d-41aa-b246-7e7948f53820,2023-02-08 15:25:12,Chargeback,Thus or serious forget fine sport.
4704e1c0-3a15-49ef-a1fc-e5a977ce8e42,be1c422f-a5dd-417d-ac2b-3c0b50edbe8f,2023-08-24 09:22:40,Chargeback,Amount energy husband west different.
aeb5dab3-871a-4327-b5c1-6bce8ff93834,f27b0e74-8491-421a-b344-9d02c7a1efe6,2023-07-04 02:59:08,Suspicious Activity,Its bank prevent.
9f71cbf0-4e83-4262-9ce0-6a6264e48596,b07079cf-4f7e-4e71-bb39-f20fba59f326,2023-07-04 22:30:12,Suspicious Activity,Including nice meeting particularly must without fall west.
f4523dde-0081-4b7c-98ba-5861f827e80b,c9d1a1dd-8cae-41d2-a327-210eb5e9d78b,2023-03-08 08:08:16,Chargeback,Sing reveal store nation.
d3dfd1e1-cbfb-45c6-bde7-549aef5614d5,7aa20f0f-4355-4a19-8f88-5f814031947b,2023-05-14 16:53:35,Suspicious Activity,Their sign former style throughout represent.
f3c11611-54c0-49e3-ad4b-372e12708582,2997a294-6417-478b-b8f8-15106de16a2b,2023-07-07 20:53:51,Chargeback,Lawyer Republican now hair level place.
bf70b246-eaa0-4d06-a2e6-3e37e9bb3dd5,8f6947da-a1f4-4a40-8f8c-6eae20ff19c6,2023-09-01 05:01:05,Chargeback,Guess compare later over outside despite.
3fd66ec2-3eec-40e6-857a-e9535bc876c2,b671f57a-db2e-4656-800a-9d23c941ff20,2023-01-08 19:35:28,Suspicious Activity,Economic what sometimes edge far.
771b3e06-afe8-435d-b1de-07c3ba198c10,6a90496d-5a43-485a-a11e-7c10055d9f46,2023-07-09 00:36:00,Suspicious Activity,Forward treat glass edge.
6ab4cb6c-27c1-4037-921b-d97325c29202,6f281314-a0b7-407e-a6b0-f1169481a639,2023-06-18 18:55:48,Chargeback,These story anything cultural notice sport.
681938d3-a27a-4b40-8ea7-e284138f7e32,53046420-d253-4176-a1f4-c648ccff4684,2023-03-17 13:43:43,Chargeback,Sense rather today cut.
0c71dc9c-6e73-4fed-831a-51a1050d8127,49b495c4-851e-4039-a02f-c71cdded2a82,2023-08-07 23:37:12,Suspicious Activity,Perform responsibility election employee community wear race building.
d280962c-63f8-4aa9-942b-e7a95cdf37d1,999113af-b217-4f04-8d77-b0cda1b662d1,2023-03-29 00:11:13,Suspicious Activity,Treatment form camera hit occur color exist.
42ea77d2-7039-4b47-93ca-5ddcda3dd09b,edddfd61-3b29-46cf-bca1-0e9da8ea392c,2023-05-10 13:34:13,Suspicious Activity,Staff common public accept.
1c956aa5-ae0f-44b2-b2a7-94157f56a3b2,d42ea5cf-798d-42bd-bed7-7423bd481253,2023-03-27 10:51:53,Chargeback,Let itself buy Republican material its.
66b07694-dd1f-4583-ab8a-14753008eb76,c6b8c49d-d405-4deb-9d9d-461aa03622e2,2023-08-14 02:25:44,Suspicious Activity,Me possible policy machine simple alone tough mouth.
