Alert ID,Transaction ID,Alert Date,Alert Type,Alert Description
5caea0c6-98fa-4012-b02e-502eda88c00e,f4342580-3d87-4611-8b06-3e34e7d238df,2023-01-21 04:13:31,Suspicious Activity,Democratic wife less fine.
65865257-2583-4827-8fe2-150f3fa4869a,f8c4bb40-a531-4148-afe1-3bc3c59996fa,2023-03-30 15:35:01,Chargeback,Seat adult several upon.
8c6649d4-08e5-4d8f-abf5-6c7322e036e4,69176466-fff1-46c8-9f3e-d7559c92adb3,2023-02-03 15:04:28,Chargeback,Million window prove enter growth smile follow certain.
9fe4dfa0-3671-4f70-b22b-a9d593f49722,c2ab6199-4e9b-4919-b458-7ea877384a6f,2023-05-22 20:45:13,Chargeback,Base send spend remain owner land.
b7a97fc0-fad4-4eb0-b0d4-ac82157be9eb,011045f2-0409-4234-9d0b-12be16d6813a,2023-03-21 08:06:37,Suspicious Activity,Draw rather institution two direction.
641fea60-dba8-4034-b4b5-3e9106785155,027a3d07-8afc-444b-b5c0-9036a6f8bcfd,2023-02-02 18:42:21,Suspicious Activity,Seven realize election every wrong.
64f10b08-eec3-465e-b012-4ab370fed16d,90acc1ac-aafa-4623-b86f-391e486a52dc,2023-02-10 18:28:31,Chargeback,List light hold health toward.
9018e135-4c37-4995-b269-283485bdce80,9f9cd345-6d1d-4aaf-a5d6-e35f215f0f17,2023-02-13 22:07:21,Chargeback,Number treatment newspaper sometimes.
aa25f4dc-06a3-43d5-abcf-6c134cf91bf0,88d8b2e7-076a-4f70-88d9-429ca997bbd3,2023-07-27 08:26:12,Chargeback,Sport quality technology night something.
3fd22511-7062-4669-8e48-3c5ffcf69630,e408f4f5-7208-4c0c-b91e-cc7e78555c3d,2023-07-27 05:15:09,Chargeback,Pull customer analysis expert century society soldier.
ab84d4f0-6968-4f5e-8bbf-5d0bcc7df897,8b96a04c-25bb-43f8-a2f7-a1072532a971,2023-06-07 07:43:52,Suspicious Activity,Think science have ball number them.
df5a41ca-42de-4ab6-b610-8f833f2c5086,0fc50995-50ec-4ca7-9cf2-0416ffa631e3,2023-04-28 12:21:12,Suspicious Activity,Note very picture matter general between.
4fcb6753-b04d-446d-aa30-fc18a2d2e6d9,10dd1800-1acd-486d-9685-4bebdd7a2b55,2023-05-05 04:06:44,Suspicious Activity,Really style yourself stop hot fire oil of.
47b7e353-bc6f-4686-ad79-0088db59ba50,369af563-b057-4577-8e10-811ccaeede36,2023-01-20 09:23:23,Chargeback,Reason serious eye serious me.
98d03cbb-7c57-4f6f-b2bd-5e5c3c5cf4b2,590075d2-7ce1-4614-84c4-c90ce582f787,2023-01-04 08:32:31,Chargeback,Moment education source bed industry.
8ce368e6-d1ed-4077-a1a4-5e02066fae89,646ddbe4-e74d-4211-8aa6-8a80f01fa39d,2023-05-12 20:20:01,Suspicious Activity,Into want stuff choose something goal reflect.
7878a33a-c8ea-4f3a-aed2-3a18b66d113b,a1ff0b5a-a8fb-4ec4-8095-485f7aaed28e,2023-03-31 07:18:51,Suspicious Activity,Become thank ahead instead city against majority.
a8a48cbf-b8ed-4038-a232-aa370fbc97bf,28afac4f-993e-4a93-b581-ae340efc398b,2023-02-06 15:58:47,Suspicious Activity,Carry first less pattern evening generation cause.
2ae34d23-c094-408a-93e7-fa78a3ca1e61,95f8ee0f-31a5-4cc8-994a-8f092479f727,2023-02-24 20:07:33,Chargeback,Seat behavior marriage.
503d26ea-97e7-4871-805d-6a6e7db7e7b3,ef81b7b7-5f24-4d04-a54c-e714e64ea573,2023-01-08 08:41:39,Chargeback,Food stay fact himself hospital would.
1a232a01-6f96-4b86-aa0e-bde994170b04,f5800156-9152-4ffd-bcf3-d364d5fa8792,2023-01-15 09:39:08,Suspicious Activity,Size seat interesting language next second full.
7114a756-e4eb-4768-b2ba-d942df206bd3,15200912-5cc2-4d36-826b-6c70f8953bc3,2023-01-29 21:30:00,Chargeback,Exist what start become.
e2ffd5b9-1421-4a32-bd33-ec36f8e9cf23,73a059d2-df4e-4abd-b7b4-f8a146ff051d,2023-02-12 05:10:13,Suspicious Activity,Purpose official instead relationship practice growth especially.
9f1e7147-17eb-4ffa-bb64-5fe88497d151,9e28bec0-642e-4a81-817c-17dfbc6c0c27,2023-06-21 03:49:44,Chargeback,Identify represent hotel program.
92edb935-9e65-4843-8b8f-f3c25da141c0,950c7486-16bc-4e48-b679-a628c8351c4e,2023-04-21 13:56:48,Chargeback,Follow possible audience.
700b30d2-af2d-43b4-ad07-9996fadc0e53,eed7e1fc-74bc-4cda-802e-e1fb5afc8e76,2023-01-31 06:09:29,Chargeback,Size always bill technology best high daughter.
575116e4-87a2-4b1f-ba44-5c4a2485323c,03676107-f8e0-4494-b226-aaa505f9920a,2023-06-04 18:33:33,Chargeback,Hard as note live close respond name.
024721d6-4528-448d-8520-d994fe387713,4416e9ef-3641-4cfd-ab67-d25efe4dad6b,2023-02-05 16:29:50,Chargeback,President message age much ok.
9186d528-ccc1-484e-8eb9-5b21b1eaf121,b8a7e9fa-19e3-481b-a406-63d2a83e25c8,2023-07-29 07:43:53,Suspicious Activity,Friend care radio feeling never same conference animal.
10027e75-540c-47c9-89a9-229bc820ecf7,052065d6-db6a-4707-9e1a-1fd808449748,2023-04-29 08:58:06,Chargeback,No open idea hard.
a25288bd-cdc4-4f1b-88df-68e27bb7c1d8,009529be-8bde-4518-bd83-7cb0bb80a985,2023-05-03 07:19:57,Suspicious Activity,As skill chance.
a144d982-56ee-4cd4-b682-2c9a8707b1a5,d40a18e3-1e45-475e-95a2-479b9e7bdca3,2023-06-03 16:00:26,Chargeback,List election when blood.
16a2372f-4ca2-422a-a235-0e896b898dd0,a88c1cb5-36ee-45d0-8543-4e0ab12aaadc,2023-03-31 11:24:40,Chargeback,Think large real wind.
95dc83ef-0866-46af-a687-3d54acfb2db7,116cc781-f13a-48d0-94db-3736b7a65472,2023-02-07 03:59:48,Chargeback,Type include trade event building prove notice.
c4732ad1-ece8-498f-890d-fdbec89ceba3,64209e04-c028-42f3-a3a6-50b9c80e6e56,2023-03-30 00:42:55,Chargeback,Woman put audience top street.
097dbabf-4259-469c-9709-c6c05b6a9fda,6178a6bc-72cc-49e1-b167-877de4bc56b1,2023-02-26 17:20:16,Chargeback,Great skill office buy.
7c16e0a0-e165-4142-bbc9-7bc4a5680d80,cbfed3f5-8c86-4775-a975-4cc092d9127e,2023-02-24 00:43:21,Suspicious Activity,Tree meet great six open prepare.
0c46a036-f824-4bd9-b969-707d206697ef,f29d4add-5f5f-42d9-a680-485d2f1e8d85,2023-08-08 20:57:34,Chargeback,Present begin modern choice tell suggest.
01d7d060-cc7c-4e06-96fd-fe1e7d5175bd,1e2460d0-5481-4f52-ad45-887418eb8805,2023-01-06 09:15:57,Suspicious Activity,Ready any we order wonder physical.
1fa0ce42-5b52-4b10-88e3-10766609518e,351b424b-148b-4118-9f32-4d36972b788e,2023-01-11 17:03:39,Chargeback,State statement be network late.
23065855-0484-4151-aac1-3d18b1873391,ba39aa09-adf2-4a3d-a38e-6a4ef052624b,2023-07-08 05:54:33,Suspicious Activity,Red both article ready quite fish early.
d8bfc3b3-ca0b-49da-b1bf-68ada58d4134,a271f030-b6c4-4a74-bd49-768d63a4381c,2023-04-07 14:16:09,Chargeback,Responsibility rest themselves day society can method brother.
cf6c408c-9f95-4c4e-ba24-35630422527c,226c6e54-bb44-4359-868f-b92a44a114ab,2023-04-13 18:44:03,Chargeback,Cover against apply.
9032c166-f32a-4efc-aacd-8a77b22dfc3a,54b759f0-f171-438a-86ae-16d1f0d0023a,2023-04-06 09:48:58,Suspicious Activity,Along of space represent kid notice.
50821651-eda5-4d60-8584-13ce6ddf9da6,2a19d389-f514-4c24-923d-570530184f04,2023-08-10 20:41:50,Suspicious Activity,Because success sister real bed run.
c7bf9b25-fd91-466e-9c14-78902337d6c5,dccbf4cb-66b0-46ae-af33-e7f3162f3e04,2023-01-08 11:45:48,Chargeback,Happen write small feeling carry first.
ed5f7a52-c6c3-424e-a54a-cb6b5b63b368,09b99b2e-ac5e-4e4a-9712-d402f60905a7,2023-02-24 02:45:15,Chargeback,Language which reflect condition provide.
46b822e3-cda8-4b7e-9ab0-c9d48fd8887b,1f910aa4-6a8c-4e5f-8b98-7408553a7d20,2023-07-16 13:44:35,Suspicious Activity,Ready require three without hundred.
25a0f648-d69a-4897-a645-84e258a3a3a1,c0a0cf81-470a-4e75-9dec-bae13ea3c5ee,2023-05-08 20:56:14,Chargeback,Tend interview strategy court inside.
cad0815d-021e-42a1-acf8-a0af0ddec8b5,4163dda2-380b-4adf-b188-bebb0864d993,2023-05-11 01:30:54,Chargeback,Evening peace account itself indeed drug remain.
18d2301a-ad05-4ecf-9117-755054fed9a4,1d08d40f-9daf-4653-879f-f58194d730c0,2023-01-29 01:18:14,Suspicious Activity,Fall attorney subject wish though test.
ce511847-7671-490e-822a-cb1ca94d6f28,98e5dc59-f1c9-45ac-8ea2-8088b2b95e2f,2023-07-06 13:01:30,Chargeback,Economy seat myself save play institution.
381fe185-1709-4b5a-9e8e-cfaca5d0f6f1,198e8980-c033-4c53-9ce5-f8eaf9294cc2,2023-05-28 08:02:00,Suspicious Activity,Professional career nice water different class.
f400e528-b382-487c-979f-05e892bafd49,cb6166b8-1392-48d2-9b73-f29313b6e9d4,2023-05-29 13:18:59,Chargeback,Article young notice purpose seek deep prove.
a24b5485-8cce-4175-862c-3a2ad8cb1533,c6360c14-a619-4a62-bacd-b1fe94bbd9fe,2023-02-14 17:44:41,Chargeback,Article social two argue education.
b32cd0b1-64fb-4c70-98a4-829c668ccd82,17a6d1ee-0381-4462-9386-44e09108f4ce,2023-05-15 11:08:53,Suspicious Activity,Family simply himself fund.
b2df0454-f62f-442a-b8f2-af4723bbf763,867c3547-c9e4-4ea6-bbcd-ed8a3be621ad,2023-01-09 20:50:34,Suspicious Activity,Party media plant nothing activity true recognize most.
349ed478-e0d7-4d14-95cd-8d1069a7c076,59c9220e-8bb0-4c65-8bde-2cdd7df6ac99,2023-08-10 02:48:04,Suspicious Activity,Dream goal but test reveal.
95591e1e-8e41-46db-a15d-6d733f56b391,159ee852-2101-469b-a34e-21f9071cbbb0,2023-03-01 12:10:44,Suspicious Activity,Claim situation citizen wrong spend begin stop.
1b41d763-f812-44f1-a28d-f63dd1b77a4f,fedba055-0c04-4ad2-a906-f6b67d6f4283,2023-03-04 18:45:16,Suspicious Activity,Son admit window west.
1f2911c3-25d7-4f26-a39b-c6c5aa3c3f7f,4ca0d4b3-a404-4ece-ada2-0b31496b7511,2023-07-07 23:13:11,Suspicious Activity,Rest development positive detail group perform.
16279b0f-3849-4602-813b-48802fce0d5f,89db23fb-d0c0-41ea-814c-9e5c9e628cf2,2023-07-02 08:35:06,Suspicious Activity,Stock no add organization any process now account.
2295e0de-800b-40fd-bb5b-b929a619dd87,49f38c1b-90f3-44b7-b58b-b021a0958369,2023-04-10 20:32:36,Chargeback,Eight anyone available prove.
1b156868-116e-4321-83a2-4b336e382b0b,9c5abf99-7ae1-4aa7-8f1a-d9556887caa4,2023-06-09 09:37:50,Suspicious Activity,Hope product while information reason tax sell.
c50d7706-04b2-4269-a8a8-f31e2d0b2d81,303963be-51ec-469e-b55d-74b4a72e8f71,2023-01-03 17:32:05,Suspicious Activity,Everybody trial heavy fast summer as.
2539fed4-597d-4c81-b0ae-c8deb7ef07ef,11263b4d-5f0a-4756-92eb-ed6779f1f0e5,2023-05-18 19:40:20,Suspicious Activity,List computer most above.
1b536350-0a48-463d-ba9d-d29822fe3769,72f278a3-0c6e-484f-abe6-4aa6c3eacfd1,2023-02-24 17:31:17,Chargeback,When different international forget study parent so.
3d967b91-a8a8-489c-9623-a6bbf02a5242,98e55c9b-b17a-4207-9da5-32e15d9c029e,2023-07-12 16:56:49,Chargeback,Card friend design thousand serve show guess stuff.
d4ef30fa-2fc9-404c-9a3c-001274466156,3cf5182e-2a04-4175-ba07-913f4e8be014,2023-06-01 06:18:57,Suspicious Activity,Usually finish economic beat staff reduce.
e5df8292-901d-4886-86e8-4514842fc9f6,628176c2-b166-46cd-a7d3-9933507eedac,2023-01-03 13:19:48,Suspicious Activity,Record painting around any.
11841638-4d33-4e95-9e04-00805da98382,b7764b58-9163-401e-8c98-f0dcd44b02b4,2023-03-19 09:16:33,Chargeback,Study population reduce smile simply owner.
c79efde4-b453-4c26-9b46-7e4478ebf479,4a359ddf-3fc6-4603-a51b-0d860a549fe7,2023-05-15 03:55:36,Chargeback,Realize ten necessary yet beyond star thus.
57b7a476-0cd9-4069-98b1-c9b007df7f5a,8970f7da-7a7f-4ee1-a0d7-743584d15a4a,2023-02-05 02:17:01,Chargeback,Lay act provide glass perhaps buy school.
de243971-7d28-462c-9f7e-0cd73ed05481,362c63c8-4ed0-4562-a98c-46b43daba089,2023-03-03 10:35:17,Chargeback,Image attack story.
9ccb0731-6c4a-41c6-b32d-07bb064d4ad2,79cab663-ce48-426a-8df8-55c714f9ec3b,2023-06-22 09:51:41,Suspicious Activity,It film you number national.
ff84b9be-fcdc-44a9-a97a-ab4006f41df6,2fb12b9f-1bd3-45be-b718-37307388b79c,2023-03-21 15:17:55,Suspicious Activity,Door country candidate record.
30dd893c-e82e-45d1-963d-61eab0281962,ce66a517-6eba-4f5f-82e7-f2bde98e8dcf,2023-08-10 06:10:12,Chargeback,Such few poor attorney southern feeling success.
caa78ef8-a7bf-4005-81c9-c397b9ebb9e8,2d664d1f-5747-488f-81b2-70c54d14db81,2023-05-23 03:03:17,Suspicious Activity,Here receive successful claim.
2d104f4f-208e-4e9a-9398-307b982810e5,10a0b996-c1fe-43e1-845b-0fd52cf4e979,2023-03-06 23:01:24,Suspicious Activity,Most so writer law talk region.
cf4289eb-7149-4473-9e62-ef8ea2303de4,bed6eebe-e3b6-4880-8182-2a648e66b84a,2023-02-15 07:35:42,Chargeback,Star hit lay training defense light even.
230d718e-93be-4fc2-873a-fd35012d4153,eadad112-edf5-4897-b976-7e92d9c45840,2023-03-07 11:25:05,Chargeback,Foot can song body.
7380ea41-c46f-4297-a5ea-18a12352f20b,93253fc8-c16b-4b48-9444-725211064a59,2023-07-14 04:02:25,Chargeback,More fight take ok feeling drive sit.
25d3049e-3f7c-4d68-b131-f86e3e7d86eb,c0eb76b4-1724-416b-a7c4-611df9d82802,2023-05-25 05:40:21,Chargeback,Gas another account either move fact.
01502bc7-12ad-456f-96c3-ab49eafb23fc,5bf6c1e4-9f76-4dcc-9169-f5c841535dc0,2023-06-21 03:47:19,Chargeback,Fine various avoid technology city cell.
9506c5d7-ffe5-4507-9416-a5ebd54b6904,22a482fd-b5a9-4d27-8967-cba5f3a2eb4f,2023-07-22 19:53:28,Chargeback,Past eight south majority today.
7028dc88-761b-41d8-9b06-a10bcb7a1a7d,a6da77bf-b9d8-4c10-8e1d-82d50c4df76c,2023-02-03 21:06:57,Chargeback,Nature PM me save none high.
479888ff-a462-4511-966c-849c6cc00629,1711d481-588f-4e1d-a805-4aef5428cf84,2023-07-01 06:47:02,Suspicious Activity,Expect minute five machine.
a0ac948d-b3ac-4497-9163-4df1b89cdd7b,2c8f2dd1-992a-41c5-9ab2-c1d2817cc75d,2023-01-01 05:58:26,Chargeback,Group affect job dark describe century.
b6316368-012d-49e8-9fa3-ab16e7bd5bc8,99dded04-8a57-4e4f-84a7-fb14065f7f24,2023-02-21 06:43:20,Chargeback,Floor practice reveal computer ever side.
81667ba1-ec70-480d-8314-396a539e9a6f,48850a21-0fca-4dfd-99e0-fa5164635b4d,2023-05-31 16:02:41,Chargeback,Past oil how learn right mind.
3718fb47-0609-44c8-b283-f3b0e82c32cc,1901e83f-4ef4-48e9-81aa-af085aa33081,2023-03-10 01:30:48,Chargeback,Woman understand economy agree yard year stand simple.
56e82f2a-deeb-4450-8757-d4dd74c53cf5,1c1f7ab4-28f6-4d85-9323-e008a16de65e,2023-06-01 17:45:59,Suspicious Activity,Practice understand statement allow set system.
92cacd79-bff0-4586-b7a3-8fcf8d9b0d64,84388e9b-19e4-491b-acc7-ec3e627bb504,2023-08-12 22:07:28,Suspicious Activity,Better trade him win.
a768910f-eba8-43e2-ad7f-edcca319f96f,c64f2ec6-e98e-4b59-925c-070a04390a38,2023-07-24 14:41:21,Chargeback,Free arm deep look and from.
3355be21-f421-48a8-adab-dc356dd2ddc3,112e4d2d-e056-4418-8a0b-e2d2fb870f76,2023-04-07 09:37:59,Chargeback,Yeah medical at glass attorney.
5d70b09c-e4f2-490b-979a-37979e6f4fa8,773e5941-ffd1-4c3b-adc1-e1da81b225bb,2023-03-09 21:42:26,Chargeback,While dinner trade.
7faba414-d1bf-4066-b236-415bc16d67a4,e336c37a-fd04-4b58-ab1a-1fb79ae61303,2023-01-12 18:04:27,Suspicious Activity,Growth around truth consider.
ba2ff198-9960-4f45-b5b8-7c167fa1d1ea,20c88064-aa0e-4a2a-84d6-00d865788afb,2023-04-29 22:25:05,Chargeback,Collection range like better hotel system result.
15f3c0d4-b8bc-4657-9ef6-88fdd97f46ab,a8735ad4-a479-47f9-9dea-78a485e8d4f1,2023-01-23 18:38:59,Chargeback,Final media perform bar big think raise.
71231973-e2b9-4ebf-aab5-c440a6f71e93,3a7769d4-6d18-47a0-978a-66ccf2deb619,2023-08-08 03:47:59,Suspicious Activity,Left coach should system determine spring upon.
a8a8fc72-d0e9-4589-b890-161927c4c78d,c68011df-f15c-4fb9-96ed-1a4304889b8a,2023-07-08 12:47:26,Chargeback,Girl capital land care talk.
f903ba2b-9ce8-4377-9fda-2afbf135695a,b461d12e-47bb-4ad4-815d-fb49e2c96534,2023-08-14 23:15:50,Chargeback,Audience head officer off each attorney the wonder.
aaa8d1ad-9e4c-4782-a279-a37ffddac335,073b5f72-364a-4b70-b84a-a6225208be19,2023-07-02 06:30:06,Chargeback,Author trip next game price staff.
d81ad622-88bf-48e0-a44b-e5242e36749b,0c1b1c04-faed-48c7-a488-9c4d9ab68b2c,2023-04-11 04:51:16,Suspicious Activity,Receive office require industry necessary adult chance.
9e5168c9-8f41-4155-b321-1c1581c57b76,ecbdf22e-c02e-474b-abb3-447acc680836,2023-07-06 18:51:45,Chargeback,Movement herself citizen age until you.
abfb5629-8abc-4652-ab00-ebb0ffe71634,3795414a-3be4-40ed-948a-3854acaf0c57,2023-01-19 18:04:28,Suspicious Activity,Activity about rich college least.
d5badda2-ab00-445e-a7e6-2814e06b477e,373f8609-3ec0-407e-a294-32d723ae6876,2023-06-10 15:51:12,Suspicious Activity,Wish popular account per address staff east rather.
5f797146-104e-443b-8d45-d5519e6ffa0b,23f33f5f-9440-488c-b5d5-82d071f66b8a,2023-05-17 01:55:51,Chargeback,Attack most item appear.
7629c191-c0be-42a6-84d3-7fe57362339e,45494762-79e7-42cb-bf7f-86b98ac2a0c3,2023-08-07 20:46:42,Suspicious Activity,Just bar employee nothing.
453e458f-1326-423c-844e-bd2224c39099,58783137-f692-483e-a5b2-246fc31a4fe7,2023-05-30 02:03:15,Chargeback,Forget indicate much enter.
dbff0ebb-dde5-4099-8921-ab026d5152f8,c986f38a-5f24-4f25-981c-f51fd6c26518,2023-05-27 11:02:44,Suspicious Activity,Sport run area executive serve door.
d48e06af-1b97-4756-bb56-743ae9774ad3,39894333-5773-4744-9767-56c6cf249fe7,2023-07-13 12:40:17,Suspicious Activity,Despite Democrat lawyer.
84108cdc-63c5-4d5a-b5fe-669b2bd42285,568fd000-7b8b-4073-b9f6-b7dbd73204ca,2023-02-25 15:07:56,Suspicious Activity,At enjoy rich need trade wind raise.
bef74070-430d-4f0b-ac2b-d3b3c856eaa7,0ce7a2e5-b63b-4314-a505-6fcc362e25ed,2023-07-07 16:55:16,Suspicious Activity,Live manage several success.
ef45d231-4bcd-487e-9794-925e37c7dabe,2a77bbdc-4853-4664-b04d-a8d3a5fc8340,2023-08-03 07:13:35,Chargeback,Whether lead maintain investment.
42afe4d0-8353-476f-a0a9-40d87e8d4af4,f87d9e4d-2640-47f4-91e0-91bc7701f8fd,2023-01-21 12:33:26,Chargeback,Serious establish explain much issue.
db00b7c9-297e-4eef-9020-ef02b0b27643,fee5a556-c1d8-498a-8150-8b9db3bf153b,2023-06-28 07:10:39,Chargeback,Better serve most believe performance may message class.
bfd30473-74a0-47f3-a9c0-9b9251d9f90d,7a70f2fb-3345-41c0-ac1f-f1bdca01b9b7,2023-04-12 20:13:35,Suspicious Activity,Why federal arrive foot blood news.
9d088738-36e2-42b7-aa3a-b4bfeb53ee4f,c751950b-c257-48f0-ab32-a7abbcceff43,2023-04-07 10:19:41,Suspicious Activity,Daughter call include because different.
f45368b3-1022-4e31-a766-5d1dffc51e6d,785e222e-d32a-452b-810b-d3edf98d2a36,2023-08-17 20:16:35,Suspicious Activity,Threat down stuff kid.
f1596db2-ce53-49bd-8dea-b50cade9ecf3,b8ff73aa-02b1-4be8-a934-2ca489eb91a2,2023-05-05 17:48:33,Suspicious Activity,Kitchen another theory set option week full.
5654bdd6-58e3-4f36-99f1-d3a6f1750278,a9e1b34d-ffd2-4d1a-a1b3-7570401092be,2023-06-02 00:07:36,Suspicious Activity,Occur employee among cut.
c4ee040e-af0f-427d-9e46-2fd500eb6b87,a654b643-e04d-4c16-b513-8d8f705dcc0a,2023-01-21 19:49:04,Suspicious Activity,Full game measure move international age left rate.
3406fb05-e553-4d01-904d-3ec6476cc5b5,00690797-6884-4a9f-92e9-239562898072,2023-02-07 03:56:07,Suspicious Activity,Future collection street subject cell.
681f98ea-fada-4999-a63b-320f8c9c781e,a75e6700-013d-42f2-81aa-b9c4047b9d94,2023-02-15 01:00:37,Chargeback,Sound today training goal article raise if.
ca43d530-215c-4e72-ba96-b1435888ecd8,d89322e4-955f-4fe7-babd-5b54a26d32f0,2023-07-18 01:08:05,Chargeback,Rather region meet save single.
37dc060f-303a-4f8b-aa06-b64544bcd3ca,e7bc3a63-554b-4bff-83fb-c26516b9d8e2,2023-03-12 11:29:43,Suspicious Activity,Training environment challenge performance police because stay.
fcc34448-8bce-4aa8-852b-452252b0038e,af5e60e0-d280-4f12-b792-2c2631e5d500,2023-02-10 06:05:10,Suspicious Activity,Sell cause travel thousand water bit employee.
9e76ca9e-1aa9-448b-b1bb-ddd2ebfc9735,fc7299b4-95c6-47f3-99ae-f32f3a264419,2023-05-22 19:11:37,Suspicious Activity,Take Mr card.
ea4e6023-ecb0-422a-bded-84a5b781b539,857e6fc1-872b-4655-b076-e44dea55bb4a,2023-04-26 11:38:34,Chargeback,So degree instead kid modern move.
21378046-13d9-4707-90e7-35ed58e366a9,7aed0597-9749-4114-91e4-403a8688771e,2023-04-15 04:12:15,Chargeback,Response garden third cold few.
27c8d5fd-b804-4e83-b3ac-a08b0de949e5,15dd7854-42db-495e-9c05-370b2f73834e,2023-04-09 12:51:26,Chargeback,Until act suddenly wall enough contain remain mention.
87f30b37-dc37-4524-a4aa-4a5e7386f9c5,bb3bfa0e-01c8-4460-8ef2-0aa4822d6484,2023-02-24 04:29:01,Chargeback,Them half plant.
5436ed23-e7c7-411c-8862-cf1e923aa3d5,197fe4c2-e597-4157-92a8-2b208a61f152,2023-02-07 21:25:34,Suspicious Activity,Them management believe along mouth lead.
ee838e5a-4cb6-4c25-9dec-c8348375e4fd,751826bc-facd-4a97-83fa-1faab9553273,2023-04-23 15:58:54,Chargeback,Gas hour tend well actually real right.
46c8f414-1b6a-4d7e-802a-f779a91ef8f6,2bbb9f5d-f695-419a-be85-b033e4fae503,2023-07-13 03:56:53,Chargeback,Impact statement piece benefit beat various audience.
bee60607-df21-4de4-82e2-e31554feffe4,23f44038-b458-4091-95f3-f0d19a309415,2023-07-06 02:27:44,Chargeback,Country couple fund indicate trip court value.
78ace883-4d45-4ebb-a05f-67d8c4f7eab5,8800b7a8-8990-4e52-8672-ce3eabb14154,2023-06-03 10:00:28,Suspicious Activity,Must whose listen class debate wear interesting.
7185003b-4647-433e-8b8e-ec52700596b7,c95f9d7c-c51d-4c3f-b061-15ff24a41ba0,2023-05-04 21:09:56,Chargeback,Red join red simple.
a7ea5266-380c-4c66-928a-c200285fc5bc,902be9ce-e3e9-4d50-994b-c083e60ba24f,2023-04-09 22:26:42,Suspicious Activity,Central health tree find book present.
9049808b-1c9d-45e8-bb90-57918dd4d2d6,cbe23d3e-46da-4df2-a51f-8ba3153ecaeb,2023-05-04 02:25:22,Chargeback,Use alone military meeting when.
10ec8c06-453a-4018-9f4d-9881a1a0f4b0,d4ec3661-e2a7-4bc2-a096-e11195855b35,2023-07-28 02:40:49,Suspicious Activity,When agent thank movement.
f575ddaf-1e97-4c65-9ae9-f0cf3f5402b6,91035cb1-2ec4-4cf4-95a3-73b0d8e0c79d,2023-05-24 14:11:30,Chargeback,Public according she into occur good girl pass.
e9ad243d-cdf9-47c8-887e-1e798d0122c3,a7562c85-4a65-4917-b7f1-4f1406615f00,2023-01-19 17:15:25,Suspicious Activity,Take card blue community answer wife people.
c91a6f7e-80a3-492e-9a16-cf0e1c1ec6c4,6365cbce-80c2-47f8-b687-b930bac903ec,2023-06-17 05:06:08,Suspicious Activity,Try should green medical image expert.
87c52c3b-97a5-472d-9392-bece855cbed2,420784ec-6ed0-48e1-9384-a2edbcc10334,2023-06-08 02:07:55,Chargeback,Apply far student member discuss.
44167eea-0695-428b-a4e2-7dc38baf86aa,35824346-549f-48a9-a232-53b821870c07,2023-03-16 23:32:29,Chargeback,Thought care try station guess forget relate statement.
adbc6597-54fa-4529-8774-edd0bd60f5a1,a15b677e-3b4e-4e19-94ce-fe8d399b8fef,2023-05-09 23:34:57,Suspicious Activity,I air deal inside budget whatever.
b9875901-77d7-4f21-a90a-fd74e331d1c5,0ac525ff-36b2-46d1-a9ca-501c750aa93d,2023-08-20 12:23:35,Chargeback,Help cold above million several main.
09dc83d4-88ff-4068-bb93-9fec509aff07,d5894161-6443-4b47-b903-f1b1c8ef33ff,2023-03-15 02:16:01,Chargeback,Society crime full only the themselves standard.
1d354314-a2b3-4d97-9837-453c34156ef6,c8681ef3-5149-4a4e-b6f7-f0029de925b4,2023-07-30 06:23:57,Chargeback,Station street kid color end likely figure these.
5a95c0ee-08cf-47a7-bac6-c424105a5d0d,984603ca-0f1b-46d0-8927-0acef74ec355,2023-01-07 17:18:39,Chargeback,Their Mrs realize month play city.
9ca615f6-641e-4a4e-9f35-79dd311dc489,eeccb47d-033f-4262-b3cd-31dfbece1243,2023-02-10 21:49:52,Chargeback,Skin experience career almost change soldier.
ecd9dd62-bf64-4371-ad63-5b7651461b67,a01d3801-c3cd-415d-a2c4-8f6c93ec842c,2023-06-21 01:49:11,Suspicious Activity,Clearly never because within issue gun.
da79db21-1ebf-4b93-a20c-77cbad430d04,6fc92214-8491-46f0-b70b-2ba59b724883,2023-05-14 18:03:06,Suspicious Activity,Hair make grow tend Democrat want maybe.
9ff61228-81fa-48f9-b903-b71753837978,236ab679-ab35-4f60-aba8-8298f404b15d,2023-03-28 06:58:09,Suspicious Activity,Local level my meet style.
525ed48d-1982-4a6a-9ff3-788b8e26eb94,3d247f1b-3038-4967-bc7a-39094c7ad4df,2023-04-22 10:26:40,Chargeback,All attorney to form.
7daa1bd2-2846-4e20-a5b3-c7153fbccb2f,9e1851b4-af9b-4d26-97af-df78c52e86d2,2023-08-01 19:47:00,Suspicious Activity,Less include affect.
110b616f-83b1-47af-a020-94a1a907cf08,1ad48d3d-cfee-4b4f-8844-662ff0e9f59e,2023-05-13 12:42:15,Chargeback,Animal edge decade continue true little.
08aaa934-f933-4240-a80a-feb2ca5d4f80,c27181ec-774c-4531-bba3-a17872984244,2023-05-15 21:26:12,Suspicious Activity,Write own story available.
3c7a7cd5-8c76-4b39-8afd-65f24a8efd7c,f5919eff-932c-474f-870a-c2dd89d3b41b,2023-06-01 13:49:27,Suspicious Activity,Official or real country quite.
ce30ecbe-1c6c-4e9e-b29b-cf891327aec0,fd96b766-6b41-4527-8491-ff2b225d7b9b,2023-02-08 18:39:33,Chargeback,Clear anyone sure.
9b3a7f7f-5b73-4d27-8049-192baca8b25d,2da444f2-d3c5-4fda-9558-07aa3a959722,2023-03-23 05:31:24,Chargeback,Democratic statement leg administration.
1d13a144-ad80-48cd-aba3-fa8c6b0a9b2b,447160be-d834-4497-976d-67f6bc18be67,2023-06-10 16:39:40,Chargeback,Customer play clear example tax hard star factor.
b97c6d7a-19e9-4cf4-9115-ab2b6ebf311d,828b7145-2e3d-4f4b-a2ed-ab6ed2bc8948,2023-04-09 11:19:16,Suspicious Activity,Newspaper major bag price close.
71fa7e55-6df5-4ace-8326-1c4adc256a9f,aff26781-d399-4f2e-8f8c-76eb4c902314,2023-05-29 19:46:46,Chargeback,Role memory leg garden.
80a0c4a3-6722-4c9d-95d9-68409d8a1f45,6126c0d5-f1c9-4820-8aa8-3e93be4befc8,2023-07-19 07:02:00,Chargeback,Listen question machine serious structure.
074ca79f-2887-4454-a274-7e11e098a654,432727e5-c74f-4c47-b58f-a75c83211f48,2023-08-13 21:31:41,Chargeback,Test future investment nature keep seek.
884e44fb-8c49-4bb5-a4d5-77a34e611ca4,a8b47aa4-6d43-415b-b648-f33d6055a54a,2023-03-23 03:21:57,Suspicious Activity,Open house expect more moment.
672adf70-4c67-4891-943b-de60c5cb62a6,5198fe71-73bb-4cee-9846-2664f54a03a5,2023-02-15 07:42:00,Chargeback,Individual mention truth score.
3a17bf52-07e3-4fe5-beb2-2f9ba4dac70e,ad8a595d-4959-4625-b3a5-eab70070022f,2023-06-22 14:15:06,Suspicious Activity,Somebody trip once audience year.
fd263bb5-7c5c-488b-850b-3742cd66eed4,0bbc90a4-86c5-47e4-816b-13012b392891,2023-05-01 11:52:36,Suspicious Activity,Someone join admit step.
908f974c-e39b-4695-8e32-60295d08c9b4,47c6b175-c8c8-480f-94d8-971453e92334,2023-02-19 07:08:59,Suspicious Activity,Hear happy forward man happen prevent.
c2291eaf-791e-4654-824c-2c8fab7d3dde,598ffab4-0523-4b44-959f-b7346d376aab,2023-07-01 12:52:19,Chargeback,After nor gun after.
93e63323-7894-47a8-ac58-f0e7aa2ce3cc,94b891af-8bb0-4e21-9cf8-8b7c225ec459,2023-02-28 18:18:13,Suspicious Activity,Ready size run pull deep art.
