Fraud Alert ID,Suspicious Transaction ID,Alert Date,Alert Type,Alert Description
e45f53d6-d15c-4a64-a704-aa4f05864e8c,7730dfc0-8a7c-4706-baf5-6e569e8006d4,2023-05-01 12:51:31,Suspicious Activity,Sure cultural also write.
b8b6c9f5-bf26-4b19-b4ff-874189be6a70,68c69e9e-af31-4061-8e38-ec84c00643b1,2023-06-17 06:14:30,Chargeback,Always board vote per manager if.
fa153ff8-fb6d-4b88-a036-b87ed72e996f,cc0030a3-ae72-4d99-9d43-67c5d824cd4e,2023-07-09 07:45:37,Chargeback,Car attention next through.
2f369d13-3b18-4729-84f6-cb83464ea947,e4da1f6b-57d3-4a52-ba3d-b8425bf114f8,2023-07-30 19:31:43,Suspicious Activity,Find a recently ever.
4db62349-09ef-40e0-baf7-858ea26119f9,7822a896-8495-45fc-ba5e-5c9b4d6f6a63,2023-05-09 07:22:44,Suspicious Activity,Material head change indicate treatment blood.
1ff92cce-1044-4045-99f7-e8829d026621,e90fc04e-9154-47ea-8337-0731848c06c9,2023-07-21 09:45:05,Chargeback,Medical something amount.
fdeaee19-e49f-428b-b631-32bef1c1d339,a5a5d6cc-8437-49c6-98c2-e34335d02b13,2023-01-17 17:26:57,Chargeback,Situation policy woman college.
0b67590c-61d0-41c8-ba58-1705cccaa22b,e8464858-ca44-4dc3-a5c1-0e7e37d8f530,2023-05-10 01:05:20,Suspicious Activity,Whose meet source husband.
9ea9ebda-8603-49ad-84fc-eb66887a0897,c1f8920c-9dcf-420f-9488-43ffe7ca8872,2023-07-10 12:08:33,Suspicious Activity,Job them walk opportunity if garden bit.
b694ec0d-c1f6-44ca-b272-072cb117d757,d61a858b-7440-473d-9595-f6d94a455abe,2023-07-23 09:15:35,Chargeback,Term range culture before owner.
ce2b8418-74cb-404c-a415-19fbb6a00c5f,adabcde0-5d43-4898-b6f1-d0b8bf9b8a93,2023-02-23 16:04:07,Chargeback,Card physical always why.
be2e7440-e875-44a1-a539-5a5919d4803c,4446170f-4410-4a84-85a6-143252a63914,2023-02-27 15:24:41,Suspicious Activity,Thousand anyone politics message seven nor.
74df8f22-7481-49c5-ba5d-0eedc52f9fa6,d10cdd88-8b89-4f42-9129-5f7b3dd7dd37,2023-02-23 06:14:31,Suspicious Activity,Effect subject another.
e9357c7a-a7f0-4b69-9600-ea80b03614ab,519b1162-52b8-4781-8c8c-157e08c3e827,2023-01-18 06:03:59,Chargeback,Well general right official money image security.
5324dadd-2be3-48c6-bbb2-b507d72ade4e,d14c4bf4-94ec-4890-9283-aacf4fde55b7,2023-08-17 07:15:22,Chargeback,Arm already get wife.
5a6cb940-e554-4ee6-a0fb-9b94ca75794b,c292fbdf-bf0d-44ea-b2b6-9955bb49183c,2023-05-08 04:56:31,Chargeback,Among want whatever between.
b1147863-c05f-4948-9bb5-0bb58c34b85c,4ac24926-8ac6-4a9b-8bd3-99dceb3fe6e4,2023-08-06 01:17:15,Chargeback,Garden old inside president.
fa88bf7f-c6a0-4d5b-91f0-a4c79010f5c1,ce3f17c9-8b0f-44fe-92a9-5d8d3ab5207f,2023-07-04 20:34:18,Suspicious Activity,Explain concern start improve against also.
d1db401e-c23c-4986-866c-901d25872664,8697faa6-10bc-40ee-9cec-29ed2aacd87f,2023-03-05 15:20:14,Chargeback,Way effort history air when cost nature.
d69b4e8f-d426-4a2f-9a00-923d6f22e5e9,c9968fc3-c108-449c-a18b-b2827cbb5bd9,2023-05-23 12:08:24,Chargeback,Create air director staff only.
cfe2bbaa-8afb-40ed-b3fa-bd617a5988ac,7458e9db-1a44-4b0d-ad32-1e5556d50657,2023-09-03 13:14:43,Suspicious Activity,Adult which bad become though piece training.
04b7452e-bcc8-4634-9422-52f323190fc6,6b69fd8c-00b9-4db1-a2c4-7cba58ab7987,2023-08-26 02:24:34,Chargeback,Enough fact admit everyone later word.
5fda6a5f-8952-4863-baaf-6cd9e6213c4d,90469cd1-992f-447f-a9f5-05e0bff6f191,2023-03-24 15:43:02,Chargeback,Phone building man short behind imagine.
512d47f1-ca68-4081-848a-642cda1908fc,1e4b82ee-46f3-432d-9e43-01ede19b2160,2023-03-03 15:49:48,Chargeback,Myself himself seat plan throughout rest.
e8f82b6b-8e6c-4048-a82e-8b3573782c72,27fa7f7b-0725-4e37-8b92-1f8650bfed0d,2023-05-23 01:45:51,Chargeback,Us charge figure truth produce.
627ab2e9-6270-443c-8baa-fc993092ac0c,4e500296-94e9-415d-8b89-73fc7afec5c4,2023-04-08 12:01:44,Suspicious Activity,Serious camera every national must table generation.
01ce7b90-fc9a-40c5-9468-5e13e4f83d66,03e2365f-473d-4897-9784-0101a319b67d,2023-05-01 09:03:55,Chargeback,Large enter year seem.
93920666-59f8-44ca-a08c-d86a5e63343f,68d2ba41-133e-4bec-ae42-0a535959460f,2023-04-02 05:29:28,Chargeback,Return establish test will concern.
8a89ccd1-789c-4f20-8856-819d7cd83f9e,19345205-c68e-4f9b-95ec-4f298d9491b6,2023-03-23 10:25:59,Suspicious Activity,Security leg contain would.
3a8fdad5-ccb3-433c-92ed-e1124ff2dbba,0413e048-8792-4c53-a5a2-e7a889d2981c,2023-04-26 06:50:25,Chargeback,Water accept top real.
40fe1c27-1d91-4f3d-8650-47920a8ab3f4,e4dcbd11-5100-4c2f-a47e-9480d69c82a5,2023-05-24 21:44:06,Suspicious Activity,Serve officer dinner past garden.
67840861-87f1-4fb7-b481-a2346b71ba3c,32357491-b830-4d50-abdb-ed9771a64787,2023-07-14 11:35:37,Suspicious Activity,Rich certain finally born professor.
c0e0abaf-9469-4fdc-a248-ed7da03779c8,9230cac5-ac79-48a9-aeea-b016178ca7aa,2023-05-25 03:02:25,Suspicious Activity,Fine together play act ten material teach.
e297ce1b-ab3a-47b4-9e78-28259a81db42,560eb172-992c-4f9e-99be-a45026389a33,2023-07-08 01:16:47,Chargeback,Raise PM remember five lead.
f920c5c4-e0dd-43e8-9215-b58f76e4344c,47946c24-83c5-4e78-a595-da0521fa069a,2023-04-01 12:51:07,Suspicious Activity,Decade relationship ready bill else attorney.
0481d9a0-3cdd-4944-b765-6c12a3db1f5b,acbccc29-b1e0-4eab-b96a-57a93fa6d3c6,2023-01-07 06:19:08,Chargeback,International any character letter good stay.
91de071a-4e42-489e-b1aa-f90dc46e1951,67e0f1b7-81c0-491e-a35c-4d3f284e499b,2023-08-26 22:12:21,Chargeback,Reach beat near material board American.
b67cb65e-b739-4377-ab7d-99ffe53d712e,dcb7186f-bf76-43fe-ab32-ba854ca865e1,2023-08-31 08:04:17,Suspicious Activity,Political top do education myself lay development bank.
2bf92504-e08c-4aab-a790-9b3779c99224,2fd91993-98c7-4810-bb01-316bc34638c2,2023-07-09 05:19:02,Chargeback,Movement edge wear future.
b4b5c9a5-1f8a-4d8d-a5d9-1952320985f2,63f96b4c-9b59-426c-be3d-ddb0304a10e2,2023-02-21 18:13:08,Chargeback,Feel official worker to.
8c9cb233-49a3-4138-b128-2e756316d08d,a176b9b0-26b9-400c-a5f6-7246eac2067c,2023-07-13 12:06:38,Chargeback,Yet day day.
bb84695b-5c72-461a-8953-c2f6d0a80221,05d863b4-6ed7-4044-8544-c30946ca4a60,2023-04-21 08:58:31,Chargeback,Fast everything pay model director quickly skin.
824e556d-16c9-44b8-b47d-3b3165d28857,d04c3d85-96b3-442c-a059-6766f3204d28,2023-07-18 12:49:18,Chargeback,Cost task sign color process design to.
623ff883-4382-46ea-b4ec-9646a97bf47e,05d863b4-6ed7-4044-8544-c30946ca4a60,2023-07-24 16:47:31,Suspicious Activity,Ball himself either stop though attack.
4f9cb260-4c26-43ee-8f23-ec78dd97cafd,944b0683-5a6e-4879-a68d-5858fd216f23,2023-06-11 23:08:15,Chargeback,Blood glass between number style value up will.
6d6f162c-f9e7-4d23-b98a-81d50e19733c,de11b55f-1d00-45fb-adf7-5d4e9bb1a30d,2023-04-11 01:25:55,Suspicious Activity,Wall news debate.
aaa347a7-3667-4b1e-a540-b280e41a4591,08ef9091-ed8c-4654-8c54-17470eb718c2,2023-01-17 08:38:29,Chargeback,But treatment blue.
1bb36487-39b0-47cc-a2c7-f3644786236e,55c1fbc5-24ba-49da-a91e-a709a830eaa3,2023-06-06 03:19:36,Chargeback,Five true structure.
48a3424f-ce79-4604-9df0-50789268b435,ca2ddd49-e37b-4342-9636-f359ad810374,2023-01-27 04:10:22,Suspicious Activity,Its stage unit anything center.
8c879707-ea78-4b20-96d0-d6865ead7892,1751dd66-cb05-4fc2-a9c9-2f2710b427d8,2023-05-21 22:46:07,Chargeback,Similar year before film baby my.
fd377197-0bc5-494f-b85c-aa1624899f3b,d57a4a0c-1304-4201-8813-b8c766618b4e,2023-08-08 09:29:55,Chargeback,North face good cup.
267209f4-8a4a-4497-996b-efe143daf0c8,4bc3cc2a-f650-4281-a48b-e199b9ac035a,2023-02-14 10:32:16,Suspicious Activity,Clearly sound piece most.
0a8bcc7f-671d-4ea1-af3a-ec31a825b3fe,f598c260-b6a4-4e39-b23f-d7e211db29e4,2023-08-12 04:04:28,Suspicious Activity,Go investment by group kind stuff.
31b2f46d-dcf7-43aa-a87e-83688969853e,c7404c7a-2aac-43a6-9fb4-64f2d365af2f,2023-08-08 16:01:35,Chargeback,Change increase training series.
49bc011a-21ed-4dee-ab9f-8fa70cf6e3f0,d11c5503-86a0-4e8d-bc65-6654c9820ef8,2023-04-05 03:34:54,Suspicious Activity,Order real Mrs I finally drive.
c7529510-1946-4b8b-86f6-f627b5d06291,335efa6f-db72-4637-99e1-efd36747a9aa,2023-01-05 14:00:33,Chargeback,Better hold media win crime across.
ef51dc39-7c98-4507-91a9-9c7292488d64,43c464ff-5b48-4f21-8f90-367b908c7e18,2023-07-16 00:07:19,Suspicious Activity,Debate hard right president school.
18884669-84d3-45ad-8bde-b9e29c713166,1aa889ba-2f6d-435d-8ac5-4ca90b99931e,2023-08-17 10:57:38,Chargeback,Set American force recent.
f44d906f-b4c2-4684-a378-93cf7fd33a46,f27ce379-7649-46b5-9913-39df0021bd3d,2023-08-02 23:29:48,Chargeback,Fire allow sure determine tell.
e78855a2-bff3-4dfc-b493-0108313937a0,d5f367ae-f9b9-4840-8ecd-33fa265d9683,2023-09-03 08:48:29,Suspicious Activity,Growth writer standard scene read join light.
79059aa9-1ac5-447f-93d9-4ae9f0d07f60,d3e11092-08a7-4391-a4d4-4b63a65592f2,2023-09-01 03:08:53,Chargeback,Coach management baby both.
682bef90-f507-4797-b947-99736c36f2e0,e1a0f3b9-356f-4ce3-94ea-2e030a1a0175,2023-06-11 23:43:33,Suspicious Activity,Policy away project own his economy.
baf26c97-6687-46d6-acc8-e7178e20fa35,fe35702c-0cc8-46bb-a01e-7d1986e59fb1,2023-04-21 12:07:48,Chargeback,Former onto then series.
548df863-80c3-436e-b2b6-468b586c5742,f44aada2-9780-4d69-a235-6c4cfe7f4ced,2023-01-13 17:33:39,Chargeback,Mission table war.
d79da27d-aef2-438e-abd2-aed7d2bcbd7b,ec63a7a4-4fac-4db7-9459-c9e975ed7e74,2023-04-14 14:13:50,Chargeback,Occur support Mrs cover much official although.
f312cde0-60d2-449b-9c5f-943253b550a6,ccab00ac-548e-4df5-84f3-a286a683fb73,2023-01-08 14:29:50,Suspicious Activity,Role head unit whose.
ec42a443-e0e0-4b7a-b9de-ec493d5bb54f,8bad0fe9-834c-44b7-9032-4787d8a8dc9e,2023-03-04 05:36:19,Chargeback,Dinner summer street large pass.
36ebc593-1003-4b9c-bb87-1b22170ba400,98d722e9-c6de-49a2-a5e5-bfb0869b485b,2023-02-25 13:39:19,Suspicious Activity,Policy full nation follow budget.
a4736aaf-ac86-4856-ad33-f7422dea475c,1bc35256-f207-4bcd-9558-203f7cf2613b,2023-06-10 14:13:11,Suspicious Activity,Field toward none.
6ae1b26f-5e63-40da-9ab8-39b48523efcd,503e31ba-fd09-4271-86a9-b8db32caae47,2023-07-22 16:49:28,Chargeback,Girl water sell last candidate general could.
acf21c14-80ae-43d3-8621-d0b0bd05bfc3,8697faa6-10bc-40ee-9cec-29ed2aacd87f,2023-05-31 21:38:56,Chargeback,Career customer choose line pull appear.
62ff48df-a9f9-49aa-ba92-41d71e6cf43c,17a95bfc-5710-4df4-a56a-9ef9c5552ec6,2023-03-16 04:29:16,Suspicious Activity,Talk than chair positive discover tell.
46fd2ca8-c829-4c04-8c10-b35ad3166b80,04feb9bc-8fd0-44b7-8769-feef34b8e339,2023-06-01 22:26:21,Suspicious Activity,Nothing mention according federal likely half.
f11ac28b-e27f-486b-af19-9cfe67178180,17ff7d62-2e7e-40fc-aca7-e19c6e95e682,2023-06-13 15:03:19,Chargeback,Design child into kid.
950fe845-337c-4df7-b551-9b1d0bea26ba,81788ad8-bfd6-44a3-b187-37b1bcf1d4be,2023-07-20 12:04:19,Chargeback,American cut find which bit example investment.
430c93c4-3869-413f-9029-e2b97e765a7e,0c3374c7-58da-403a-bd09-7bf07e30e0b6,2023-04-12 11:26:50,Suspicious Activity,Hold the apply commercial many.
5f5921b3-487d-4973-abf4-2afff75b0f6c,6e3cc9ef-1535-4680-a72a-90340e8af108,2023-02-24 20:54:02,Suspicious Activity,Program seem radio water plant prepare.
e7ee89df-5273-4f9c-afc9-fb0caec53c53,9e047516-4120-47ba-a82e-8263aa8c40f0,2023-05-15 09:05:09,Chargeback,Dog check close explain together key.
ab37de88-91ab-40b4-8e10-cced329d65e6,fb9513ef-a820-42ac-acfd-39ed20b1b2c4,2023-04-20 18:55:16,Suspicious Activity,Store police me into you what certain safe.
5525f969-9817-4e3e-a576-5ca86086cc9f,c965dc37-61af-4fbc-8398-4f28666ab2c2,2023-08-13 06:00:10,Chargeback,Moment free your customer author.
cf63445f-8a7c-4d49-830d-6d018a29c2cc,9ba2d6ae-1d00-40e2-9791-02106139a44d,2023-07-19 14:36:33,Chargeback,Natural including send happen watch wish late.
ecdb30ca-a0cf-4734-ba9e-68e65566975a,62d795ff-7572-4783-b4fb-e3891ff556a3,2023-04-16 10:42:33,Chargeback,Third manage explain night expect outside.
31358f8e-ad5a-48a3-b71c-24f02163ce86,adc73c4b-9e11-4fbe-9c21-c6507be7ed56,2023-02-23 01:30:24,Suspicious Activity,Mind position much wear site board.
ea401068-cfb2-40b8-83e0-a25c50b7e22e,7ec2141d-1ddd-4e0f-9c82-4605ad395170,2023-07-16 13:52:49,Suspicious Activity,Hospital past partner guy father note statement.
328202c9-24dc-481b-a565-393c4fa335e9,6ddad0e2-8c88-4d82-b528-5d68cb84166b,2023-06-23 05:54:23,Suspicious Activity,Enough final decade kid example.
2ea56327-7231-435e-8f87-b94c2ba74067,92a5130e-125e-4194-8827-0c5c3016bc63,2023-05-24 12:24:45,Suspicious Activity,State or huge quality open.
ff2b68e3-c02c-4f4e-89f0-462a865a14cb,9cb6ae3c-ae05-4ed5-9c3b-b5875c90441d,2023-07-06 14:28:41,Chargeback,Room receive common others.
b6238a08-c112-4fa2-95d3-cf28bb5e91f4,32b0fe0c-ff35-40db-9806-cddd76236119,2023-04-20 03:54:34,Chargeback,Water manager image community student.
325f60ed-c94e-4d32-b514-d1e6ffa8d0b2,5108c776-bcfe-4e8f-ba87-9e6f67198461,2023-04-13 13:22:07,Chargeback,Break material management theory.
3711349a-ae76-4c76-b9b9-06a264ad6e3c,3c7a535c-6e83-46a0-8b01-b65d93e1ac2f,2023-08-18 15:13:13,Suspicious Activity,Appear travel opportunity quite need.
5d0b48cd-fd39-49ac-9085-375111ab77d3,6cda96ef-8c85-47b0-b8a3-e5cb9985129b,2023-07-22 12:42:07,Chargeback,Nor protect staff against.
8b170c84-56ee-40d5-bdd1-f8ec0e90c6b8,df8f6663-7081-4856-9894-89e416d39968,2023-09-03 12:41:30,Chargeback,Government thousand relationship try method.
ed7618d9-7710-473b-8d81-a10b27d01d76,9c3d3fc0-ab1a-4bbf-988c-fe68ab31864e,2023-02-28 09:49:38,Chargeback,Indicate energy mouth meet.
ffe4abd7-44a5-4f47-8d3e-fb94fea58e37,652ce621-d155-4119-8442-6acabd2ca5e1,2023-01-08 03:58:36,Suspicious Activity,Final work because practice top my.
b6fca4a6-066b-48bd-a972-52b680b31fb8,30f5219f-0e00-49b9-a593-b51be025306a,2023-08-19 03:41:50,Chargeback,Car family drop start real summer.
25aa3510-41d0-4005-815d-e1beb8b9bc96,f076b6db-090b-44cf-8ac8-109e327ffcd1,2023-04-24 20:13:33,Chargeback,Claim several future item charge style.
182a030d-c6d1-43bb-99b2-b5d86c9a4fcc,4afdabcc-e6c3-4415-9c9e-2fd9a751ca43,2023-04-04 13:41:57,Chargeback,Determine sea produce student by.
8c9d7138-2336-41be-b855-50b552ba3077,4ab23234-25f7-4f2c-abbe-ad4bd21d7895,2023-07-05 20:31:01,Chargeback,Think field well have state.
39c1994a-ef9a-4fda-9208-38ae1350d6f9,9387f35f-4826-462a-84f2-7bc9d621e62c,2023-04-11 22:11:29,Chargeback,Recently who also skin center fish.
95a06e98-4928-4411-888e-04d4b07e2c41,c40cea5e-8414-43f0-b910-b28573f5813f,2023-07-30 23:40:50,Suspicious Activity,Same together hard usually foot send democratic address.
89483471-78ce-4f85-a432-8454107d6651,73ec10a6-5fcc-4dd6-ac5c-204f5a5a8200,2023-08-19 18:36:42,Chargeback,Despite least until range piece.
cbffce3e-8c5a-4556-bedb-69756e75d9c1,dbac6848-5337-42e3-83eb-4291da0a3fe3,2023-04-09 15:03:44,Suspicious Activity,Treatment above pretty.
e3ef2e12-b47b-467e-bdf9-b590b1051d9d,e6407982-8a1f-41f9-8818-3d2cfb7e69f6,2023-02-18 04:47:51,Chargeback,Thank person daughter tree.
e00fc8cc-b197-4727-8044-220609bc2b39,10c27dcd-0c06-4922-9ff3-c965e600481d,2023-06-04 03:39:39,Suspicious Activity,Stage leader what watch what rise partner.
c219dc90-7a3e-4ee1-9eab-d5a8d7de3fbc,41304b24-b9fe-4ed5-ae41-9359b0ee9ff6,2023-04-21 09:49:13,Suspicious Activity,Garden hour couple thank for easy.
9539cdae-0a34-4433-b283-1b18711650d9,c02d383d-eaa6-4db5-a128-417cc3ab6b39,2023-03-30 12:15:19,Chargeback,Occur nothing choose back notice draw partner.
9a6ba6bc-c1a0-45ae-a0e3-19ad20e77d46,7fe836d3-8ee6-4087-a2ce-f3fef71c9e12,2023-07-05 07:20:47,Suspicious Activity,At ready health event.
0c32833f-7b0c-446b-9b7e-d35ba4d74e53,9b1f0d6f-83e2-44b2-85ae-28d8116b8721,2023-01-22 10:27:25,Chargeback,Career but new after worry.
a42f598d-72ab-4a01-a235-b6f87097d299,e1e2303d-4df0-40af-b321-8d0b79d25484,2023-06-11 11:28:32,Suspicious Activity,Training police task remember success agree put.
11a0d212-9d09-4d83-bfe4-7088528389fa,811326db-945e-44cd-b1a0-cd8211ca639e,2023-02-09 18:32:07,Suspicious Activity,New lay difference seek hundred accept.
269e451a-cc83-4503-912a-3c59e4856379,00edb100-1aee-4810-ad2d-97b7c67ca030,2023-05-12 15:42:51,Chargeback,Forward bag write for step save adult.
cdfe2e8d-ad42-4673-b1d3-7235f06acc0b,3e2925d3-3a3a-451f-8cde-cf6e0eda12b3,2023-08-21 08:05:59,Suspicious Activity,Movement goal project.
0224bcbe-c155-45ce-a5da-c7b5cd752875,33da0f89-0aad-4945-ad8d-a6f28b82a3b4,2023-02-25 07:03:00,Chargeback,Fall down from hotel give.
54ae7310-ff04-4554-b780-3910b86c3abe,ccf5e553-b8df-4ced-b543-48ea754a1bac,2023-07-16 08:14:01,Chargeback,Ready wear military writer hour.
6e128e2b-294f-49b9-9563-f45f4f862fe9,ae0cfd6d-339b-4315-902d-cef6531ed9ea,2023-07-20 17:17:51,Chargeback,Family seat plan main cost.
4f743633-3dba-4d44-ac6d-03c022a67f5b,05f8797b-320f-427f-9103-09014c678209,2023-05-22 16:21:39,Chargeback,Government general lose prepare husband eat no.
613ea68c-0db2-4af1-b929-7362b8cf7a9b,c7404c7a-2aac-43a6-9fb4-64f2d365af2f,2023-04-02 17:03:18,Chargeback,Reduce story new child choose skill drug.
b3a563e8-0fcf-483f-8c52-fecfbde7cec7,2cd7e30a-b7da-482d-8919-73f5caa9a192,2023-01-04 09:06:39,Suspicious Activity,Rise east already laugh.
00b5353e-5650-4781-881a-4e34f078b17b,abdb2f70-c4d6-42a4-a964-7b964f9803a9,2023-06-08 17:40:58,Suspicious Activity,Good quite push enough sit religious.
1fa73947-e3b6-46a9-a856-d0bb6392f0bd,9bc9b2bc-dec6-40f6-be76-a1f36aea13a7,2023-03-14 04:22:32,Suspicious Activity,Skin bad able wait player decade.
a92faf90-ef5a-47e8-ad0c-6cd08a5d6ade,4629db46-9a90-4d3d-8f11-e8a9becdbd04,2023-06-16 17:40:19,Chargeback,Story likely to true brother president.
b6d10c09-32f5-46b2-9e7f-f8331081d0c5,6a16e979-7f51-4e76-aea6-9c35fab8f3da,2023-03-26 04:24:53,Chargeback,Wife indicate animal economy try together.
0f19141d-2594-4b8a-beca-54246f59ab08,1c1af92f-c0f2-4e81-a25d-877463e4ddf3,2023-04-15 03:46:12,Chargeback,Anyone series outside quality citizen can police.
2e60d8bc-ed13-4f40-9908-0959e57f3fa4,a90d756a-1895-4beb-bddd-a4899743ed80,2023-07-02 19:56:28,Chargeback,Dream everything mother alone third someone just.
0ffa9fad-cd44-4d96-b369-d4254c400987,9c0c19e3-6947-4887-b3e6-8ecc8b0dd785,2023-03-31 15:25:36,Chargeback,Art billion mention decide bill.
262ab42c-3eb0-4353-9eb5-03a483c2055a,1b5d1ff2-f05d-4016-aa11-77d5d7dd7089,2023-08-20 14:50:06,Chargeback,Month hand reduce as right today item.
b2d8cdbd-7df9-4420-81ca-0610c5f6ff94,c84019d4-8b62-45ac-a8a9-a2370e570902,2023-08-20 04:39:50,Chargeback,Interest research statement former support also.
cff52544-e756-427f-bc09-0bb4b1a0c9e4,8acd89ac-60d8-4e8e-8a47-47bc0f039dfc,2023-05-12 01:47:23,Suspicious Activity,Crime magazine sea page card nice accept subject.
c261477b-6562-4212-a3e7-c93caf5610af,688e8228-6a1d-416e-8861-14508659eb00,2023-01-02 17:56:15,Chargeback,Star language quickly decide.
ab444df8-ac0e-483e-8d15-0c16c2a0ad82,4b49c136-2cfc-490d-876a-bdbc8fd6a276,2023-08-19 03:04:44,Suspicious Activity,Vote black clear.
17d1ad30-6046-4829-92ce-ca3b87214599,659dd57d-b3d9-4cff-b9aa-b9a9ac31ff16,2023-06-06 08:34:38,Chargeback,Beat statement responsibility story around actually.
da89b19f-8bec-4c12-b146-ef068ddddb6e,564833a9-a788-4766-ba44-fae35b6ec11e,2023-02-13 03:31:21,Chargeback,Add arrive affect company executive resource him.
c4293e1d-b46f-4c57-95de-8d4e233b6bd5,c0d33f93-719a-43fb-86df-53056d8a3aeb,2023-08-03 02:07:26,Suspicious Activity,Light body question represent stop material statement.
326811b7-0c51-432a-a0f8-910ff97896da,e084547b-882f-47df-a02d-af2cdbe3d718,2023-01-23 07:14:34,Chargeback,Include parent appear these rise particularly white old.
65004362-2999-4810-abe9-2f3e0bd6dfc3,818323d8-e172-4952-a3b4-b15f90e65efd,2023-07-25 12:49:27,Chargeback,Pretty response mean office direction.
e7e4f560-508b-40d1-98e5-307b3826bc1e,ade75875-7ed2-4fa0-b4cd-85916875040e,2023-04-01 09:43:35,Suspicious Activity,Mind approach responsibility hand total fill federal miss.
a5ac47b7-ee40-418b-b5e6-983fea57ebd9,c21db6c2-0ada-4f61-89d4-e3973da006d6,2023-01-21 19:13:50,Suspicious Activity,Owner event situation.
42f9821a-cf08-49ac-962f-549bbccb7f1a,efc2cbca-8baf-498a-a1eb-54518c37d193,2023-08-18 06:55:27,Suspicious Activity,Cost should information morning visit.
ae71e426-b512-49f9-b9ff-e065ad79e9c5,ebf678d6-6702-4733-a635-d7b3e2c5f32e,2023-08-02 23:53:31,Suspicious Activity,Interview perhaps hundred base skin turn manage guess.
0eceee81-ce4f-4ddd-865a-3ba4b975a9cd,47597ab0-256b-49fb-bdd5-7396a35eca21,2023-07-24 23:17:55,Suspicious Activity,Throw foreign free direction.
690dde81-e6b3-4255-a1e8-68095cc6f0a6,11b165c3-b008-4e2a-9479-78ce80d8e155,2023-01-06 05:57:12,Suspicious Activity,Source class floor race oil contain.
0a863f7c-92be-4cb4-94a2-da333a12fbd1,3291ac4a-4cb0-476f-ae08-482f41e07cc5,2023-06-16 09:24:38,Suspicious Activity,Cold bed action prevent industry do process.
6b848057-9c55-4afc-8034-6ea43fa4ca6c,e3636884-268b-4099-909d-721290b2188b,2023-02-17 01:04:39,Suspicious Activity,Knowledge clearly figure realize mother.
63b1b949-269b-4301-85d9-462cf99d9a5c,a2c9f273-48c4-4976-849d-1bd0e5aee50d,2023-06-09 08:16:14,Chargeback,Benefit section drug chance today year whatever.
804ba9dc-163f-4eab-8279-b7fb7deac1c3,d3d8a43f-f998-4bbe-938d-d962df5dfe41,2023-06-06 14:34:22,Chargeback,Shoulder under black summer herself learn.
c283e07a-3ccd-4956-9cd1-0ca9ff0483a1,59d361bd-19fe-46e5-8f44-8f1418ed1b82,2023-05-15 14:24:19,Chargeback,Far factor shoulder their area billion reach still.
514ac38c-ff30-4844-b7fb-55a8efd2caa0,d5905d3b-ea15-42ac-b446-9cebfe57e16a,2023-01-19 18:18:49,Suspicious Activity,The maybe fire seem capital matter enjoy.
492b222f-d82e-4ab1-a491-cea47aaee374,ff502cd6-e10e-4de6-9828-fb5fdc5f0b98,2023-03-20 11:16:28,Chargeback,Maybe at now sing over.
2e043d1f-e647-4973-857a-5ac203190422,c691640c-f15e-4064-9c45-10f2e08523d1,2023-02-14 02:31:22,Suspicious Activity,Avoid say environmental individual.
95bb3ad5-2a0e-4fb3-93c5-944194872994,855c0ba5-baef-4e9a-b082-40990bb59052,2023-04-20 11:40:19,Suspicious Activity,Seat fund sister half response move.
63b08417-b025-4dcb-9a7a-4c6dea05d8cc,7b2a79d3-1129-458e-bd8f-8556197c49f6,2023-05-22 09:58:04,Suspicious Activity,Unit plan myself avoid.
a7317fb1-7993-4186-9ac3-daa7a55121f1,3b144a03-1ba4-4c60-8050-2d958e27cf04,2023-01-27 03:13:00,Chargeback,Live customer reflect yard sell.
4d78dca9-3bd8-476c-91ba-0bdad68f9e38,b3a194d9-54b1-4a93-92ab-2c29014140a2,2023-09-02 15:15:52,Suspicious Activity,Shoulder factor moment power always resource line room.
ee356586-de5a-495e-a0d7-b450abafda32,daf620cc-4fa9-41db-b85b-f33b46fb4cb5,2023-04-23 08:39:43,Chargeback,Which important need behind toward.
46daa8ee-fce9-4874-93e1-58b3aabc5099,ebc5a326-741b-40f1-aa5a-968e9a505c3c,2023-08-11 15:26:45,Chargeback,Finally let common.
a294ae82-f303-446b-93dc-8309c053e503,2d84ef73-b682-4477-a3fe-d1516f2e7144,2023-04-07 00:54:10,Suspicious Activity,Almost center ago term future want great assume.
d0c571e1-8d20-471e-8d57-d4a168a097bb,744c86a3-0e16-40be-9c67-f58196319557,2023-04-20 06:17:21,Chargeback,Everyone how pick tonight learn describe.
ff85bea7-518c-43b1-b619-1f2821f2b84c,c7914329-c400-4466-a505-a46b7ceca47a,2023-08-23 21:09:03,Chargeback,Result education school rest time continue price song.
6396d1af-a5d5-4c30-bed2-9d7b93f47c78,bc603df6-f258-4c5f-8392-4b1e98e01ef2,2023-07-30 03:22:40,Suspicious Activity,In decide small win entire culture wish another.
153c8939-8d55-486d-bec9-fe509998bcb2,d941c560-fad8-4ba5-9412-eb21f840d94c,2023-07-18 07:34:44,Suspicious Activity,If significant tend evening management kid however easy.
a94d48b3-b6b7-4ee3-8dc2-d1d3a1d886a0,17ff7d62-2e7e-40fc-aca7-e19c6e95e682,2023-05-18 14:22:09,Chargeback,Heavy season develop with.
7ed32041-85d3-4b02-b143-44983912dca6,620212b1-debb-48fe-9c8e-80a3602d276b,2023-05-17 13:49:45,Suspicious Activity,Front hear control force.
760d8836-b0dc-42ea-9620-5857eff5d729,5eb96fa2-7adb-4eb3-b8ca-04a8624063cc,2023-03-19 13:23:32,Suspicious Activity,Turn heart situation trouble.
929b847b-876e-4640-b6d7-5c9a3c05f6eb,412e90a3-8d22-4da4-8e47-54c89d827138,2023-01-31 01:39:39,Chargeback,Art alone say language.
1536e255-8dd0-42a9-bf40-f8522dca3211,4bdd9220-3895-4fbb-89db-7feadf3b4bc6,2023-06-13 23:21:31,Chargeback,Every whatever per market.
0ed785b6-3600-483a-ad52-285dc6d8569d,ed2e0e58-f5dd-40c0-8381-1e7a519c45a5,2023-02-09 15:39:29,Suspicious Activity,Front evidence somebody modern scene kitchen official.
6ca0e7f0-7b44-42b0-882d-87078da12b2f,d64aa23d-ca96-4e9c-acee-e3e998ddc4f0,2023-04-25 07:38:23,Chargeback,Nice consumer sea conference alone right room.
f1c6c902-2bb2-47a9-a628-90c4bbf23683,80fefa28-9eb8-4631-9627-4965b76a12a8,2023-01-14 23:50:16,Suspicious Activity,Second clear level available positive occur.
03fad4bb-6e41-446b-bec8-8211d74a855b,ab2b9c61-dd3b-44e7-aee0-8bb479cd9abd,2023-06-08 06:17:42,Suspicious Activity,Single attack center ever boy the.
04832a61-2d53-4979-8526-c7b5b0f1d6a6,d816fcb1-3f75-42bb-977c-8063db629746,2023-07-13 16:28:29,Chargeback,Defense bag resource sit act.
4ea9c061-1004-4d86-90ab-1721723d620d,4dde5bdb-afbe-406a-9f1a-64d444df0448,2023-04-06 20:36:36,Suspicious Activity,Until person size strategy.
73488495-bac6-4732-8d5f-c2ec688b44a6,058fd291-6ea5-4121-a8d1-e7559abb2d5b,2023-04-27 21:09:27,Chargeback,Family pressure data thank east mission theory.
fa3c591a-b7ed-4402-9ef4-2c5114e6fea7,02f001fb-43a8-43e5-b017-2c076ea370ea,2023-07-28 17:27:41,Chargeback,Use real section case them writer.
0cc21149-bf87-44ea-90e5-bd1b177e977c,5715d03e-601a-4c4f-aa5a-26bde3c0e2e1,2023-01-01 11:06:46,Suspicious Activity,Heart name assume detail.
98c97f1b-cd24-4e19-ac94-0d67367c68c8,3291ac4a-4cb0-476f-ae08-482f41e07cc5,2023-01-23 14:46:11,Suspicious Activity,Dog tree music fast.
2144a777-8f7b-4525-80c1-9a866849a6c4,3f55fb68-aa6d-4e30-9e44-38a59149c73c,2023-03-17 08:22:43,Suspicious Activity,Yourself analysis leader his.
7b92c336-654b-42eb-b9cc-34ff164d95e0,c5c1c49f-eeff-4f39-8e37-40caeafe3435,2023-07-13 08:10:41,Chargeback,Send chance drive once lawyer west senior.
