Fraud Alert ID,Suspicious Transaction ID,Alert Date,Alert Type,Alert Description
8dbb24aa-fc91-4fcc-9fcf-85deb140fa10,27759098-3f15-4c84-93e2-b7d4cee15413,2023-08-15 19:57:08,Suspicious Activity,Assume government growth yard collection own military.
8b4c70b1-fd9c-4806-9424-36da58e9ad48,691ca87f-d0fb-4e85-9abd-ffc83bc38980,2023-04-03 08:43:03,Suspicious Activity,Education consider knowledge eat.
74eab9ce-3e2d-4738-92df-2dd38dc8fae4,dcee886d-5b40-4dbf-adb0-54789ddf48b2,2023-07-14 12:07:45,Chargeback,Gun worker fund.
db300d43-336f-495d-b371-68fc4bebf548,c81e5f62-3d4b-4fe4-8e6e-b57aef9e8e22,2023-04-24 16:15:03,Suspicious Activity,Plant drive understand subject himself still already.
567f5313-d2ef-4c3b-8779-7c08319e8148,2b12ceff-ee65-44ef-9d8f-9aa7aa937c24,2023-01-31 21:40:43,Chargeback,Government exist weight attention.
59dd4671-9a14-4ec3-bd58-bed8f0a3fe0f,c0a6f9c1-8713-49ce-b2a0-6bc75ed2e231,2023-03-17 13:11:42,Suspicious Activity,Age attack sea.
d6d67a9a-86df-43f6-a3ef-1bcc49284baa,87b11ad1-701c-45f1-abdd-5b52982b8344,2023-03-23 15:08:52,Chargeback,Black hear look.
f09c99e9-bb71-487a-89d7-b23eed794019,24dd20d3-cf1c-45d0-9619-9d9b4e769434,2023-07-20 13:48:41,Chargeback,Back either little benefit grow.
ac734a98-b92d-4ee5-a96c-96a1710db479,0dc979a9-7b07-4040-b59e-3995752813f1,2023-07-01 08:13:26,Suspicious Activity,Resource him black every there book.
cc91f175-8725-49b0-9296-0ff5b1d141d3,9dc658b1-0627-454f-85c5-b15ec02a4747,2023-08-25 14:14:17,Chargeback,Miss necessary inside require class.
6e5207a5-e223-407b-9b64-9d3f93b4f73a,049ef2cf-55a1-4816-a659-2b204074ad88,2023-03-28 15:29:28,Chargeback,Big certain himself thank business.
af140c97-90b0-487a-b747-0abb4657637d,0b4cc775-e1f5-40d5-83a5-99504175cd19,2023-05-23 01:53:26,Chargeback,Discuss would month forget account call cell leave.
b6e89ed6-7712-43bf-9e40-d7ff234c74aa,238cf84a-245a-44f0-aa5b-036df0498bc4,2023-08-24 00:30:34,Suspicious Activity,Street health red wall though half than.
86225b84-c858-41a4-a674-cc6313d93c6d,0ac9b75a-086b-4835-8227-dc910aca92b5,2023-02-03 18:35:56,Chargeback,Because heart once lay guy able.
d33b05bf-9231-412d-8311-2f9d2cabecbf,f334f6b3-7420-4caf-b0b0-af3442b1d968,2023-04-19 02:51:33,Chargeback,Society truth four should civil do.
ffd05a44-d1ad-4e4b-94f6-10c8db08af2a,5d792aef-0311-46e1-9cca-7c9dc2f8e093,2023-08-02 05:50:24,Chargeback,Education mother no find.
b205e9bb-2137-433d-96c9-43a55cd466d9,d3ec63d8-7591-4643-9430-ed1825641161,2023-06-26 08:57:57,Suspicious Activity,Building including because story enter system.
6c112a6e-fa2f-4e35-80a6-d5624ed5462a,08eefa3c-8fc6-4b44-a45c-f4f2d95dbd66,2023-09-01 08:21:53,Chargeback,Fill operation true industry pull.
4408469c-b33c-47dd-8f00-2f41171f2a2f,efc9b13a-c869-4063-be83-73547a4cf58b,2023-01-25 14:25:22,Chargeback,Find think unit now physical.
d3a22c43-5cc9-475f-acdd-02eed78b4c77,7c57b53d-0df9-484c-ab32-11f55ca131e7,2023-01-17 14:09:24,Suspicious Activity,Stand before talk.
5df0c878-ed22-4868-9092-539cb0131b2d,3a9bf061-1cf4-468d-a003-cf2dbb94dbc6,2023-03-27 12:40:34,Chargeback,Around or nor lead morning.
3399d0e8-ec8c-44d6-9655-edb6ef5b2115,d3e11092-08a7-4391-a4d4-4b63a65592f2,2023-05-13 02:52:50,Suspicious Activity,Away visit past cultural.
92689a00-84c0-4569-8a43-0b9af3488d52,d066528a-79aa-453d-8caa-9abe39a6b1a8,2023-07-15 13:14:15,Suspicious Activity,Accept assume guess only some keep.
192c0a0c-1b4d-492f-abae-6ac50b7a2f9b,c40f83e0-b14f-4346-9e53-4c3aee995cee,2023-07-16 19:46:30,Suspicious Activity,Morning easy key real black.
cef3e98f-45bf-4dcf-935d-dd8498ea28c8,224f16e3-67cd-4d2e-a481-385a882f1add,2023-04-15 23:12:21,Chargeback,Especially we moment example.
d8cf676c-0fd7-451b-868e-c9237201fada,c1d0b6ff-0356-46d2-81e3-469990012cdf,2023-04-26 10:50:59,Chargeback,Water significant gun.
abd6cd9c-c4f1-4f5e-b62b-851dc865d0c9,fc089d6a-cc1e-49a3-881d-62782e85b77e,2023-04-07 01:12:00,Suspicious Activity,Animal able east blood after science many.
606361cd-3200-41c0-9a3a-a3f2d25760fe,d7110a51-e7c4-43fb-8ecc-8964314906f8,2023-07-10 11:01:48,Chargeback,Three happy certain artist receive.
d83f67df-86da-4ad2-88dc-a595c96073ea,39f28a9b-be6e-407e-822e-dea6b0f85aa6,2023-04-24 15:52:08,Chargeback,Federal own music science.
b318cc24-7223-4c0f-be62-14bb4be02cf7,87a0b7b9-dfbe-4ba2-9f94-9144dad79f12,2023-06-23 13:58:44,Chargeback,Name public discussion miss report shake bill outside.
883e594f-5fda-44b0-9d73-0c2a44749545,3162d248-567a-45ef-b98e-93db5e245ac2,2023-08-22 02:47:31,Chargeback,Someone short concern require send trial.
7dbb4dea-3fd7-424c-831a-ee23dde2c669,45fd923e-a07e-48d1-93c8-72f17673327e,2023-07-26 16:38:22,Chargeback,Federal better soon include.
d52c62cc-f430-4f9d-97e3-2b0f97afab03,f9c28390-e5de-4b43-a1a6-83248659f83b,2023-07-16 11:37:51,Suspicious Activity,Follow low school dream.
b09cc165-1d6e-42dc-bf06-89cbc4c2a6fd,762212ea-5357-4fd0-8602-1e8949adf591,2023-04-30 20:36:47,Chargeback,Light significant order report.
fd59f137-b687-4dd6-9679-de2d9ce62bb1,7959230c-96c5-4d21-8b86-4bc5216c32f1,2023-06-15 19:45:55,Suspicious Activity,Baby who strategy plant choose.
3103ae62-3ec0-4446-b099-41ec2830f5b3,da48c740-bd14-424e-b8c1-a14b9da1b6bb,2023-01-03 18:10:17,Chargeback,Per travel senior wonder team decide do concern.
b08092cf-570c-49cc-98a8-e4cdb042da40,febfc8eb-d036-40a4-bb29-515cf3faf28b,2023-01-18 09:36:33,Chargeback,Line eight us election.
20ae2090-c212-422e-8e5e-879f0a9c6aac,dea37122-a3f1-4d96-a986-af3028dbd724,2023-02-16 07:52:02,Chargeback,Probably sometimes enter even main realize note.
9cf83411-fcfe-424b-bc67-e67f5a975cff,96d1111d-7855-4c01-8e41-4ba588579ee7,2023-07-15 06:59:18,Suspicious Activity,Without until rock prepare wait itself despite.
7951a37c-3085-44c4-a845-69983d84e7bb,b7eb4698-33e5-417c-87b0-479d35b5cfa5,2023-07-21 23:11:42,Suspicious Activity,Majority white response enough.
cdaeadb4-124b-4633-be14-37fa2a5e6706,0bf6c8e0-c783-4d14-942c-924816a6d7da,2023-07-09 05:57:18,Chargeback,Director thing finish teach wait deal suggest.
fa74f2c9-6322-4bb6-9aff-c9277342822e,d284fade-d4c8-4f2c-a5b8-c1caa3a7b8dd,2023-03-03 10:08:43,Chargeback,Mother product much job his open.
c7c2a8cb-331b-44b8-b0fb-39806123649a,5a9989c1-3e6d-4286-9c30-23a5d6f217b1,2023-06-20 14:32:29,Chargeback,Soldier man some easy bed explain you.
8f1087e9-0803-4f5f-aa2c-6c45396f3e3e,f628a20a-6f2a-4a3d-9374-b6ead17ad645,2023-03-17 19:43:16,Chargeback,Detail simple audience hospital.
be3d7ded-51b1-4c06-aad5-43676199119b,cf254fbd-03a9-48c6-8490-ca1cad16da08,2023-05-04 05:38:03,Suspicious Activity,Series network author read.
cb643b2c-aa1b-4009-b8f2-6dbaa957a68d,e402a625-9734-4005-bac2-e906d220d9cc,2023-09-02 19:21:28,Chargeback,Another computer why leg because think.
894b6ce6-aff3-4e14-9ee3-9b713ec79743,4b49c136-2cfc-490d-876a-bdbc8fd6a276,2023-02-10 23:23:58,Chargeback,Newspaper yard seven population on too pressure.
98057eb0-af4c-4fba-80ce-0c56c751ba30,a3cfe6df-725c-443d-a10e-7e80deccc8d8,2023-06-29 09:06:32,Suspicious Activity,Material prove national authority daughter that agent beat.
96250a24-4445-4160-9ef6-02285fe14e3f,5b69f8d5-d221-4a43-8c8d-cbd62696caa6,2023-02-22 16:07:31,Chargeback,Chance sister of thus trip turn power.
1e32095f-7aba-4e6b-8251-7f8bc9d8a958,6137d8cf-8da9-4081-b9a2-757a099c2731,2023-05-26 00:35:10,Suspicious Activity,Measure exactly natural north source sea style.
a2ba5aa8-e12e-404c-b875-30a1f42530e8,1f9c5a28-1ff3-41ee-8c0f-dc434195bbef,2023-01-16 22:38:55,Suspicious Activity,Nothing somebody apply sort air.
d94c5a5d-c685-4330-815e-2ce5d8250630,fb4acdf1-a870-4f10-9605-7006dae4400a,2023-06-22 23:02:16,Suspicious Activity,Protect able daughter across.
ae795a59-ca16-4bd8-8729-67d450222614,ee36e268-f9e8-4e3b-97f2-2c303dd2b529,2023-09-03 07:18:27,Chargeback,Call design result each enter.
47aa1172-cdbb-49b3-baba-f917e0ecc6d6,10c27dcd-0c06-4922-9ff3-c965e600481d,2023-07-07 01:26:39,Chargeback,We back raise music even energy such beyond.
028ab7a5-a71e-4fe9-8fa6-ea9e68318274,1d9bba57-e14f-48b9-a154-1db89d6566b7,2023-02-09 23:40:06,Suspicious Activity,Real throughout most discuss should approach hair.
85fbbacb-268e-4d12-85c0-316d917a6a2c,bc58e911-6b4b-42c8-ac0b-b589ba988cab,2023-06-19 18:41:13,Suspicious Activity,Spring weight cold.
389eaa29-ad63-47e5-b307-fcd310b83bbf,f80dd296-b6f9-48be-ab9b-35a55b01f123,2023-02-06 21:51:04,Chargeback,Range idea just wrong.
1b2bb070-ca90-46b6-b0f5-bef1342b9c5d,a771cc34-352b-4a19-aa74-c8fee22ce4f7,2023-01-12 12:31:34,Chargeback,Board yeah kid fish third.
83e02e42-a25b-423b-af90-bcf2961f8fbf,6435b2ad-2062-407b-a21c-e697be254105,2023-08-07 03:41:05,Chargeback,Exactly happy image begin.
7c8f741e-4e5b-4532-bea5-6ccb1f89c243,87dce4df-71f0-4e2b-bf38-8fb2b23c8c7b,2023-08-14 03:10:15,Chargeback,Our possible experience necessary gun poor yard.
de8ecb52-9706-446b-bb1c-1a60cb6a19c6,643b8fde-97fb-44a8-a30c-6d77a4ed08c6,2023-02-17 20:07:32,Suspicious Activity,Expert check method artist many.
31e669a3-8a96-497b-b6a7-6cb1800233b0,af0089ac-1a7e-41f8-9e42-10795386bbdf,2023-05-31 09:08:45,Chargeback,Realize determine skin voice rock reach quite.
e1ac4f7b-dd75-4c71-827b-dee87ceea2c5,c8cf2070-6414-40fb-b921-875a3e59faca,2023-04-28 13:31:35,Suspicious Activity,Capital bad specific office field care.
cd4eeaa9-91c8-495a-afaf-7bc169000e6b,61906a4c-482a-46dd-b15d-03213c21a6e5,2023-05-16 09:56:11,Suspicious Activity,Wish north tend.
b8992a68-bdf5-40d7-8ed5-82f06580d2d3,77ca7e72-b9bd-492c-82b0-f537dbf9aad1,2023-02-27 20:05:22,Suspicious Activity,Record several with quickly according among put.
f6e9bf97-7f60-47c4-bf4f-a86e74732a22,3ce4a9ef-d225-4b81-b81c-df5460792515,2023-05-28 04:12:21,Suspicious Activity,Real democratic direction station.
5d7ffdd5-e0e3-4544-879d-314d6bc774c3,819d86a8-804b-43d5-b39a-7d88148e5f60,2023-01-13 22:43:09,Chargeback,Also community agent task benefit either computer mean.
2a068569-8f9a-4c76-86c6-e3835f232efa,32f719af-7dc3-477a-a4d9-d7eac79bb77e,2023-03-30 04:11:36,Chargeback,Audience how rule very page responsibility.
87a3e1f1-0bbe-44be-8b8d-0840341f43cc,63f7d6ec-c899-4a10-8013-888c4043e9c3,2023-02-04 14:48:05,Chargeback,Policy maybe simply add democratic improve.
1a6f0ed9-63fe-4efa-8d6d-3b27092ac00f,5ddaf8e7-3c3b-4d5a-9024-8d96b0c70646,2023-07-18 13:30:42,Suspicious Activity,Success store move decision middle realize blood bad.
834e6a04-0291-4b92-8ab6-02d747414d42,ded28c0f-1dcf-4412-a021-4a2f68c364d8,2023-01-24 03:35:57,Suspicious Activity,Southern kid keep performance.
6b8efb28-cba3-449d-941e-b028902bb871,59feaa25-3b45-4bb8-992f-daa1d1b12b58,2023-07-22 19:00:29,Suspicious Activity,Sport debate cause realize central read.
dea72010-8969-4ef0-8913-53f7e8f3d23f,1b5d1ff2-f05d-4016-aa11-77d5d7dd7089,2023-06-11 17:34:12,Chargeback,Best key child both become best century.
1b0b280c-bab6-417f-9c79-b2f9367cd487,30da4e23-7eaa-493c-8d24-95fa1d2a27b2,2023-07-30 23:57:14,Chargeback,Large election peace most gas world old worry.
c0ee8740-f937-44a6-92cb-30971fe032ae,63ee6d39-92fa-4751-8656-49f6a8e0e15d,2023-01-17 15:49:29,Chargeback,Necessary without thank continue nation rise.
ca0ff1f3-56fa-4b05-b945-2f61f4394704,e72e7538-2f2a-4490-901a-2ccb3f6501c3,2023-05-21 13:04:06,Suspicious Activity,Truth right rest question wonder generation discussion.
7114f414-0216-4846-b5bd-7b2150af330f,239f839e-ea14-433f-97ec-fdaf5cc5f844,2023-02-04 08:49:16,Suspicious Activity,Too detail bed from north only life.
0ced5e5f-1133-4a89-83b8-ab6dfc2cc7ee,26d202fb-8b6f-4f68-9cec-a414b42b5224,2023-01-26 05:09:55,Suspicious Activity,Best music after three my.
61be2935-153a-45ce-9a90-b8fc919c60d8,bfd45a3d-8bab-4db4-87e6-417edd987271,2023-03-13 05:08:38,Chargeback,Join open have serious might enough different.
b2391c9a-afc8-4435-b61e-3186cd6c8c2b,01554d30-18b2-4dfe-a215-4bf321f7d8a6,2023-02-13 14:40:40,Suspicious Activity,Prove range resource politics industry education mean.
49e37cf1-ebcd-4906-9634-4736ecc5f1e4,c46d3a84-6d35-44bb-ad4c-a9be27d808dd,2023-05-03 17:26:18,Suspicious Activity,Clear democratic but close two benefit.
bb1d4ac9-9169-4c78-ab5d-8526ae9be23e,5bc59e86-1336-4e30-9536-78bacac08b1e,2023-04-12 04:50:59,Chargeback,Just spend work firm better.
3bea9e4f-ba15-448b-b6d8-a47a5e93f452,460b9f3e-4983-470e-93cf-69cfd176736c,2023-06-30 14:51:31,Chargeback,Different become win example myself.
fb91d77a-2c88-418e-8b0a-1bb3e6a1accb,533590c2-8100-449c-a3dd-06de70320d32,2023-08-11 08:17:20,Chargeback,Peace seven on education effect pay south design.
b1971189-db01-444f-8580-0058e8b23f36,a3a94d00-faf3-406b-9e50-14cf6c58c36a,2023-08-13 06:01:26,Chargeback,Before director run side.
a2f21582-e57d-4727-9fc9-75e530ca7f79,5e1f334a-8611-4c6c-ba00-0ce7d3949599,2023-07-18 05:37:14,Chargeback,Might several order report check.
58d102fb-4059-482c-8924-e2d5cded3069,d8832b14-9acc-4559-9227-36baeb7a6144,2023-05-19 15:06:16,Chargeback,Administration matter statement test billion modern family size.
432fa61a-e3f5-481d-9b2f-d9b390af0139,c1f8920c-9dcf-420f-9488-43ffe7ca8872,2023-02-25 06:49:06,Suspicious Activity,Gun happy behavior weight alone simple office.
fe372cd7-681b-4087-a268-8f3f834613b0,23997f47-7a83-478a-affe-97a6b01c1e22,2023-01-06 10:08:49,Chargeback,Reality once show reach simply price let ever.
3ee00385-9e08-4a13-90d0-3bb504241144,94ea1382-9d19-416f-8680-73c19f70e7a5,2023-02-06 08:36:10,Chargeback,Last individual he.
0fc03e6a-45d9-4d9f-bf5d-2fd3d32cf999,52759d52-6ba5-4833-9649-86e8b75b9661,2023-07-18 02:14:32,Chargeback,Style later fish every.
50fa12af-6b78-4fac-9c95-08f1224594f2,18654738-baed-43bd-88b5-100bd439e384,2023-07-09 16:05:01,Suspicious Activity,I seek begin general vote free.
de41765e-2e91-4141-bf3b-26d79ab5e79e,fe23c657-b391-4334-a752-86b7bf4f3925,2023-06-09 21:45:33,Chargeback,On behind audience own throughout particularly war.
f2adffdb-8d60-43b5-bd2b-cafeb3216115,34557abe-932a-454e-99b1-274790d9b938,2023-05-11 01:39:41,Suspicious Activity,Different those home himself investment power.
7dcbf545-5cf2-4ed8-9055-2bd845751063,30e07f8b-7ba7-43b9-adf5-82a3fd16ee0c,2023-03-13 16:42:14,Suspicious Activity,Certainly play reveal ball answer if.
b0d3eee4-1565-4b25-ab4c-66aa177323f6,24bf7b75-b454-4b1b-bb4a-435981f1690b,2023-09-02 22:29:57,Chargeback,Dark view machine fly opportunity though win.
316b6833-370c-4da1-b0ca-726365fb3f49,76072b68-7939-4018-9341-23da7b4a9b7b,2023-08-12 15:25:52,Chargeback,Season four doctor two win least.
4fd70751-3734-46b2-b2b8-c479d7fe9573,3423c94b-eaf2-4fe5-bfc5-c1c6bf638787,2023-01-01 15:32:10,Chargeback,Keep live recognize dark truth challenge author.
432a7319-3d60-4da5-983a-89dff025337d,a54151d2-691d-4c2d-8b37-55a87de669e9,2023-07-17 06:56:24,Chargeback,Travel population character word.
f26855ae-0306-438e-a168-ea47b7dc91b5,916cbf8b-7cf8-4234-a763-3ea0555bb85a,2023-07-15 06:46:47,Chargeback,According coach us direction product agreement leave.
19bbbb13-96f9-43ac-bdaf-ff3b98d1c537,a9672509-fa71-4273-ab9b-ac39e500d5e4,2023-06-15 02:04:48,Suspicious Activity,You kitchen few after let lead mean.
fcf23633-d949-419f-9eb9-7864f70ed166,886af3ae-0bab-460f-9d91-6a0b76f58277,2023-05-14 03:41:35,Suspicious Activity,Skin pick quite Mr human simple must.
f9c714b8-1e92-4607-9a8c-6a975e486fc8,70c74511-c46e-4374-bc9b-7301148e29f5,2023-02-23 20:25:22,Suspicious Activity,Already political goal service than three.
b574d76d-91e9-4970-80cc-b19743f62290,ad017273-26f5-48df-ad7a-75ce1b3df837,2023-06-02 02:57:42,Chargeback,Too sell they five issue over.
7b7a43d6-c01d-4124-8e0b-26f0902e05cd,5f416a5e-0034-4180-9866-29b880f55c51,2023-08-31 16:06:31,Suspicious Activity,Score month right successful agree.
5ef34106-1008-4272-a077-f6c8db8ed08f,e4429507-2341-4f4a-99ad-fa7566610219,2023-03-21 11:45:33,Suspicious Activity,Service fund approach sea feel always.
67718481-a0fe-4132-9156-af73b6d88d7a,be3b377c-05bf-47b0-a869-21cd942fdcd2,2023-08-08 17:24:37,Suspicious Activity,Condition including bed along.
7e5c99b0-4433-4abb-b072-51c34a2b4986,5841603d-a5b3-4949-9b00-d2ce5d30d4af,2023-03-13 00:09:44,Suspicious Activity,Must lot hear test it we fight put.
9f57a664-370c-4296-8cd6-dab197df66c2,2a8ca57c-200f-42bc-b2da-5e7bbc41c0b9,2023-08-29 21:25:28,Chargeback,Suddenly health third situation yeah.
3e984c37-f2e8-4ffd-9dd1-9bafe3bbe0a9,2224af46-a2fb-4bd7-8b10-b8e05e5efbc8,2023-09-04 15:54:03,Chargeback,Station manage last fact role control customer.
c91752e9-b808-4b47-bfb2-3756840afb26,5196f163-7d41-4459-9e4f-ddd4343b6fd3,2023-01-25 10:43:40,Suspicious Activity,Necessary check third degree own such after.
f0871348-4b0a-4906-ba58-bcfff756bf40,ca94ce88-ac98-4567-855a-e3a1920cdc00,2023-03-28 04:29:22,Chargeback,Radio sea certainly yeah.
e2ae278a-6d2a-4026-a19d-7b0aa142d1e4,629f38d1-d578-49b1-89ca-99784f742872,2023-03-06 06:16:18,Suspicious Activity,Possible so authority population something cost.
f0eb3347-b7fe-4e6f-89ef-7fd4703f695b,52759d52-6ba5-4833-9649-86e8b75b9661,2023-05-20 17:33:09,Chargeback,Drug also beyond well total during outside.
8f64a627-6054-40cc-842b-14eccd28af34,b1111636-c19d-49d4-90a4-6620053497b0,2023-05-31 22:40:40,Chargeback,In senior ground night dog at although.
40dceec8-2b79-40ff-8465-646fa5ed646e,9c6cdb68-d8cc-4c46-93a6-9db5b4672517,2023-01-03 08:56:30,Chargeback,She return pick.
c3649c4c-6b14-41d9-bc01-454d22be53c6,2a74b890-f14c-4949-88fc-b0df9fdbfac3,2023-08-30 17:45:48,Chargeback,Figure popular or year avoid.
a4f2debc-094f-4430-b2ee-9604ec679a54,8889cf13-8db2-4837-9c9d-9badb16398ff,2023-03-10 01:21:04,Chargeback,Employee but pressure play social.
6b2f0a13-c1bb-411d-98a7-cb6d84d56853,04feda7b-0079-4846-a020-232da6f74d71,2023-06-19 06:56:49,Chargeback,Determine future center account.
6cce1fd5-6211-407c-832e-8cc7df5c34c2,cf9b0939-f3f2-4ec0-a049-c9e1c0c4002c,2023-05-02 10:29:21,Suspicious Activity,Knowledge card loss carry foreign away.
637b58a8-02ca-49d0-83ab-82228873f934,76f32b0c-236c-42ab-85cb-5349edf1674c,2023-06-08 22:20:02,Suspicious Activity,Listen four shoulder.
8b25af68-8c3e-4b92-8159-9b3b96766915,aa3ce631-2402-4042-8714-92c8fe648cd4,2023-03-19 12:35:12,Chargeback,Wear itself game happy seat.
60988266-4333-4b93-8bfb-34961fd01e9d,2e50b36f-71aa-4903-950f-c02e4402f3af,2023-04-12 16:15:17,Suspicious Activity,Others little field recently indeed.
6c56d7aa-8cb1-4711-934e-8c9cc6798b94,6a90496d-5a43-485a-a11e-7c10055d9f46,2023-06-07 17:04:46,Chargeback,Computer wrong reduce fly three college require join.
2737de94-c550-4963-a386-b3b6efc83b2d,0b03b22a-1fd3-4def-a14a-b1462d857acf,2023-03-10 04:50:49,Suspicious Activity,Today yourself design region goal available trouble.
2079df16-3f97-4e79-bc58-d4209fd28ddf,ae575618-14cb-439c-bffb-3824a1cf8d40,2023-05-06 10:53:36,Chargeback,They reduce church eat safe pretty open floor.
f091e780-6a69-4061-a84d-57e21737efa8,62519595-d2ca-4f48-b79f-ea19c829c8ea,2023-05-17 23:36:52,Suspicious Activity,Remember dark until care.
eba0fc54-0878-4b91-8897-672b7b3eab53,2455c548-7379-48eb-a7f0-20bfa7c305f7,2023-05-26 06:25:15,Chargeback,Ahead administration term I late amount.
683249ff-556f-40f1-9640-8de298d713a4,c260cd8b-ae91-4760-a17e-4be08f4057a1,2023-04-03 04:58:51,Suspicious Activity,Base machine no manager everything.
dc95259d-43fd-427e-90a6-6c04fa06fcd8,b35db619-f408-4eb6-a6b0-80db45a4b442,2023-06-19 08:25:00,Chargeback,Job well daughter stay.
4dd44595-6b39-436d-8919-1190885caa32,41919485-c6e8-48fb-aee8-3da7390b1a8f,2023-02-27 04:12:18,Suspicious Activity,Probably continue whose.
b883732b-7146-43fa-9dd0-df09de71a14f,7322d54a-1c76-48ff-98a0-fc002e46ef83,2023-02-27 13:13:41,Suspicious Activity,Task number would.
bb27b972-5fa5-42de-961f-86275badc066,bb78c9dc-88e1-4315-aea3-3bec18beaced,2023-04-16 23:06:47,Chargeback,Seek performance bank summer process when.
f9b1d273-1eaa-4b5d-a0a8-8236d7eb2dd0,b715e040-3b7f-4589-b839-a3914ba827f7,2023-03-05 19:51:49,Suspicious Activity,Hour wear risk capital family.
584a54af-3ae7-4e5d-adf7-4e332349d3de,c81e5f62-3d4b-4fe4-8e6e-b57aef9e8e22,2023-06-06 20:00:47,Suspicious Activity,Record site surface option financial.
f1d6071d-a818-4721-b788-67a44e6cb02f,255e9e14-2123-472f-b965-36e67ea5ae87,2023-07-31 09:55:08,Suspicious Activity,Onto daughter computer partner former property.
c3cf5b61-cd02-4a6e-b50d-78f6dad3a258,44eeaa0a-9805-4cc3-b08a-a4676f4e318f,2023-01-17 20:01:03,Suspicious Activity,Tree old pick might industry can would recognize.
3392f690-6b8b-471c-adb7-76ffcaf277f4,4fee813a-71d0-4906-a004-01d8ba80f0df,2023-01-20 08:13:41,Suspicious Activity,Organization bar any seek many picture then stage.
281e1445-af56-4086-8099-bc94b229498a,baa5d17f-f316-44ed-9c27-63edafdbe3da,2023-01-06 10:39:57,Suspicious Activity,Vote language heart firm really ready return.
7fba3bac-0a38-456a-856f-1f183ac8935d,b394fb2d-0d17-4717-92a0-1742178b5191,2023-06-24 07:22:17,Suspicious Activity,Military character keep deep central maintain industry son.
f7c7b793-291d-450e-a7ec-c6e43169d267,ef684c15-4435-461c-8b4e-f1b80d358466,2023-01-23 16:27:29,Suspicious Activity,Ahead third and next end third material bed.
19b24731-4c1b-4cb5-bf12-c653e103ed89,39d477a9-074e-4da6-9b67-f7a56e46c815,2023-05-03 12:08:04,Chargeback,Science could at series tough.
9dcf75d6-0991-4cc1-ba52-bc3e0494c6fe,60fc0566-3a87-4956-881b-02acf08e19be,2023-05-28 13:45:06,Suspicious Activity,Choose look so.
7457c99a-caab-4058-b920-13d8288e140f,f69ce482-6350-4743-97fe-e7ed706c3d12,2023-08-08 02:25:15,Chargeback,Respond life suddenly along let break condition.
dd934ec3-7b33-413a-a70b-877cf21c4857,0efb8a19-e711-48a2-bc9d-45d39963e574,2023-05-07 16:38:40,Chargeback,Later our help board miss.
dd7fb881-894c-4169-be00-c96c82baff11,84ded45e-e853-4cae-babd-57e0565bb44c,2023-01-10 16:20:49,Suspicious Activity,Past level PM shoulder trip figure professor.
603cee3a-8f9d-465b-b4eb-7486b69257ab,729d1284-af2a-47eb-8263-f0ea7a4902f8,2023-03-27 05:15:22,Chargeback,Decide through eye security doctor source where.
48491875-f13e-4b8b-bc69-aa0601df23f0,78be1188-8cba-4ae9-8bb8-97442375d50f,2023-06-15 19:56:43,Suspicious Activity,Fast security large claim these.
b3e93550-13d3-4df3-a619-3733de45f53e,2884124a-279a-424d-b3d9-9403239fec51,2023-01-09 07:14:14,Suspicious Activity,New today any leave.
6906da0c-e1eb-42a9-a22f-e7c4946ef226,84a2b1b3-3958-4aa8-8e5f-60d6d102f01a,2023-05-27 02:51:25,Chargeback,Car professor reach stuff begin blood.
2bd5e9dc-3b51-4b98-a4a9-3181e615e39b,4f916ae5-f949-4fc0-8534-8474d3e08e06,2023-07-02 21:06:09,Suspicious Activity,Grow five exactly.
960d9004-e122-44c8-a6ab-5a090128e452,ad777f90-9732-45db-81b1-9c7d844331c4,2023-01-24 12:41:31,Suspicious Activity,Answer ask population listen nice development against.
932c0380-c3eb-4cc0-92e2-0bfe73a4af88,4cb1d677-cec7-41b6-a6e5-714e778cdb4b,2023-08-21 22:12:51,Suspicious Activity,Even shake film entire.
a02ccdba-57bc-417e-bf30-49f6b050553b,6207aef7-90a7-45c6-8149-2dfdd17945df,2023-05-24 08:40:38,Chargeback,Only establish and might inside light state.
6b39e98e-cd94-4c34-a63d-f21152c0adda,d4ef6502-3c83-4e7b-982e-ec12c6f8dd4e,2023-05-16 14:03:58,Chargeback,Information simply develop customer everybody catch.
4861347d-ba4e-45ec-b292-5448c06ce577,09bf7258-d915-4cad-9f9e-cca03152c0e9,2023-02-06 12:50:12,Chargeback,Participant hard art wind wife.
fed01e33-f241-4d66-bf98-3e5c00bf8df8,22ecc769-5156-466e-b4be-f11d4d8f261a,2023-03-26 01:17:51,Suspicious Activity,State ball clearly rest religious go campaign.
9e459dd6-e71f-455c-8818-174cd4f055de,b9cb2d5c-877f-462a-9fa3-0ff85c5bec62,2023-08-01 20:53:33,Suspicious Activity,Fall war process sometimes.
ca9c1c23-5020-4432-a35c-7dc176151d0a,df9b4e20-6f92-433d-b2b7-efb74219ca41,2023-05-13 19:17:31,Chargeback,Lawyer wish tree those likely quickly of.
69030dd9-24c8-4613-ba6a-30b9c6b48215,d6c962a5-3e3e-4ec4-9245-e23b3ace19b0,2023-07-09 16:18:30,Chargeback,Woman agency win yet personal.
6f9151e1-c908-42be-92f2-c3dec263509d,4935d3ae-3730-49cc-a1ac-3eb02554f803,2023-02-14 04:08:13,Chargeback,Machine family require professional meet.
e47b7328-a1ae-442a-ab7d-edc9927e3220,0dad5533-95e9-4d3d-a057-147c664f4783,2023-01-09 11:26:30,Suspicious Activity,Him hair see cold any.
84478002-74d5-49d9-a590-1e30e663b4cc,6137d8cf-8da9-4081-b9a2-757a099c2731,2023-08-13 09:18:51,Suspicious Activity,Specific for decide serve.
9f396691-7155-4413-942a-c579bcad4ce2,194170c5-9e92-4c0d-b918-be23b9ded96d,2023-05-01 12:54:57,Suspicious Activity,Card forget century food win hear PM.
38d2377b-3c0b-4a1a-88cb-9bf693588cf9,fab2438e-d403-4f38-a902-3d27e1aa2890,2023-02-05 03:05:47,Suspicious Activity,Draw box none believe argue.
7ae77cb0-4236-4aeb-8839-6a618fe20646,c5c1c49f-eeff-4f39-8e37-40caeafe3435,2023-05-25 19:01:42,Chargeback,Today should near direction.
d33af8b8-f24a-4dca-ba9b-667a28066796,57c210f0-0eac-4116-9187-0e98897bd0b4,2023-03-30 00:03:31,Suspicious Activity,Street behavior continue some.
7ad91556-f40f-4b14-bab7-245277fa2354,b1a0546a-02de-48f4-994d-6a4f10b3f6cc,2023-01-15 14:49:12,Suspicious Activity,Page specific they win.
3b8c6db6-3c6e-424a-b416-b37b84c53183,9fa60248-8c8c-48c3-89e7-54279821d6bc,2023-07-10 12:55:16,Chargeback,At onto return operation argue key cold kid.
fc7e4cbb-6359-457d-917b-afe8c20db4ea,a90dd910-c4da-4a82-bf66-d83777f38f03,2023-06-02 20:50:40,Suspicious Activity,Skill cell into.
07b9b644-2944-40d8-a78b-6dcd40a2a3ab,38019530-45eb-4f89-8fdb-f9c47364e5c2,2023-01-03 22:36:22,Suspicious Activity,Prepare report response continue computer activity.
d73eeba1-53da-477f-afe7-0aa7906db335,17d849ba-a319-4db5-8d2a-e72ab1b70442,2023-06-06 16:18:00,Chargeback,Already machine usually decision provide.
baa4c05e-a77e-4eb3-8042-45ded27c3d8e,54905095-bbd6-4c9c-ab2d-1db852ad3466,2023-07-29 11:25:15,Suspicious Activity,Same despite not campaign trip buy.
098f5fb5-9921-4368-9fca-58672ee917a4,0b49721e-d56c-43f1-895d-b22d0573a084,2023-01-05 18:29:48,Chargeback,Process trade check role.
103f20b1-e8a3-4f5e-bc6a-0bcba4e1baa8,29b30fc6-e82b-4309-b370-3afbe3defcb9,2023-03-31 14:34:37,Suspicious Activity,Executive step about instead black.
