Fraud Alert ID,Suspicious Transaction ID,Alert Date,Alert Type,Alert Description
8ab69179-2e15-42d0-86b4-a400146b0b51,7cc12392-f99e-41fa-b127-f830bd2a3ac8,2023-03-16 14:11:05,Suspicious Activity,Story clearly measure red.
c10e7a89-ca7b-4068-ae3f-92656ad1dcf3,96128f4e-49cc-4137-b389-66338567486b,2023-08-12 01:47:07,Chargeback,Actually financial camera.
bc28e475-95a0-492e-8b25-c6e2768eff2b,aa5a5a43-af38-4511-b32c-e3978d275b49,2023-07-25 19:43:18,Chargeback,Peace form before focus.
2fef5fd4-8fcd-44f4-b20a-32c59064e533,733d6647-7927-4d0c-a2fc-1c14ddac6aa0,2023-08-20 19:28:32,Suspicious Activity,Space nor leader.
bd44a5c5-2158-4a1f-97d4-93193a004530,a2c9f273-48c4-4976-849d-1bd0e5aee50d,2023-07-25 21:10:17,Chargeback,And threat account role still reality.
8f79e4fe-8938-4387-b6f3-620a629c85c5,b8f2a29f-db07-4747-ba66-26a93142e4cb,2023-03-17 20:07:49,Chargeback,Card kitchen wear about crime.
00473fe7-3c6d-45eb-85d6-aeeea020b63a,98a553c3-0d55-4bca-8251-a14f231474da,2023-04-01 07:38:38,Chargeback,Show event first team.
5d585988-673e-4478-b031-a67594221171,55e3096d-e111-4ee7-90c5-d4aaf93fd863,2023-02-25 16:08:21,Suspicious Activity,Heart recent sell yeah fill war morning.
4b8b9818-1ded-486f-899a-56c3ebef2044,e76be2f4-112e-48ff-931f-10ad7cc3d553,2023-01-18 14:32:37,Suspicious Activity,Voice benefit political way treat.
525c5155-7a3f-4a4d-8097-8b846e41bf0e,f23a1e12-d9c6-4eab-b493-a0b9cb3365f2,2023-03-12 16:01:27,Chargeback,Model owner high tell sound far full.
3eac717a-c910-4b2c-b20e-b38d2a33d28b,bab78e75-9151-48fd-885e-b942c1c8f35d,2023-06-14 15:15:38,Suspicious Activity,Break do weight within great.
4e12f849-2fdc-4b63-abc8-d0051eafc28b,7a58ddf0-1295-4d3d-9520-1b1a41c28cc9,2023-06-03 21:43:42,Suspicious Activity,Item enter structure finally floor.
0cfa8e4a-f112-496b-9204-972569b45e7c,838084f8-1dd6-4fb7-a7fc-953bbde25342,2023-05-08 01:27:07,Suspicious Activity,Center gun cost deal act.
711b0298-a0f1-45bc-b690-76e0a04cdf3e,c5d6a758-d1b7-4000-a4d3-2c9f0f57389f,2023-07-27 00:22:37,Chargeback,Cell oil north even this because.
636dc192-e0ba-4065-9f58-14131186b92b,11b26ca0-fb9c-4da8-8f97-8c12fa9f24d4,2023-08-11 02:49:25,Chargeback,Method score another audience last wait.
e1a1497a-4729-48ca-9475-18d3508fc1ed,680ddb4d-c479-4694-b39d-29c0b507830c,2023-08-02 13:24:04,Chargeback,Blood little produce then on.
92d1b6df-6ea9-4ffd-a12e-e3ddf110e026,7280abea-babd-497f-8619-d5ea904bce5e,2023-03-08 13:21:53,Suspicious Activity,Paper into manage stand policy.
966529b2-86fa-48c3-8123-6f07ef645d4f,dd0cd0bb-22c7-4c4b-b063-db3c57c120d3,2023-02-18 22:04:31,Suspicious Activity,Happy method none once between nature.
b0e1123d-ae8f-4aff-854d-e4d15add1a6e,7b2a79d3-1129-458e-bd8f-8556197c49f6,2023-02-09 14:15:04,Suspicious Activity,Box research program scientist.
925548e8-3cc1-44a3-8617-dd5f5c8165cf,bac60266-e7c9-4f87-a23d-b210f8f6495e,2023-08-05 02:03:33,Chargeback,Speech forget lot.
c89fdfcb-b909-4b6c-9747-4cffaa0d4303,96e56be5-4dd2-4d3f-b8c7-54f15e6323ca,2023-05-01 23:37:43,Chargeback,Keep through available money wrong truth.
d7afe68f-9999-488d-bb6e-8b75d50a1ab9,628152de-8ed1-49e6-8251-d5f914805524,2023-01-27 15:49:41,Chargeback,Sit theory character audience firm.
2289031f-26c6-46ad-a487-8b48131fd545,60327268-d8b4-4df4-97cc-29c973e8bd6f,2023-07-29 09:05:02,Suspicious Activity,Strategy American prove wife wrong election.
df2e0958-4faf-48a4-ae7b-11bc33210fd9,9c0c19e3-6947-4887-b3e6-8ecc8b0dd785,2023-04-08 17:48:18,Chargeback,Evening tend arm future usually.
46dd998d-c401-4faf-b6ee-717af95f0ecf,c7c3e6f3-66ff-4870-b591-8abb96208d0b,2023-08-22 18:41:54,Suspicious Activity,Wall common result avoid home executive record.
e45bfc95-3b0b-4222-8397-1341dd7061bd,f96d748d-019e-4d8b-beee-6d04e45c6100,2023-07-15 04:23:39,Suspicious Activity,Total education serious yeah.
45895e8b-a9ca-48c6-bf48-ec2482b4cd97,e58910e3-ba32-4fb5-92ea-6d7fe34e6c78,2023-05-19 13:30:49,Chargeback,Head field ago manage win guy ability.
69ddb360-878d-4053-b87d-f72b43df9d11,e26d1c42-0b7e-45b3-8340-583f595ebfb4,2023-08-04 01:24:18,Suspicious Activity,Music become far note every mean training.
16d04e6d-a39f-45bd-928a-1c629995f124,eb38c940-b392-4566-92e5-a81c2d023f6c,2023-09-03 06:08:05,Chargeback,Appear meeting simple or.
2a97953a-90c1-4d7d-ac38-01b51150c4d1,8a947322-4aa1-457e-942d-162344d7a079,2023-01-12 12:20:20,Suspicious Activity,Daughter show test responsibility allow seat.
c7b99d8c-52f6-4088-b1cd-32e776f27ac3,ca2ddd49-e37b-4342-9636-f359ad810374,2023-07-08 18:35:24,Suspicious Activity,Suddenly space teach mind.
7190eb49-232f-4740-baa4-33f325437734,1372dd3e-86ed-4c22-ac08-b164e688321d,2023-04-03 23:28:46,Suspicious Activity,Believe walk be gas discover cell daughter boy.
e325534b-9c10-4a1c-96c3-1a1e214e8cfe,bde3f743-4058-45d8-84b9-a32242894811,2023-08-04 16:59:04,Suspicious Activity,Into big lead safe sort trial.
b7d317b6-9443-47be-a291-8aa654fcf231,d6de258a-bfa1-4ad1-94c9-693fd3125c53,2023-02-08 08:44:19,Suspicious Activity,High born huge almost everybody.
2c61d2ad-1031-41ae-acb5-778d17f4aecc,35fb1d22-323f-46a8-836d-3987979f1fe2,2023-08-14 07:56:12,Suspicious Activity,Fall small that become.
ed6e2aa6-7b4f-4a44-aab5-14c953aa19a8,dc282394-56df-4028-987e-7d5ae94a2cc2,2023-04-11 08:55:05,Suspicious Activity,Little religious serious tree often various across guess.
ea3b0ca9-ad83-4c3c-888b-87a307ccd417,659dd57d-b3d9-4cff-b9aa-b9a9ac31ff16,2023-06-06 04:38:16,Chargeback,Go sort like nearly enter bar former agent.
1d84c45e-ce67-4dbd-9738-7367fd235bdc,b238ea1b-a3bc-4373-8a4e-8f12b35c5897,2023-05-04 19:58:37,Chargeback,Upon few article worry own.
c279b836-da75-4465-8012-4d123d1f5044,6ca94c79-8f6c-4dae-a88d-a5c3a67e57f4,2023-01-04 11:05:05,Chargeback,Challenge energy before.
910260fb-3391-4d92-bee5-98516a72bc5b,adb68916-d470-47fc-a1c8-022e5649c4a4,2023-02-07 19:43:59,Suspicious Activity,Particularly network myself likely what administration.
e5261c30-a661-4be5-b46b-23984f00a49d,6b69fd8c-00b9-4db1-a2c4-7cba58ab7987,2023-06-02 14:07:40,Suspicious Activity,Available animal light environment force.
6e67be9c-b61a-47dd-9a75-df89c650deac,308f930e-871a-4123-bb9d-e48716c21a77,2023-05-12 19:53:14,Suspicious Activity,Firm course action president school away around.
450efff8-647a-4cb9-b47a-d774efc15db5,7269fd71-68cc-4d22-9b7a-f3bc7356da74,2023-02-03 11:42:51,Chargeback,Response product save only approach.
a86bc668-57f0-496c-946b-b546572a4313,20bdee6e-6267-45da-94bf-5d02787d141d,2023-02-14 04:45:35,Chargeback,Sister boy near end.
fc8ab5bd-dfb4-454d-b90d-1653a4f4b5da,e07c91cc-3a4c-4f45-8f51-8e27d8a970fd,2023-08-19 20:52:38,Suspicious Activity,Term future there myself once staff.
a65d84b5-24b1-48d6-ae1f-db2cbabab150,ad014b2e-e6b8-4f1e-a228-5d3860776f80,2023-01-28 23:42:45,Chargeback,Course herself same himself color give moment street.
c6b7728e-3f08-426c-9092-92a100ad677e,77bafc71-5f40-4952-8007-9319cb2dde04,2023-07-01 00:45:35,Suspicious Activity,North myself challenge.
0d052875-f571-41ea-9327-78b152b8008d,0ec83fd4-0c82-4830-8189-f36797bb0b30,2023-06-13 04:36:10,Suspicious Activity,Himself matter participant.
2499bc3b-eb2d-4781-a7de-a8c968e9f2fa,48fe272f-2bc4-4273-aea2-f0f07360cc80,2023-03-06 02:51:26,Suspicious Activity,Test evidence discussion however position.
964c94fc-4b13-4067-9948-365c7e4340e6,f9441127-7726-4b43-adfb-03a4039cbdb9,2023-01-12 15:51:59,Chargeback,Treat feel important office late school.
cd131ce5-2c68-4fa5-a8e9-9fe5037a7dd1,617c332f-2d2d-4ba2-9ff5-c87c64011e85,2023-02-23 18:46:15,Chargeback,Yeah strong place also table.
e164de6c-487d-4f9c-9989-7eb0360de615,1bc35256-f207-4bcd-9558-203f7cf2613b,2023-07-10 06:09:11,Suspicious Activity,Risk another color red.
64e77cf0-795d-4845-b837-a0604146f793,0ed07355-8459-4924-8e1e-ac55448b2efd,2023-07-16 21:57:57,Chargeback,Task want start try the find price.
26402a65-2087-44d6-8310-05d5fde49924,9504450b-d78a-4beb-8831-217ca2d6261d,2023-05-19 21:53:34,Suspicious Activity,Turn animal direction new region.
6315b7ca-7413-4f36-9e41-9aa51e493045,79e5d5e5-4253-4104-a184-029351c25aae,2023-02-12 07:48:28,Chargeback,Century glass general pull especially first success need.
90d67d86-f867-44d3-855a-431dac288984,4b49c136-2cfc-490d-876a-bdbc8fd6a276,2023-03-27 05:56:52,Suspicious Activity,Country respond role make probably wall.
d50676a9-3cbf-484f-a0be-c432f54040e4,c99ce00b-c751-451a-a0ac-625e95364195,2023-03-04 20:52:29,Suspicious Activity,Others stock daughter interesting political material.
aba30173-0a32-438f-aa87-f57f86c9758c,05bfe712-e82a-45a7-a5f2-e830f334c8a0,2023-01-10 20:35:56,Chargeback,Remain end without image understand office.
21c4472f-db8a-457e-8729-69776a4ff285,06f9cc07-0d55-4886-92be-0632af6286bc,2023-07-06 08:49:21,Chargeback,Choose company thing sometimes religious.
f7ac54e7-8a28-4783-9321-3c9043193678,9fece33b-c718-4db0-8633-0f7130c6a0b5,2023-01-04 14:06:18,Suspicious Activity,Picture final discussion exactly financial.
4f7e2811-06f9-4a0c-8969-70f64a21860a,6700e30a-acd7-4c85-87a8-d6d3b6479c37,2023-03-31 21:52:43,Chargeback,Civil manage him between.
588dc630-406d-4562-9e53-bdd71a99e289,44b0570e-7c05-4eee-8e36-26c7141aee9b,2023-07-09 23:50:19,Suspicious Activity,Drop would daughter order.
08cbe1dd-2a0d-41ca-9555-7f7fe6406911,6cd743ea-2a61-4aa2-bff6-c973ae93fe0c,2023-04-07 18:43:54,Suspicious Activity,Write last certain well measure carry successful.
44074517-93e1-4843-b1b3-934d6ae8f4ce,46352fa2-4a76-4b3d-975f-fdaa027887d8,2023-02-05 14:16:17,Suspicious Activity,Base their side character second fear.
95a50742-c1b1-4074-8557-66edc27596fe,19c3f4bc-ea15-4c1a-ba32-c94ce22d0bf4,2023-02-09 08:50:06,Chargeback,Reflect say apply turn huge rule.
23168044-5270-4991-b084-e23f6d0eba85,d0fe7ca3-a9f3-4f9e-ad84-365728846b5e,2023-01-10 21:07:10,Suspicious Activity,Ready interest commercial under fish.
9aa9ed19-087b-4a49-91c9-8a28ffcff46e,ee2e0b32-5761-4506-ad04-6146d0ebd20c,2023-01-08 07:54:52,Suspicious Activity,Mouth from significant item receive record southern.
b2604e66-f0e5-448a-a6f1-ef3a6cdd9819,28668085-fe10-4942-a030-dda0ac040779,2023-06-27 18:30:13,Suspicious Activity,Response full walk base culture range rate task.
5eebcdf2-cd24-4c30-a879-c4310557bc34,6d6399e6-944b-4a2b-8042-09b7aeb5b666,2023-05-08 05:42:28,Chargeback,Out reflect weight agree carry realize risk general.
c0345b71-a414-42db-bc44-9e3ce79374dd,6c1bd15a-1014-4192-99d1-ec13ace015fc,2023-06-26 14:32:12,Suspicious Activity,Point rise news old.
d5bd5c0d-bf53-4fa3-86ce-ecbac7cfd222,8f20e37f-0db3-4f82-bc1c-89efb5f824e8,2023-02-24 10:57:03,Chargeback,This turn career buy experience always.
4fe9d051-adbe-4280-9bde-7c92ffaea2ab,c02d383d-eaa6-4db5-a128-417cc3ab6b39,2023-01-05 12:00:45,Chargeback,Win author write early few food seek.
8d938f4d-a318-4255-b1eb-01827bb78c51,93ae7e61-8164-49e9-8c6b-9e306adfbcb3,2023-03-17 13:15:15,Suspicious Activity,Our reduce much improve whom economy.
a063e74d-3c93-47e7-ab8f-0aa68c019788,a771cc34-352b-4a19-aa74-c8fee22ce4f7,2023-03-02 18:13:17,Suspicious Activity,Light of director gun hotel oil everybody.
ae7016dc-cff2-4452-acbe-b3fac2155938,2555aead-0645-4ddd-b8a5-8cae4075fc97,2023-03-16 06:39:27,Chargeback,Investment score need value step.
7655de63-383a-47c9-868a-ff030127db49,beeefad0-5ec3-47e7-adb7-ba947227c9d0,2023-07-14 06:17:58,Suspicious Activity,Use before bag part a.
791fb8df-6fe1-467c-b4b4-2945b98666d6,1034717a-c336-4c13-a6b2-ec1932eecb30,2023-03-16 17:33:46,Chargeback,About once mind help relationship short relate.
da45d7aa-dbb3-46f4-b942-0aaddb8825d7,96d1111d-7855-4c01-8e41-4ba588579ee7,2023-05-16 02:03:49,Chargeback,Direction little top member.
e522c87b-29a6-4cf4-8bb2-24e24fed7dd9,d1bd2e47-5c0f-4e4c-976b-c9fd682d4018,2023-05-13 01:58:10,Suspicious Activity,Teach cover information staff new indeed.
20f74804-3ebf-499f-b08a-58819c3d9ea5,476a05d5-e605-4f26-9d0f-9e84a900f400,2023-06-04 17:25:14,Chargeback,Near too executive author stuff fish.
7682031e-72bf-46c0-9cae-0ea410216115,5d07411e-87c9-4f07-a919-c80c1e932486,2023-05-27 20:31:05,Chargeback,Whole get hard consider history western.
4c91b340-c51b-4482-ba93-35a1f24f822d,73a80ed0-d3e6-48de-9171-440529ce40c6,2023-05-20 00:41:25,Chargeback,Economic early word house oil.
6160d653-fb47-4840-b044-414ec2486e19,c3afb01e-1b07-4609-ad10-f27860bac8e8,2023-03-08 20:05:03,Chargeback,Clearly education popular know each help.
9272e923-45d4-4b00-acc3-456fbaa1361b,59a0e84a-c875-48fa-824e-8d8e5762efbd,2023-07-01 05:13:03,Suspicious Activity,Look east government care event.
ac36ac9f-3e71-4bdc-ba99-17f533a942fa,4584c5ac-2436-4243-9a66-81da62afa4a5,2023-05-28 13:03:20,Chargeback,Try authority success PM grow dinner baby ever.
0a806299-8663-41b2-afaa-a1e2af5a9f5d,a90dd910-c4da-4a82-bf66-d83777f38f03,2023-08-03 20:23:03,Suspicious Activity,Information natural it too media forget name.
313ed7ec-8e82-4026-adba-389fdbc2aa69,49ddbb40-8953-457b-8f83-0b495e58a845,2023-03-17 23:24:36,Suspicious Activity,Old bag wrong stuff view stock put.
ac82eb6f-7dda-4083-a0fa-b1ce80cc7daf,5a560c6f-d22e-4bf0-a734-31c1ce80ba83,2023-08-05 02:20:23,Suspicious Activity,Win ten during as specific.
15d30c54-eee0-46e0-bf6f-5f54f2a52262,d2be079d-5bb2-4081-8b66-f945ea55e653,2023-08-28 07:40:28,Suspicious Activity,Chance see partner gun authority small bit.
04952359-d115-4e55-adb4-4f937955efda,a0d7a3a7-f9db-4447-9775-97bf1cbbb595,2023-03-04 00:28:40,Suspicious Activity,Order heavy answer store.
ef655d93-1b03-4ab7-b2e1-34b86e016862,d048cfd0-14ea-4be1-89af-d6804573f529,2023-01-30 20:23:18,Chargeback,Act authority pretty trial from structure.
35596ec4-b4a7-4d1e-998f-e567b88e32b6,935a7be1-99b7-42bf-a4f6-7a8af54b0f75,2023-06-12 08:04:01,Chargeback,Remember help his air.
dd632dc9-d8ae-4081-b960-872d8c0d41fa,dfb5077e-d9bf-47fd-ae20-9dc775d20092,2023-02-25 23:01:56,Chargeback,Other investment lay health sort open.
434ee7b0-dbed-4667-9f8e-6cd093358f05,7e4d6247-3794-4968-a54a-6383f8a8474e,2023-05-11 06:56:36,Chargeback,Similar hundred husband easy deal forward hit.
81deb5f7-c6bf-4c44-923f-a88aa423a2b5,e395bd35-57b8-437c-9ff3-928f27c93adf,2023-05-18 06:46:56,Suspicious Activity,Than hair national defense military board.
b431bb73-be0e-481f-87f6-31c52e41ff7f,9d57fde0-ae4c-4237-a7c9-3c67edc660b3,2023-07-05 18:33:47,Chargeback,Likely radio strategy type this try everyone.
a8f431ff-cc9d-4e80-8d8f-34804c02d050,af1c0ea6-d324-4595-9271-66cf9b2dd57b,2023-01-22 09:51:32,Suspicious Activity,Feeling where rock.
da48335d-696d-4bab-a2d6-63231e8c932e,423a2d14-e2bd-4f11-be52-39b6849c825a,2023-08-25 21:39:26,Chargeback,Service wait trial like.
80ed9ca1-36e1-40c0-918f-40a794cf674d,63ee6d39-92fa-4751-8656-49f6a8e0e15d,2023-02-08 15:49:30,Chargeback,Career each hair he.
1ba2abf9-2a29-4000-a9bb-425d99fbe807,098cb5f1-0415-4ca8-a2c1-8166148f120a,2023-05-28 00:32:32,Suspicious Activity,Answer brother result guess claim still.
e6a44e2a-4bff-4493-8690-f6962da15a33,dec76d0d-9b30-4e1b-b3fe-03fa8002f8f3,2023-06-02 13:12:07,Suspicious Activity,Hard language raise apply budget try.
604b7470-ffd2-4bf2-8f54-3aca3253af2e,11a33027-d6c1-46b6-9c21-2e21cda9ea33,2023-02-14 06:30:35,Chargeback,Skin herself machine some protect up factor.
2f22a17c-559e-44b8-a4f2-0a76f842a3cf,078d4bbe-27ca-4f8a-b7bf-3006edcd727f,2023-07-16 06:23:58,Suspicious Activity,Win decade a threat research might around.
8b06d183-ad21-4011-a822-529d2d1bff1d,63ee6d39-92fa-4751-8656-49f6a8e0e15d,2023-05-27 08:52:15,Chargeback,Recent surface so decide soon ok.
ffc032b5-1a8a-4640-a58a-1d5da96b849f,80a3f10c-f2e5-4577-930e-fff5d583b8d4,2023-08-11 01:14:23,Suspicious Activity,Discuss statement yourself including sport member.
a4241f43-9c7e-4d42-94d2-b075f442892d,23860263-8a35-4250-bbd6-940d292d1709,2023-06-10 16:50:12,Chargeback,Respond beautiful nation admit.
8fd04866-f82f-4158-ab77-637173f8f634,352752bf-5ec1-4cbb-a5bf-c3f674f2fb22,2023-05-12 07:15:54,Suspicious Activity,Fine trial yeah north.
e5ca57fe-71fa-4855-a50d-55f4b7be2491,37bbd211-fc81-4160-be68-0cfd992df899,2023-07-08 22:41:44,Chargeback,Which Democrat other far.
97669f9c-94fc-43b9-a481-9ced3762374f,c029e42e-1124-4b88-be20-588c3feaf321,2023-05-06 03:16:13,Chargeback,Republican people president.
a8418f16-57a1-4a68-a752-bdf484723fbe,468cf346-fdea-4431-b001-6f0ee8069d42,2023-05-07 17:40:13,Suspicious Activity,Onto audience enjoy forget book purpose they.
24bd0f33-6119-40e6-bc9b-06a20011383b,726f9750-fe2c-4fc0-aee3-ebf88db8446d,2023-07-02 16:43:41,Suspicious Activity,Structure picture economy store.
10cde3e4-677f-4df8-8799-be1092576ec5,40cfb0a1-a054-439a-aca9-50ac096cbcab,2023-08-01 23:46:19,Chargeback,Late laugh mission.
8c5a8005-7244-467d-9772-5a312e322e4f,5c73a81d-d25d-435a-8e67-46b7cde86e15,2023-02-20 09:57:18,Suspicious Activity,Morning study marriage different case draw.
a69eb3ef-7911-4718-8d35-ffb33cc1db75,acbcee14-ab7a-473a-b6f2-e3a1a8ab8b5c,2023-03-16 14:41:33,Chargeback,Ten someone Democrat whatever reach another.
c2374aaa-a360-40b8-82a8-4beef0e373b9,c2766d42-990a-4434-9cf3-948555cf84d7,2023-09-04 00:45:13,Chargeback,Hope office end us degree boy likely.
860af892-ac43-470b-9805-9a6cd955b5fd,b02a2b8b-82ae-4f94-aaf0-aef9b271714a,2023-07-13 19:31:26,Suspicious Activity,Time movie door as black already loss today.
9b37720e-942e-43b3-ba1e-f6be09a576d5,335b8fbd-3c0b-4c3e-a0ff-54dbb3262ae6,2023-02-15 02:13:50,Chargeback,Have though from network tough good.
c66a0854-01cc-44dc-a800-c4a4502c7fbe,560eb172-992c-4f9e-99be-a45026389a33,2023-06-11 19:13:16,Chargeback,Everyone month various level together support add.
878dfcb0-5e27-449e-a348-3e61e469955b,b7b3554f-e37e-478c-b0d1-7cb2e8640c88,2023-07-22 21:09:02,Suspicious Activity,Situation history entire human.
9bcdc792-cb44-4ab7-8ff5-c8fe89cae496,b7c54b17-9192-48ba-a8f6-53938cf7bc2e,2023-01-15 10:22:15,Chargeback,Him eight newspaper action.
1bb7da8c-8592-4603-998c-40bf75e3d02a,bde3f743-4058-45d8-84b9-a32242894811,2023-08-23 19:48:07,Suspicious Activity,Name character owner staff.
488de6af-01b5-41f0-bf8d-6c02ad97c1fc,28b57e30-7fe3-4122-a319-95c55fa71802,2023-08-30 21:06:13,Chargeback,Nation use manager travel through.
41d62b0f-ff5a-4400-9128-c952fdb17bff,59d361bd-19fe-46e5-8f44-8f1418ed1b82,2023-01-30 22:58:26,Chargeback,Whatever car public culture spend.
68a30c47-72a8-4c41-9f91-88043d56bd8c,39b71793-40e5-4a0c-a79f-2081e00cd22c,2023-03-28 01:05:09,Suspicious Activity,Each paper skin environment.
f66c9c57-f925-4a03-a08c-8b96dd39dce1,16ab8288-ec1d-404d-a2eb-d0d1aa98c7cc,2023-01-20 23:25:01,Suspicious Activity,Cup summer throw arm east.
20e11299-80fc-4a53-8355-972b9870bc4d,88aebfec-838c-4da1-a81d-f43d0a37dee4,2023-02-20 13:34:47,Suspicious Activity,Forget his thousand may.
e6ca956f-ea72-4469-b1de-1aa893269db9,9befac1c-9c92-4afe-b206-5688eaacb676,2023-03-07 01:51:18,Suspicious Activity,Better year expert either year research difficult school.
daa976ca-f49b-42c2-ab6e-932fbb4c513e,26e38c46-599c-4f38-82e8-f55b06bdf11a,2023-08-28 18:16:16,Chargeback,Early month production front.
f17db052-d06a-4a1d-a7ec-bb44b990c766,90a0a5e5-9208-4f62-8c53-1343d295ccde,2023-07-23 21:25:47,Chargeback,Born cell by management particular political because.
dc7e8862-ce1f-4f7e-a940-dceeb30a0fa6,5d7ec499-0e28-4d54-8754-ec76794d49e0,2023-06-24 23:52:17,Suspicious Activity,Once paper us environmental and central adult fish.
4b6ae727-8122-46d0-88a1-4125ebc4ba14,18a591d3-7a3f-431b-9533-f964981bd7f4,2023-03-04 11:25:22,Chargeback,Sea real consumer prepare.
b93c2ec6-84a8-4c8b-a4fc-e9d552251a76,49d8d4c0-4095-4609-9056-3971486ddf53,2023-08-29 17:00:20,Suspicious Activity,Effort always bit easy pass new.
3cdb0423-ca4e-47de-86b3-f5090ef5a6d7,56525696-9509-43fe-b4c9-49588cbaa378,2023-06-12 06:12:27,Suspicious Activity,Some keep successful myself outside air.
3908041a-1507-49d9-8faf-baab0789f597,998066ef-1d16-4987-83d5-d36c2e8acb4c,2023-03-24 11:51:11,Suspicious Activity,Ability sometimes to middle attorney wait your.
8877a958-5f78-41be-ac77-b84551373e0b,98beb5ed-bc95-4578-9417-8d64bc072545,2023-01-31 02:47:42,Chargeback,Many fall already all way character current doctor.
8bba8746-a91c-4c57-b2c9-e62f5747dc6a,5e044d3e-60f1-4afc-b156-5bb67f084771,2023-08-14 04:07:27,Chargeback,Player would house Mrs white.
cc800167-da7b-4206-ad2f-9f7f3d5c2051,8b5690c6-b0db-4cfc-8af5-2c65fc938c1d,2023-07-07 17:26:28,Suspicious Activity,Series onto apply read.
5383c10d-2a81-4a47-a9ee-252ec873b6e1,618e7fb7-f845-401f-9d3f-651620baa9c9,2023-07-15 01:52:22,Chargeback,Option trial of growth boy physical.
aa1ca809-72cc-46f3-bc9c-702d3cd00f49,a552ae13-c20e-4781-a992-0ad9e1ebd062,2023-08-28 17:27:38,Chargeback,Red where task stage defense kitchen there.
984207cf-4beb-4b42-9013-81b7e0e9dfd8,63ee6d39-92fa-4751-8656-49f6a8e0e15d,2023-03-31 07:16:26,Chargeback,Create evening concern after.
4a07299b-9216-47fb-98b8-f71d8bcc9ab0,f2524906-10cb-4af5-9503-77b39b5dde57,2023-01-13 09:09:24,Suspicious Activity,Dinner color as seem white public cup.
b03ccd24-32d7-4e76-b9d5-bd4bbba2d654,cd62a169-389d-4022-962a-3d5a8775eb73,2023-04-07 15:21:58,Suspicious Activity,Idea site effort drop prepare office view get.
6aae1771-034d-4423-9b9d-eea404e535c4,04577f7c-6d71-416e-b3bb-facc59386c95,2023-03-05 23:38:13,Suspicious Activity,Of pass occur on outside hope feeling.
0b682cd0-a066-4d4f-b9ad-b6ebfe917877,4cdbd236-36c3-4b0a-b3f2-38befb7380c7,2023-05-20 13:23:50,Suspicious Activity,Able executive leader.
7f3fd5c8-e794-4516-b556-6fb993b2a0ec,e67f64f4-1ec0-46dc-b1a7-d65f843b25dd,2023-04-14 23:56:04,Suspicious Activity,Nation husband traditional artist fill.
16f6c412-753a-414c-bcea-0128bf2ff40a,ad2b6f91-c0e6-4b77-84ac-7c3327b28b20,2023-05-19 19:46:02,Chargeback,Finish black time or individual still threat.
a480394f-7ffb-4f9f-9d48-b385ff35c189,cef7f8f1-76ba-4548-8f4d-24790b8b3d7e,2023-03-27 08:33:27,Suspicious Activity,Me must officer others tell cold effort.
b92d7790-885b-4356-b020-e935db6cecc6,54af6968-761e-4bd8-bea9-49f2aa6d4904,2023-01-29 21:13:30,Chargeback,Organization less after.
c7e34c2a-5009-47f8-b1cc-f72272c22306,886af3ae-0bab-460f-9d91-6a0b76f58277,2023-07-06 08:46:53,Suspicious Activity,Approach film picture.
a9c9e3cd-5ef2-4951-a8e4-c664c8625a15,5f338a7b-a71c-4176-9d12-cd0d79c7cf86,2023-08-24 10:48:06,Suspicious Activity,Team point piece night family.
a385774f-140f-43dc-9db0-bfc7c04e12e7,eb1eade5-4a10-46f3-a4c9-779592789292,2023-03-12 00:17:50,Suspicious Activity,Off piece one will three poor land.
0cafd376-217b-4e11-8192-d4bbb4f2868a,5a8dd92a-fd70-4a0f-a3b7-b7f270f94a67,2023-07-08 12:32:06,Suspicious Activity,Which key strong whom.
086875bc-16fa-4205-8f7a-438d7c6868fc,8932eb83-c844-4063-99cd-815bf7cf45e1,2023-06-11 18:19:27,Chargeback,To claim like anyone manage.
acf587e2-355b-4e6d-997e-b17a95e5aaf4,14bb3968-1bfc-49e2-a9f6-7fcbeed67c18,2023-03-23 19:44:16,Chargeback,Democrat senior by believe.
16aafa01-284e-4df8-8107-2657e6c12a6b,0eb18dfc-bc04-43a8-b8bd-bc691a9f08e5,2023-04-25 02:49:53,Chargeback,Animal east lead candidate.
211fdf1f-1ce5-4b3d-800b-6a0822630f4a,0229d145-838d-4415-a423-7043b678e1ea,2023-04-16 21:23:15,Suspicious Activity,Watch card officer hour.
c1af1857-18b6-4577-a764-483f9f2b0135,73fa87f2-dc64-4130-be10-676b93f3ce57,2023-08-20 06:39:26,Suspicious Activity,By water chance age baby forget.
90a9543d-0c36-4feb-b775-a6a68a79f8de,63ee6d39-92fa-4751-8656-49f6a8e0e15d,2023-05-09 22:48:14,Suspicious Activity,Seven among nor possible.
4c55aac2-6573-444d-bfb2-7dbaa61896c8,d8f1a47d-91af-4b58-9a1d-da93ac7dd8ad,2023-01-21 07:58:33,Suspicious Activity,Build charge place enter over.
a5fdf710-e7b7-4883-8b0d-b3d63ace10c8,9d57fde0-ae4c-4237-a7c9-3c67edc660b3,2023-05-01 10:01:38,Suspicious Activity,Sense drive Mrs blue.
4db91653-9ea4-46e4-9504-42b54d7d5d6d,93965d3b-8f59-47b5-95ac-3ad044203cbe,2023-08-24 15:02:43,Suspicious Activity,Mrs ability American interview skill seat.
be468be3-9b00-4df2-b1e9-ddd712f2fefc,9a14fd6c-8564-4e11-991f-d210917a2a7b,2023-08-30 18:45:44,Suspicious Activity,Approach chance real hundred everything financial.
8389eec0-14e0-468c-89f0-405d99078efd,3423c94b-eaf2-4fe5-bfc5-c1c6bf638787,2023-03-23 09:53:54,Chargeback,Those some everything reach side from.
0f03fb20-a70d-4aaf-8403-9965826ec3f3,5bc59e86-1336-4e30-9536-78bacac08b1e,2023-02-06 17:38:41,Suspicious Activity,Brother ability beat down safe.
da4cfe1e-226a-4d74-b23a-77f59ef6be03,33806de4-9bff-42ed-a678-531b100feff1,2023-04-12 21:53:36,Suspicious Activity,Information son defense.
560dc4da-3ebd-408d-8bc0-8320aa3ac2c6,84ded45e-e853-4cae-babd-57e0565bb44c,2023-01-07 06:21:25,Suspicious Activity,Sign like more certain off.
753aa85b-3618-4de1-b099-c9a4a3f24c16,ed48bbec-fd4f-4ae9-81b7-e346992a168b,2023-03-22 21:12:15,Suspicious Activity,Cause run force senior TV visit.
97b2d540-4ed6-45a6-aa65-06c2ed088444,a60b3f62-01c1-4872-96a0-94eaba879810,2023-08-22 14:59:15,Chargeback,Big water who writer answer with.
549ea53b-beb3-40ec-ab42-2956cb4e15a7,a2cc05b4-b35d-46ed-9787-d27449553993,2023-01-02 20:24:48,Suspicious Activity,Create individual seat member firm.
a6e68a68-dda9-4c0e-893f-835724f5b208,a3217472-8935-4616-ae6e-a3236ba437d1,2023-08-12 18:47:23,Suspicious Activity,Shoulder nor value dog.
667d68a0-7fff-424c-bfe6-29eccd76697b,24b604d6-36a1-4d42-9554-91643306c064,2023-05-21 13:27:33,Suspicious Activity,Firm chance sort offer.
2aa8e611-3719-4db8-a143-9fb2242be80a,1f48a7e5-ce07-4b2d-9a02-213f0c488a4f,2023-05-19 15:53:55,Suspicious Activity,Figure court organization management capital chair.
a166bb98-d2d7-4b7d-9c48-ef863e321100,6e0e1757-7a67-4f42-b6bc-2c4686558036,2023-06-12 04:29:04,Suspicious Activity,Animal lawyer do get.
9432d7d4-9090-4458-bdf4-773c68692945,e4429507-2341-4f4a-99ad-fa7566610219,2023-03-06 23:22:46,Chargeback,Carry federal notice by year water.
0a851511-c9be-4bf6-9d6d-a3c0cb0cff56,e229bf16-5a18-4ef2-a33b-e25a87479fcb,2023-02-05 22:35:11,Chargeback,Quality interesting agreement today four campaign fish.
e30d0584-098c-4d20-9a33-da1ae690d8e5,b2d60c1d-0f8a-46ea-a505-b4a6d3d086c2,2023-03-12 02:18:12,Chargeback,Service rich term west.
